9:55 AM - 30 Nov 2015|YOU GOT THIS! pic.twitter.com/eAvRiedgMo
1:23 PM - 29 Nov 2015|#SundayStudyTips: Drawing diagrams will help you visualize information that could be hard to describe. Try it!
1:45 PM - 28 Nov 2015|Professor: Okay, so any questions?  Me: Yeah, what the what?  #studentconfessions
9:44 AM - 25 Nov 2015|Like if you can relate. pic.twitter.com/s1LFrrr1X8
10:00 AM - 21 Nov 2015|- said every college student ever pic.twitter.com/o8OLxPed01
9:00 AM - 20 Nov 2015|That moment when you try to use algebra in your everyday life. pic.twitter.com/gZPgjzqTAQ
9:00 AM - 19 Nov 2015|What's your definition of StudyMode? pic.twitter.com/q9j2G7kIDh
9:42 AM - 18 Nov 2015|RT if all you need is more sleep right now. pic.twitter.com/w2o3joYX1t
10:50 AM - 16 Nov 2015|Monday mornings be like... pic.twitter.com/UuOlOyI8yi
12:53 PM - 15 Nov 2015|Exercise is the ultimate stress reliever. It is the best thing you can do to clear your head. It will make your study much more effective.
10:20 AM - 12 Nov 2015|It's all about perspective. pic.twitter.com/c95W9CkPla
10:30 AM - 10 Nov 2015|Asking for a friend. pic.twitter.com/TKPIGY5NDL
11:13 AM - 8 Nov 2015|#SundayStudyingTips: Turning the details you need to remember into a crazy story helps make the information you're studying more meaningful.
11:26 AM - 7 Nov 2015|Expectations vs Reality pic.twitter.com/qiQWilojVi
1:40 PM - 6 Nov 2015|You have to find that balance between enough sleep and studying.  Good luck on exams! pic.twitter.com/pp9caVaE9W
9:23 AM - 5 Nov 2015|Learn more about @MalalaFund and her cause for furthering education by watching her celebrated film #HeNamedMeMalala pic.twitter.com/dxfKn6REBF
10:44 AM - 4 Nov 2015|Study Sessions + Pizza = Bliss pic.twitter.com/J3gO0Y2S18
12:20 PM - 2 Nov 2015|Site maintenance occurring TODAY & TOMORROW 1pm-5pm PST, and Wednesday 8am-5pm PST. This may cause delays on the site. support@studymode.com
9:52 AM - 1 Nov 2015|This is too true. #lol pic.twitter.com/4NCITU6CHb
10:26 AM - 31 Oct 2015|The sign that every testing center should have above their door. #HappyHalloween pic.twitter.com/lHWbyiagrA
9:56 AM - 29 Oct 2015|Drake gets it. #lol pic.twitter.com/Eu4EOtF8V0
9:26 AM - 28 Oct 2015|#StudentConfessions: I am putting my GPA up for adoption because I can't raise it on my own.
9:00 AM - 25 Oct 2015|#StudyTip: Poor readers always read at the same slow rate. An efficient reader speeds up for easier material and slows down for the hard.
3:34 PM - 24 Oct 2015|Can you relate? #HappySaturday pic.twitter.com/KKEulKcxpj
9:00 AM - 22 Oct 2015|School Squad Goals. #ThrowbackThursday #Clueless pic.twitter.com/XeLnaBVCwl
10:12 AM - 20 Oct 2015|Today is National Writing Day! Tweet us why you love to write! #WhyIWrite
9:00 AM - 20 Oct 2015|That moment when you can't concentrate on one thing because your brain has too many tabs open. pic.twitter.com/JLnVPmw0jd
9:57 AM - 19 Oct 2015|Steve Jobs got it. #MondayMotivation pic.twitter.com/vJYExORlcW
10:04 AM - 16 Oct 2015|Anyone else feel this way? pic.twitter.com/cDxmf4s8BM
9:56 AM - 14 Oct 2015|Time for a #WednesdayWisdom! pic.twitter.com/eps4kH85UQ
9:51 AM - 12 Oct 2015|RT if you have the Monday Blues too. pic.twitter.com/DTsdBNUw7G
11:37 AM - 11 Oct 2015|#Tip Whenever looking at a math problem you should draw a diagram.  You can view the situation from different sides pic.twitter.com/HZmW8ShFee
9:12 AM - 10 Oct 2015|RT if you can relate. pic.twitter.com/AVG7qv1u19
9:58 AM - 9 Oct 2015|You made it through the week! Time to relax. #FridayFeeling pic.twitter.com/pPe2BCWHQX
6:13 PM - 7 Oct 2015|dreaming ahead pic.twitter.com/icsl3XmgPq
3:22 PM - 5 Oct 2015|Today is World Teachers' Day! Show your appreciation and tweet why you love your teachers.
10:21 AM - 4 Oct 2015|#SundayStudyTips: Research suggests studying the same stuff in a different place every day makes us less likely to forget that information.
11:17 AM - 3 Oct 2015|We want to know... pic.twitter.com/o6dIw7EKG3
12:32 PM - 1 Oct 2015|Life was simpler back then! #ThrowbackThursday #ElementarySchool pic.twitter.com/0oBLzkdrkV
9:44 AM - 27 Sep 2015|#SundayStudyTips: During a test make sure to pace yourself. Keep an eye on the clock. Make sure that you are not working too slowly.
9:41 AM - 26 Sep 2015|Kick out your feet and relax. It's the weekend! pic.twitter.com/wccCDoMEFZ
9:32 AM - 25 Sep 2015|Life as a college student be like... pic.twitter.com/66Aqpyu8ps
9:54 AM - 23 Sep 2015|FAV if you already need a break from classes. #FirstDayOfFall pic.twitter.com/E4b5P3dqo1
11:11 AM - 21 Sep 2015|RT if you agree! pic.twitter.com/tQCT30h8Z0
2:42 PM - 20 Sep 2015|#SundayStudyTips:  If you're looking for a place where you and a bunch of classmates can go to study, then find an empty classroom!
2:35 PM - 19 Sep 2015|You are always a student, never a master. You have to keep moving forward. -Conrad Hall
10:22 AM - 16 Sep 2015|RT if you can relate! pic.twitter.com/LIh5m8xYNg
2:16 PM - 13 Sep 2015|#SundayStudyTip: Find your perfect study spot to concentrate without any distractions. pic.twitter.com/DZKptJ6GsB
2:09 PM - 12 Sep 2015|You're never too old, too wacky, too wild, to pick up a book and read to a child.  -Dr. Seuss
10:59 AM - 10 Sep 2015|That moment when your teacher calls on you but your hand wasn't even raised. #KimKardashian pic.twitter.com/Y0p0FMdeN1
9:13 AM - 9 Sep 2015|I'm not a procrastinator. I just prefer doing all my work in a deadline-induced panic. #StudentProblems
10:45 AM - 6 Sep 2015|#SundayStudyingTips: Make sure to take 10-minute breaks for every 50 minutes of studying! pic.twitter.com/7rmBnH8WQz
11:07 AM - 5 Sep 2015|Get out and stretch your legs this weekend! pic.twitter.com/44xwFwH0qF
10:37 AM - 4 Sep 2015|Favorite if you can relate! pic.twitter.com/Q4Kca7tUIY
9:26 AM - 2 Sep 2015|Today's motto! #WednesdayWisdom pic.twitter.com/TO3LA2BPTs
9:14 AM - 1 Sep 2015|#StudentConfessions: My favorite childhood memory is not paying bills.
11:10 AM - 31 Aug 2015|Conquer Monday the Cara Delevingne way!   | Illustration by @JarynBunney pic.twitter.com/pafYyQnawk
10:49 AM - 30 Aug 2015|#SundayStudyTips: Rewrite your notes. It gives you a chance to review what you covered in class& it can make sure you didn't miss anything.
9:07 AM - 28 Aug 2015|We had a blast at the StudyMode Bowling Night! Browse through our photos and take a look at our sweet bowling skills. pic.twitter.com/LEHBjQjwnZ
11:19 AM - 27 Aug 2015|Like if you can relate. pic.twitter.com/QYVrcfdPmB
9:55 AM - 24 Aug 2015|Anyone else got the Monday Blues? pic.twitter.com/LInNzoAQIA
1:17 PM - 23 Aug 2015|#SundayStudyTip:  It is usually best to keep the notes for different classes separate from each other. pic.twitter.com/IrdyznGY5R
1:02 PM - 22 Aug 2015|That moment when you don't want to do your homework but you don't want to disappoint Shia LeBeouf. pic.twitter.com/EpPqVxZi6k
9:44 AM - 21 Aug 2015|We're busy at work coming up with some top secret projects we can't wait to release! pic.twitter.com/oJm3TYFQbp
10:09 AM - 18 Aug 2015|Fav if you can relate! pic.twitter.com/RN8C9fLNRP
9:00 AM - 16 Aug 2015|#SundayStudyTips Always review the material you learned the next day! pic.twitter.com/AFqht7brcu
1:16 PM - 15 Aug 2015|Saturday expectations vs reality when you're in college. pic.twitter.com/ESe7FugBSQ
10:49 AM - 13 Aug 2015|Rihanna at school be like... pic.twitter.com/VkGD2Ul2DP
9:00 AM - 9 Aug 2015|#SundayStudyTips: Take the time to double check your answers before turning in your work! pic.twitter.com/SfzYY1zStl
9:38 AM - 7 Aug 2015|#StudentConfessions: I wish all my refused naps from childhood could rollover.
9:28 AM - 6 Aug 2015|New school year means a fresh new start! #TBT #FreshPrince #WillSmith Illustrated by @JarynBunney pic.twitter.com/hYWnTG4Bxr
9:29 AM - 5 Aug 2015|Parents be like... pic.twitter.com/EmXHSx4O13
10:08 AM - 4 Aug 2015|Make sure to pick a major that will bring you happiness. pic.twitter.com/4fPaJN0XIZ
8:41 AM - 3 Aug 2015|Life as a student be like... pic.twitter.com/8JdII0FQv2
9:33 AM - 2 Aug 2015|Keep some sticky notes around with you. That way you can write your thoughts and notes without ruining your books. pic.twitter.com/R1F5GmkLoK
10:10 AM - 1 Aug 2015|It's summer and a Saturday!  Life doesn't get better than that. pic.twitter.com/diqepcppY0
5:08 AM - 31 Jul 2015|Thank you so much to everyone wishing Harry and me a happy birthday! I'm having a wonderful time in the sun with family and friends. xxxxx
10:45 AM - 30 Jul 2015|You got this! pic.twitter.com/BBXd2V05xr
9:05 AM - 29 Jul 2015|When in doubt, just listen to Angelina Jolie. #WednesdayWisdom pic.twitter.com/klw3e3Ry1l
9:00 AM - 26 Jul 2015|Reading a lot of material can give you more flexibility in finding patterns and metaphors in new topics. pic.twitter.com/qLYY4umoC3
9:28 AM - 25 Jul 2015|#FreshmanProblems: When fall semester classes you want to schedule for are already full.
10:20 AM - 23 Jul 2015|Just keep swimming! pic.twitter.com/Lcl7OKGrpG
9:13 AM - 21 Jul 2015|Please say yes. pic.twitter.com/liqiP7vqKZ
9:22 AM - 19 Jul 2015|Slow and steady wins the race. Make sure to study a little bit of each subject every day. That way you're not cramming the night before.
3:13 PM - 18 Jul 2015|It's Saturday! You're allowed to do nothing. pic.twitter.com/sLSknd37rD
9:28 AM - 15 Jul 2015|The face you give when someone mentions going back to school soon. #lol pic.twitter.com/J8uacivFKm
10:17 AM - 14 Jul 2015|Remember to focus on you. pic.twitter.com/Hjb4kdQZVl
9:00 AM - 11 Jul 2015|Best advice. pic.twitter.com/kVMv8gchj9
9:24 AM - 8 Jul 2015|FAV if you agree with Jerry Seinfeld! pic.twitter.com/FBKUSalIjm
2:03 PM - 5 Jul 2015|Take notes and write down a summary of the important ideas as you read through your study material. pic.twitter.com/DEZ177WQdV
9:28 AM - 3 Jul 2015|Dark chocolate produces endorphins. So a couple of slices, ease your stress during exams. pic.twitter.com/WF1MRminU4
9:33 AM - 2 Jul 2015|#StudentProblems: Everyone is out having fun, but you're stuck studying for summer school.
9:08 AM - 1 Jul 2015|Study buddy goals. pic.twitter.com/qkeQiDlhw1
9:58 AM - 30 Jun 2015|RT if you can relate! pic.twitter.com/zdIxTDS1xZ
10:34 AM - 29 Jun 2015|Thank you to @greenleaftweets for the best @StudyMode gathering ever! #StudyModeLife pic.twitter.com/C4QUNNzmNy
9:50 AM - 29 Jun 2015|Time for some motivation this Monday! pic.twitter.com/etCbJFsDTB
9:00 AM - 28 Jun 2015|#SundayStudyTip Have a study partner read your writing aloud to you while listening for mistakes or possible changes. pic.twitter.com/xw1Zpwn5Hx
9:09 AM - 26 Jun 2015|Don't overthink it. pic.twitter.com/gNkj3MhnKs
9:17 AM - 25 Jun 2015|This happens way too many times. #StudentProblems pic.twitter.com/j6cOSdIcbf
9:00 AM - 23 Jun 2015|Fav if you love your bed the most. #SleepDeprived pic.twitter.com/qou6HnPfPL
6:19 PM - 22 Jun 2015|What books are on your summer reading list? pic.twitter.com/6EK6IyVpt1
8:37 AM - 21 Jun 2015|#SundayStudyTip: Next time you need to review new material try saying the information out loud. Talk through the ideas in your own words.
8:24 AM - 19 Jun 2015|Happy Friday everyone! pic.twitter.com/wB8xUXQdwm
4:38 PM - 17 Jun 2015|Follow us on Snapchat! Handle name: StudyMode pic.twitter.com/5sDNugkWDf
11:14 AM - 16 Jun 2015|Has this happened to you? pic.twitter.com/b3zdfmRwNM
10:22 AM - 15 Jun 2015|Never stop learning. #MondayMotivation pic.twitter.com/YiM6ce9Yyt
9:29 AM - 14 Jun 2015|#StudyTip: Professors are willing to help you or to refer you to other sources of help. Ask questions when you don't understand something.
9:25 AM - 13 Jun 2015|When you should be studying but all you want to do is take a catnap. #studentlife #Instagram pic.twitter.com/TckkfrD9g7
8:12 AM - 11 Jun 2015|Have you done this in the past too? pic.twitter.com/MmDb0YesOm
9:00 AM - 7 Jun 2015|It's not even summer and I already have a tan! #lol pic.twitter.com/ka1hy3VSky
8:14 AM - 8 Jun 2015|#CollegeProblems:That moment when you thought you could make it to your early Monday morning class, but now realize how far-fetched that was
9:09 AM - 7 Jun 2015|When you know the answer to each question, then cross it off. Just a simple thin line diagonally through it. pic.twitter.com/LXyKxoDVqG
8:57 AM - 6 Jun 2015|Teacher: Describe yourself in one word.  Me: Done.
9:19 AM - 4 Jun 2015|Today's motto! pic.twitter.com/YcjcSSWkAy
10:43 AM - 2 Jun 2015|The struggle is real. pic.twitter.com/F5eyZ0J5wv
10:05 AM - 1 Jun 2015|Ugh, Monday. pic.twitter.com/4JUFrz0Euf
9:00 AM - 31 May 2015|#SundayStudyTips: Relax.If you're feeling nervous when you sit down to take the test, take three slow, steady breaths.
1:00 PM - 30 May 2015|RT if you can relate! pic.twitter.com/0TuTY1MDb1
8:39 AM - 28 May 2015|Newton's Lesser Known 4th Law of Motion:   A student in bed will remain in bed unless acted upon by a large enough panic.
10:07 AM - 26 May 2015|RT if this is you right now. pic.twitter.com/mBwhvqPOUN
9:10 AM - 25 May 2015|Who sows virtue reaps honor.  -Leonardo da Vinci  #MemorialDay
9:00 AM - 23 May 2015|The essentials for the day. #StudyMode #App pic.twitter.com/ZyabPC75ie
9:06 AM - 21 May 2015|For all those that are starting summer internships, just remember to... pic.twitter.com/12TwEvCfSw
9:00 AM - 17 May 2015|#SundayStudyTips:  Use the spare minutes during your day to study flashcards. Make flashcards online with @flashcards pic.twitter.com/DmZvNASQNv
9:00 AM - 16 May 2015|Congratulations to all of the recent college graduates! YOU DID IT! pic.twitter.com/XR5r6tOp5d
8:52 AM - 15 May 2015|#StudentConfessions: Family member: What are you doing with your life?  Me: It's a surprise.
11:33 AM - 11 May 2015|yeah, I tried that and it still isn't working pic.twitter.com/10LC7YBaSs
9:00 AM - 10 May 2015|Don't forget to thank the most important person in your life! #HappyMothersDay pic.twitter.com/7BAOGWrcRa
9:09 AM - 9 May 2015|The common reaction one has when 3 exams, two tests, and one group project needs to get done on a Saturday. pic.twitter.com/llpl6OwB4V
9:06 AM - 7 May 2015|Just a reminder! pic.twitter.com/67lQ9yoUBx
9:00 AM - 4 May 2015|Always make learning a priority. #MondayMotivation pic.twitter.com/nx2CmreVOV
9:00 AM - 3 May 2015|#SundayStudyTips: It is best to review the material right after class when it's still fresh in your memory. pic.twitter.com/ZEdHiqnnhX
8:00 AM - 2 May 2015|#CollegeProblems: That moment when you're barely passing your easy A.
9:51 AM - 29 Apr 2015|#WednesdayWisdom Never stop reading! pic.twitter.com/QPtqi5iN97
3:03 PM - 18 Apr 2015|when you want to sleep during class pic.twitter.com/1knQnaHzTM
9:25 AM - 25 Apr 2015|Thank goodness it's the weekend.  Time to have some fun! pic.twitter.com/MlGBUR0sqf
9:00 AM - 19 Apr 2015|It is usually best to keep the notes for different classes separate from each other. Spiral notebooks with built-in dividers are the best!
9:00 AM - 17 Apr 2015|If @taylorswift13 was a student: I got a blank space baby and I'll write your name.  (Even though I did the whole group project.)
9:00 AM - 16 Apr 2015|#Fillintheblank: Study like you____________. pic.twitter.com/2lh2qBMimW
9:36 AM - 15 Apr 2015|Taylor Swift said it best! #WednesdayWisdom pic.twitter.com/mS5lJc781a
10:26 AM - 14 Apr 2015|This is how you mess with your BFF. #LOL pic.twitter.com/DyRG1mI6xK
9:37 AM - 13 Apr 2015|(Asking for a friend) #MondayBlues pic.twitter.com/msk6mqCu98
9:00 AM - 12 Apr 2015|#SundayStudyTips Stress will melt away when you study to your favorite tunes! So get that Beyonce playlist out and make studying fun.
9:00 AM - 11 Apr 2015|#StudentConfessions: I wish I could just major in procrastination and minor in pizza.
9:30 AM - 8 Apr 2015|Be true to you. #WednesdayWisdom pic.twitter.com/ppY3mi6Rdt
9:57 AM - 7 Apr 2015|Swipe up to see all of your worries fly away! #StudentLife #LOL pic.twitter.com/Iytu5lvwKX
9:17 AM - 6 Apr 2015|When it's Monday and you're too tired to pay attention in class. pic.twitter.com/TCHJRsYhDI
9:03 AM - 5 Apr 2015|#SundayStudyTip On this first trip through the chapter, you should concentrate on catching the major subjects and points of the material.
9:02 AM - 4 Apr 2015|Best prank ever! #HappySaturday pic.twitter.com/0EYkBXgY8t
9:24 AM - 2 Apr 2015|Don't let the small stuff get you down today. #StudyMode #Instagram pic.twitter.com/Mho0aSVyEh
9:17 AM - 31 Mar 2015|College Problem #34: When you transfer, but your credits don't.
9:00 AM - 14 Mar 2015|This is too accurate. pic.twitter.com/kddIaelgKF
9:56 AM - 25 Mar 2015|The countdown begins! #SummerFreedom pic.twitter.com/0Da7101fZ8
9:41 AM - 23 Mar 2015|Friends help friends with their grammar. #lol pic.twitter.com/is9vSgIn0b
9:00 AM - 22 Mar 2015|#StudyTips Analyze how you did on a similar test in the past. Review your previous tests and sample tests. pic.twitter.com/0EsXkJTCPq
9:06 AM - 21 Mar 2015|#CollegeProblems: When you can't figure out if you really have free time or if you're just forgetting something.
6:40 PM - 20 Mar 2014|it's spring now pic.twitter.com/80zTvE3PW5
9:00 AM - 18 Mar 2015|Some words of encouragement from all of us here at #StudyMode. pic.twitter.com/GhdMnTUnMe
9:03 AM - 17 Mar 2015|Don't let this happen to you today. #StPatricksDay pic.twitter.com/h2hZLpTzPQ
9:25 AM - 11 Mar 2015|Is it Friday yet? pic.twitter.com/C8n0IN4lPI
9:13 AM - 16 Mar 2015|My planner says study but my hearts says SPRING BREAK!
3:53 PM - 15 Mar 2015|You can't write down everything the teacher says since we talk at a rate of about 225 words per minute. Write down the important material.
6:32 AM - 12 Mar 2015|when u look away for a second in math pic.twitter.com/BuJJWXWUes
9:36 AM - 11 Mar 2015|Listen to Bill Gates. He knows what he's talking about. #WednesdayWisdom pic.twitter.com/0NYpolFMXy
9:32 AM - 9 Mar 2015|College Problem #109 When you're tired in your morning class because Daylight Savings Time made you lose an hour of sleep.
9:00 AM - 8 Mar 2015|Read math problems completely before doing calculations. Glancing at a problem might make you misunderstand what really needs to be done.
11:49 AM - 6 Mar 2015|A note to #Friday. pic.twitter.com/S6S7UWb3y8
9:00 AM - 5 Mar 2015|RT if you can relate. pic.twitter.com/sVV8BQIUfy
10:06 AM - 2 Mar 2015|RT if you're ready for a fresh start.  #HelloMonday pic.twitter.com/joeZF8YXCw
9:26 AM - 1 Mar 2015|#SundayStudyTips: Be involved in your classes. Don't simply pretend you are a sponge, ready to soak up whatever the instructor says.
9:25 AM - 28 Feb 2015|Happy #Caturday everyone! pic.twitter.com/4c4kUko9zz
10:53 AM - 25 Feb 2015|#WednesdayWisdom It's always a good idea to listen to Mahatma Gandhi. pic.twitter.com/NRMXSRfotS
10:09 AM - 23 Feb 2015|The constant battle inside a student's mind. #StudentHumor pic.twitter.com/DOizfLwdx8
9:00 AM - 22 Feb 2015|#StudyTips Try to over learn the material because then you will be able to recall it more quickly on exam day. pic.twitter.com/TyaoeYn7sN
9:00 AM - 21 Feb 2015|College Problem #214: When you finally decide a major and then you realize your school doesn't offer it.
7:01 AM - 3 Feb 2015|never enough pic.twitter.com/kW6uPBcZTQ
9:00 AM - 17 Feb 2015|Why is it so hard to remember this?  #StudentProblems pic.twitter.com/MqXdqmijw0
9:20 AM - 15 Feb 2015|Don't be a perfectionist. You need to set achievable goals, but they should also be challenging. PC @ vineandlight. pic.twitter.com/8Gse8xGNR1
9:00 AM - 14 Feb 2015|Love comes in all shapes and sizes. #BookLover #HappyVDay pic.twitter.com/ixFNSXZ8La
10:04 AM - 12 Feb 2015|Nothing like a newly sharpened pencil.  Ready, set, #StudyMode on. pic.twitter.com/m153nClaqx
9:51 AM - 10 Feb 2015|We keep moving forward, opening new doors, & doing new things, because we're curious & curiosity keeps leading us down new paths. W Disney
10:17 AM - 9 Feb 2015|Time to let go of your stress.  #MondayMotivation pic.twitter.com/VlmC8QZwHo
9:20 AM - 8 Feb 2015|#SundayStudyTips Good lighting can increase your productivity. pic.twitter.com/k0xJWKDk8p
10:29 AM - 4 Feb 2015|This happens way too often. #CollegeProblems.  Instagram PC: @mylee_ pic.twitter.com/pBnmNUvs4d
9:29 AM - 3 Feb 2015|Time to sharpen up those pencils for battle.  Oops, we mean for exams. #HungerGames pic.twitter.com/uXoMHdgfU4
10:07 AM - 2 Feb 2015|To do list: - Study for tests - Start writing that research paper - Finish homework assignment  But first, coffee. pic.twitter.com/ZFgYRdzTUI
9:21 AM - 1 Feb 2015|If you can convert information you want to remember into a rhyme, then it will be easier to remember. PC:@wintercourt pic.twitter.com/Wurcxhbus3
10:25 AM - 29 Jan 2015|Is your research paper on fleek? If not, then let us help you with over a million research documents! pic.twitter.com/fKy4pvWnH7
9:56 AM - 28 Jan 2015|#WednesdayWisdom  Sometimes you just need to take advice from @EmWatson. pic.twitter.com/YUAjcFe2to
10:14 AM - 27 Jan 2015|Why didn't my alarm go off? Now I'm late for class!  Checks phone and realizes it's set to PM instead of AM.  Oh. pic.twitter.com/dF8xgTgSjt
10:26 AM - 26 Jan 2015|Studying on a #Monday.  The struggle is real. pic.twitter.com/ba8P8wwPvp
10:09 AM - 22 Jan 2015|#StudentConfessions  Can you relate?  Tweet @ us some student confessions! We'll RT the best one. pic.twitter.com/qJBjqJKsGD
7:37 AM - 20 Jan 2015|Studymode Activated 
9:00 AM - 21 Jan 2015|#WednesdayWisdom Don't quit! You're closer to your goal every day.   [ Instagram PC: @ Chloelist ] pic.twitter.com/zTWab5dNIf
10:28 AM - 20 Jan 2015|#SMStudyGroup Surround yourself with things that inspire you when you're studying. -@jacelyn_bolton, horticulture pic.twitter.com/Okqzka2OOd
9:03 AM - 18 Jan 2015|Research says reviewing new material within 24 hrs of hearing it increases your retention of that material by 60%. pic.twitter.com/tg86rITZV6
9:01 AM - 17 Jan 2015|Well played. #SaturdayHumor pic.twitter.com/Y795zpendD
10:23 AM - 12 Jan 2015|Weekend Mode Off StudyMode On #MotivationMonday pic.twitter.com/cSzMFIHZj4
9:12 AM - 11 Jan 2015|#SundayStudyTips:  Relieve stress from school. Meditation brings short-term stress relief as well as lasting stress management benefits.
5:52 PM - 10 Jan 2015|I nominate @StudyMode for an #EmployerGoodyLA #GoodyAwards for providing #students with a network of online #learning tools #edu
9:07 AM - 9 Jan 2015|A little too true. #HappyFriday pic.twitter.com/vUfoJEE60K
10:47 AM - 7 Jan 2015|Happy Wednesday from our LA office in Hollywood!  #StudyMode pic.twitter.com/3EiSeB3pIO
9:25 AM - 5 Jan 2015|Anyone else feeling the Monday blues today? #GoodbyeWinterBreak pic.twitter.com/nruF6u3x2s
10:39 AM - 4 Jan 2015|Don't study later than the time you usually go to sleep, you may fall asleep. If you are a morning person try studying in the morning.
11:52 AM - 2 Jan 2015|Anyone else make this mistake today?  #thestruggleisreal pic.twitter.com/J7MjXGpx8Q
9:05 AM - 30 Dec 2014|Can you relate? #WordOfTheDay pic.twitter.com/kFQMATPAON
10:47 AM - 28 Dec 2014|Apply ur studies to ur life experiences. It makes everything relatable when you need to recall it. @franciskenneth pic.twitter.com/9YzxJiSaQp
9:21 AM - 26 Dec 2014|Life Tip #1 pic.twitter.com/L3nOyHXXGj
9:19 AM - 23 Dec 2014|Nerd humor alert! #Puns #lol pic.twitter.com/Bwf0Xwndnk
9:15 AM - 22 Dec 2014|This might be the best Monday of the year. #WinterBreak pic.twitter.com/OEGpJU52Zp
9:04 AM - 21 Dec 2014|#SundayStudyTips: ALWAYS have someone else proofread and edit your papers for you.  Instagram PC: @alvinwkim pic.twitter.com/LtLiPsl15z
9:01 AM - 20 Dec 2014|The note every student wishes they could write to their math homework. #LOL #HappySaturday pic.twitter.com/CVVUycv4us
9:59 AM - 18 Dec 2014|Friends help friends pass their finals. #Instagram PC: @ robynkejr pic.twitter.com/Ilz1ePmbYS
9:31 AM - 16 Dec 2014|The mind of a student. #Funny pic.twitter.com/zJXjM20V8x
9:07 AM - 15 Dec 2014|Wake up. Survive. Go back to bed. #Mondays (#Instagram PC: @dachi94 ) pic.twitter.com/iMx8qobywp
3:56 PM - 14 Dec 2014|#SundayStudyTips: Make sure your study group contains only students who are serious about studying. pic.twitter.com/tiyTbGdcno
9:19 AM - 13 Dec 2014|RT if you're Feliz NaviDONE with this semester!
9:46 AM - 11 Dec 2014|That moment when you have to choose between watching Netflix or researching for your paper. We're here to help. pic.twitter.com/ujPPMJVXhI
9:36 AM - 10 Dec 2014|'Tis the season for all-nighters, hours of crying, mental breakdowns, and anxiety. #FINALS  INSTA PC: @jordanobinger pic.twitter.com/FYOiW0MMVe
9:13 AM - 9 Dec 2014|Is this your motto for the next couple weeks? #Finals pic.twitter.com/NpEKMFiYWX
9:36 AM - 8 Dec 2014|Sometimes you just have to listen to Queen Bey. #MotivationMonday @Beyonce pic.twitter.com/elzXbCyluk
9:16 AM - 7 Dec 2014|#SundayStudyTips: If you aren't sure about a particular topic, don't be shy. Just ask! PC: @ashley_centola pic.twitter.com/3PC8ryKcZH
9:12 AM - 6 Dec 2014|#MathJoke #LOL What do you call friends who love math?   Algebros.
9:03 AM - 5 Dec 2014|This definition of synonym is a little too accurate. #LOL pic.twitter.com/EJxsTPOFLa
9:32 AM - 4 Dec 2014|#TBT to no homework, tests, or deadlines. #Summer pic.twitter.com/CpSMCiSy58
8:57 AM - 2 Dec 2014|Make sure to take a 10 minute break for every 40 - 50 minutes of studying! #Finals #BusyWeek pic.twitter.com/Ghg3HnIlXj
8:50 AM - 1 Dec 2014|#MondayMotivation I don't want the fear of failure to stop me from doing what I really care about. -Emma Watson
9:19 AM - 29 Nov 2014|On everyone's mind today... pic.twitter.com/IqG0GQLlA6
9:19 AM - 28 Nov 2014|Like if this is where you'll be today on Black Friday. #BookStore Photo credit: (Instagram) @Erikasaidhello pic.twitter.com/nK6J0qaK43
9:08 AM - 21 Nov 2014|Like if you get this joke! #FunnyFriday pic.twitter.com/UvaPbb9NUG
8:45 AM - 20 Nov 2014|Time for a school pick up line! You must be a high test score, because I want to take you home and show you to my mother.
10:52 AM - 15 Nov 2014|Nothing is impossible, the word itself says 'I'm possible'! -Audrey Hepburn
9:32 AM - 13 Nov 2014|Yeah that pretty much sums it up! #LOL pic.twitter.com/j01pPybAsZ
6:15 PM - 11 Nov 2014|studymode on.
