8:45 AM - 12 Dec 2015|Emailing professors like Me polite greeting multiple paragraphs perfect grammar Professor sure -sent iPhone|2.5K|4.4K
11:28 AM - 12 Dec 2015|u hate christmas spirit u jingle fuck life|1.3K|1.8K
5:23 PM - 12 Dec 2015|I live one rule event photographer wedding school etc says let's take fun ones I walk fuck away|232|688
11:07 AM - 12 Dec 2015|Bill Gates drop Yeah dropped Harvard 11th grade intensive reading|1.8K|5.3K
2:18 PM - 10 Dec 2015|Bret bench What bench Bitch I sit benches tf @bretmanrock|219|804
4:13 PM - 12 Dec 2015|therapist whats wrong want marry stranger balloon pic twitter com W2f8scaqs2|416|1K
8:50 AM - 9 Dec 2015|Guy next coffee shop explaining plans scam professor whose class skipped semester It class _ _|8.5K|14K
7:23 PM - 7 Dec 2015|Writing English final @freethenipple I 3 pages pros 1 sentence cons|5|40
