11:46 AM - 1 Dec 2015|PM urged MPs walk lobbies Jeremy Corbyn bunch terrorist sympathisers|1.6K|420
2:46 AM - 28 Nov 2015|My cartoon Saturday @TheTimes Isis barbaric death cult allies #syriaairstrikes pic twitter com QkA4QLp9kq|4.8K|2.9K
2:17 AM - 25 Nov 2015|What Osborne used say breaching welfare cap - http www theguardian com politics live 2015 nov 25 spending-review-george-osborne-autumn-statement-#block-56558322e4b0cae9260e13ea pic twitter com Ue54y3jVMe|20|8
5:45 AM - 25 Nov 2015|This tough McDonnell I wonder many go points today crossed unexpectedly mid-statement #spendingreview|11|6
5:31 AM - 25 Nov 2015|Humane conditions women's prisons says Osborne - men fine inhumane conditions|2|1
5:31 AM - 25 Nov 2015|mistake slash housebuilding budget 60 2010 - perhaps biggest spending cut contributor deficit reduction|25|7
4:54 AM - 25 Nov 2015|Digital tax avoidance measures announced Cuts Whitehall admin 1 9billion Will Facebook pay 4327 #spendingreview|1|3
4:48 AM - 25 Nov 2015|Scrapping changes tax credits v welcome - must overturn rest cruel welfare policies get real living wage #spendingreview|270|310
4:40 AM - 25 Nov 2015|What @George_Osborne said far #spendingreview #bbcdp pic twitter com OhZnQMqOzu|21|4
3:35 AM - 17 Nov 2015|Stiff Little Fingers play Paris show despite terror attacks http www irishtimes com news world europe stiff-little-fingers-to-play-paris-show-despite-terror-attacks-1 2433202 via @IrishTimesWorld pic twitter com HDavGdxLot|9|12
2:19 AM - 17 Nov 2015|With male suicide 3x female rate @UniOfYork robbing men opportunity talk banning International Men's Day #SwitchOnTheLight|52|47
