5:37 PM - 11 Dec 2015|80 sq ft tiny A-frame built 1200 pic twitter com Fo0ZSr7sTy|147|461
4:33 AM - 11 Dec 2015|Well well well turntables|1.4K|1.9K
9:49 AM - 21 Nov 2015|CHILLIN pic twitter com H4RUlc3aCT|3.3K|2.9K
2:02 PM - 10 Dec 2015|Pink Floyd pic twitter com fk9hE4ZFYB|204|231
2:44 PM - 9 Dec 2015|I'm crazy I'm little unwell|1|1
1:55 AM - 3 Dec 2015|hate getting sad point body completely shuts lay think problems|1.6K|1.7K
6:10 PM - 26 Nov 2015|I'm thankful relationship I mom|451|416
5:01 PM - 26 Nov 2015|LMAO Too cute https vine co v izJLanxmLHB|509|640
10:22 PM - 24 Nov 2015|Teacher Why always late Me pic twitter com PLuqOmWsB8|6.4K|7.4K
11:45 AM - 25 Nov 2015|ur family roasting thanksgiving dinner ur grandma steps says leave u alone pic twitter com KukQ5kd1SX|893|1.4K
8:24 AM - 25 Nov 2015|protect dolphins pic twitter com uWiY25PRrf|27|33
2:48 PM - 22 Nov 2015|waste much energy people won't even know next year|1.5K|1.4K
1:33 PM - 20 Nov 2015|Overhead albatross hangs motionless upon air deep beneath rolling waves labyrinths coral caves pic twitter com zcE2jvRILM|69|134
6:08 PM - 18 Nov 2015|rlly hope Christmas feels like Christmas year|788|1.3K
5:38 PM - 18 Nov 2015|actual picture freestyling pic twitter com gAg4OxvMnO|26|47
11:04 AM - 18 Nov 2015|When mom add u snapchat pic twitter com haVw3hZOMU|329|478
10:27 AM - 17 Nov 2015|#BadFirstDateActivities show date everybody town wearing salmon suit pic twitter com 8lkylGJey1|234|317
3:20 PM - 15 Nov 2015|Lmao nigga PETA commercial Acapella pic twitter com AK35UdJjMp|4.6K|5.2K
6:25 PM - 15 Nov 2015|This far one favorites far pic twitter com OltqLgQ73N|7.3K|9.1K
12:31 PM - 16 Nov 2015|Someone used 500 dick pics make regal portrait Donald Trump http bzfd 1PKUc7B pic twitter com hXfSWiTTkY|1.6K|2.1K
11:05 AM - 16 Nov 2015|A duck walks bar The bartender says What'll The duck says nothing duck|322|510
