3:28 AM - 13 Dec 2015|Uber vs taxis Who winning war public support http ift tt 1May4hj pic twitter com Bimz9YWhS3|9|17
11:57 PM - 12 Dec 2015|The aging men behind biggest burglary England http nyti ms 1I0T0MN pic twitter com Q8Q81UIqWa|106|190
8:49 PM - 12 Dec 2015|Port Coquitlam 3D printing expert partners artist Douglas Coupland http www tricitynews com news port-coquitlam-3d-printing-expert-partners-with-artist-douglas-coupland-1 2128798|1|1
8:15 AM - 12 Dec 2015|Kings assistant coach Nancy Lieberman baller http es pn 1UhsXCn|449|980
7:00 AM - 5 Dec 2015|It T-minus 13 days The Force Awakens Enjoy every single trailer clip TV spot http cinplx co 1Nzhatu pic twitter com 7gmJUQqlB3|14|31
6:56 AM - 5 Dec 2015|NY Times tackles gun control rare front page editorial http mash 1R0jhxi pic twitter com oDLTfd34Gn|43|24
4:00 PM - 4 Dec 2015|The Force Awakens new Star Wars 3D glasses Find theatres December 9th supplies last http cinplx co 1XHq4Ao|15|19
8:22 AM - 4 Dec 2015|Some families creeped Elf Shelf says @bitsofbee Mommy's Grounded http vancouver 24hrs ca 2015 12 02 creepy-shelf-elf-not-for-all-families pic twitter com 3RW9LrsrPu|1|1
8:24 AM - 4 Dec 2015|How many mass shootings U S Numbers deceiving http ift tt 1QkkUEn pic twitter com ceih2wdY0F|12|11
8:22 AM - 4 Dec 2015|see rollin pic twitter com bPlSqrc4Wh|15|22
8:33 AM - 4 Dec 2015|Needs grows organ donors #BC transplants http vancouver 24hrs ca 2015 12 03 long-list-of-people-waiting-for-transplants pic twitter com AxeXoiFZhs|5|4
8:21 AM - 2 Dec 2015|Good morning #BC The #sunrise storm @Kampelafella -- 7 storms exact http ow ly VnV9B pic twitter com C6rSpydnCG|24|43
