7:22 AM - 12 Dec 2015|Oh taste see Lord good Blessed man takes refuge -Psalm 34 8|1|3
3:24 PM - 29 Nov 2015|BREAKING NEWS ONLY 600 HOURS CHRISTMAS #CountdowntoChristmas pic twitter com DbCfpOf7Re|592|626
8:03 AM - 21 Nov 2015|When allow people's opinion define person becomes idol substitute God - Shauna Niequist|1|1
8:27 AM - 18 Nov 2015|Control illusion It becomes check engine light reveals ve placed ultimate hope|377|436
7:03 PM - 16 Nov 2015|It's time create journey that's ridiculously worth Don't afraid leap|4|12
4:52 PM - 16 Nov 2015|created serve people love well dream wild dreams|3|5
