10:43 AM - 3 Dec 2015|Time little bit #Cthulhu pic twitter com zfNi53qc9s|111|127
3:58 PM - 11 Dec 2015|Model railroad fan builds part HP Lovecraft universe toy trains http boingboing net 2015 12 11 ho-fhtagn-detailed-model-rail html #cthulhu #arkham pic twitter com 0ePP0Q7dzL|28|27
2:28 PM - 11 Dec 2015|The malmaison Oxford former prison things gone downhill since|55|178
6:00 AM - 11 Dec 2015|I ve never felt power like Prepare #XMenApocalypse cinemas 2016 http www youtube com watch v bgQcilG-7as|1.2K|1.2K
1:58 PM - 10 Dec 2015|Nazis move distance SF shocking photo emerges pic twitter com Quby6W9TPZ|8|23
3:10 AM - 5 Dec 2015|Yesterday I asked I could name famous Syrian I said McKellen|1.1K|1.1K
4:10 AM - 6 Dec 2015|There's way isn't fucking #Cthulhu right @andydiggle pic twitter com GchXrKl2P7|11|22
11:48 AM - 3 Dec 2015|Abandoned Hobbiton Lord Of The Rings taken sheep pic twitter com uVO3yjSMp0|386|1K
1:55 PM - 2 Dec 2015|@LADFLEG There three good wars Star Wars The newer ones shit pic twitter com TK8fObssm9|5|7
4:31 PM - 17 Nov 2015|Rugby legend Jonah Lomu tragically died age 40 A giant sport giant personality RIP pic twitter com ncMtL13kfo|5.4K|5K
9:20 AM - 17 Nov 2015|Harder Bono @RigidDigits pic twitter com njBSQAIlPM|19|33
12:03 PM - 16 Nov 2015|seasonally appropriate story middle eastern people seeking refuge turned away heartless|21K|19K
12:56 PM - 16 Nov 2015|Jimmy Saville Rolf Harris Stuart Hall walk pub Ireland Barman says yew tree|856|650
