12:51 AM - 6 Dec 2015|My psalms sweaty knees weak cross heavy last supper ready it's lord's spaghetti pic twitter com tq0Lkevx12|7.8K|8.8K
8:00 AM - 3 Dec 2015|Getting hair nails done proven significantly treat anxiety depression also relieving stress|1|3
8:31 PM - 1 Dec 2015|Chapel Hill versus y'all|65|115
9:00 PM - 24 Nov 2015|Gotta love Tar Heel chant fans beating Kansas State Kansas City|35|56
10:41 AM - 22 Nov 2015|She thinks hate pic twitter com cAlf6I5F90|6.9K|10K
6:42 PM - 17 Nov 2015|What Duke University #JeopardySports pic twitter com 6IYeSEIbO4|901|1.3K
5:10 PM - 16 Nov 2015|This always funny pic twitter com 1LtKgWNdW1|8.6K|11K
10:21 AM - 17 Nov 2015|Now basketball pic twitter com dKx2IyBTna|2.6K|3.4K
5:43 PM - 16 Nov 2015|lmaooo If folks wanna pop pic twitter com EUq965ommJ|315|531
