5:11 AM - 3 Dec 2015|N America @duranduran wants hear music Enter @TouchTunes #BreakoutBand #contest http bit ly breakoutband pic twitter com YjPPYvTOtg|28|107
3:49 AM - 3 Dec 2015|attempting sort HUNDREDS footage artwork harmonies videos #FaC video YOU ARE SO TALENTED|54|711
5:32 AM - 3 Dec 2015|I get texts local Domino's friends|234|382
7:45 AM - 3 Dec 2015|Everything need know you're going see @duranduran @GentingArena http duran io 1XC3YiC @birminghammail|57|203
2:58 AM - 3 Dec 2015|You'll never get @NCLairport Now I Dank Swan Belgian gem detective NOT play rules pic twitter com y3KQcpnWqD|15|56
2:25 AM - 3 Dec 2015|Watch trailer last-ever Christmas episode Downton Abbey http uk bazaar com 1lZ86bF pic twitter com qsz1sUBKSV|14|21
12:24 AM - 3 Dec 2015|Let's remain focused today get distracted opponents take vote granted campaign right 10pm #IbackJim|59|55
12:22 AM - 3 Dec 2015|Good luck @CllrJimMcMahon today Can't I'm college day I'm sure you'll us proud #IbackJim|30|64
11:59 AM - 2 Dec 2015|It next DIYSOS https twitter com karencain3 status 672139294555926528|1|1
9:05 AM - 2 Dec 2015|New Video Cats included https www youtube com watch v ZwkZkREADdc 3 pic twitter com CXnV62lWYE|6|69
9:04 AM - 2 Dec 2015|Having stab making mince pies But first wine chef #hohoho|9|50
7:38 AM - 2 Dec 2015|The amount people come irl asking I dan phil games video terrifying yet oddly satisfying|2|23
7:40 AM - 2 Dec 2015|today girl told used hair dyed colours bisexual flag I almost fell chair|3|8
12:07 AM - 1 Dec 2015|Postcards land Auck pic twitter com jDvfLqGS1D|150|1.4K
4:57 AM - 2 Dec 2015|Rufus best news I've heard weeks Hush Ho xxx https twitter com rufusjones1 status 672035339884756994|139|661
5:04 AM - 2 Dec 2015|Or milk 'turns' 1 minute u think it's friend next it's blabbing yr secrets 2 dairy products https twitter com jk_rowling status 672038166845644800|214|1.1K
5:02 AM - 2 Dec 2015|It threatens flick-knife open fridge door https twitter com ZoePerdue status 672034595051872257|770|2.9K
5:16 AM - 2 Dec 2015|It's one funniest things I've ever seen television #Hunderby https twitter com katedoak status 672039798828208128|178|933
1:25 PM - 30 Nov 2015|@savannxhb keep calm dftba yeah pic twitter com aPspSXoHpT|10|138
5:11 AM - 2 Dec 2015|@CalumMcSwiggan I voted grow changes name|1|3
5:11 AM - 2 Dec 2015|BIGGEST COFFEE EVER pic twitter com LMzsZMym1l|12|71
5:13 AM - 2 Dec 2015|Pro war Tory MP Alan Duncan says UK cd flying mess #SyriaVote|26|27
4:14 AM - 2 Dec 2015|Stay tuned break we'll finding exactly #LadyC left @imacelebrity #Jungle @Rylan #Rylan|3|22
3:56 AM - 2 Dec 2015|Hmph Thinks he's Doberman #Hobbes pic twitter com AC6uS2bpKm|9|60
4:01 AM - 2 Dec 2015|@DreyfusJames My god Unadulterated mischief awaits|1|2
11:22 AM - 1 Dec 2015|Here's brand new Christmas card courtesy amazing @Jimllpaintit Get http tinyurl com q9729oo pic twitter com BEKdkvrSIV|14|16
12:46 PM - 1 Dec 2015|Today's real #Tourettes Gold frankincense Andrew Marr #Festiveoutburst http tinyurl com q9729oo|18|23
2:00 AM - 2 Dec 2015|I'll Drapers Hall 7th Dec @WellbeingofWmen Xmas Fair @JackPerfume Hope see|7|24
1:49 AM - 2 Dec 2015|@hassall26 please would great Do upload http www touretteshero com possible people enjoy|1|1
1:45 AM - 2 Dec 2015|Thanks lovely evening Want put PX Sherry everything seems bit early day sherry dreams https twitter com GrubClubCambs status 671770392130928640|2|5
12:50 AM - 2 Dec 2015|@BritActorsFan Happy #WelshWednesday #MattRyan pic twitter com XOVatekbDe|5|11
9:00 AM - 27 Nov 2015|Yay - good times x https twitter com jamie_marsters status 670206140437819392|8|57
2:07 PM - 1 Dec 2015|James Bowen Street Cat Bob Anthony Head know it's Cool Kind animals Thnk @StreetCatBob 4 yr support pic twitter com idadcXognt|43|133
11:26 PM - 1 Dec 2015|Don't ask I'll five years I don't 2020 vision #boomtish|43|107
11:13 PM - 1 Dec 2015|Baby lives hour becomes UK's youngest organ donor http dailym ai 1QcQofK|12|12
11:00 PM - 1 Dec 2015|BREAKING NEWS Lady C left Jungle For information http www itv com imacelebrity lady-colin-campbell-leaves-the-jungle pic twitter com COvC35lzRP|6.3K|4.8K
11:08 PM - 1 Dec 2015|ITV2 showing BTrial TONIGHT weds Friday|2|11
11:09 PM - 1 Dec 2015|Yes Joss Whedon 'Girlfriends' Guide Divorce'|9|25
5:54 PM - 1 Dec 2015|Everybody sing Bomb Bomb Bomb - Bomb Bomb Will NEVER learn http brianmay com brian brianssb brianssbdec15a html#01 My view it's worth Soapbox Bri|89|182
11:10 PM - 1 Dec 2015|Be scared Moriarity's coming Sherlock Bond actor Andrew Scott 8 It's ok tho Christmas song soon pic twitter com C2siOaaxJd|65|225
10:12 PM - 1 Dec 2015|Facebook's Mark Zuckerberg give away 99 shares http www bbc co uk news world-us-canada-34978249 pic twitter com nWX2qE0Fun|9|19
10:12 PM - 1 Dec 2015|The woman Baby It's Cold Outside call police|788|1.5K
10:18 PM - 1 Dec 2015|When you're told call time think they're joking 5 30am THE MIDDLE OF THE NIGHT https www instagram com p -x3MdKQpFT|339|1.1K
11:47 AM - 1 Dec 2015|Just avoid confusion - stands I returning play Darcy I however news report soon hopefully|12|69
11:48 AM - 1 Dec 2015|Should added Twitter FAQs pic twitter com iO4zzAWw4r|1|1
5:39 PM - 26 Nov 2015|At least try pic twitter com 0NWhfQyCR2|704|1.4K
9:29 PM - 29 Nov 2015|RT save someone math grade pic twitter com vH72GT2y6A|781|1.2K
10:26 AM - 1 Dec 2015|The #christmascountdown begun More GIFs Paul's @giphy channel HERE http mpl pm pmc_giphy pic twitter com atvfQPSs09|593|1.2K
8:43 AM - 1 Dec 2015|thing pull bit skin nail way elbow|62|312
7:33 AM - 1 Dec 2015|Only month Sherlock hiatus whole 90 minutes|45|34
8:03 AM - 1 Dec 2015|#TuneInTuesday @duranduran Today's song American Science Chemical Reaction Mix Listen @ DD playlist http duran io DDplaylist|22|80
8:53 AM - 1 Dec 2015|I'm @TheHazelHayes decorate tree film Christmassy vids SO EXCITEDDDD crimbo crimbo crumbs|82|899
7:20 AM - 1 Dec 2015|Eighties icons Duran Duran didn disappoint tub-thumping two hour set http duran io 1HDgyaj @WOWalesOnline #Duranlive|46|151
8:47 AM - 1 Dec 2015|When start get Christmas cards post pic twitter com JZPYVkf2H0|161|335
8:28 AM - 1 Dec 2015|There two types people country 1 People who've begun sellotaping tinsel everything 2 Miserable bastards|363|493
6:24 AM - 1 Dec 2015|After questionable diet road 26-hour journey home possibly greatest https www instagram com p -wKCY8EQ8u|70|369
6:00 AM - 1 Dec 2015|@BritActorsFan #ThemeTuesday #MaxIrons wearing blue pic twitter com AUeuvOqxPw|4|7
6:01 AM - 1 Dec 2015|#ThemeTuesday colour #Blue @BritActorsFan #AndrewBuchan pic twitter com b0fFENrGh5|3|12
4:34 AM - 1 Dec 2015|HAPPY DECEMBER 1ST covers tinsel|21K|39K
2:38 AM - 1 Dec 2015|@phlaimeaux tweet butt|2|4
2:10 AM - 1 Dec 2015|HOLY SHIT FUCK FACEBOOK TIMELINE JUST INFORMED ME THAT MY LAST SERIOUS EX-BOYFRIEND JUST GOT MARRIED FUUUUUUUUUUUCK ADULT LIFE IS WEIRD|9|278
2:09 AM - 1 Dec 2015|@DrBrianMay pls could u record quick video wishing Tim Charlotte luck wedding I donate Dreamflight say thanks|1|1
2:03 AM - 1 Dec 2015|Remember I'm daily vlogmas videos 13th Christmas|7|56
7:23 AM - 30 Nov 2015|Wait Sam Pepper still thing pic twitter com Znba58uZ7z|95|235
12:13 PM - 30 Nov 2015|@hassall26 @JosephMcGann That's lot Joe lol|1|1
12:11 PM - 30 Nov 2015|@hassall26 @JosephMcGann Never get fed Watched re runs last year year|1|1
11:55 AM - 30 Nov 2015|Getting ready @GrubClubCambs tomorrow Satisfying bit metal bending today baking tomorrow pic twitter com YZzieQ6wNA|2|6
11:33 AM - 30 Nov 2015|So pleased @SilvijaVil talked Sam's video Fucking indecent repulsive content https twitter com ScarfDemon status 671373816275312640|7|43
5:14 AM - 30 Nov 2015|We save atheism New Atheists like Richard Dawkins Jeff Sparrow http gu com p 4et66 stw|2|4
7:19 AM - 30 Nov 2015|75 Labour members tell party opposed RAF airstrikes http dailym ai 1Q8rvlf pic twitter com XM27ve4dJP|7|2
7:18 AM - 30 Nov 2015|wedding night pic twitter com bVFwzbQo45|819|1.1K
2:06 AM - 30 Nov 2015|Pictures day There's bird swears he's Elvis Solent #potd http goo gl QNfgSR pic twitter com bk7RMqmYar|36|38
11:47 AM - 25 Nov 2015|- Time spent traffic 1 hour 12 minutes - Time spent talking traffic 4 hours 17 minutes|1.1K|2.3K
7:13 AM - 26 Nov 2015|Starting end conversations Anyway I don't see good Christmas|3K|4.2K
3:20 PM - 26 Nov 2015|I'm bed - Translation I'm stare phone bed|2.9K|4.1K
2:27 AM - 27 Nov 2015|Departing-the-office-kitchen phrases Roll next year Still least it's Friday Anyway shall see Oh well soon Christmas|1.2K|1.8K
5:57 AM - 27 Nov 2015|Putting much effort pretending work would less effort job|1.8K|3K
8:57 AM - 27 Nov 2015|Beer - Say time - Look watch - Go erm three seconds - Yeah quick one won't hurt - Get home Saturday|1.7K|2.5K
3:19 AM - 28 Nov 2015|I feel bit rough actually - Translation I think I might dead|2.8K|3.4K
5:51 AM - 29 Nov 2015|Descriptions slightly busy shop 1 Absolute chaos 2 A bloody nightmare 3 Mayhem 4 Total carnage 5 Heaving 6 Hell|2.9K|4.1K
7:52 AM - 29 Nov 2015|Journeying window every give weather good frowning|2.5K|3.3K
9:28 AM - 29 Nov 2015|Appropriate responses worst possible news Bugger Typical Well obviously Marvellous Brilliant Righto Perfect Great I see Oh good|3.2K|4.3K
5:37 AM - 30 Nov 2015|Looking like you've spent past half hour getting dragged behind ship asked still wet|1.6K|2.4K
5:38 AM - 30 Nov 2015|#callthemidwife 's gorgeous @Charitchie talks life Nurse Gilbert - http www dailymail co uk home article-3331730 Call-Midwife-s-Charlotte-Ritchie-used-bit-school-ve-calmed-learnt-censor-myself html pic twitter com 640i5Ib1PN|9|46
9:01 AM - 29 Nov 2015|Who worse school Kids 90's kids today Hope like NEW VIDEO https www youtube com watch v 6PqaAfYtHXI pic twitter com SyVLi3ASdr|596|1.2K
5:37 AM - 30 Nov 2015|@EvanEdinger You Good x #Evan200|5|54
7:55 AM - 24 Nov 2015|PITCH FOR #CRACKANORY 'Imagine told grow-up stories @carriefisher ' We're Are https amp twimg com v 0dd60ac5-64cc-4bae-b7d4-4513aee1efce|15|52
1:39 AM - 30 Nov 2015|@BritActorsFan Morning lovely pic twitter com l5YjpkXznc|2|10
2:05 AM - 30 Nov 2015|Happy #StAndrewsDay Scotland If you're celebrating party tonight set table tartan xx pic twitter com VhFvpZa0Fp|10|28
4:33 PM - 29 Nov 2015|When threatened Pope spray holy venom 25 ft pic twitter com W7vSfT1UAj|1.6K|1.8K
1:12 AM - 30 Nov 2015|My favourite #YoungChekhov good luck card I'm Chichester We know like I'm Room View pic twitter com QuOXYWvTBT|20|58
11:10 AM - 29 Nov 2015|two things I love one picture Theo James drawing dicks people's faces pic twitter com hcjjptFEcO|8|15
4:08 AM - 17 Nov 2015|A #shelfie #explorearchives pic twitter com kZLumGecMA|9|16
11:54 PM - 28 Nov 2015|Lovely @HolyTrinityHull use church beer festival every year @clarebalding @BBCRadio2|11|42
12:57 AM - 29 Nov 2015|That's week If want hear #GMS find http bbc 1XlmfAt|4|11
12:11 AM - 29 Nov 2015|My daughter made Christmas decoration broke sad I pic twitter com 0ejovVP1wf|5|44
1:58 AM - 29 Nov 2015|I CANT WATCH DOCTOR WHO BECAUSE OF MY DAMN TV|1|1
1:59 AM - 29 Nov 2015|On flight Stewardess gives Yank The Observer Mail Sunday There sir That give two different views England|65|166
2:00 AM - 29 Nov 2015|Charlie told 93 year old Grandma Joyce #BigKnit she's already made first hat Thanks Joyce pic twitter com GAwtlKh8jj|11|70
2:00 AM - 29 Nov 2015|Women dyed London fountains red protest cuts domestic violence services http www buzzfeed com laurasilver women-dyed-fountains-red-to-protest-against-cuts-to-domestic bftwuk utm_term 4ldqpgm#4ldqpgm pic twitter com zSEJL29QMa|42|58
2:01 AM - 29 Nov 2015|Wrexham Let's #WalesComicCon|5|36
2:05 AM - 29 Nov 2015|Loved Tom Baker retrospectively @SylvesterMcCoyy - brought darkness role https twitter com awsmguy715 status 670878912394584066|2|7
2:04 AM - 29 Nov 2015|@BritActorsFan #SuitPornSunday @JeremyIrons Then still commanding presence Thank sharing gift pic twitter com zSdFigeXgs|5|9
2:08 AM - 29 Nov 2015|Have great birthday lovely day @Gemma_Chan1|3|30
1:35 AM - 29 Nov 2015|I'm thinking Jeremy Corbyn set put leadership line #Syria vote Back back shadow cabinet|63|48
7:21 PM - 28 Nov 2015|A young George Osborne realises he's taken visit Scotland pic twitter com 6N9LdSARjK|208|267
8:38 PM - 28 Nov 2015|Thousands pop fans joyfully bellowing Planet Earth response cannot fail gladden heart http duran io 1Q5DS1D|71|260
4:09 PM - 28 Nov 2015|Things I want 1 To love 2 Coconut rice|395|1.7K
3:44 PM - 28 Nov 2015|Thank Leeds We great time #Duranlive pic twitter com UPhljqCzLw|108|321
1:01 AM - 29 Nov 2015|Jamie Vardy first player score 11 consecutive Premier League matches http bbc 1XAj56Q pic twitter com fPDTeAgret|173|283
1:09 AM - 28 Nov 2015|1 Volume 2 Click http youtu S-cbOl96RFM Oh Etta|10|35
12:58 PM - 27 Nov 2015|We re getting band back together SHAKESPEARE IN LOVE 2 PIG IN THE CITY @tom_bateman @alistairpetrie pic twitter com loL9OG9fYp|33|151
2:17 PM - 28 Nov 2015|Planet Earth Best debut single ever #DuranDuran https instagram com p -pRyO2xBsz|5|21
2:01 PM - 28 Nov 2015|Disregard last 2000 tweets|692|1.2K
1:59 PM - 28 Nov 2015|Me dead Person Peter Capaldi bad doctor Me pic twitter com fmnvrg0I9i|20|22
2:02 PM - 28 Nov 2015|When fave Who writer ever leaves I change account name Doctor Who Thing Rants I want show back|6|17
12:45 PM - 28 Nov 2015|What hell even episode I idea what's going|2|2
12:46 PM - 28 Nov 2015|That gave time doctor Amy 11 flashbacks|1|1
12:46 PM - 28 Nov 2015|'Get arse win' CLARA I MISSED YOU|2|4
12:46 PM - 28 Nov 2015|The music episode amazing|1|2
11:25 AM - 27 Nov 2015|When one friends shows pre-drinks right time pic twitter com MlNTttaQKW|194|484
1:55 PM - 27 Nov 2015|When someone comments appearance pic twitter com cH93XjI864|191|240
11:27 AM - 28 Nov 2015|When you're stressed getting ready dad asks room's tidy pic twitter com PkmDqFTHSH|282|422
11:14 AM - 28 Nov 2015|There's always one person family bloody loves Monopoly can't think someone it's probably|224|576
4:07 AM - 28 Nov 2015|Just started raining obviously great time doorstep Oldham #IBackJim pic twitter com G8uZwUuWMM|78|162
7:27 AM - 28 Nov 2015|When friend asks youse getting mortal tonight pic twitter com UquiS6Faau|173|289
7:13 AM - 28 Nov 2015|Only Britain could game Scrabble become heated|174|447
1:45 PM - 20 Nov 2015|That crappy advert made go Crumpets Muppets Formerly two favourite things|87|477
3:17 PM - 27 Nov 2015|Why funny pic twitter com 03t94ZZZ2L|122|954
3:12 PM - 27 Nov 2015|Thank Manchester great night #Duranlive pic twitter com lZoiyLgrm9|144|445
5:34 PM - 27 Nov 2015|Forget New Romantics - felt like full-blown rock concert http duran io 1lPaQIq @MENnewsdesk pic twitter com zG5AqihD62|110|343
1:46 PM - 27 Nov 2015|Has occured much David looks like Peter Capaldi #Gogglebox|1|3
12:45 PM - 27 Nov 2015|Almost #ImACeleb eviction time Plus we're hoping @TheTonyHadley @SpandauBallet #TVGold #TeamTony pic twitter com zjMa6ZVgw0|14|46
11:32 AM - 27 Nov 2015|I always talk hand get go people can't sass telling|16|54
7:52 AM - 27 Nov 2015|Oh god bear https twitter com thegnshow status 670265349640617984|1|3
7:52 AM - 27 Nov 2015|Happy Black Friday|75|439
7:51 AM - 27 Nov 2015|Harrison Ford proper #Sherlock addict proof http www radiotimes com news 2015-11-27 harrison-ford-is-a-proper-sherlock-addict-according-to-his-wife pic twitter com 6GIKgEqmD0|44|67
5:26 AM - 27 Nov 2015|One perfect mornings Love #6music listeners #tshirtday pic twitter com lnbh2M6LQV|6|54
5:27 AM - 27 Nov 2015|I've busy week here's something I wrote @AttitudeMag mental health gay men http attitude co uk dr-christian-on-gay-men-and-mental-health|20|31
5:28 AM - 27 Nov 2015|New helmet safety measures Find http the-ecb co uk TOUj6Z pic twitter com QtO11raaqf|33|20
5:30 AM - 27 Nov 2015|17 comics tired real http www buzzfeed com lorynbrantz 16-comics-only-lazy-people-will-understand bftwuk utm_term 4ldqpgm#4ldqpgm pic twitter com GJxbcdhs4e|23|32
5:32 AM - 27 Nov 2015|Important pic twitter com afK6QvM3vB|656|916
5:32 AM - 27 Nov 2015|This week held several #BAFTA events Hong Kong #HughBonneville find http bit ly 1NfZebN pic twitter com 1vJalFjsMw|20|43
7:48 PM - 26 Nov 2015|https www facebook com TheFieldMagazine Hurrah 'Unfortunately' ass ReTweet congratulate councillors Bri pic twitter com IiQNpQCYxU|269|242
4:08 AM - 27 Nov 2015|Very Happy #FreddieFriday #BriDay @DrBrianMay @OIQFC @_Marine_T @AnnaR966 @annamariapapa4a @QueenFacts1991 pic twitter com cVNIsiKMNU|12|21
4:01 AM - 27 Nov 2015|Spending Friday Saturday Lisbon two sold Prima Donna shows Gulbenkian pic twitter com DdfvTCqMxQ|10|43
12:13 PM - 26 Nov 2015|The Seven Sins @RichardEGrant Eating cooking one THE greatest pleasures 'Life banquet' pic twitter com wyXtQxJcH5|13|53
9:17 AM - 26 Nov 2015|Soup Dragon Join @innocent #BigKnit today fab FREE pattern http www deramores com bigknit-patterns pic twitter com EMJAzjEBwh|9|27
1:37 AM - 27 Nov 2015|How avoid Black Friday 1 Get internet 2 Hire submarine 3 Go submarine operation course 4 Go bottom ocean 5 Wait|202|303
11:50 PM - 26 Nov 2015|Sun shinin' sky There ain't cloud sight At least song always shines - Mr Blue Sky http bbc 1Iaw65p|7|12
10:26 AM - 25 Nov 2015|yellow number world square snails fly moon crayon brain https twitter com _therealrd3 status 668488083290001408|687|638
10:20 AM - 26 Nov 2015|That may well true https twitter com Basilokpara status 669943677561774080|17|53
10:22 AM - 26 Nov 2015|I love lots nominate Mums #100inspirationalwomen Quite right Xx|7|43
10:22 AM - 26 Nov 2015|Got feeling belly I'm sure it's hunger nerves sickness|9|102
10:23 AM - 26 Nov 2015|Admit first real crush Troy Bolton pic twitter com SRmWWX42Bs|552|602
2:24 AM - 26 Nov 2015|Thanksgiving Americans busy eating pumpkin pie online The Brits overrun Twitter tweeting tea saying sorry lot|251|350
3:23 AM - 26 Nov 2015|My darling friend wasn't pleased results pregnancy test #dear pic twitter com Ds8CUlreX4|40|62
7:56 AM - 23 Nov 2015|When Rome pic twitter com TCbvxofu6u|1|1
7:25 AM - 25 Nov 2015|Fantastic morning @PennyhillPark Spa- epitome luxurious relaxation Thrilled they're stocking @JackPerfume|5|4
12:00 AM - 26 Nov 2015|Catch Ugly Sisters Matthew Kelly Matthew Rixon @ITVLorraine around 8 30am @FFEPanto pic twitter com NhtJdYGn8h|8|8
11:18 PM - 25 Nov 2015|Apparently it's international rock band t-shirt day Wearing Inxs whilst face painted blue sketch show pic twitter com LDV2usphdS|27|152
9:56 AM - 25 Nov 2015|I spent much money clothes arghhhhHHhhHh I'll lookbook make feel less guilty|116|1.3K
10:30 AM - 25 Nov 2015|Check cool new feature - @duranduran Week Review http duran io 1N6XUnb pic twitter com VNK7jtT8FE|22|114
1:11 PM - 25 Nov 2015|The background music #TheApprentice identical bg music The Simpsons Tapped Out game I'm serious|1|4
2:10 PM - 25 Nov 2015|Saying thank self-service checkout seem rude|170|416
9:00 AM - 25 Nov 2015|31 years since pop rock acts came together record Do They Know It's Christmas http duran io 1NPhZyU pic twitter com BmSSMo5FrA|172|404
6:41 AM - 25 Nov 2015|In spirit Cole Porter - 'I love Paris drizzles ' pic twitter com iGDBjCsL69|20|88
5:56 AM - 25 Nov 2015|Dublin Tomorrow night @hugorifkind @DAaronovitch I attempting play News Quiz live drunk https roundtown com event 36257998 The-Times-The-Sunday-Times-Quiz-Evening-Dublin-IE|12|27
5:31 AM - 25 Nov 2015|Ready another one #guardiansofthegalaxy #gamora #scifi #Marvel pic twitter com aVYyUnbTSe|1.5K|2.3K
5:31 AM - 25 Nov 2015|Anyone believes #tampontax probably fit involved governing country #AutumnStatement|51|139
5:30 AM - 25 Nov 2015|19 small awards anyone anxiety deserves receive http www buzzfeed com annaborges you-did-it bftwuk utm_term 4ldqpgm#4ldqpgm pic twitter com NuQBLEXWx3|42|72
5:30 AM - 25 Nov 2015|Interestingly like trickle doesn't work Premier League The buggers keep top keep https twitter com marcuschown status 669506713079390208|1|1
3:27 AM - 25 Nov 2015|Every day clinic I turn heating open windows put furniture I like The next day put back|2|60
5:28 AM - 25 Nov 2015|Yes definitely genetic factors life style environment play part eg family upbringing https twitter com scotthunterxxx status 669501263235694592|6|12
4:35 AM - 25 Nov 2015|ur local principal 80s proud students pic twitter com lOr7Llsbia|15|96
5:29 AM - 25 Nov 2015|I don't see numbers add Must big revenue raising measure coming Fuel duty Something else #spendingreview|379|112
5:20 AM - 25 Nov 2015|Our print digital editions Feat #DuchessKate @CherylOfficial lots http ow ly UXwza pic twitter com AklkdbEJ7z|1|1
5:21 AM - 25 Nov 2015|Looks like trickle doesn't What surprise https twitter com NHAparty status 669504508255469568|1|1
5:21 AM - 25 Nov 2015|Great see brilliant @brainpicker writing NYTBR Dark Matter Dinosaurs Lisa Randall http nyti ms 1QGlPk3|101|231
2:34 AM - 25 Nov 2015|Harley Granville Barker born #onthisday 1877 Read life http ow ly V3yL5 #HappyBirthdayHGB pic twitter com 1a5IgK6nF2|17|18
12:46 AM - 25 Nov 2015|I walked past school I miss school|51|537
2:39 AM - 25 Nov 2015|This lady's weather today Those late nights London caught seems|1|2
9:36 AM - 24 Nov 2015|@brianmaycom And don't forget @TheStruts @LukeStruts Freddie look|1|3
4:12 PM - 24 Nov 2015|Omg remember farmville|183|1.1K
2:00 PM - 24 Nov 2015|When you're mortal pre-drinks nobody ordered taxis town pic twitter com zZrXKxou8w|236|389
3:43 PM - 24 Nov 2015|#Duranlive begins FRIDAY #UKTour2015 pic twitter com A4PF4puB6q|58|204
2:09 PM - 24 Nov 2015|Foreign bands think 'UK tour' consists London Manchester|489|1K
8:57 AM - 24 Nov 2015|attractive persons funny fuck tho|77|164
12:32 PM - 24 Nov 2015|Visited favourite Parisian restaurant early evening queue around block get time I left BRAVO|38|157
12:13 PM - 24 Nov 2015|Just smashed @mattforde Humble Quest Thanks @matthewcrosby @sarapascoe realising true genius pic twitter com 8vTP5gOVkf|8|35
12:14 PM - 24 Nov 2015|Holby City Winter Holby City heating http bbc 1TcTDnr|27|77
12:14 PM - 24 Nov 2015|BOOOOOOM 1-0 Thank God Ozil player #afc|511|508
12:14 PM - 24 Nov 2015|Just smashed phone screen - anyone know earth I replace|6|44
9:16 AM - 24 Nov 2015|Oh FUCK OFF Daily Mail Tanya ass queen heck shouldn't show pic twitter com stUFvaRYVl|445|1.4K
12:05 PM - 24 Nov 2015|Pain https twitter com ChampionsLeague status 669244825896665088|45|76
11:27 AM - 24 Nov 2015|I m 30 I still feel like Kevin McCallister I go supermarket|569|2.1K
9:06 AM - 24 Nov 2015|This time next month Christmas Eve|475|510
7:43 AM - 24 Nov 2015|Jac's back Main story tonight - oh man - yes - welcoming ice queen back Synopsis http www bbc co uk programmes b06qqznj|2|3
7:45 AM - 24 Nov 2015|Who seeing next weeks @duranduran @Seal #bloomsisters #Duranlive pic twitter com uNy7n2XR9S|49|144
7:28 AM - 24 Nov 2015|Been asked bring along bake votes https twitter com GrubClubCambs status 669135640978681856|2|6
12:20 AM - 24 Nov 2015|ICYMI Peter Capaldi Alex Kingston joined Greg Davies Matt Lucas 2015 Christmas Special pic twitter com ZicXVmterq|303|852
11:36 AM - 23 Nov 2015|When you're 11 weeks school chill start realise you've probably done much chilling|2K|2.3K
5:37 AM - 24 Nov 2015|Two brave women called tell us #abused childhood - first time spoken anyone One 63 @bbcradio2|18|111
4:25 AM - 24 Nov 2015|I think life starting revolve around @bbcapprentice|58|521
2:55 AM - 24 Nov 2015|Sat empty cinema waiting Steve Jobs #screeningforone|3|29
3:20 AM - 24 Nov 2015|I always want take little working running selfies I look like sweaty purple egg|143|960
12:05 AM - 24 Nov 2015|ICYMI Should #WHUFC start put youth development first http westhamworld co uk time-for-west-ham-to-take-the-lead-in-youth-development-again pic twitter com zTY2lQEHC7|5|7
6:15 AM - 23 Nov 2015|I know people sometimes buy stuff online they're drunk might lowest point @DanielJLayton pic twitter com gUXgVSahBw|22|228
12:06 AM - 24 Nov 2015|It's come @GMB pic twitter com 5T7Xiio3Ft|36|187
12:00 AM - 24 Nov 2015|44 days #DavidTennant's return Richard II @TheRSC @BarbicanCentre http www davidtennantontwitter com RichardII html pic twitter com wZMHbXvKdw|16|65
12:00 AM - 24 Nov 2015|The depressing nail polish names 2015 http bzfd 1PWqPPR|6|11
12:01 AM - 24 Nov 2015|Please make ET musical Steve https twitter com bbcradio4 status 669060308615495680|6|57
12:01 AM - 24 Nov 2015|Flat back This former PL boss took tumble week http po st SheFellOver pic twitter com JoPAvw9LZ2|1|3
12:01 AM - 24 Nov 2015|Happy birthday @RichardAArnold Best cake caption ever pic twitter com a3MjNS5HTR|2|4
11:48 PM - 23 Nov 2015|Bonjour mes amis New dawn The city light pic twitter com mOQvhMERKz|32|192
9:07 AM - 23 Nov 2015|Say cheese Tomorrow's case 'poses' questions Dr Valentine We hope you'll watching #HolbyCity #BBCOne pic twitter com 6f7dBZ5EBO|27|87
7:22 AM - 23 Nov 2015|@DreyfusJames @sarcasomic Once clicked you're faced chilling banner 'Start Gallery ' Tony Hart ain't|1|2
2:16 AM - 23 Nov 2015|Proud Pop daughter arm Evening Standard Theatre Awards last night Old Vic pic twitter com CGots2naP2|7|113
1:19 AM - 23 Nov 2015|Amazing evening #eveningstandardawards @RichardEGrant pic twitter com 5X6SjCz6Th|1|2
1:01 AM - 23 Nov 2015|It's 9am I'm showered dressed fed already edited one video This week going busy one|2|93
12:39 AM - 23 Nov 2015|Well I returned flat isn't mine bringing 4 inch platform heels Do I return home barefoot werk Monday morning|114|1.1K
3:36 PM - 22 Nov 2015|@RealScottMaslen #JamesHolloway #TheRoyals #Season2 #Loyals #cyrus #Ep2 https instagram com p -Z-CtAvwZd|1|1
7:07 AM - 20 Nov 2015|Duffle coat definitely I think I'll hot cocoa I get home|44|96
7:07 AM - 22 Nov 2015|Sometimes even marmalade isn't sticky enough pic twitter com 3CSMgtv4DO|20|40
12:47 PM - 22 Nov 2015|My film #Paddington won @BAFTA This calls marmalade sandwiches round Thank voted #BAFTAkids|206|434
6:13 AM - 22 Nov 2015|And see wild bus drinking river pic twitter com 0jlo6yKlIU|951|1.8K
