7:46 PM - 6 Dec 2015|I understand you're saying comments valuable I'm gonna ignore advice - Roald Dahl|2|3
9:41 PM - 7 Dec 2015|We Living Dangerous World Don't waste ur positive energy Others Keep ur Inner Strength you'll need pic twitter com 0jux1xukFb|195|277
1:23 PM - 8 Dec 2015|http SI com 's annual People's Heisman poll live Cast Heisman ballot http si com 1NJv8sW pic twitter com 3YRRw9QCnz|13|27
10:42 AM - 28 Nov 2015|Let dreams bigger fears actions louder words #mindfulness #dreams pic twitter com vbAGR4Zixq|228|212
1:39 PM - 24 Nov 2015|Confidence comes always right fearing wrong #confidence #mindfulness pic twitter com 7TwZMjwAOL|200|228
3:31 PM - 24 Nov 2015|Join us info sessions Utah's new primary election process Dec Price Parowan Ogden Salt Lake pic twitter com dgfWfpCKE3|7|6
1:26 PM - 21 Nov 2015|@ Retreat Without inner peace mind cannot heal Don't let destroy #healing #innerpeace #mindfulness pic twitter com L05mIScEl9|481|526
11:25 PM - 20 Nov 2015|Floating Lantern Festival Thailand pic twitter com JDviViRrLk|1|4
9:15 PM - 17 Nov 2015|You belong If someone know feeling suicidal call Trevor Lifeline 866-488-7386 #TransWk pic twitter com 9IoBjXei11|75|58
