8:13 AM - 12 Dec 2015|@MikaelKingsbury all-time World Cup moguls wins leader Ruka victory http bit ly 1lWiHDL #TeamCanada pic twitter com qwEpxkswKS|22|59
8:08 PM - 9 Dec 2015|Look mom #RoadToRio #TeamCanada @0oKarineo0 @jackie_simoneau pic twitter com fzHHnpMsEm|8|32
2:09 AM - 8 Dec 2015|IOC President marks anniversary Olympic Agenda 2020 call renew trust sport http bit ly 1Qc9R1w pic twitter com eaBIarxKdH|181|129
11:20 AM - 7 Dec 2015|Live experience pic twitter com cGgvVN3M1L|9.4K|16K
6:01 AM - 1 Dec 2015|#GivingTuesday http bit ly 1MSmX00 Team build future Olympians 1 4 thanks generous partners pic twitter com dYoLSi3cJm|31|29
6:06 AM - 27 Nov 2015|It's nice know clean sport rewarded says marathoner upgraded Pan Am bronze http www thestar com sports amateur 2015 11 26 rachel-hannah-awarded-pan-am-games-bronze-medal-in-marathon-four-months-later html pic twitter com MDKsDBdOCJ|2|3
9:24 PM - 26 Nov 2015|One wonderful choices family make educate daughters @Malala http econ st 1IbDpty pic twitter com eHNa2fJ6bA|855|932
10:25 AM - 23 Nov 2015|If social media internet ceased exist today would would spend time|80|100
11:48 AM - 19 Nov 2015|Watching LIVE #Periscope World champion pole vaulter Shawn Barber https www periscope tv w aR4dgjIwNTEwNnwxTHl4QnZrV0JQWXhOAJ51Klgzw_jDOnfw-sjiTtg0xtOHn5P0e-gCPX2VruQ pic twitter com 5bQFOhlVLU|2|0
