4:37 PM - 2 Dec 2015|You never friends someone fell love|2.3K|3.2K
12:22 PM - 12 Dec 2015|u thought snapchat realize it's story pic twitter com RQiCX83BLY|516|1.1K
10:37 PM - 11 Dec 2015|Can I like turn life days|283|289
2:00 PM - 26 Nov 2015|At thanksgiving dinner how's school How's grades How's love life Me https vine co v egK9F3atjVv|407|472
7:35 PM - 11 Dec 2015|There's always one person you've feelings since moment met|540|1.4K
11:21 AM - 29 Nov 2015|Neck kisses got like pic twitter com rXK2MZI24z|2.1K|6.2K
10:35 AM - 12 Dec 2015|guy stretches see boxers V-line sweet baby jesus|396|1.1K
