4:58 PM - 11 Dec 2015|I CANT WAIT ANY LONGER OMG|5|7
3:46 PM - 11 Dec 2015|You Don't Have To Go - 1 Day #YDHTG pic twitter com XovsgAFAcw|1.5K|3.3K
2:45 PM - 10 Dec 2015|Be change want see world|1.9K|4.2K
12:08 PM - 9 Dec 2015|Run Harry Run See Wells survives #TheFlash Winter Finale NOW The CW App http cwtv com FLA09 https amp twimg com v 6ca516f3-a756-4302-952e-0bf82cb9ba43|1.1K|2.3K
12:59 AM - 9 Dec 2015|If don't like naps you're wrong|1.3K|2.9K
3:21 PM - 8 Dec 2015|I can't even pic twitter com BC9ozcVk9n|4.6K|4.9K
12:24 PM - 8 Dec 2015|Me #TheFlash tonight @grantgust pic twitter com gOMI4DOHsH|798|2.2K
7:58 PM - 7 Dec 2015|Chunky chocolate peanut butter ice cream pic twitter com WcHBcvmSU0|1.2K|1.6K
7:57 PM - 7 Dec 2015|Fried Oreos pic twitter com q6oWp3HgFl|2.3K|3K
4:26 PM - 30 Nov 2015|#TheFlash #Arrow crossover event begins TOMORROW 8 7c #FlashxArrow pic twitter com 9Aetc4LIFu|1K|1.9K
12:22 PM - 1 Dec 2015|The boys show tonight Opening jingle ball show Dallas|55|82
3:45 PM - 26 Nov 2015|Thanksgiving Dinner Homeless http youtu _FLweDRU6J4 pic twitter com huS7ldfQXz|402|707
6:49 PM - 25 Nov 2015|How turkey feels day Thanksgiving pic twitter com noOCueip3I|4.4K|5.3K
5:24 PM - 24 Nov 2015|This sneak peek January premiere cool #5YearsForward #PLLChat|269|639
5:19 PM - 24 Nov 2015|What think happens Ezra #PLL #5YearsForward pic twitter com hcKT9dcp7Z|453|929
5:18 PM - 24 Nov 2015|They knew needed go experience life #PLL #5YearsForward|287|626
7:52 PM - 22 Nov 2015|#Update According dear @dinahjane97's snapchat One Direction won Artist The Year|164|122
6:43 PM - 22 Nov 2015|Lou posted snapchat Harry's boots pic twitter com M07c1S4g21|311|339
6:17 PM - 22 Nov 2015|They showed 5SOS boys performance|99|107
6:01 PM - 22 Nov 2015|Luke Michael interviewed niall #5SOSonAMAs #AMAs pic twitter com xIH0MGLsAG|503|539
2:00 PM - 20 Nov 2015|When realize you're lost https vine co v iuQhexeaMIK|52|189
10:41 AM - 17 Nov 2015|EP @TVGab previews fallout Barry's infamous beating tonight's new episode #TheFlash 8 7c https amp twimg com v f6985424-c107-4b65-89e8-409aaebd6c21|676|1.3K
10:16 PM - 16 Nov 2015|Cookies Cream Mocha Milkshake pic twitter com aWvvNSOkjp|2.5K|2.8K
