3:06 PM - 12 Dec 2015|The funniest parenting tweets week http huff 1I0t03W pic twitter com Bz7nHnZRFT|127|263
11:58 AM - 12 Dec 2015|Low key trying lose mind Star Wars coming 6 days|1|2
4:59 PM - 10 Dec 2015|Part 2 #staplesthistime #cantconcussme @BroncoSportsWRE pic twitter com NE1TIS9wcE|1|9
7:32 AM - 6 Dec 2015|Pretty fly white guy #terriblesignature #looklikejamesbond #cleanuprealgood https www instagram com p -9Jx_rkavp|1|1
1:56 PM - 3 Dec 2015|Preview Broncos' trip #CKLV http www broncosports com sports m-wrestl spec-rel 120315aaa html pic twitter com A3AlSRWhHh|1|1
4:00 PM - 2 Dec 2015|@marcmariani80 joins @CSNBoden Tom Thayer #Bears All Access LISTEN LIVE http chgobrs com 1XzQdB2 pic twitter com MKrYGoXg6c|20|64
12:40 PM - 2 Dec 2015|Packers fans RT use hashtag #BarringtonWPMOYChallenge give @Sam_Barrington_ chance win 20k charity choice|781|260
3:28 PM - 28 Nov 2015|FINAL The Griz defeat Jackrabbits 24-17 advance second round FCS Playoffs pic twitter com lrfgQhWUlf|86|115
5:11 PM - 28 Nov 2015|Still playing football December Great win tough Jackrabbits today Proud Griz #GoGriz #PrideOfMT #FCSPlayoffs|6|22
4:15 PM - 28 Nov 2015|Taylor West makes four-straight decisions Broncos knocking Kieffer Taylor 6-4 Broncos lead 12-8|3|3
2:30 PM - 28 Nov 2015|Boise State vs Utah Valley 4 p m LIVE VIDEO https www youtube com user uvuevents2 LIVE RESULTS http s100 trackwrestling com tw seasons LoadBalance jsp seasonId 56251094 pageName DualMatches jsp dualId 13975010 pic twitter com ps7CoKxQIE|1|3
3:00 PM - 27 Nov 2015|The University Montana #OnlyinMissoula http www destinationmissoula org pic twitter com fVen3Zvoco|7|9
5:00 PM - 27 Nov 2015|ICYMI check first edition Bronco Wrestling Podcast https soundcloud com user-143066352 bronco-wrestling-podcast-episode-1|2|1
11:00 AM - 27 Nov 2015|Preview tomorrow's dual Utah Valley HERE http www broncosports com sports m-wrestl spec-rel 112515aaa html pic twitter com Bmgsy1x06C|3|8
11:15 AM - 27 Nov 2015|Check Episode One Bronco Wrestling Podcast featuring Coach Randall @Taylor_M_West https soundcloud com user-143066352 bronco-wrestling-podcast-episode-1|2|7
8:49 PM - 22 Nov 2015|Pins Dewey West give Broncos 22-21 tie-breaking win Arizona State http www broncosports com sports m-wrestl recaps 112215aaa html|4|7
7:59 PM - 22 Nov 2015|Boise State knocks Arizona State 22-21 picking team point criteria Broncos victorious first league dual 2015-16|12|31
8:26 AM - 22 Nov 2015|#GrizFootball host South Dakota State opening round @NCAA_FCS Playoffs 1pm Nov 28 #GoGriz|51|67
8:22 AM - 22 Nov 2015|#GrizFootball waiting patiently name called @NCAA_FCS selection show #GoGriz pic twitter com NC3RzHi1Gt|9|21
4:23 PM - 19 Nov 2015|#WranglerNFR #CHAMPS 2 weeks http ift tt 1I2mIvj pic twitter com 6mQUleAggy|36|49
5:03 PM - 15 Nov 2015|Chris Castillo 157 Taylor West 165 finish fourth Jake Velarda 141 finished sixth|3|8
6:49 PM - 15 Nov 2015|Geordan Martinez leads Broncos Cyclone Invitational Full recap today's action http www broncosports com sports m-wrestl recaps 111515aab html pic twitter com pcbHbIbxMX|3|5
