5:00 PM - 7 Dec 2015|Hear Brandon Falzon chose become SkyWest #pilot Want fly us Apply http ow ly VBazN pic twitter com z3kI7ZNQJ9|1|2
10:35 AM - 10 Dec 2015|It great @WestminsterSLC talk #aviation students Thanks coming good luck finals pic twitter com Od3FV00NW0|3|5
9:30 AM - 5 Dec 2015|Let us try find peace As individuals homes chapels find peace It happen us It happen us|283|858
9:25 AM - 6 Dec 2015|We're looking A P mechanics Minneapolis @mspairport http ow ly VvB86 Seattle @SeaTacairport http ow ly VvB58|1|1
1:50 PM - 2 Dec 2015|Dozens SkyWest people raised money awareness men's health issues #Movember http ow ly VouvT pic twitter com Yuk35WEewU|1|1
3:55 PM - 4 Dec 2015|What love working airline industry #avgeek pic twitter com 186LCsou2U|1|1
4:20 PM - 3 Dec 2015|Our team great time @TransPacAcademy today Check upcoming events http ow ly VskDQ pic twitter com cbqj53fqS9|2|2
4:55 PM - 1 Dec 2015|Start First Class Career SkyWest Airlines #pilot Apply online fly us http ow ly Vm6c2 pic twitter com OhgS99CSP4|1|4
1:55 PM - 19 Nov 2015|Tomorrow #pilot recruitment team @FAPA Aero Global Pilot Job Fair If you're attending make sure come chat us|1|1
3:40 PM - 18 Nov 2015|We've great time visiting students @NMCdotEDU today talking future SkyWest pilots pic twitter com VsTK2EAw09|1|4
