1:45 PM - 12 Dec 2015|If missed #Arrow mid-season finale watch free online http cwtv com AR09 pic twitter com mKlzxnNt05|101|334
4:45 AM - 13 Dec 2015|#TheFlash's mid-season finale left us anxious January Watch free online http cwtv com FLA09 pic twitter com Sr3rml3y9b|97|290
11:46 PM - 12 Dec 2015|When best friend sees crush hallway pic twitter com K7EJRhHZFL|2.4K|1.5K
5:02 PM - 12 Dec 2015|I can't say sorry mean hello anymore without starting sing song|2.1K|2.1K
10:09 PM - 12 Dec 2015|overprotective parents raise best liars|2K|3.4K
9:00 PM - 5 Dec 2015|Be Happy|78|68
11:00 PM - 8 Dec 2015|Pour Grandma Esther's Eggnog watch #TheFlash Winter Finale FREE http cwtv com FLA09 pic twitter com mCFfmV6olE|388|1.3K
5:25 PM - 8 Dec 2015|Legendary response #TheFlash #DCLegends pic twitter com NwVqO7IHtR|923|1.8K
6:49 PM - 12 Dec 2015|Nice night KCP went 18pts 7rbs 8asts 4stls lifting @DetroitPistons @Pacers 118-96 pic twitter com MBkmOCWKHn|164|286
10:00 AM - 12 Dec 2015|Some things aren't meant Grieve Cisco http chroniclesofcisco tumblr com pic twitter com UbR7XdS1PT|498|1.7K
5:06 PM - 8 Dec 2015|I don't always lie job But I #StayThirstyMyFriends #Flash #Zoom https twitter com accesshollywood status 674310010667712512|622|1.6K
11:00 PM - 8 Dec 2015|Don't chase people Be thing work hard The right people belong life come stay|95|98
10:00 PM - 11 Dec 2015|Enjoy moments don't last forever|64|73
5:43 AM - 10 Dec 2015|Paul bass 'Band Run' recording sessions Lagos Nigeria 1973 #ThrowbackThursday #TBT pic twitter com sOchr9dFQi|774|1.7K
4:45 PM - 12 Dec 2015|christmas much worse get older like want year sense purpose|1.7K|2.8K
5:33 PM - 11 Dec 2015|The four stages haircut hatred regret sadness acceptance|318|489
1:33 AM - 12 Dec 2015|This true lol pic twitter com 05eFYD76T8|741|1.1K
8:11 AM - 12 Dec 2015|dont understand fries longer average potato|1.9K|3.2K
8:27 AM - 12 Dec 2015|Is Han Solo legally justified shooting Greedo first @thelegalgeeks investigate http vult re 1Z590RV pic twitter com 12MvmAU2f7|33|37
7:08 AM - 12 Dec 2015|When see crush @grantgust pic twitter com OSnvmQwLSt|6|4
