2:21 PM - 5 Dec 2015|#LabRats Bionic Action Hero #DisneyChannel 7pm tonight @BillyUnger @SpencerBoldman @kelliberglund @Tyreljwill @HalSparks @iamLeoHoward|12|47
2:01 PM - 5 Dec 2015|What would Cap died Civil War pic twitter com 70csz9vTCq|496|808
1:23 PM - 5 Dec 2015|LMFAOOOO pic twitter com CHSJgMcbDs|484|1K
10:10 AM - 5 Dec 2015|uninstall anxiety|643|916
7:43 AM - 4 Dec 2015|Happy birthday one greatest rappers time #HappyBirthdayJayZ Tribute Jay-Z AJae https www youtube com watch v tN4-3ssbxVk|19|53
2:41 PM - 2 Dec 2015|#LabRats Ultimate Tailgate Challenge 9pm tonight @BillyUnger @SpencerBoldman @kelliberglund @Tyreljwill @HalSparks @WillieMcGinest|32|85
2:25 PM - 2 Dec 2015|please make stop #sanbernadino pic twitter com APAAUWerEn|1.9K|1.8K
7:45 AM - 2 Dec 2015|New #LabRatsBionicIsland tonight @SpencerBoldman @BillyUnger @kelliberglund @Tyreljwill http www dis411 net 2015 11 27 lab-rats-bionic-island-episode-ultimate-tailgate-challenge-airs-on-disney-xd-december-2-2015 pic twitter com x80eAp8Hkb|26|60
7:33 AM - 2 Dec 2015|Lab Rats Ultimate Tailgate Challenge Airs TONIGHT December 2nd http rcnamericaca blogspot com 2015 12 lab-rats-ultimate-tailgate-challenge html @Tyreljwill @HalSparks|3|9
9:30 PM - 1 Dec 2015|Goal pic twitter com kEMhYfdm5x|210|498
3:40 PM - 28 Nov 2015|Only 4 days til Ultimate Tailgate Challenge @WillieMcGinest http www tvinsider com article 55966 disney-xd-nfl-pro-athlete-willie-mcginest-on-lab-rats-plus-espn-sports-science-photos utm_source facebook utm_medium tvi #LabRatsBionicIsland #DisneyXD|15|35
8:10 PM - 27 Nov 2015|Lab Rats coming CANADA December 1 http www disneyxd ca shows lab-rats pic twitter com ptuKhvRbBo|27|87
11:11 PM - 24 Nov 2015|lord please save one favor|508|789
1:30 PM - 26 Nov 2015|So thankful Just goddamn thankful pic twitter com iHuBQqghmE|10|34
9:20 AM - 26 Nov 2015|I thankful Jessica Jones Matt Murdock Trish Walker Foggy I thankful Margot Robbie Harley Quinn Zack Snyder|449|1K
1:18 PM - 24 Nov 2015|New Lab Rats bionic island december 2 9pm Disney XD guest star @WillieMcGinest pic twitter com W2nk7iqtFJ|20|69
