2:10 AM - 12 Dec 2015|@XxOmgitsErickxX horrible lol long explain|1|6
2:22 AM - 12 Dec 2015|@XxOmgitsErickxX new map pack|1|6
8:34 AM - 11 Dec 2015|homie little pic twitter com njH3AkvpHy|4|7
6:06 PM - 10 Dec 2015|GIVEAWAY Halo 5 Tomb Raider Fallout 4 Black Ops 3 SW Battlefront RT enter http xboxdvr com anniversary pic twitter com EvKf3bvv1l|261|31
9:06 PM - 10 Dec 2015|Again I must ask perspective Minions @DavidVonderhaar|110|261
2:02 PM - 22 Nov 2015|PS4 XB1 Giveaway 2 Winners 1 RETWEET 2 Follow @PaZe_NoLackin 3 Turn notifications 4 Show proof|113|100
10:11 PM - 9 Dec 2015|No stream today felt tomorrow we're going full speed ahead pic twitter com t8EfJUB8R3|29|185
6:28 PM - 7 Dec 2015|ICYMI Take look Awesome Arcade Machine showcased #PSX lets play Dead Ops #COD pic twitter com V8fL8fdxUh|5|18
10:37 AM - 5 Dec 2015|Der Eisendrachen means The Iron Dragon English #BlackOps3|16|34
8:37 AM - 4 Dec 2015|Hey you're gonna great day today|191|1.1K
9:17 AM - 3 Dec 2015|IM DEAD pic twitter com J2ivxiStO7|189|382
8:51 AM - 3 Dec 2015|Minion starter pack pic twitter com KnjX4JpHrf|97|271
11:22 PM - 2 Dec 2015|I hate say I can't stand viners bunch ego driven people cocky mentality zero humility Not lot|14|70
2:23 PM - 2 Dec 2015|I liked @YouTube video @mrdalekjd http youtu vCXOc3Jz5oc Black Ops 3 ZOMBIES - QUIZ SHOW Zombies Trivia vs LiamFTWinter The|7|28
12:48 PM - 2 Dec 2015|watching videos tax accounts WHY DON'T THEY TEACH THIS STUFF IN SCHOOL LMAO I'm lost|13|67
1:28 PM - 2 Dec 2015|ICYMI The Bug Guardian ScoreStreak appears Winners Circle #BlackOps3 occurred pic twitter com lVp6Ivc4Zm|12|27
8:24 AM - 2 Dec 2015|HOTLINE BLING FOR YOU http youtu cFU-FJzPE80|2|5
7:40 AM - 20 Nov 2015|eating spaghetti forgetti regretti|604|539
10:45 PM - 1 Dec 2015|How semester going http vine co v ianwilKd7E9|64|62
12:39 AM - 1 Dec 2015|@MrTLexify You use account Dark Matter Zombies video like 3 use vid pic twitter com mi7J1F55Ow|2|9
8:48 PM - 1 Dec 2015|@XxOmgitsErickxX Amen|1|7
8:33 PM - 1 Dec 2015|Just disrespectful https amp twimg com v efbc9b74-2afa-4fbb-9140-0747927779ab|2.9K|3K
7:05 PM - 1 Dec 2015|Insert 'City Brotherly Love' joke http es pn 1N2PQEX|138|231
2:39 PM - 1 Dec 2015|Chels teaches preschool uses Super Cooper Sunday reward good behavior pic twitter com 9PTJ1GpHqG|235|1.5K
5:00 AM - 30 Nov 2015|RT chance win Star Wars The Force Awakens tickets #ForceOfFamily #KohlsSweepstakes http oak ctx ly r 41eaa pic twitter com RVNsiwjiqA|11K|3.8K
2:03 PM - 1 Dec 2015|I'm giving away 10 official Black Ops 3 guides RT Follow enter check http www primagames com games call-duty-black-ops-iii products pic twitter com jzTQoVgkL4|3.1K|1.1K
9:30 PM - 29 Nov 2015|This towards fallen wrath God bless pic twitter com 30n760kPVL|55|307
2:54 PM - 29 Nov 2015|When realize you've got homework procrastinated due next day pic twitter com fNb7pV6G8z|3.8K|3.7K
6:10 AM - 27 Nov 2015|Darth Noodle doesn't really ring #KraftStarWarsLove pic twitter com U9FUs56JnE|45|154
4:13 PM - 29 Nov 2015|This person you're electing president America pic twitter com 1845lkgvl6|137|276
12:05 PM - 28 Nov 2015|ONE MORE DAY TILL WE ANNOUCE THE GIVEAWAY WINNER Its late join guys To enter follow twitch twitter Hurry|1|2
12:09 PM - 28 Nov 2015|Giveaway prize one month PSN Plus To join follow us twitch twitter ENDS SUNDAY pic twitter com Ey0kAlvAeP|1|4
11:27 AM - 28 Nov 2015|Opened snapchat popped Kill fire pic twitter com 0s0N9dNx3A|158|1.2K
3:52 AM - 26 Nov 2015|Social Life type power-up pic twitter com e0KXd19lgw|50|276
3:10 PM - 22 Nov 2015|oh shit xD @TheRelaxingEnd pic twitter com s0Zvq5attw|1|2
7:42 PM - 22 Nov 2015|I hell|235|1.5K
11:34 AM - 26 Nov 2015|Happy Thanksgiving American homies|54|337
9:18 AM - 26 Nov 2015|From family #HappyThanksgiving celebrate And yes Zombies team designed card pic twitter com RWNzrNlsIS|1.2K|3.9K
7:48 PM - 25 Nov 2015|Who's still awake About hit super cool NEW Shadows Evil Easter Egg video|15|145
6:00 AM - 24 Nov 2015|Is someone life d love Xbox RT chance win #KohlsSweepstakes #BlackFriday pic twitter com Nn1RUO4kPy|37K|6.2K
6:22 PM - 25 Nov 2015|Call Duty Ghosts Xbox360 PS3 1 Toys R Us #BlackFriday - http www toysrus com product index jsp productId 21040866 cp parentPage search - pic twitter com ZBU8ITTpEy|573|712
11:55 AM - 25 Nov 2015|Cupcake time https twitter com shawnhaas1130 status 669602608391331841|4|45
9:18 AM - 25 Nov 2015|Which Call Of Duty Title Definitely playing Weekend RT - #BO3 #DoubleWXP Like - #AW #DXP pic twitter com FC4JLbLDKP|88|17
4:42 PM - 24 Nov 2015|The zombies community incredible thing I loved since World War You amazing We goals|1|12
10:55 AM - 25 Nov 2015|Want win EPIC collection Just RETWEET make sure you're following @KontrolFreek - Good luck D 3 pic twitter com GV83us71fx|11K|3.7K
12:43 AM - 23 Nov 2015|@XxOmgitsErickxX Hi Erick Sorry hear Are getting 100 time Do repro steps KJ|1|1
6:52 PM - 22 Nov 2015|Glenn's fate FINALLY revealed tonight's episode #TWD http ow ly UWVok pic twitter com G8u5Btg9ym|87|214
9:43 PM - 20 Nov 2015|Today amazing day|2|0
12:29 PM - 20 Nov 2015|Black Ops 3 Zombies - NEW PATCH UPDATE Samantha's Curse NEW Zombie Animations FIXES http youtu kARiZd_XMoc via @YouTube|11|37
12:19 PM - 20 Nov 2015|Should I continue Prestige Series|14|78
6:25 PM - 18 Nov 2015|Can I get amen pic twitter com RgTl1BusUN|66|225
5:42 PM - 18 Nov 2015|Sure may think funny But support game considered old wonderful thing Just sayin' P|11|101
5:51 PM - 18 Nov 2015|BREAKING - 3 New Weapons Live Now #CoDAW XB1 Lever Action Repulsor Sten Image TBR #CoDAW pic twitter com x0zDcwn0PM|6|15
5:47 PM - 18 Nov 2015|BREAKING SHGames Michael Condrey teased New 'Gingerbread' Gear Set along New Weapon 'Lever Action' pic twitter com M5vthg0mh2|11|19
11:55 AM - 18 Nov 2015|Why start wishlist buy Get jump holidays save 20 today http ow ly UOuhE pic twitter com RvlGtyMvV9|37|117
11:54 AM - 18 Nov 2015|RT think Boba Fett feared bounty hunter galaxy http bit ly 1NE1aac https amp twimg com v dfb6bc03-bfa1-42ed-8f26-f174f51a1c5a|736|779
11:49 AM - 18 Nov 2015|Anyone know real legit modder|7|25
9:51 PM - 16 Nov 2015|LMAO IM REALLY LAUGHING SO HARD pic twitter com KYWkbkevz2|4.8K|5.8K
10:19 PM - 17 Nov 2015|Action movies chill|3|2
11:33 PM - 17 Nov 2015|BOBA GODDAMN FETT GAMEPLAY CONFIRMED https twitter com xxomgitserickxx status 666878180850974721|1|3
8:49 PM - 16 Nov 2015|Me everytime I die Margwa pic twitter com dhwj8BLL4l|65|260
9:57 AM - 17 Nov 2015|ICYMI Take look Comparison COD Zombies - Der Riese WaW BO1 Now #BO3 Via BO3Reddit pic twitter com 2FdtpaZFas|12|20
11:39 AM - 16 Nov 2015|Success outcome get obsessing keep grinding|29|145
9:46 AM - 16 Nov 2015|ISIS put video morning As struck France stronghold Paris strike America stronghold Washington|1.4K|2.3K
8:27 AM - 16 Nov 2015|WOW Check NEW EasterEgg NUK3TOWN makes Mannequins Follow When you're looking http codintel8880 weebly com 1 post 2015 11 bo3-nuk3town-easter-egg-turns-mannequins-into-zombies html #BO3|4|11
10:51 AM - 15 Nov 2015|I believe BEST Black Ops 3 Zombies video ever uploaded https www youtube com watch v OFBS4my7Bh4 Kappa|21|126
10:46 AM - 15 Nov 2015|I've laptop 2 weeks went wipe smudge page shifted I touch screen Good know|6|88
