5:45 AM - 7 Dec 2015|Don't know Sonia Rahul certainly take advantage juvenility #NationalHerald case|64|37
10:04 PM - 6 Dec 2015|Superb video IAF chopper rescuing pregnant Rajeshwari Chennai rooftop Dec 3 She twins http youtu ni-fxUt19Mw|431|325
6:54 AM - 3 Dec 2015|Dear @PIB_India real pic Please stop spreading rumours pic twitter com QgBp65Fdyd|290|163
8:22 AM - 28 Nov 2015|My Husband And I Are Thriving Muslim Professionals In India We Have Only Felt Acceptance http www huffingtonpost dr-sofia-rangwala1 my-husband-and-i-are-thri_b_8660876 html # via HuffPostIndia|80|37
6:53 AM - 28 Nov 2015|Lessons Life You loved u know More u want believe Take deep breath And let go And see Feel|171|240
7:24 AM - 28 Nov 2015|What think THANK bring #LawOfAttraction|3|1
8:34 PM - 25 Nov 2015|Mumbai terror attack 26 11 - 7 years ago Justice yet done We shall forget brave fought innocents martyrd|155|179
2:02 AM - 26 Nov 2015|You'll always hungry 5 mins refusing eat someone offers|2|0
8:27 AM - 16 Nov 2015|The great military strategist modern Napoleon Bonaparte Ladies Gentlemen I give Shekhar Gupta pic twitter com F8av96G01n|132|79
10:28 AM - 15 Nov 2015|Quiz Are attracting repelling soul mate Try http bit ly 1P3ojIi pic twitter com MzIUzJYXdL|5|6
