6:01 AM - 11 Dec 2015|Welcome Canada pic twitter com xEOn44GjJF|19K|25K
5:36 AM - 10 Dec 2015|Today's Toronto Star front page pic twitter com mPf5FtC2Sz|470|345
8:02 AM - 9 Dec 2015|Infinite The number opened applications background check moms phone week|62|113
8:04 PM - 10 Dec 2015|Why doesn't Ed girlfriend Cause Sheeran|749|1.1K
8:16 AM - 10 Dec 2015|Took half hour break work made For fun #TheForceAwakens #StarWars pic twitter com iTdk4CEuOh|166|218
8:25 AM - 10 Dec 2015|A big thank 5000 customers http blog freshservice com dear-customers-thank-you #ITSM #custserv|5|7
10:45 AM - 8 Dec 2015|The city loves back @mrgirish https medium com @mrgirish the-city-that-loves-you-back-1f7b41f12a7# 8bdqpymm2|22|15
3:59 AM - 8 Dec 2015|How horrible Voldemort nowhere near bad https twitter com BBCNewsbeat status 674170911344455680|210K|200K
12:32 PM - 7 Dec 2015|According Mail I demanded helicopter get gravy Where come nonsense|3.3K|12K
12:02 AM - 7 Dec 2015|Proud @freshdesk team energy passion service past week help #inspired #ChennaiRains pic twitter com CQF0nAaNlM|22|20
5:54 AM - 2 Dec 2015|Lots love The Marina hotel 4000 biriyani packets counting Sent across Chennai Proud city pic twitter com vI7SoumWQ5|805|573
7:35 PM - 30 Nov 2015|You intuitively know want I dare break rational mind chase real dreams http stanford io 1QiPgcx|53|72
3:50 PM - 29 Nov 2015|Dear Basketball http playerstribu ne dearbball #KB20|130K|120K
1:11 PM - 27 Nov 2015|On Black Friday lot companies promise something nothing We're company offer nothing something|237|390
8:39 AM - 26 Nov 2015|58 years #RaspberryPi via https www reddit com r pics comments 3uc55k 58_years_on pic twitter com ollGWWOlly|3K|2.3K
8:29 AM - 27 Nov 2015|Just come back Twitter find great Snape debate still raging|2.5K|9.1K
12:58 PM - 25 Nov 2015|If eh Nissan pic twitter com SOJXFpscYs|5|9
6:47 PM - 22 Nov 2015|Ba come U cant im beta decaying pu Ba im undergoing cluster decay U pic twitter com YyBRkZfP3X|264|313
7:31 AM - 23 Nov 2015|Iniesta Some people like people In end #MondayMotivation #UCL pic twitter com FGOxrNiPBu|1.2K|1.2K
5:52 PM - 18 Nov 2015|If want learn write well read Wodehouse|72|266
10:49 PM - 17 Nov 2015|#TIL first ever official ODI 40 experiment 5th day rained test https twitter com ESPNcricinfo status 666862302289903616|2|2
9:01 PM - 17 Nov 2015|'Movie Director Portrait Prints' Get posters someone loves movies #giftideas http ow ly UKmHo pic twitter com UViYE9KZuF|76|136
1:50 AM - 16 Nov 2015|Zidane Scholes undoubtedly greatest midfielder generation #UCL pic twitter com 2OgIgvZMA6|1.4K|1.1K
9:34 PM - 13 Nov 2015|My heart goes innocent victims Paris|109|300
5:26 PM - 13 Nov 2015|#PorteOuverte free taxi-fare stories show even darkest moments humanity overwhelmingly cooperation love|545|571
