1:42 AM - 12 Dec 2015|Always https twitter com RjPankaj983 status 675188085311856641|1|2
1:42 AM - 12 Dec 2015|There 3 5cr retail employees India probably meet daily All celebrating Your tweets cheered many #RetailEmployeesDay|35|115
4:02 AM - 9 Dec 2015|You truly middle class unless least one Neelkamal chair|68|173
4:07 AM - 6 Dec 2015|A bank robber went clean became DJ didn't want let go catch phrase Put hands air|52|121
7:09 AM - 4 Dec 2015|Useful information car owners floods pic twitter com yYSPwXx0V0|143|55
7:18 AM - 4 Dec 2015|Freaky think https twitter com theweirdworld status 672794459646464001|12|17
6:06 AM - 4 Dec 2015|#Confused better #Batman For #ConfusionKaEnd investment http Bharti-axalife com|103|102
4:00 AM - 2 Dec 2015|Since holidays coming Here's Christmas to-do list http 9gag com gag aQnG8dw ref tp pic twitter com EOFchdDABA|1.9K|2.3K
10:48 AM - 1 Dec 2015|#HelpChennai Region-wise helpline numbers http timesofindia indiatimes com city chennai Chennai-flood-alert-Helpline-numbers articleshow 50002900 cms pic twitter com vpq2TmUzzf|170|46
9:01 AM - 1 Dec 2015|A motivational quote http 9gag com gag a3L69mv ref tp pic twitter com cD5zsIA26s|2.2K|2.1K
