9:12 AM - 10 Dec 2015|Chennai ppl Pls avoid supermarkets atleast weeks Smallvendors platform sellers rebuilding life scratch Pls help|893|582
8:35 AM - 10 Dec 2015|Congrats @NSaina winning world 1 Carolina Marin You keep us making proud time n time|35|102
3:02 AM - 10 Dec 2015|Salman's acquittal India favours lucky enough wealthy famous http bit ly 1OjDS9R pic twitter com bnEJXJrlQS|25|21
7:46 AM - 4 Dec 2015|This little girl lost Chennai floods pls help find parents Pls share much pic twitter com XCAq3Qz3cW|6.8K|3.4K
10:26 PM - 1 Dec 2015|Skype made Intl calls free Nepal Earthquake Requesting @VodafoneIN @Airtel_Presence @ideacellular make calls free #ChennaiFloods|144|61
9:11 AM - 1 Dec 2015|Can't Ignore coverage horrible Situation TN surrounding areas plagued crazy Rains https twitter com rj_balaji status 671667132065681408|124|74
5:38 AM - 1 Dec 2015|Bathrooms submerged Water coming drains I affluent actor This house Imagine rest TN pic twitter com tjU2O2vESw|2.2K|1.5K
2:43 AM - 1 Dec 2015|http osm-in github io flood-map chennai html#11 13 0000 80 2000 -30 Please use map you're travelling road Stay safe people #ChennaiFloods #chennairains|100|101
2:01 AM - 1 Dec 2015|Looking apartments shift families crew Lots people office home shelter Please share information flats|393|450
