8:02 PM - 10 Dec 2015|Train mind live present moment drop stress carrying nothing Our smile worth whole world|1.8K|1.4K
12:27 AM - 11 Dec 2015|Spirituality sharpens ur intellect softens ur heart lifts ur spirits u become productive whatever u fruitful @SriSri|73|43
12:36 AM - 11 Dec 2015|Enlightenment seed born It needs little nourishment nurturing @SriSri|64|45
9:12 AM - 11 Dec 2015|Gurudev@ Advance Meditation Program @sangeetajani - His words create silence minds love hearts pic twitter com x3ec2PQSYX|35|55
12:04 AM - 12 Dec 2015|Light lamp goodness harmony illuminate planet us #WCF2016 Details http www worldculturefestival pic twitter com fZXU86JeHK|118|43
9:24 AM - 5 Dec 2015|wanna kiss words leave mouth|124|230
11:18 AM - 11 Dec 2015|He held knew She could never let go|41|73
10:02 PM - 9 Dec 2015|Have serenity know let go move doesn't open long isn't door|74|55
9:13 PM - 10 Dec 2015|No matter life celebrate It either product growth place help grow|82|57
8:47 PM - 9 Dec 2015|Any citizen whether guilty appear court case Why worry innocent #NationalHerald|36|27
3:30 AM - 10 Dec 2015|While fans cheers aaptards r wishing AK become judiciary @sardesairajdeep @BDUTT superbusy creating blame-it-on-modi cards #Salmanverdict|3|2
9:29 AM - 10 Dec 2015|Congrats India pioneers driverless cars since 2002 Even Google still working auto cars So proud #salmanverdict|12|14
10:36 PM - 9 Dec 2015|Moto G Turbo Launched Buy Here http goo gl pO0fWJ #MotoGTurbo #MotorolaMotoGTurbo #Flipkart #India pic twitter com eJxsHhsVft|2|4
9:43 PM - 9 Dec 2015|Coimbatore volunteers team relief material #ChennaiFloodsRelief pic twitter com OFmIyy1m9D|126|87
7:08 PM - 9 Dec 2015|To find new idea read old book pic twitter com h5wY5Kmpfg|39|57
12:43 AM - 9 Dec 2015|If presence make impact absence make difference Be worth last|117|86
8:03 AM - 8 Dec 2015|Bahrain National Day Celebrations Swamiji Royal Family Bahrain ministers pic twitter com DgmhJZssLL|937|829
12:31 PM - 1 Dec 2015|We blessed @AOLDubai @AOLSwamiji It wonderful evening @WCF2016 #IVolunteer4WCF pic twitter com OYvODQBaKh|15|9
12:07 AM - 7 Dec 2015|1 Aarey lake cleanup 2 Mangrove cover 3 Save Kamala Nehru Park Citizens uniting #Save #IVolunteer4WCF pic twitter com t81UX0C1jd|12|7
12:17 AM - 8 Dec 2015|The Gorgeous @DeepikaPadukone In @AnjuModi Couture sets #Swaragini #BajiraoMastani Promotions pic twitter com x3Z2QrDmo3|27|46
12:30 AM - 8 Dec 2015|#155Footprints @SriSri receiving highest civilian award 'National Order Merito de Comuneros' #Paraguay pic twitter com giO6z2LGdB|246|155
6:37 PM - 8 Dec 2015|It nature mind wander Focusing Self stabilize - @SriSri Satsang yesterday pic twitter com VEeBWPznFi|66|66
10:51 PM - 8 Dec 2015|The Whole World Family Time Meet World #WCF2016 Visit http www worldculturefestival pic twitter com 75tpbkrOYv|262|133
10:46 AM - 8 Dec 2015|abandoned places visited heart favorite said|12|19
7:31 PM - 8 Dec 2015|Purity heart clarity mind sincerity action contentment formula happiness|1.8K|1.5K
2:05 AM - 27 Nov 2015|#IVolunteer4WCF Experience love World it's people it's cultures diversity 11 12 13 march pic twitter com LmLqAHiwqm|9|4
4:59 AM - 8 Dec 2015|Art Living receives 'Best Volunteer Organisation' Award Macedonian Govt Congratulations volunteers pic twitter com nffl87NQSi|1.7K|1.3K
1:03 AM - 7 Dec 2015|Building bridges love crossing unity family 155 countries #WCF2016 Follow us pic twitter com loYtel4gVQ|198|101
10:42 PM - 7 Dec 2015|The World moves Love Love moves World See love action grandeur #WCF2016 RT Share pic twitter com q3XfENptQN|193|96
9:32 AM - 4 Dec 2015|Look joined Chennai Seva #ArtOfLiving volunteers Dhanush Inspiring Where Bollywood stars pic twitter com Rack2nFdjN|230|146
9:52 PM - 6 Dec 2015|God perfect plan us He never step step wants us walk faith sight|117|106
8:28 PM - 7 Dec 2015|People love see best Focus character reputation|101|81
8:21 PM - 6 Dec 2015|When heart speaks heart listens harmony produced When head talks head listens argument produced|1.7K|1.3K
8:35 PM - 26 Nov 2015|#IVolunteer4WCF everyday get see 3 5 million people celebrating cultures around world|3|1
8:36 PM - 26 Nov 2015|#IVolunteer4WCF My Event My World My Family Let us celebrate everything|5|1
1:58 AM - 6 Dec 2015|Art Living volunteers supplying cooked food almost flood-affected areas Chennai pic twitter com wXw9QVGXWq|1.3K|989
9:38 PM - 26 Nov 2015|Biggest stage World 9 acres that's right 9 acres Stage Can't wait witness biggest Event times #IVolunteer4WCF|16|2
4:00 PM - 29 Nov 2015|One World Family Come celebrate diversity World Cultural Festival 2016 next March #WCF2016 http fb 7J54jAmVS|8|7
9:06 PM - 28 Nov 2015|One Divinity One Humanity Celebrating Differences sacred duty - SriSri #WCF2016 http twitter com WCF2016 status 670828508633952256|10|9
12:14 AM - 6 Dec 2015|The Beginnings Music Practices Begin #Vadodara Grand Symphony @WCF2016 #Delhi #WCF2016 pic twitter com R61pHjilN9|25|8
9:16 AM - 28 Nov 2015|The feeling contribute precious @WCF2016 #IVolunteer4WCF|8|2
4:17 AM - 27 Nov 2015|lit lighten world smile #IVolunteer4WCF|262|161
9:22 PM - 5 Dec 2015|Passion transformation dispassion momentary pleasures make profound solid person|1.6K|1.2K
7:27 PM - 5 Dec 2015|Tamil Nadu Minister Handlooms Gokula Indira distributes milk packets Visuals Anna Nagar #ChennaiFloods pic twitter com NGEOMbwx2P|26|27
6:41 PM - 4 Dec 2015|1 smile cn start friendship 1 word cn end fight 1 look cn save relationship 1 person cn change r life Live possibilities|3|7
12:56 AM - 5 Dec 2015|Carry love peace heart #WCF2016 Let's us reflect love universally RT join us pic twitter com Pqd7nVt4wx|229|119
12:44 AM - 3 Dec 2015|In March planning big cultural festival Delhi decided start clean Yamuna campaign-Sri Sri Ravishankar pic twitter com yezuFRiRkg|479|315
8:05 PM - 3 Dec 2015|Volunteers #ArtofLiving Vellore chapter collect dispatch supplies Chennai Relief Works @iahv pic twitter com 717GMUDTvJ|146|90
11:53 PM - 2 Dec 2015|While service true form worship slavery worst insult God #EndSlavery|1.6K|1.1K
8:37 AM - 2 Dec 2015|She Your beard really cute He Yours #BadConversationStarters|121|105
9:02 AM - 2 Dec 2015|Hey girl next picture uploaded #badconversationstarters|6|10
11:22 AM - 2 Dec 2015|Hi Are Hindu Muslim Sagarika Ghose #BadConversationStarters|61|68
8:28 PM - 2 Dec 2015|He Hiiii She Wait plssss He 58 KG #BadConversationStarters|19|19
10:09 AM - 2 Dec 2015|Boy - Hello Girl - I Already Have A Boyfriend #BadConversationStarters|47|102
9:32 PM - 29 Nov 2015|You lose power giving away giving away|29|20
8:59 PM - 26 Nov 2015|Spiritual blossoming simply means blossoming dimensions life happy ease everybody around|1.6K|1.2K
8:56 PM - 27 Nov 2015|Your job judge figure someone deserves Your job lift fallen restore broken heal hurting|175|117
10:34 PM - 27 Nov 2015|Every act service begins #Smile Make someone smile share story #CelebratingSmiles pic twitter com 75oOXBrfGx|308|152
6:37 AM - 28 Nov 2015|Dispassion doesn't mean lack enthusiasm There called dispassionate don't smile don't http fb 4cBIz6G7J|34|35
8:09 PM - 28 Nov 2015|Happiness depends 'only' mind Keeping mind happy makes work effortless This skill productivity|2.4K|1.9K
9:29 PM - 28 Nov 2015|Let light shine brightly others see way dark Make everyday Sun-day|122|98
6:33 AM - 26 Nov 2015|stories told one sitting|63|116
7:16 PM - 23 Nov 2015|places inside belong|157|273
3:31 PM - 22 Nov 2015|Our love forever exist poems|39|69
11:20 PM - 26 Nov 2015|#Tamasha REVIEW You need patience watch movie watch full movie Theater powerful person world|61|38
9:45 PM - 25 Nov 2015|Spiritual education essential bring peace around us make world beautiful place live|1.8K|1.4K
9:50 PM - 24 Nov 2015|Whoever said small things don't matter probably seen Sachin Lara Pele Maradona play #iMatter|31|39
6:54 AM - 20 Nov 2015|I acknowledge wisdom goodwill EU parliament conference exception others cancelled|1.4K|1.1K
7:45 PM - 24 Nov 2015|If mind bitter can't find joy anywhere If mind sweet find joy everywhere Meditation finding sweetness inside|2.2K|1.7K
9:31 PM - 21 Nov 2015|A Sunday reminds us everyone needs break So take break give others also break #SunnySunday|51|54
9:10 PM - 22 Nov 2015|The greatest gift give freedom others think|100|80
1:20 AM - 24 Nov 2015|Are giving much importance another actor reacting comments|62|69
8:55 PM - 23 Nov 2015|Without Salman Khan making statement growing intolerance https twitter com timesnow status 669014568090234880|20|15
8:11 PM - 23 Nov 2015|Do give beginning always hardest|67|49
9:22 AM - 23 Nov 2015|Now @aamir_khan experiencing #Intolerance hope follow #AwardWapsi https en m wikipedia org wiki List_of_awards_and_nominations_received_by_Aamir_Khan pic twitter com xuOjQf9B2i|240|166
11:21 PM - 20 Nov 2015|#Needofthehour This talk @SriSri 'Nurturing Peace Yoga Meditation' http www artofliving org in-en wisdom nurturing-peace-through-meditation @aoluniverse pic twitter com k1pN5SBb11|23|8
9:28 PM - 20 Nov 2015|Every morning sun reminds us rise darkness shine light #GoodMorning|112|84
9:25 PM - 17 Nov 2015|If want learn control situations around first thing learn Let go|120|91
2:25 AM - 18 Nov 2015|Bae No one's home #SanskariJamesBond sends security guards protect|75|63
3:18 AM - 18 Nov 2015|The heroine #SanskariJamesBond asked sing romantic song The actress sings Wo hai albela mastana wo Kiss na hai|39|44
3:31 AM - 18 Nov 2015|#SanskariJamesBond 's new car pic twitter com Z2FSvFh0BQ|281|205
3:55 AM - 18 Nov 2015|M James hear JB Sorry line clear M Zor se bolo JB Jai Mata Di #SanskariJamesBond|302|226
3:11 AM - 18 Nov 2015|#SanskariJamesBond small idol Ganeshji dashboard Aston Martin|265|298
11:09 PM - 16 Nov 2015|Govt Bank Interview Interviewer Why I hire Candidate 4 Counter pe pucho Interviewer Hired|721|367
11:53 PM - 16 Nov 2015|Do listen intent reply intent understand #wisdom|109|112
3:02 PM - 15 Nov 2015|Dear vegetarians stop eating m food's food|163|83
1:09 AM - 17 Nov 2015|Spending today complaining yesterday won't make tomorrow better It's improving 'now'|135|103
7:51 PM - 16 Nov 2015|Challenge something know could never ll find overcome anything|17|9
11:55 PM - 16 Nov 2015|Spirituality reinforces humane qualities makes us collected gives broad vision|1.6K|1.2K
10:47 PM - 16 Nov 2015|Gurudev @SriSri cooked served food y'day evening volunteers #ArtofLiving Centre #Hamburg pic twitter com 3P9dH21Oq7|71|55
11:18 PM - 15 Nov 2015|I choose kind Being mean average #NerdValues #TweetLikeYourbro|11|22
1:03 AM - 15 Nov 2015|Teacher What Success Indian Student Success Tea seller India served Tea Queen Elizabeth|13|10
1:09 PM - 15 Nov 2015|You know loves way plays hair|81|196
10:23 PM - 15 Nov 2015|Faith great wealth It gives instant strength It makes centered brings stability peace|2K|1.5K
7:50 PM - 15 Nov 2015|Celebrate essence 'One World Family' #WCF2016 rejoice fact differences make us unique pic twitter com Dp1nUZJjKl|274|141
