2:24 AM - 4 Dec 2015|Delhi Govt decides 1st Jan 2016 private vehicles odd number plates even number plates ply alternate days|332|126
12:36 AM - 2 Dec 2015|List verified doctors hosp available help #ChennaiFloods #ChennaiRainsHelp @iamlakshmirai @ChennaiConnect pic twitter com zTNNQgNE38|139|24
8:40 PM - 1 Dec 2015|Please share info ask support require #chennaiNeedsUs #ChennaiFloods Help support pray pic twitter com vHHgxuGnld|150|129
8:31 AM - 30 Nov 2015|Addressing climate change takes us especially private sector going all-in clean energy worldwide https twitter com billgates status 671325937749872640|3.8K|7.2K
2:31 PM - 29 Nov 2015|Good news world adds clean power capacity year dirtier fossil-fuel based power capacity pic twitter com nrNiwDAKuN|4.5K|7.6K
1:41 AM - 27 Nov 2015|#Tamasha Imtiaz Ali's finest commercial movie since Jab We Met It's Imtiaz Ali's Moulin Rouge way @deepikapadukone|217|401
7:49 AM - 25 Nov 2015|It almost hereeee Don forget tune #MacysParade Thursday 9am NBC http mcys co 1WpQUfy pic twitter com LAcabP1cl0|5.1K|10K
11:10 PM - 24 Nov 2015|Turkey downs Russian warplane near Syria border Putin warns 'serious consequences' http reut rs 1HlTpJc pic twitter com fkxKlRZe1h|329|152
