4:46 PM - 17 Nov 2015|Life precious taken granted Dont someone wastes gift something matters|161|25
9:39 AM - 18 Nov 2015|It's time pic twitter com XDC33PfVKb|32|132
12:36 PM - 19 Nov 2015|#InternationalMensDay - Donate hairy #Movember efforts help kick prostate cancer arse http mobro co garrettorange @Movember|84|0
4:11 PM - 14 Nov 2015|http Neuralgia co uk #domain 110 000 monthly searches #neuralgia #UnitedStates #UnitedKingdom #Mexico #Spain #Australia|104|7
3:54 PM - 14 Nov 2015|http imperialism co uk #domain 165 000 monthly #imperialism searches #UnitedStates 120 879 #Canada 6 960 #UnitedKingdom 5685|95|0
5:43 PM - 18 Nov 2015|SOCIETY #MEDIA Data November 19 2015 1 40 52 AM 3 247 896 709 #internet users #world 15 382 374 357 #emails sent today|104|4
5:00 PM - 18 Nov 2015|#KLOUT score #Bulgarian #Facebook #GooglePlus #India #politics #London #marketing #socialmedia removed #banking #Greek #internet #GM|106|17
3:38 PM - 17 Nov 2015|UK Breaking #news 30bn #cybersecurity Platform Coming Soon Made #GreatBritain By Top #British online Experts pic twitter com hJbJQSgaYQ|166|18
4:01 PM - 14 Nov 2015|http Stealing co uk #domain 22 200 monthly searches #stealing #UnitedStates 11 097 #UnitedKingdom 1 957 #Canada 1 082|132|2
9:46 PM - 15 Nov 2015|http Mississauga co uk #domainname 90 500 monthly searches #Mississauga #Canada #UnitedStates #India #UnitedKingdom #Germany|126|5
9:51 PM - 15 Nov 2015|http Gainesville co uk #domainname 40 500 monthly searches #Gainesville #UnitedStates #Germany #India #australia #Brazil #UK|108|2
9:58 PM - 15 Nov 2015|http HonoluluHotels co uk #domainname 12 100 monthly searches #Honolulu #Hotels #UnitedStates #Canada #Australia #UnitedKingdom|124|2
2:51 AM - 17 Nov 2015|Well-built site clean OS X app icons http appicns com If geek personalization worth look #mac #icons|7|1
1:06 AM - 16 Nov 2015|#Chestnut baked #hasselback #potatoes - #MAGGIArabia # _ _ _ pic twitter com wj9h1qsEMo|107|8
2:29 AM - 16 Nov 2015|Design architectural floor plan 20 http www peopleperhour com hourlie design-architectural-floor-plan 72668|54|0
6:28 AM - 14 Nov 2015|Sheik Yerbouti says IBIZA OR BUST - Nov 2015 - https www mixcloud com sutajio-west ibiza-or-bust-november-2015 #deep house #house #deephouse #nudisco #dance #mix #ibiza|52|3
