5:50 PM - 9 Dec 2015|Tumblr's reblogged cities 2015 http mash 1Qx2sIJ|41|57
4:05 AM - 7 Dec 2015|2 dead 11 injured major fire broke Mumbai's Kandivali area http bit ly 1HQ12Ih pic twitter com GRXOvZjeE8|29|18
3:40 AM - 7 Dec 2015|I desperately need sleep|3.3K|4.3K
3:35 AM - 7 Dec 2015|Iran talks 4 5 billion undersea gas pipeline Gujarat http www businesstoday sectors energy iran-in-talks-for-4 5-billion-undersea-gas-pipeline-to-gujarat story 226845 html pic twitter com 0AVdLqJDg1|35|37
2:53 AM - 7 Dec 2015|Every girl woman deserves fair chance follow dreams I #respect2protect Will Check pledge http youtu sX0TIlFEkx4|498|1.2K
11:59 PM - 6 Dec 2015|Strong 7 2 magnitude quake strikes Tajikistan says USGS Reuters|36|19
11:57 PM - 6 Dec 2015|A day life German #refugee camp Eirlani Abdul Rahman http bit ly 1XV3M8U #refugeecrisis #Syria pic twitter com Hjl6bVAHXQ|7|7
11:58 PM - 6 Dec 2015|Strong 7 2 magnitude quake strikes Tajikistan USGS|29|2
11:56 PM - 6 Dec 2015|#BREAKING Mild tremors felt Srinagar NCR|20|8
11:55 PM - 6 Dec 2015|Foreign journalists allege confinement Pakistan hotel stopped probing California shooter's radicalisation http bit ly 1lIdVd0|12|6
11:55 PM - 6 Dec 2015|#ExpressOpinion The Fanatic Mainstream http iexp fcb212176 pic twitter com brpOsTGklu|4|6
11:55 PM - 6 Dec 2015|Follow live updates #StormDesmond causes disruption across north UK http bbc 1NEu8pS pic twitter com PX7wVHuuad|52|51
12:07 AM - 6 Dec 2015|Colombia possibly discovers world's largest sunken treasure http fxn ws 1NbtX6o|106|147
11:28 PM - 5 Dec 2015|Spanish politician poses nude defend reputation http ind pn 1R1c1RG|23|17
10:35 PM - 5 Dec 2015|How one Facebook post overthrew government http i100 io OTCuSXf pic twitter com 0skvHdqLKj|26|14
10:33 PM - 5 Dec 2015|Services likely get costlier GST rollout Experts pic twitter com VMvBhIgxk0|48|54
4:35 AM - 4 Dec 2015|Shelter available Marundeeswara kalyana Mandapam Anagaputhur contact Dr Kumar 9444148766 food b provided next 2 days|1.4K|1.2K
12:17 AM - 5 Dec 2015|Due horrible floodings Chennai forced cancel show Sunburn Festival tonight #PrayForChennai|152|397
10:48 PM - 4 Dec 2015|Watch live NDTV Mehbooba Mufti HT Leadership Summit http www ndtv com hindustan-times-leadership-summit-2015 pic twitter com 3KCgjwAkQT|34|38
