3:37 AM - 10 Dec 2015|Sundar Pichai expected announce next phase Android One next week http goo gl 6RzTyV pic twitter com FzNcDQ52Ey|47|72
8:36 PM - 7 Dec 2015|@RJ_Balaji I regrouping figure best way forward #ChennaiMicro Rehabilitation long term impact focus|487|757
9:57 AM - 6 Dec 2015|Mudichur completely unattended Req volunteers look No elec Covered one area much poss Back tom pic twitter com tnDc12MlpF|153|75
12:51 PM - 5 Dec 2015|Cldnt see city drown And I spontaneous n emotional Bt never expected ths unbelievable trust n love Thank u Am truly blessed|559|1K
10:47 PM - 5 Dec 2015|We urgently require blankets ladies inner wear medicines food come nd pick Kindly tweet leaving ur contact #ChennaiRainsHelp|4.1K|4K
1:36 AM - 4 Dec 2015|It's pouring This going take longer hoped Please donate Send supplies funds Do venture Be safe #TNFlood|904|680
9:37 AM - 3 Dec 2015|Guys foreign someone plz confirm transfer #ChennaiMicroFund trust successful Are u facing issues Plz let us know|408|267
8:35 AM - 2 Dec 2015|Thoughts prayers everyone Chennai|1.1K|1.4K
