1:12 AM - 11 Dec 2015|you'll always fat inside x|1|2
12:31 AM - 11 Dec 2015|@ItsAadhyaKay That's way go Have tried experimenting colored liners|1|0
11:42 PM - 10 Dec 2015|Why B'wood rejoices Salman acquittal https twitter com manalib0103 status 675218687901741056|10|20
4:48 AM - 6 Dec 2015|I feel like I could get living jungle I really Hopefully monkeys would accept one train|6K|11K
8:35 AM - 4 Dec 2015|DIRTY DANCING Baby I'm scared walking room never feeling rest whole life way I feel I'm|9|8
3:18 AM - 6 Dec 2015|21 people make soul hurt http bzfd 1lD0tqS pic twitter com ddYLMqDAgO|194|527
5:01 AM - 5 Dec 2015|say louder pic twitter com Nq9eHSPF87|16K|16K
4:46 AM - 29 Nov 2015|Diego Costa 7 goals 10 months Olivier Giroud 9 goals last 10 games|180|143
4:21 AM - 28 Nov 2015|GOOD NEWS Theo Walcott expected return squad next weekends game vs Sunderland|140|150
9:05 AM - 14 Nov 2015|THIS need right #PorteOuverte pic twitter com jAn0ls9RIZ|3|0
3:47 AM - 18 Nov 2015|#SanskariJamesBond Thats Alok Nath His target find kanyas|1|1
9:46 AM - 17 Nov 2015|Hope players staff supporters sing French national anthem tonight We one #EngvFra #Freedom #Peace #Respect|50|115
8:25 AM - 17 Nov 2015|READ THIS PLEASE http summerteenageking tumblr com post 133405419216 uncreativelyinclined-mediamattersforamerica|12K|13K
6:44 AM - 17 Nov 2015|Welcome back Hector Bellerin Aaron Ramsey Alex Oxlade-Chamberlain #COYG|244|231
2:11 AM - 17 Nov 2015|Making song making moment Some times last world lifetime #Copywrites|25|68
10:09 PM - 16 Nov 2015|The Best Bollywood Dancers On This Planet #1DIN pic twitter com H2Kd2P7Plf|156|31
9:59 PM - 16 Nov 2015|We're still 31 We big country make use Everyone please tweet rt quote Everything counts #1DIN|9|0
10:43 AM - 15 Nov 2015|beautiful cover watch share Almost Lover -A Fine Frenzy Acoustic Cover- Aditi Kodipady https youtu v06yGtDW0Og via @YouTube|1|1
