11:46 AM - 11 Dec 2015|Sorry @realDonaldTrump you're minority Muslims http dailym ai 1Z3UVnY|12|18
9:56 AM - 8 Dec 2015|Of course story Pathan brothers cricket it's much http www thecricketmonthly com story 940173 the-brothers-pathan via @cricketmonthly|5|12
10:35 PM - 8 Dec 2015|Don't run challenge Instead run toward way escape fear trample beneath feet -Nadia Comaneci|174|226
11:39 PM - 4 Dec 2015|Higher purpose doesn greater import Highest purpose purity wotever u heart physical capacity|3.6K|7.2K
5:30 PM - 7 Dec 2015|Thank u sir It least https twitter com SirPareshRawal status 673892943829196800|2.4K|4.8K
2:26 AM - 5 Dec 2015|SRK's 30-minutes Chak De kinda speech low phase #KKR fondest memory superstar #CheekySingles|435|456
10:22 PM - 5 Dec 2015|realise close exams pic twitter com XBipgvkVSL|4K|3.6K
3:45 AM - 5 Dec 2015|Delhi traffic cops like #DelhiOddEvenLogic pic twitter com o0CkGJDdsB|133|114
11:25 PM - 4 Dec 2015|The #Quraan One copy Unchanged No contradictions Error free Scientifically Accurate Historically correct Poetically beautiful|32|33
10:10 PM - 29 Nov 2015|My personal advice - See National Flag Salute look respectfully Hear National Anthem Stand Meet National Animal Run away|1.3K|972
1:23 PM - 3 Dec 2015|Warner Bros Zack Snyder could saved millions dollars ran Twitter poll instead #BatmanvSuperman|8|5
11:52 PM - 24 Nov 2015|How many people trolling Aamir Khan actually seen read really said We definitely rabid lynch mob country|723|475
10:55 AM - 2 Dec 2015|May God look brothers sisters Chennai Nature fury strong may strength fight Insha Allah|5K|8.6K
4:04 AM - 1 Dec 2015|The ICC announced pitch third #INDvSA Test Nagpur rated poor http es pn 1XusDWf|96|79
2:45 AM - 30 Nov 2015|With Ravi director three days enough Kotla ground available wedding days http www fakingnews firstpost com 2015 11 bcci-is-confident-with-ravi-as-director-three-days-are-enough-announce-kotla-is-available-for-wedding-reception-on-4th-and-5th-day-of-the-match @Hello_Dasu|23|17
10:31 PM - 29 Nov 2015|lt time make revolution live dialogues youth|3|3
10:33 PM - 29 Nov 2015|Indian Cinema Halls Today Cat-calls lewd comments talking loudly mobile CHALTA HAI Not standing National Anthem SPARTAAAAAA|226|117
3:06 AM - 22 Nov 2015|Son Lalu couldn't pass 10th standard And think Bihaar mein exam mein cheating hoti hai|116|123
8:44 AM - 15 Nov 2015|Why would suicide bombers take passports #parisattacks|2.2K|1.7K
7:44 AM - 29 Nov 2015|Sanghis Britishers 1947 With #IndiaWantsRamMandir want create unrest widely leading us lose freedom|23|13
8:18 AM - 29 Nov 2015|#IndiaWantsRamMandir Oh Development finally table Hindutva Caliphate that's main dish pic twitter com EQbBYkbkC8|78|55
9:18 AM - 29 Nov 2015|Definitely #IndiaWantsRamMandir verge Riots Intolerance Politics It independent|33|33
9:27 AM - 29 Nov 2015|As Indian don't feel insulted see #IndiaWantsRamMandir trending 2015 instead India wants better road hospital job|299|184
11:37 PM - 20 Nov 2015|Why keep asking Smriti Irani's degrees She B A H U|234|267
10:23 AM - 19 Nov 2015|Hey @realDonaldTrump I'm American Muslim I already carry special ID badge Where's #SemperFi #USMC pic twitter com QSf2O9PTi2|39K|51K
