9:00 AM - 10 Dec 2015|Martin Luther King Jr's call tolerant equal America remains pertinent ever pic twitter com OgniF2PYqo|247|214
12:15 AM - 10 Dec 2015|Key continued economic prosperity Three ways India improve child nutrition http ow ly VHq6P|9|3
5:18 PM - 7 Dec 2015|According CNN spokesperson Trump said even American Muslims overseas would allowed back USA Does include soldiers|197|286
6:30 PM - 7 Dec 2015|Today's cartoonscape @surendracart - http bit ly 1LZZJS3 #ChennaiFloods pic twitter com BJ7ZlZBi4t|90|77
6:50 PM - 7 Dec 2015|The forces led destruction Babri Masjid still us http thewire 2015 12 06 the-history-and-future-of-a-demolition-without-end-16843 pic twitter com f5jX8a2gQA|6|6
3:49 PM - 4 Dec 2015|Creativity everyone's job http hbr org 1NwPXYD|91|96
3:50 PM - 4 Dec 2015|A book must axe frozen sea within us Franz Kafka The importance reading must make national mission|10|13
6:21 AM - 3 Dec 2015|Joseph Conrad author Heart Darkness Lord Jim born #onthisday 1857 pic twitter com 9uFPyagq13|192|168
