6:23 PM - 21 Nov 2015|You know you're completely done someone tell mum exactly Too late apologize turning back lol|637|621
10:33 AM - 23 Nov 2015|Now that's one GORGEOUS sea slug http thedo 1NHnG1O pic twitter com reZvY0OS35|36|42
10:33 AM - 23 Nov 2015|What know solar system week Here 5 things http nasa tumblr com post 133802249329 solar-system-5-things-to-know-this-week pic twitter com 7soBD7o475|938|1.8K
10:30 AM - 23 Nov 2015|The #GoT bosses toying emotions Is Jon Snow alive http peoplem ag AGT1Y6h pic twitter com cNVZFjqPn0|130|179
10:23 AM - 23 Nov 2015|A modern car's computer 10 million lines software code - jet fighter Panorama 8 30pm BBC1 https amp twimg com v 77389712-9166-42af-afc9-e69c92b44969|15|6
7:33 PM - 18 Nov 2015|Vote every day People's Choice #AdvofYear http natgeo com 1Qi6G8f|18|25
2:05 AM - 22 Nov 2015|#Secunderabad B ve blood Urgent Yashoda Malakpet Call 9014043600 @BloodDonorsIn @iCanSaveLife @nistula @Sangeetha_Devi @GreenTV_India|48|1
10:24 PM - 18 Nov 2015|Smile make others smile #behappy #lifeisbeautiful #dowhatyoulove #spreadthelove #singh52 https instagram com p -QZfQjsTa0|3|14
