7:58 AM - 10 Dec 2015|Sonakshi Sinha - tries dress looking Friend - XXLent|140|74
4:26 PM - 8 Dec 2015|Whos mum pic twitter com IbSVD3VroX|9.9K|6K
6:36 PM - 21 Nov 2015|Me What's breakfast Waiter Choco Waffle Me Who eats morning Waiter Sir instagram pe accha dikhega Me La plate|510|325
11:43 PM - 7 Dec 2015|He I love She You thin mujhe utha paoge He Nahi tumhare kharche utha lunga She I love|106|64
3:50 AM - 8 Dec 2015|Yesterday Vin Diesel Today Vin Petrol What next Vin Gasoline Vin CNG Vin PNG Vin Gobar Gas|2|4
5:40 AM - 18 Nov 2015|@Musaveerali RETWEET Follow 4MORE Deals OMG Buy One Get One Free Sony Headphone With Mic At 249rs Only http www Indianhotdeal com p 57|1|0
1:45 AM - 17 Nov 2015|DP decade pic twitter com 8TOOPJGJnX|301|166
