4:07 AM - 6 Dec 2015|A bank robber went clean became DJ didn't want let go catch phrase Put hands air|52|121
1:43 PM - 25 Nov 2015|There's least two sides every war story here's mine #CivilWar @Marvel pic twitter com W3R5tydXIM|19K|29K
1:20 AM - 26 Nov 2015|Too tired finish studying finish I mean start|5|5
4:04 AM - 29 Nov 2015|Nintendo's 'Wii' slang 'penis'|199|401
2:00 PM - 27 Nov 2015|Hate math When see crazy multiplication trick you'll curse grade 3 teacher http diply com what-the-facts article math-trick-line-draw-easy-simple-crazy-hack-test-school-class-mathematics-multiplication-multiply pic twitter com X1N2buzOuX|198|491
2:00 AM - 26 Nov 2015|People keep saying go big go home going home doesn sound like best idea ever F k yeah wanna go home m gonna nap|5.3K|4.3K
