9:58 PM - 7 Dec 2015|If true acquittal assumed plan play victim claim witchhunt dramatic visual proof https twitter com NewsX status 674103369242316800|191|83
9:43 PM - 5 Dec 2015|CJI's support 2 odd even formula welcome n huge encouragement SC judges pooling cars wud inspire millions 2 follow Thank u My Lords|2.4K|2.5K
9:39 PM - 5 Dec 2015|Chief Justice India TS Thakur There NO INTOLERANCE India There independent judiciary Only illusion intolerance propagated|2.6K|1.4K
9:09 PM - 4 Dec 2015|Odd city Public Transport Infra near China would apply Chinese Laws get even Pollution #DelhiOddEvenLogic|38|28
9:51 PM - 25 Nov 2015|The original constitution India handwritten Prem Behari Narain Raizada #ConstitutionDay pic twitter com lWiZpFUJwZ|617|471
9:30 AM - 25 Nov 2015|Amazon make Maharashtra anchor investment state opens 7th fulfilment center state pic twitter com FIKJMpJsRE|70|84
11:28 AM - 23 Nov 2015|Dear @aamir_khan #SatyamevaJayate u talked evil practices gave Hope So even Intolerant times u need 2 spread Hope Fear|9.1K|11K
6:08 AM - 24 Nov 2015|Col Santosh Mahadik's wife wants kids join Army serve India Actor's wife finds India unsafe kid I know HERO|2.3K|1.2K
