4:25 AM - 11 Dec 2015|DuPont Dow Chemical formally announce megamerger plan http wsj com 1QAmK4d pic twitter com nZDpUGMUH8|113|72
2:05 AM - 11 Dec 2015|Value BEYOND illumination achieved alliance Cisco #PoELighting http philips 1QvfXbW pic twitter com LVm3Nms9GN|5|1
2:09 AM - 11 Dec 2015|No new diesel vehicles registered Delhi backdrop rising pollution NGT http bit ly 1NK7ZLk pic twitter com p1dy8cBg3M|17|18
12:06 PM - 10 Dec 2015|The Lewes Festival created beautiful scenes spaces encouraging community engagement http ow ly VCj7V pic twitter com S5DvAWigGM|6|4
8:30 AM - 10 Dec 2015|Almost 26 000 people vanished Mexico since 2007 The mothers 'the disappeared' silenced http mash 1OTJc8x|59|36
8:05 AM - 10 Dec 2015|Modern dynamic lighting helped transform open-air car park lively urban space http ow ly VrRg5 pic twitter com vR2ZprZ9zd|6|5
4:35 AM - 10 Dec 2015|Philips SmartPoles deliver value beyond illumination San Jose http philips 1QsYoJM #smartcities #LED pic twitter com Cbmhhit2VD|6|14
8:31 AM - 10 Dec 2015|Beautiful #Amsterdam sun sun simultaneously Via @communirene pic twitter com L4Dr3QmFWb|36|57
2:27 PM - 9 Dec 2015|Angry Birds chief Rantala step http ft com 1QwOAy8|5|2
6:45 AM - 9 Dec 2015|Angela Merkel @TIME Person Year http tn 1NLYUxb pic twitter com EC3yZpKFic|84|43
9:06 AM - 9 Dec 2015|Philips SmartPoles @ericsson 4G LTE wireless tech help San Jose smart city transformation http ow ly VzMf5 pic twitter com SRQrZFRl01|20|10
2:38 PM - 9 Dec 2015|The woman behind female Viagra leaving post CEO http read bi 1NN4YWj pic twitter com WFrzepzXYg|16|16
6:08 AM - 9 Dec 2015|#Anonymous declares December 11 #ISIS trolling day http indiatoday intoday story anonymous-declares-december-11-as-isis-trolling-day 1 542141 html pic twitter com 73oIBa5Hzs|22|15
6:15 AM - 9 Dec 2015|Donald Trump's Muslim ban would cost 18 billion http tn 1IUH7CU pic twitter com T0I6IJc35t|32|18
6:15 AM - 9 Dec 2015|Apple suspended plans offer live Internet-based television service http bloom bg 1HTDimA pic twitter com qqXHUC9zYj|78|44
2:35 AM - 9 Dec 2015|#LED lighting provides viable solution change Read LED lighting booklet http philips 1XYtRUH pic twitter com amwlpuHzls|8|3
8:05 AM - 8 Dec 2015|How stunning lighting effects revitalize city square turn dome intriguing icon http ow ly VrUd7 pic twitter com hErHuDi1z4|6|6
3:35 AM - 8 Dec 2015|San Jose pilot 50 Philips SmartPoles #LEDs @ericsson wireless tech http philips 1QsYoJM #smartcities pic twitter com ZQyGLTpFp6|7|7
6:05 AM - 8 Dec 2015|San Jose Vice Mayor Rose Herrera Philips team announce Philips SmartPoles pilot project http ow ly VCdl1 pic twitter com QK6EDLlf48|5|6
2:35 PM - 5 Dec 2015|Darkness cannot drive darkness light Hate cannot drive hate love -Martin Luther King Jr|10K|14K
8:50 AM - 3 Dec 2015|In book Philips wins prize beautiful booth #RSNA15 pic twitter com eVfE3tZTg6|7|6
1:40 PM - 5 Dec 2015|Vatican appoints external auditor http bbc 1Qn163g|173|120
9:02 AM - 4 Dec 2015|Switching clean energy takes decades need start innovating http b-gat es 1ItTlHE pic twitter com jEHZMH59oD|1.4K|2.2K
11:07 AM - 4 Dec 2015|Philips Lighting provide 76 000 solar LED street lights across 800 villages India http ow ly VueJ2 pic twitter com jFSapzg3Oe|9|7
5:02 AM - 4 Dec 2015|2015 Is Now Biggest Year Ever M A http tn 1QjX4sy|14|11
5:05 AM - 4 Dec 2015|The world's best places visit 2016 chosen #LP #travel experts http lptravel BestinTravel #BestinTravel pic twitter com 7jba21Jvj5|125|166
4:36 AM - 4 Dec 2015|Let's Delhi This man vacuumed Beijing's smog 100 days made brick http indiatoday intoday story smog-beijing-air-pollution-nut-brother-vacuum-cleaner-delhi-china 1 538746 html pic twitter com Kj11mEtMKt|26|17
3:59 AM - 2 Dec 2015|Most cyber crimes committed people known victims More @ http bit ly 1Rj0rkh pic twitter com cgfgB0lnPM|8|5
4:05 AM - 2 Dec 2015|The secret life one richest men world http ti 1NnL6sD|63|106
2:42 AM - 18 Nov 2015|#SanskariJamesBond seduces women lighting aggarbattis bedroom introduces Mom|151|155
2:50 AM - 18 Nov 2015|In #SanskariJamesBond movies Bond girls names like Pooja Aarti What's Bond Pooja Aarti Oh|153|145
