9:45 AM - 2 Dec 2015|SRM University accommodating ppl buildings Whoever's standed n GST pls go thr For Food Contact Mr Jogani 9840042152|406|189
9:12 PM - 29 Nov 2015|#India third largest emitter We fourth SMALL emitter #IndiaAtCOP21|53|58
8:59 PM - 29 Nov 2015|A historic day indeed|96|58
8:58 PM - 29 Nov 2015|AAP committed Lokpal drafted Ramlila Maidan going forward discuss today floor house|208|134
9:01 PM - 29 Nov 2015|Currency Check Dollar-Rupee 66 8300 0 0700 #CNBCTV18Market|2|1
3:00 AM - 29 Nov 2015|@burgerkingindia people can't enough amazing taste pic twitter com BJ1UIQSHfD|25|88
7:19 AM - 29 Nov 2015|It interesting democracies left usually hijacks environmentalism Communist countries environmentalists silenced|6|2
7:21 AM - 29 Nov 2015|Morons say good population control That's morons pic twitter com xEuowJXOKt|2|1
2:59 AM - 29 Nov 2015|A building South Mumbai- Does one know named - 'Blackie House' #curious pic twitter com mhf4taT59P|104|588
1:08 AM - 28 Nov 2015|This I said yesterday BJp anti-woman WOMAN IPS Haryana Ms Kalia transferred less 24 hours without inquiry|296|235
1:00 AM - 28 Nov 2015|That's cool message aspiring women rally drivers Laleh Do adrenalin https www youtube com watch v jJoU51Enhb4 feature youtu|15|59
4:05 AM - 26 Nov 2015|Just call 1912 North Koreans get new phone numbers honour Kim Il-sung's year birth http gu com p 4egcd stw via @GuardianNK|43|21
4:04 AM - 26 Nov 2015|Shatrughan Sinha disapproves Aamir Khan's remark intolerance http dnai d2SY|8|12
1:38 AM - 26 Nov 2015|No matter badly got hit always stood #MumbaiAttacks #JaiHind pic twitter com 59iPpT4IUG|48|44
