3:31 PM - 8 Dec 2015|Sometimes die little inside order reborn rise stronger smarter version|49|32
7:36 PM - 7 Dec 2015|Sometimes need person makes smile even means waiting|36|34
10:45 AM - 11 Dec 2015|Who Is #Quantico Terrorist @priyankachopra Rates Suspects http bit ly 1SQXNke @QuanticoTV pic twitter com bpyxvdVXVb|176|534
2:29 AM - 10 Dec 2015|Judge Gaadi koun chala raha tha Salman Sir Engine Judge ok free go #SalmanVerdict|96|61
4:50 AM - 10 Dec 2015|Time flies takes away oppurtunities|2|3
4:49 AM - 10 Dec 2015|Love feeling love need need someone appreciate n love|4|3
2:33 AM - 10 Dec 2015|In parallel universe Salman's Land Cruiser became first fully automatic self driven car Salman files PATENT #SalmanVerdict|18|8
2:13 AM - 10 Dec 2015|Did know Chocolate makes clothes shrink|14|18
12:35 AM - 10 Dec 2015|I love whoever made pic twitter com j1FYBKOJOW|330|358
9:12 PM - 9 Dec 2015|While playing GTA I become Salman Khan I run car people #hahasolamehaha|3|6
12:08 AM - 10 Dec 2015|Salman Khan acquitted charges #HitAndRunVerdict|96|86
12:08 AM - 10 Dec 2015|#26 11 case witness turns hostile claims #Kasab alive http bit ly 1RG5w6j pic twitter com 3tpsvQjCsN|15|15
5:05 AM - 8 Dec 2015|An orange dream beneath blue skies #KTMIndia #ReadyToRace Image courtesy - Kamal Gill pic twitter com cxyZdCU7Bs|3|8
9:27 AM - 3 Dec 2015|She Surprise He sends pic umpire signaling four runs She ye kya hai He Chauka dene wali pics pic twitter com VMx8y7dUzX|127|102
10:34 PM - 9 Dec 2015|#CG small backward state earlier moving rapidly path development #JagranForum @JagranNews|4|7
10:35 PM - 9 Dec 2015|We taken many decisions made various schemes empower farmers CM @drramansingh #JagranForum @JagranNews|7|12
10:16 AM - 8 Dec 2015|Fastest mode transport bollywood songs ek gaane india se U K chale jao|4|4
9:02 PM - 9 Dec 2015|G1 How crush G2 Like Channing Tatum G1 Aww mean Hot n Sexy G2 No I mean unapproachable doesn't know I exist|9|2
9:53 PM - 9 Dec 2015|Someone twitter Be reason stays night Becomes mosquito|7|6
6:37 PM - 9 Dec 2015|Aditya Chopra And Rani Mukherjee named kid AdiRa Is reason Ranbir Kapoor broke Deepika Padukone|6|6
7:15 PM - 9 Dec 2015|Two suspected ISI spies arrested Jodhpur #India #Pakistan http www abplive india-news two-suspected-isi-spies-arrested-in-jodhpur-258177 pic twitter com XtXeuduvoL|11|23
7:22 PM - 9 Dec 2015|I'm sick pic twitter com 3wzaoEHREn|211|276
7:13 PM - 9 Dec 2015|TN floods help #indiaforchennai @the_hindu initiative collect needed items funds pic twitter com 9A3PeCsbdX|47|25
11:21 AM - 9 Dec 2015|When said bring change girls started changing DPs fast possible|14|6
11:20 AM - 9 Dec 2015|A real boyfriend - calls nothing - texts time - wants see - gets jealous - overprotective - loves|165|216
11:26 AM - 9 Dec 2015|True love two people don't talk yet understand everything fucking texts emojis|10|2
2:59 AM - 5 Dec 2015|In new @5SOS dvd How end find red black surprise Two hints San Siro #ACMilan https amp twimg com v a2bf19d5-e14d-4306-a17a-25db6350b5d7|10K|18K
11:38 AM - 9 Dec 2015|Parineeti Chopra trying fly like Superman pic twitter com uPWvkrcKst|7|6
5:33 AM - 2 Dec 2015|Computer enter username Me Girlfriend Computer Not available|7|5
6:19 AM - 2 Dec 2015|Good work @BSNLCorporate bus network sath dede logo ka|2|3
6:28 AM - 2 Dec 2015|I thought humans Slow claps face https twitter com sagarikaghose status 672054986151342080|4|7
7:05 AM - 2 Dec 2015|Everyone id best chennai #ChennaiFloods pic twitter com frZ1lBFCNC|12|9
9:00 AM - 3 Dec 2015|U S girl status Blowing bae Comments Blow honey Join Paki girl status Blowing bae Comments RIP May get 72 virgins|87|31
6:39 AM - 8 Dec 2015|#GandhisInTrouble 'Private complaint' come Subramanian Swamy BJP member Congress's Sanjay Jha @LRC_NDTV pic twitter com 1faxSnDBEi|29|42
6:54 AM - 8 Dec 2015|Both India Pakistan decided best interests @ABlinken #TTP|6|8
6:54 AM - 8 Dec 2015|This step towards mature dialogue India Pak international pressure talks @ABlinken #TTP|2|7
6:53 AM - 8 Dec 2015|US encourages Indo-Pak talks Improving relation two countries important @ABlinken #TTP http snpy tv 1TywrPV|4|5
6:55 AM - 8 Dec 2015|#GandhisInTrouble Every line used Congress leaders amounts contempt court Minister Babul Supriyo @LRC_NDTV pic twitter com NJaGMFZV9X|30|34
6:44 AM - 8 Dec 2015|#GandhisInTrouble Huge amount public money wasted Congress funded public Minister Babul Supriyo @LRC_NDTV|18|34
6:44 AM - 8 Dec 2015|#GandhisInTrouble The Rahul Gandhi speaks better BJP Minister Babul Supriyo @LRC_NDTV|34|51
6:55 AM - 8 Dec 2015|A terrorist freedom fighter one person terrorist another Maroof Raza Consulting Editor #IndoPakIceBreaker|24|41
6:56 AM - 8 Dec 2015|India-US bound together issue 26 11 discussed 26 11 Pakistan @ABlinken #TTP http snpy tv 1jM6kc7|6|5
6:57 AM - 8 Dec 2015|Even Americans would killed 26 11 stood India like case also @ABlinken #TTP|7|7
6:57 AM - 8 Dec 2015|Justice granted soon 26 11 attacks @ABlinken #TTP|3|5
10:37 PM - 7 Dec 2015|@princenarula88 @PriyaSometimes get heated argument tonight Whose side #BB9 http snpy tv 1IBEtXJ|38|130
10:17 PM - 7 Dec 2015|National Herald Case Next hearing Dec 19 Sonia says 'I'm afraid anyone' #Sonia http www abplive crime national-herald-case-next-hearing-on-dec-19-sonia-says-im-not-afraid-of-anyone-257234 pic twitter com 7qk2wqST6y|23|65
10:20 PM - 7 Dec 2015|@RBI says looking debt-for-equity swap provision lenders http www businesstoday money banking rbi-says-looking-into-debt-for-equity-swap-provision-for-lenders story 226875 html pic twitter com XxdFxkRCZ8|3|7
9:25 PM - 7 Dec 2015|I know girls must thinking lol like tweets epic stuffs bloody stupid|3|4
9:22 PM - 7 Dec 2015|Why people follow girls keep tweeting shit don't even RT good tweets For DP's|14|15
7:27 AM - 5 Dec 2015|Outside Multipex Dad's friend - Which movie Me - Tamasha Him- Me Meets Hate Story Interval Smiles runs|589|381
9:38 PM - 7 Dec 2015|#Modi wise return Vajpayee's #Pakistan policy @ShekharGupta http bit ly 1lpUW7m #BJP pic twitter com BFyfJZrLoQ|6|13
11:39 AM - 3 Dec 2015|When realize dog much better looking pic twitter com WlE6TLikDz|7|53
1:05 PM - 7 Dec 2015|NEW VIDEO Please like subscribe Sorry face https youtu kYTVcYYQPBE pic twitter com 78Ypn1AiTp|20|110
6:23 PM - 5 Dec 2015|So 418 tiles bathroom walls things I get know I forget taking phone washroom|3|7
2:10 AM - 6 Dec 2015|People contacts like sis new dad2 needs jailed forever|3|1
11:13 AM - 6 Dec 2015|http B tech Placement|3|3
11:45 AM - 6 Dec 2015|The hunt An New episode #Quantico Tonight Only one episode winter finale https amp twimg com v 140d3490-8721-47a8-aab1-dc5bbf13e3c3|424|1.2K
11:37 PM - 2 Dec 2015|Paid tributes Dr Rajendra Prasad birth anniversary Central Hall Parliament House today pic twitter com itBcsuSLxr|197|579
11:53 PM - 5 Dec 2015|Free wifii great ambiance soothing music that's U need begin weekend #LiveAtTheBuzzar #VRBengaluru pic twitter com FVxXu3lz5c|2|2
11:51 PM - 5 Dec 2015|Highlighted Dr Ambedkar's vision women empowerment federalism economy relevance today http nm-4 com fekb|1.1K|3.1K
11:52 PM - 5 Dec 2015|Our Government leaving stone unturned fulfil vision dreams Dr Ambedkar create prosperous inclusive India|2.3K|6K
8:49 PM - 5 Dec 2015|Soulful tribute architect Indian Constitution educationist revolutionist Bharat Ratna Dr #BRAmbedkar ji pic twitter com 7b4YsYL4q6|50|96
6:00 PM - 6 Dec 2015|It's Time pic twitter com E3gEew6BdA|146|171
6:28 PM - 6 Dec 2015|Ratan Tata says mandatory CSR like tax http www businesstoday current policy ratan-tata-says-mandatory-csr-is-like-a-tax story 226808 html @RNTata2000 pic twitter com YKVvH72YqE|18|28
7:00 PM - 6 Dec 2015|No matter apologise http 9gag com gag azV0XWm ref tp pic twitter com ofsSHQ0k2g|1.9K|2K
7:08 PM - 6 Dec 2015|A typical relationship pic twitter com BdQNTU9oG2|3K|2.3K
7:14 PM - 6 Dec 2015|Someone finally understands Maths pic twitter com sBGRA594wU|225|216
6:21 PM - 6 Dec 2015|Rumors circulating Yahoo sale Here potential buyers http onforb es 1ldig8v pic twitter com bR59c7gtWj|186|116
7:16 PM - 6 Dec 2015|Her Snapchat Story Started Out Happy But Then It Took A Violent Turn https cards twitter com cards 18ce53wk2fw 171pq|16|44
11:12 PM - 5 Dec 2015|Ashton Bryana LA today HQ Dec 5 #VideoMTV2015 5 Seconds Summer pic twitter com FWI97wAI87|488|726
10:11 PM - 5 Dec 2015|@TwitterIndia @ChennaiCares @AidOffered @ChennaiRainsOrg @ChennaiMicro working together amplify #ChennaiRainsHelp campaign|431|640
11:30 PM - 5 Dec 2015|Last Night #Mumbai Thank Indian Navy #Goa Tonite CAR MEIN MUSIC BAJA Releasing Soon pic twitter com FCLfDzfTPI|29|90
11:32 PM - 5 Dec 2015|Kotla Test Day 4 Six Bavuma pulls Ashwin midwicket http indiatoday intoday story india-vs-south-africa-4th-test-day-4-live-update 1 539490 html #IndvsSA|4|5
11:18 PM - 5 Dec 2015|Here's review #DoctorWho 'Hell Bent' if'n want look https nerdist com doctor-who-review-hell-bent @nerdist|19|39
11:35 PM - 5 Dec 2015|Rain-devastated Chennai begins life anew train services resume http indiatoday intoday story chennai-rains-live-residents-battle-scarcity-high-prices-death-toll 1 539493 html pic twitter com firWHJlpRB|18|16
11:41 PM - 5 Dec 2015|Narrow escape stranded #ChennaiRains wreck havoc city Watch #ITVideo people recount horror https amp twimg com v 131ef321-c7f1-4ba2-a3a5-e78adea55319|8|12
6:13 AM - 6 Dec 2015|Help Chennai Funds Raised used provide provisions Flood Victims #ChennaiFloods #ChennaiRains https cards twitter com cards 18ce545mfpv 194sz|33|27
9:09 PM - 5 Dec 2015|In Test #cricket let #pitch imperfect @palashmehrotra #KotlaTest #IndiaVsSA http bit ly 1HO95oT|3|2
6:39 AM - 2 Dec 2015|#CG rapidly emerging new international sports destination Govt committed provide world class amenities players|9|24
6:28 AM - 5 Dec 2015|Will even-odd car scheme implemented Delhi Here's Arvind Kejriwal say http indiatoday intoday story will-even-odd-car-scheme-be-implemented-in-delhi-here-what-kejriwal-has-to-say 1 539461 html pic twitter com L6mTC0qneE|9|11
10:01 PM - 4 Dec 2015|Gaming Daily PS2 classics coming PS4 feature trophy support http nerdi st 21DNK8h pic twitter com 5w63oBs02p|62|101
2:40 AM - 5 Dec 2015|This people Delhi go office January 1 #DelhiOddEvenLogic pic twitter com OBmP85sB7A|7|8
