8:47 PM - 7 Dec 2015|TL G1 Donald Trump right ya G2 Yeah babe DM G1 Deedi Donald Trump kya hai G2 Arre pagli woh jo Cartoon Network par aata hai na|12|9
11:02 AM - 11 Dec 2015|Haha good Gujjar boys react odd-even formula https youtu H9LdGrxEEas featuring @Rofl_Delhite|48|58
10:32 PM - 8 Dec 2015|Aditya chopra Rani mukherjee name daughter Adira Surname chomu|1.3K|744
3:09 AM - 10 Dec 2015|After acquittal Salman Khan HC gave instruction rise da height footpath poor fellow dont suffer #SalmanVerdict|1|0
10:55 AM - 9 Dec 2015|Instead wasting time talking Pakistan leaders something constructive like reviewing movies|81|68
1:26 AM - 6 Dec 2015|A woman tied tree Mamata Banerjee's West Bengal tortured expect secular journalists blame Modi http www abplive india-news six-hour-torture-for-woman-in-wb-lady-tied-to-tree-assaulted-over-refusal-to-withdraw-case-255612|413|153
6:04 AM - 26 Nov 2015|Somewhat ironic Shah Rukh Aamir latter married Kiran|68|96
2:54 AM - 6 Dec 2015|Temples monetising gold coins gold biscuits non ornameted gold good idea earns 2 5 interest Also avoids pilferage|125|71
9:36 PM - 5 Dec 2015|demolition #BabriMasjid #India hyped yrs worldwide demolition Hindu temples Pak Bangla ignored #ShauryaDiwas|561|284
10:10 PM - 5 Dec 2015|If I say Demolition #BabriMasjid #6DecBlackDay I Secular If I say first Babur demolished Temple n later #ShauryaDiwas I Sanghi|303|168
11:54 PM - 5 Dec 2015|@narendramodi Sir Ram Lala need stones government Mandir #ShauryaDiwas #JaiJaiShriRam|1|0
12:04 AM - 6 Dec 2015|Right Hizbul JKLF etc using AK-47 garlands Kashmiri pandits Babri https twitter com abpnewstv status 673149389792108545|240|78
6:57 AM - 4 Dec 2015|Why hugging right people important Pic1 Gives 99 charity Pic2 Takes 400 hike pic twitter com nBkFBkupWx|111|57
