4:04 AM - 5 Dec 2015|By way Instagram page hacked deleted Let know I'm ready new one I think they're tired seeing|62|354
7:03 PM - 3 Dec 2015|Chennai fighting back My thoughts people lost dear ones|2.8K|4.4K
6:30 AM - 3 Dec 2015|If guy #WindowsInsidersUK looks pretty happy it's he's 1st UK #Lumia950 pic twitter com ojlQgBdpew|3|20
6:31 AM - 2 Dec 2015|Woah Massive vote swing heart Sanghi bastion https twitter com Kailashsaran73 status 672056778889146368|3|1
9:27 AM - 2 Dec 2015|Monument Valley free limited time wait ends give 4 bucks instead it's goddamn work art|77|73
12:00 AM - 27 Nov 2015|Here The full video new single Adventure Of A Lifetime - http cldp ly AOALvideo A #AOALvideo pic twitter com bcZPuORniZ|3.6K|4.8K
12:07 AM - 27 Nov 2015|Turkey downs Russian plane Whole world downs Turkey thanksgiving|46|129
11:17 AM - 19 Nov 2015|This page design perfect I love ugly ads I hate reading articles pic twitter com tfyR02J2yp|324|739
12:01 AM - 22 Nov 2015|10 Years ago today launched Xbox 360 Thank millions fans around world helping us create great decade gaming|837|1.8K
12:58 AM - 17 Nov 2015|Thank much birthday wishes feeling loved today it's amazing great followers xxx|27|173
1:35 AM - 17 Nov 2015|We laugh language|1|3
5:42 AM - 15 Nov 2015|Wanna know easy stream game Xbox One Windows 10 machine Check @XboxIND pic twitter com EYKhrfIrSO|5|10
9:59 PM - 13 Nov 2015|We deeply saddened news Paris My heart thoughts especially time together week|822|1.3K
