7:17 PM - 26 Oct 2015|Well We can always sneak away https twitter com jacksonite98 status 658828943450087424 
5:49 PM - 26 Oct 2015|@_RaeOfSunlight Me that hot chocolate looks nice Rae looks pretty hot pic twitter com czGC1G51Hn 
4:59 PM - 26 Oct 2015|I wish I could be scary But nope 
4:57 PM - 26 Oct 2015|puts on lion onesie RAWR 
4:32 PM - 26 Oct 2015|People who put sugar and milk in their coffee make me question the point of living 
3:54 PM - 26 Oct 2015|Thanks doll cx https twitter com helvetefanfykat status 658778345585422337 
3:39 PM - 26 Oct 2015|@_RaeOfSunlight i love you 3 
3:40 PM - 26 Oct 2015|Stalk @_RaeOfSunlight She gets me #coffeelove 
3:36 PM - 26 Oct 2015|Humans go stalk @natashalarisa 
1:39 PM - 26 Oct 2015|Because I'm a loser https instagram com p 9UIUWbFbC5 
12:48 PM - 26 Oct 2015|Forever wishing I could sing decently 
8:13 AM - 26 Oct 2015|Me Never https twitter com foreverfrisian status 658615795908481024 
4:59 AM - 26 Oct 2015|Go big or go home pic twitter com KPs9UkBGKH 
4:09 AM - 26 Oct 2015|I'm not feeling this whole life thing today 
2:55 PM - 25 Oct 2015|Ugh Perf https twitter com natashalarisa status 658399358140833793 
2:45 PM - 25 Oct 2015|cough cough Obviously https twitter com natashalarisa status 658399012362424320 
2:43 PM - 25 Oct 2015|You're obviously jealous pic twitter com WvSOYc6fi3 
10:46 AM - 25 Oct 2015|Stressed depressed and lipstick obsessed 
10:44 AM - 25 Oct 2015|Same https twitter com depresseddarth status 658289292788310016 
6:32 PM - 24 Oct 2015|You need to start acting like an adult Me pic twitter com 5nsNJ8OxD7 
3:20 AM - 25 Oct 2015|You can't always get what you want but you can always watch Star Wars 
9:22 PM - 23 Oct 2015|I CAN'T BREATHE pic twitter com f7viFi0JXI 
10:42 PM - 24 Oct 2015|I'm beginning to realize that I'm the dumb blonde in the horror movie that trips over air and get herself killed by the demon and whatnot 
10:40 PM - 24 Oct 2015|Update I got my blanket but I somehow managed to really hurt my leg running away from the creepy shadows on the stairs 
9:59 PM - 24 Oct 2015|I left my blanket downstairs and I really need it but I really don't want to go get it because it's dark and scary down there 
8:24 PM - 24 Oct 2015|Because yay coffee and homework https twitter com natashalarisa status 658121575489671169 
4:36 PM - 24 Oct 2015|I'm done I'm over it I'm so fucking sick of it 
10:57 AM - 24 Oct 2015|Huntington's disease The theft of the self - Chicago Tribune http sco lt 8avCPx 
4:10 PM - 24 Oct 2015|I really enjoy drawing on people 
2:50 PM - 24 Oct 2015|Bras and pants are so oppressive 
2:44 PM - 24 Oct 2015|Moms making me go shopping no complaint there but it means I have to actually put on real people clothes 
2:25 PM - 24 Oct 2015|People who romanticize naturally curly hair really piss me off In reality it's a big frizzy uncontrollable mess that doesn't go away ever 
2:21 PM - 24 Oct 2015|@_RaeOfSunlight OMG SOUL MATE YES XD 
2:22 PM - 24 Oct 2015|Yaaaasssssss more rain 
2:09 PM - 24 Oct 2015|Kidding I actually like a lot of you 
1:54 PM - 24 Oct 2015|Fall will always be my favorite season https instagram com p 9PAWUbFbFE pic twitter com 347ZA08lMJ 
1:25 PM - 24 Oct 2015|Same Bring me coffee and I'm yours forever https twitter com natashalarisa status 658016187104669696 
1:24 PM - 24 Oct 2015|This is literally how I flirt lmao Puns and cheesy dirty jokes cx https twitter com natashalarisa status 658016044271861760 
1:06 PM - 24 Oct 2015|This is why we're friends https twitter com pmt_unicorn status 657904093315379201 
11:08 AM - 24 Oct 2015|I'm getting to that point where there are those days where I kinda wanna end it but I don't give in of course but those thoughts are back 
10:42 AM - 24 Oct 2015|Rain 
10:24 AM - 24 Oct 2015|Yay Saturday The day I do nothing but sit in my bedroom with the lights off and avoid everybody that tries to talk to me 
10:13 AM - 24 Oct 2015|Is that even a question Like fuck yes https twitter com helvetefanfykat status 657967971130875904 
8:33 AM - 24 Oct 2015|Breakfast pic twitter com zIYvx7jYGK 
8:06 AM - 24 Oct 2015|I got a lot of much needed sleep but I still feel like absolute shit 
7:57 AM - 24 Oct 2015|Adele is obviously the real queen here 
4:36 PM - 23 Oct 2015|Rather punny now are we https twitter com nebulamdcm status 657702007034290180 
4:34 PM - 23 Oct 2015|TUMBLR IS SO CONFUSING AGGGGHHHH I CANT DEAL WITH THIS 
3:37 PM - 23 Oct 2015|Riiiiiiight that was the word I was looking for https twitter com pinkbunnyof75 status 657687091808239616 
3:32 PM - 23 Oct 2015|Accidentally ordered too much Chinese food #mybad 
3:28 PM - 23 Oct 2015|The amount of fried rice I can eat by myself is disgusting 
2:24 PM - 23 Oct 2015|Who will win 
12:04 PM - 23 Oct 2015|can't stress this enough pic twitter com 86jQdQL4qg 
1:05 PM - 23 Oct 2015|Cool date idea nap all day 
1:10 PM - 23 Oct 2015|Thanks doll https twitter com robertjnicholls status 657650054887514115 
1:06 PM - 23 Oct 2015|Netflix and pretend my grades are okay 
3:15 AM - 23 Oct 2015|When you accidentally close the music app mid-song 
1:13 AM - 16 Oct 2015|can i sell my stress i don t want it anymore 
7:47 PM - 22 Oct 2015|The new middle finger emoji is possibly my favorite 
7:14 PM - 22 Oct 2015|Have you ever stayed in the shower for so long you just forget who you are Yes I might possibly be tweeting in the shower 
6:50 PM - 22 Oct 2015|Shave my legs and dress nice tomorrow Or be lazy and look like crap but be comfy Literally the most difficult decision 
3:00 PM - 21 Oct 2015|I want someone who is mesmerized by my thoughts beliefs and my character not someone who just thinks I'm hot lol 
8:28 AM - 22 Oct 2015|I'm just here for the food 
5:32 AM - 22 Oct 2015|Let's play a game of Russian roulette I'll load the gun you place the bets Alligator Blood @bmthofficial 
2:30 AM - 20 Feb 2014|This is so accurate pic twitter com qpBd4F6Ffv 
2:41 AM - 22 Oct 2015|Ew morning Can I just go back to bed 
7:40 PM - 21 Oct 2015|sings in shower Simon Cowell appears It's a no from me 
2:11 PM - 21 Oct 2015|I am paranoid all the fucking time 
7:16 PM - 21 Oct 2015|Update it's just past 10 and I can't stop singing I sound like a dying whale but the musical urges are too strong Drown me with coffee 
5:00 PM - 21 Oct 2015|My blood is probably 4 3 pasta sauce at this point 
2:04 PM - 21 Oct 2015|People are very quick at attacking things they don't fully understand 
5:09 PM - 18 Oct 2015|Do u ever try to do ur homework but then pic twitter com HkeABSbYlj 
1:59 PM - 7 Aug 2015|Somewhere in there inside that hurting body there is something better something stronger and something real 
9:48 AM - 21 Oct 2015|Just posted a photo https instagram com p 9G12fvFbCp 
9:43 AM - 21 Oct 2015|If only you knew how much I think about you 
8:58 AM - 21 Oct 2015|I'm slightly overly obsessed https twitter com katlynlayton status 656861229722550272 
2:41 AM - 19 Oct 2015|Don t let your victories go to your head or your failures go to your heart 
9:21 PM - 18 Oct 2015|people watch your language me oh fuck sorry 
4:55 AM - 21 Oct 2015|Some Wednesday motivation #OnWednesdaysWeWearBlack https instagram com p 9GUU0-FbKD 
4:12 AM - 21 Oct 2015|The smell of fresh coffee is the best tbh 
