3:55 AM - 1 Dec 2015|What a #Fantastico campaign for upcoming car @TataMotors Read Full Detail - http goo gl kZQegP pic twitter com C5PfQ426Xs 
11:30 PM - 16 Oct 2015|Video Team india took dinner at Cheteshwar Pujara's house in Rajkot https www youtube com watch v x9wdU-ElnIs #IndvsSA #TeamIndia #Dhoni 
4:52 AM - 16 Oct 2015|Top 10 Social Media Tips to Build Your Blog http beforeworks com top-10-social-media-tips-to-build-your-blog #socialmedia #BloggingTips pic twitter com 8GZgWAcVLL 
4:44 AM - 16 Oct 2015|Video Award winning short Film Ambani the investor http beforeworks com video-award-winning-short-film-ambani-the-investor via @beforeworks 
4:29 AM - 16 Oct 2015|Inspire others to join the fight against Breast Cancer #HimInitiative 
3:47 AM - 15 Oct 2015|Show your love with the craziest Dubsmash Selfies with the #Shaandaar Closeup Pack meet Shalia #CloseupWithShalia pic twitter com ENbwjttc7E 
2:24 AM - 16 Oct 2015|Participate in #CloseupWithShalia contest You have chance to meet #Shaandaar Team 
1:12 AM - 16 Oct 2015|People in Gurgaon Pre-book the iPhone 6s at iWorld Galleria Gurgaon Be a part of the launch too on 16th oct 12 am #MyNewiPhoneIndia 
12:38 AM - 16 Oct 2015|Get in shape Instantly with #FigureItOutWithDermawear 
1:35 AM - 15 Oct 2015|@anujprajapati11 You have a sparkling smile 
1:08 AM - 15 Oct 2015|share your smiling selfies with @HappydentGum to win exciting prizes #MyKindOfSmile #SmileOffer 
12:43 AM - 15 Oct 2015|Do you have a Frap-A-Smile Show us your #MyKindOfSmile and stand a chance to win amazing Happydent goodies pic twitter com Bl8YvGmkd2 
12:58 AM - 15 Oct 2015|Send a selfie with the @CloseUpIndia pack and #CloseupWithShalia 
12:30 AM - 15 Oct 2015|Amaze Shalia with your coolest selfies velfies with the #Shaandaar Closeup pack and get to meet them #CloseupWithShalia 
12:57 AM - 15 Oct 2015|Meet @aliaa08 @shahidkapoor by sending us your selfies with the #Shaandaar Closeup pack #CloseupWithShalia 
11:53 PM - 14 Oct 2015|I will miss Zaheer Khan 's simplicity My Fav Bowler #ZaheerKhan pic twitter com ucTGa1KnBe 
11:09 PM - 14 Oct 2015|Pacer @ImZaheer Khan set to announce retirement from international cricket 
8:21 AM - 14 Oct 2015|India won the match RIP for those who throws water bottle #IndvsSA #SAvsIND 
7:37 AM - 14 Oct 2015|Another fantastic catch pick by virat kohli #IndvsSA #SAvsIND 
7:26 AM - 14 Oct 2015|2 brilliant catch by virat kohli #IndvsSA #SAvsIND 
7:26 AM - 14 Oct 2015|Indore stadium proves that crowd support really gave encouragement #indvssa 
5:00 AM - 14 Oct 2015|Dhoni and Rahane Try to save the match now Bowlers have to write rest of the story #IndvsSA #MSD 
4:44 AM - 14 Oct 2015|Dhoni on 86 Just One Over Left 
4:41 AM - 14 Oct 2015|2nd ODI Dhoni playing Like One Man Army Good To see him back in Form 
1:30 AM - 14 Oct 2015|What s the thing you want to upgrade Give us your wackiest reasons why and win vouchers worth 10k #AmazonSaleDay2 pic twitter com cfMHzVkCPG 
1:44 AM - 14 Oct 2015|I'm going to upgrade those old sneakers to new running shoes @amazonIN and feel like Usain Bolt when I run next #AmazonSaleDay2 
1:41 AM - 14 Oct 2015|With the festive season right around the corner #AllAboutYouFromDP from @deepikapadukone couldn t have launched her label at a better time 
11:17 AM - 13 Oct 2015|Things We Always Hate http beforeworks com things-we-always-hate via @beforeworks 
10:30 AM - 13 Oct 2015|Travel Experience Golden Temple Coorg http beforeworks com travel-experience-golden-temple-coorg via @beforeworks 
7:37 AM - 13 Oct 2015|Side view of the Golden Temple pic twitter com zVGW0RSQKr 
7:31 AM - 13 Oct 2015|Golden Temple pics pic twitter com 0LgoP9ikpl 
7:30 AM - 13 Oct 2015|Painting inside Golden Temple Coorg pic twitter com 5UuAyhk76Z 
5:40 AM - 13 Oct 2015|Golden Temple in Coorg pic twitter com 9rHqNO6VoM 
3:36 AM - 13 Oct 2015|#LGNexus5X One huge upgrade in design that sets the 5X apart http www digitaltrends com mobile nexus-5x-vs-nexus-5 
3:21 AM - 13 Oct 2015|#LGNexus5X Nexus 5X vs Nexus 5 Was it worth the wait 
2:46 AM - 13 Oct 2015|#LGNexus5X is quicker and more secure with a fingerprint sensor http www in techradar com reviews phones mobile-phones Nexus-5X articleshow 49160384 cms 
2:46 AM - 13 Oct 2015|#LGNexus5X launched in india http www digitaltrends com mobile nexus-5x-vs-nexus-5 
12:45 AM - 13 Oct 2015|Don't forget to RT the questions for #CheckSnapdealToday #contest and make sure your answers are in place 
12:13 AM - 13 Oct 2015|Q 3 What is the offer on Clothing footwear and Accessories Hint in the image #CheckSnapdealToday pic twitter com z1UzbMvLnU 
2:03 AM - 13 Oct 2015|Your life is not between good or bad Your life is between #Mahagathbandhan and #BJP nowadays people thinking this pic twitter com iqRoSa2pDY 
12:50 AM - 13 Oct 2015|Rs 50 cashback on Rs 50 freerecharge code - FIFTYCB #freerecharge @ManishSEO @anujprajapati11 @Deepakpal @Kelawalababa 
12:21 AM - 13 Oct 2015|Do you Know Full Form of Google #Google #facts pic twitter com CAGNk9Vgdq 
11:26 PM - 12 Oct 2015|#KaashEkTweetSe i could go to my dream place and enjoy with my best buddies #SmartCare @anujprajapati11 
9:45 PM - 12 Oct 2015|Here are the Terms and Conditions for #CheckSnapdealToday #contest http bit ly CheckSnapdealToday-TnC Read them carefully 
10:09 PM - 12 Oct 2015|History repeats itself @snapdeal has come up with great offers this time as well #CheckSnapdealToday http www snapdeal com offers diwali-offers 
8:18 PM - 12 Oct 2015|Hello Friends My New #famestar Video Launch Will be Tomorrow 11th Oct at 8 30 PM http dl livfame com social 
8:17 AM - 12 Oct 2015|Hello Friends My New #famestar Video Launch Will be Tomorrow My New Video Will be live on 13th Oct at 8 30 PM http dl livfame com social 
5:30 AM - 11 Oct 2015|With national MNP you can now keep your Airtel number no matter where you move to in India http bit ly 1RAXeL3 pic twitter com KQdmJ9T0Tc 
1:00 AM - 12 Oct 2015|Work hard in silence and let success make the noise 
11:00 PM - 11 Oct 2015|One single press and the 3D Touch opens you to a world of possibilities Pre-bookings are now open for the iPhone 6s #MyNewiPhoneIndia 
11:52 PM - 11 Oct 2015|Here is the video of Golden Temple in Coorg https www youtube com watch v kiv_rjF4QLU #travel #AmazingPlaces #Video 
10:58 PM - 11 Oct 2015|Finally its confirmed #wifi #technology @ManishSEO @anujprajapati11 #India pic twitter com 4y9LsEapJC 
8:24 AM - 11 Oct 2015|Hello Friends My New #famestar Video Launch Will be Tomorrow My New Video Will be live on 11th Oct Sunday at 3 PM http dl livfame com social 
2:22 AM - 11 Oct 2015|Travel Experience at Coorg LIVE on #fame Watch me LIVE on #Others http dl livfame com m MJHhbQzhAn pic twitter com mPtZzjDEPF 
10:27 AM - 10 Oct 2015|Hello Friends My New #famestar Video On Travel Trips My New Video Will be live on 11th Oct Sunday at 3 PM http dl livfame com social 
9:34 AM - 10 Oct 2015|Suspect that your boyfriend is cheating on you Download @ChimneeApp to get advice about what you should do pic twitter com PmFr3qAupK 
8:29 AM - 10 Oct 2015|UKn Belvedere Best Place to Invest Money http beforeworks com ukn-belvedere-best-place-to-invest-money via @beforeworks 
5:59 AM - 10 Oct 2015|Save Your Time Know More News In Less Time @LittleNews_App #LittleNews http goo gl 3OU0CV 
4:47 AM - 10 Oct 2015|Things that scared me LIVE on #fame Watch me LIVE on #Others http dl livfame com m VZasXH2Myn pic twitter com 82KTFFL54Y 
1:42 AM - 10 Oct 2015|Friends I am happy to announce that I have launched http biharclasses com Agenda Free classes #DigitalBihar pic twitter com DogUVIjUDl 
12:58 AM - 10 Oct 2015|Top Stories From Top News Sources @LittleNews_App #LittleNews http goo gl 3OU0CV 
11:30 PM - 9 Oct 2015|The only thing that s changed is everything And we re bringing it to you soon Pre-book the iPhone 6s now #MyNewiPhoneIndia 
11:59 PM - 9 Oct 2015|Put on your party shoes #BreezerSoundHike is here again Any guesses for the next destination guys 
11:01 PM - 9 Oct 2015|Hello Friends My New #famestar Video On Things Scared Me My New Video Will be live on 10th Oct Saturday at 6 PM http dl livfame com social 
9:54 PM - 9 Oct 2015|You Will Get Short and Interesting News Over Here @LittleNews_App #LittleNews http goo gl 3OU0CV 
5:03 AM - 9 Oct 2015|Money Comes Like turtle and Goes Like Rabbit #Facts 
4:40 AM - 9 Oct 2015|Searching for a well-educated professional soulmate Come to @iBluebottle the choice of top Indian professionals pic twitter com WWmmac15Rl 
5:16 AM - 7 Oct 2015|The stupidest thing in this world is to allow yourself to be treated as nothing by the person you treated as your everything 
2:25 AM - 9 Oct 2015|3 Apples that changed the world pic twitter com Dklz0aDP8f 
2:20 AM - 9 Oct 2015|Adorable robot smartphone is a trusty friend that can talk walk cheer you up http ow ly TctIE pic twitter com NX8AJnekEo 
12:35 AM - 9 Oct 2015|What I learned from trying to fix the Ghost Referrer Spam in Google Analytics http www optimizesmart com what-i-learned-from-trying-to-fix-the-ghost-referrer-spam-in-google-analytics via @optimizesmart @anujprajapati11 
12:20 AM - 9 Oct 2015|iPhone 6s pre-bookings are now open #MyNewiPhoneIndia @MyNewiPhone_IN 
11:10 PM - 8 Oct 2015|You will get all the news and entertainment update over here @LittleNews_App #LittleNews http goo gl 3OU0CV 
10:11 PM - 8 Oct 2015|Hello Friends Get Ready for New #famestar Video My New Video Will be live on 10th Oct Saturday at 6 PM http dl livfame com social 
9:38 PM - 8 Oct 2015|This program has stopped responding #TodayKidsWillNeverKnow @anujprajapati11 @ManishSEO @ManojSethiSEO pic twitter com LkcdiIfIsv 
11:26 AM - 8 Oct 2015|Interesting Trending Post Of Scare Me in 4 Words http beforeworks com scare-me-in-3-words #ScareMeIn3Words pic twitter com dwHAkHIb7Q 
9:17 AM - 8 Oct 2015|Amazing atmosphere at Coorg pic twitter com M9mVi0pvK8 
7:06 AM - 8 Oct 2015|Hi Friends just registered myself on http Blogmint com Amazing platform to monetize your Blogs YouTube or Tweet http blogmint ref-r com c i 7230 2623694 
7:01 AM - 8 Oct 2015|One Of the Best App for Gujju @LittleNews_App You will get all the update over here #LittleNews http goo gl 3OU0CV 
5:06 AM - 8 Oct 2015|Guys Want to know what goes on in the minds of your girlfriends Get @ChimneeApp read what they actually think pic twitter com wJb1B4Mu8V 
2:18 AM - 8 Oct 2015|Top 5 Tourist Place in India that you should love to travel http beforeworks com top-5-tourist-place-in-india-that-you-should-love-to-travel via @beforeworks 
1:52 AM - 8 Oct 2015|Get huge discount when u book a lemon tree hotel MMTLT @makemytrip #MMTLT http bit ly 1Oes6Rx 
1:52 AM - 8 Oct 2015|airtel broadband users to get free anti-virus subscription http broadbandsurprises airtel in #BroadbandSurprises @airtelindia 
9:22 PM - 7 Oct 2015|Political career is the only field where you don't need Education Talent common sense as well as salary hike #fact 
5:56 AM - 7 Oct 2015|It's always great when we found some time to #travel #friends pic twitter com pwLEs9JGt1 
4:48 AM - 7 Oct 2015|Boyfriend issues Fake friends Mood swings Sex anxiety Get answers to the most personal questions on @ChimneeApp pic twitter com NPUvBcPfWw 
1:35 AM - 7 Oct 2015|Looking for a compatible life-partner Let the Personality Matching algorithm of @iBluebottle find a match for you pic twitter com QCcsf9ilXI 
12:47 AM - 7 Oct 2015|#TwitterTip dimensions of images on twitter Header Profile Post Images https dev twitter com rest public uploading-media Size of Gif images etc pic twitter com LMMmD9VU5u 
12:21 AM - 7 Oct 2015|Somewhere between fighting with each other and Fighting for each other we became best friends 
12:07 AM - 7 Oct 2015|Don't ask for anybody's help Be your own Savior 
11:59 PM - 6 Oct 2015|According to German Media SRK is more popular than POPE in the world @iamsrk 
5:18 AM - 6 Oct 2015|Interesting Bizarre Cars In The World http beforeworks com interesting-bizarre-cars-in-the-world via @beforeworks 
5:18 AM - 6 Oct 2015|Things We Always Hate http beforeworks com things-we-always-hate via @beforeworks 
5:02 AM - 6 Oct 2015|How to answer an interview question in an honest way http on mash to 1LcNDEM @anujprajapati11 @ManishSEO @ManojSethiSEO @Kelawalababa 
4:40 AM - 6 Oct 2015|What about this Maha Wildlife Week @anujprajapati11 @ManishSEO @ManojSethiSEO 
4:16 AM - 6 Oct 2015|Want to know how to #FightFrizz for your hair Follow @Oilopedia and join the tweet chat 
2:53 AM - 6 Oct 2015|Happiest Moment Which Money Can t Buy http beforeworks com happiest-moment-which-money-cant-buy via @beforeworks 
2:50 AM - 6 Oct 2015|@RubhuSocial A3 Better i would go with #InfluencerMarketing in India its cheaper than Twitter ads #RubhuSocial @anujprajapati11 
10:42 PM - 5 Oct 2015|The challenge is ON Tell us what you'd do for a OnePlus2 10 Invites 1 OnePlus2 up for grabs #BeOneUp @OnePlus_IN pic twitter com wCvJKC1ZLU 
4:21 AM - 5 Oct 2015|6 Tips to Clean Up Your #Twitter Account http www socialmediaexaminer com 6-tips-to-clean-up-your-twitter-account via @smexaminer @iSamraj @anujprajapati11 
3:13 AM - 5 Oct 2015|Imagine life without internet or imagine assured free data or speed upgrades #Broadbandsurprises #Airtel 
3:13 AM - 5 Oct 2015|Yesss if you are an airtel broadband user grab the #BroadbandSurpirses get free GB s or speed upgrades Log onto http broadbandsurprises airtel in 
1:23 AM - 5 Oct 2015|Offer 5th 8th October @makemytrip 60 off on lemon tree hotels Deal code MMTLT #MMTLT http bit ly 1Oes6Rx 
1:17 AM - 5 Oct 2015|Get flat 60 cashback on Lemon Tree hotels Just use the Deal Code MMTLT #MMTLT http bit ly 1Oes6Rx 
9:31 PM - 4 Oct 2015|The ultimate #Contest is here Watch the TVC and answer simple questions to win big It s time to #BendTheRules http hp nu T0qxo 
10:32 PM - 4 Oct 2015|Here are the Rules http hp nu T0udL Mention the Question No don t forget to use #BendTheRules in your replies to every question 
11:37 PM - 4 Oct 2015|It s time to #BendTheRules Watch @HPIndia s latest TVC answer simple questions to win 
9:07 AM - 4 Oct 2015|All your personal problems Sorted Download @ChimneeApp - the Agony Aunt to the world pic twitter com dapCGfSx0L 
8:04 AM - 4 Oct 2015|Never depend on one source of income 
3:34 AM - 4 Oct 2015|Kill 2-5 cops but no Patel should die A Bullshit Statement Given By Hardik Patel 
3:03 AM - 4 Oct 2015|27 Travel Hacks That Will Save You Time Money http wlst us 5V #wluk #ttot pic twitter com qAAnTcY7Ll 
3:00 AM - 4 Oct 2015|Leadership is not about your title it's about your behaviour 
1:54 AM - 4 Oct 2015|My First Post in Hindi http nextsamachar com what-is-digital-marketing #NEXTSamachar # pic twitter com KrhqLkz8VD 
12:14 AM - 4 Oct 2015|Don't store dreams in ur eyes they may roll down with tears Store them in ur heart so each heart beat will inspire u to full fill them 
11:51 PM - 3 Oct 2015|Friend is going abroad so I should post a picture with a long essay on Facebook to wish him luck instead of calling him up 
11:46 PM - 3 Oct 2015|India is basically a country with 125 Cr Cricket experts only when match is on air 
10:28 AM - 3 Oct 2015|Coorg tour over now Hope I can spend some more time over there Now get back to Bangalore pic twitter com qh0oR2XPbj 
3:17 AM - 3 Oct 2015|At Golden Temple Coorg pic twitter com 5Igk4j6VGo 
9:16 AM - 2 Oct 2015|Coorg tour pic twitter com RiXTuIsF87 
5:25 AM - 2 Oct 2015|Great time at coorg Amazing holiday with friends pic twitter com X6qYxGWXJT 
2:17 PM - 1 Oct 2015|Traveling to coorg at morning 2 AM Thank you Gandhi bapu just because of holiday only 
3:28 AM - 1 Oct 2015|The most push-ups performed in one day by a single person was 46 001 @anujprajapati11 
12:41 AM - 1 Oct 2015|How to stop auto download in whatsapp http beforeworks com how-to-stop-auto-download-in-whatsapp via @beforeworks 
12:36 AM - 1 Oct 2015|They need Proper Education Can't digest #DigitalIndia in next 5-10 yrs Whats say #StreetDreams pic twitter com KOr7hzfSnE 
10:48 PM - 30 Sep 2015|Can someone connect me to good tech bloggers #Help #RT 
6:23 AM - 30 Sep 2015|There is a blogging paid campaign on disqus interested people contact to @TheBrainSticker 
5:35 AM - 30 Sep 2015|Any body having pre-registered account in Disqus 
4:02 AM - 30 Sep 2015|Saputara One of the best hill station in Gujarat http beforeworks com saputara-one-of-the-best-hill-station-in-gujarat via @beforeworks 
4:01 AM - 30 Sep 2015|That moment when your Pet is not talking to You pic twitter com GEJbSkMZby 
3:22 AM - 30 Sep 2015|How My Salary React to me http beforeworks com how-my-salary-react-to-me via @beforeworks 
5:30 AM - 29 Sep 2015|Searching for a well-educated professional soulmate Come to @iBluebottle the choice of top Indian professionals pic twitter com C1FvWms9Zt 
5:17 AM - 29 Sep 2015|How To Get New Links To Our Website http beforeworks com get-new-links-website via @beforeworks 
12:23 AM - 28 Sep 2015|Show us your #Dubsmash andaaz share it using #JiyoApneAndaazSe #win the stylish new Passion Pro pic twitter com GjkSdg7San 
10:12 PM - 28 Sep 2015|Happiest Moment Which Money Can t Buy http beforeworks com happiest-moment-which-money-cant-buy via @beforeworks 
9:15 PM - 28 Sep 2015|In Beijing you can pay for the metro with plastic bottles A brilliant idea http www sheldonsfans com article-1351-in-beijing-you-can-pay-for-the-metro-with-plastic-bottles-a-brilliant-idea html @manishseo @anujprajapati11 
5:30 AM - 28 Sep 2015|Guys Want to know what goes on in the minds of your girlfriends Get @ChimneeApp read what they actually think pic twitter com MagNlHfUFo 
4:43 AM - 28 Sep 2015|4 Skills You Will Need To Run a Successful Authority Site http www authorityhacker com 4-skills-you-need via @authorityhackr pic twitter com 7u2RXWviav 
4:39 AM - 28 Sep 2015|Things We Always Hate http beforeworks com things-we-always-hate via @beforeworks 
12:37 AM - 28 Sep 2015|Wooow Some news coming from TN - Amma has introduced #AmmaMobiles Can we relate it to #DigitalIndia 
11:07 PM - 27 Sep 2015|India is going to be most stylish technology-friendly Country and i support #DigitalIndia #ModiAtSAPCenter 
10:58 PM - 27 Sep 2015|Personality Thoughts and Work is really impressive done by Narendra Modi #ModiAtSAPCenter 
10:20 PM - 27 Sep 2015|WWF Can t Replace This Kids http beforeworks com wwf-cant-replace-this-kids via @beforeworks 
5:30 AM - 27 Sep 2015|Weekend at Bangalore LIVE on #fame Watch me LIVE on #Others http dl livfame com m SnkoDqngdn pic twitter com n5IGDHXR60 
5:30 AM - 27 Sep 2015|Looking for a compatible life-partner Let the Personality Matching algorithm of @iBluebottle find a match for you pic twitter com c9H3tzyhx0 
12:18 AM - 27 Sep 2015|Tired of browsing hundreds of useless profiles on matrimonial websites Give @iBluebottle a try We are different pic twitter com LvsK7VClFw 
9:51 PM - 26 Sep 2015|Highlighted steps taken by the Govt to mitigate poverty through technology how technology is transforming lives of 1 25 billion Indians 
11:06 PM - 26 Sep 2015|Biggest enemy of Indian #Entrepreneurs so called Society http yourstory com 2015 09 society-entrepreneurs-enemy via @pardeepg @YourStoryCo #startup pic twitter com HdRGP96qkp 
9:39 PM - 26 Sep 2015|7 Tips Every WhatsApp User Should Know http beforeworks com 7-tips-every-whatsapp-user-should-know via @beforeworks 
8:13 PM - 26 Sep 2015|Google's 17th Birthday long live #SEO @google @googleindia pic twitter com o04I9PGnEa 
9:05 AM - 26 Sep 2015|My Another Video #Famestar on Weekend Life in Bangalore @livyourfame 
11:49 PM - 25 Sep 2015|You can't get a caring boyfriend on @ChimneeApp but you can certainly get alternative ideas pic twitter com qEOtPOqsUp 
11:48 PM - 25 Sep 2015|You can't get a caring boyfriend on @ChimneeApp but you can certainly get alternative ideas pic twitter com qr7MBQseaX 
3:30 AM - 25 Sep 2015|It's a beautiful thing when you get so comfortable with someone and you realize you re telling them things you ve never said out loud before 
2:04 AM - 25 Sep 2015|So Cute Baby Pandas Playing On The Slide http beforeworks com so-cute-baby-pandas-playing-on-the-slide via @beforeworks 
12:58 AM - 25 Sep 2015|Everyone is an entrepreneur after 5 drinks or having a Website D dude it takes lot of hard-work Dedication 
10:43 PM - 24 Sep 2015|Top 5 Tourist Place in India that you should love to travel http beforeworks com top-5-tourist-place-in-india-that-you-should-love-to-travel via @beforeworks 
10:04 PM - 24 Sep 2015|Happy Long #weekend Friends and Eid Mubarak Happy Eid @ManojSethiSEO @anujprajapati11 @MouryaJii @nagubela pic twitter com z7BKI2CaoV 
10:15 PM - 24 Sep 2015|Hahahahhaha I love the last kick P @anujprajapati11 @ManojSethiSEO @snehakanchan @Deepakpal @dEeYaJ12 pic twitter com wi1s6stbXB 
9:29 AM - 24 Sep 2015|@angelnumber1111 @anujprajapati11 iPhone http bit ly Chimnee_iphone Android http bit ly 18ViYAR 
7:37 AM - 24 Sep 2015|All your personal problems Sorted Download @ChimneeApp - the Agony Aunt to the world pic twitter com uqdgLF4PVj 
5:16 AM - 24 Sep 2015|Interesting Bizarre Cars In The World http beforeworks com interesting-bizarre-cars-in-the-world via @beforeworks 
4:48 AM - 24 Sep 2015|Cute Pics pic twitter com pGqmVTdloX 
4:30 AM - 24 Sep 2015|Love To Buy most iconic phone ever With Power Packed Specs #InFocusM812 #bestofbothworlds http bit ly 1jcFiuE @InFocus_IN 
2:03 AM - 24 Sep 2015|Always Get the Review Before Use Check the M812 Review http www digit in mobile-phones infocus-m812-review-5816 html #bestofbothworlds @InFocus_IN #InFocusM812 
1:26 AM - 24 Sep 2015|Guys how is Renault Kwid at Rs 2 56 Lakh Any Idea pic twitter com 1LO0TRU2Kh 
12:07 AM - 24 Sep 2015|InFocus M812 has brought the same iPhone design but on Android #BestOfBothWorlds 
12:02 AM - 24 Sep 2015|Fast processing with Snapdragon 801 @InFocus_IN #bestofbothworlds 
11:00 PM - 23 Sep 2015|this real or what Same looks same design same finish like an i-phone @InFocus_IN #BestOfBothWorlds 
5:00 AM - 23 Sep 2015|Dumb Ways to Marry video by @iBluebottle on what to avoid while looking for a life-partner https youtu be c6luYXhpXuI pic twitter com RMtzJ5cSJT 
4:45 AM - 23 Sep 2015|How to Write an Awesome Blog Post in Five Steps http www wordstream com blog ws 2015 02 09 how-to-write-a-blog-post via @WordStream pic twitter com 7qhxByUh32 
4:31 AM - 23 Sep 2015|Got a Great Response From You Guys At #Does_God_Exist Discussion Going Well 
3:40 AM - 23 Sep 2015|This book may explain all your doubts about Gods Read @Evolutionofgods http goo gl MtGdHP #Does_God_Exist 
3:32 AM - 23 Sep 2015|Know how when and why religions and God came into being @Evolutionofgods http goo gl MtGdHP #Does_God_Exist 
3:30 AM - 23 Sep 2015|Has Anyone of you Seen God Ever in your Lifetime #Does_God_Exist What's their Religion Then Why Should we Fight 
3:28 AM - 23 Sep 2015|Guys A very interesting conversation is still on join follow @Evolutionofgods by using #Does_God_Exist n express your experience 
3:30 AM - 23 Sep 2015|@Evolutionofgods I believe in a Power but don't know who named God #Does_God_Exist @anujprajapati11 
3:28 AM - 23 Sep 2015|@ManishSEO @anujprajapati11 @Evolutionofgods Nobody saves us but the spirit in heart of common man is the best saver 
3:08 AM - 23 Sep 2015|Now a Days Some People Call Them GodMen and God Women Do You Believe in Those Baba #Does_God_Exist 
3:26 AM - 23 Sep 2015|We People talk about one god and then after we people fight on religion Why #Does_God_Exist 
3:22 AM - 23 Sep 2015|@Evolutionofgods Hindu will say Bhagwan Christian will say God Muslims will say Allah #Does_God_Exist @anujprajapati11 but all are One 
3:07 AM - 23 Sep 2015|I'm not against the existence of God #Does_God_Exist @Evolutionofgods @anujprajapati11 
2:48 AM - 23 Sep 2015|#Does_God_Exist is trending heights Top Trends every hour for India only @ http hashgurus com image aspx q 23Does_God_Exist pic twitter com kY8OaWEyaf 
2:53 AM - 23 Sep 2015|#Does_God_Exist shows up as trending topic in India at rank 5 Check http TheIndianSubcontinent com to know why 
2:49 AM - 23 Sep 2015|@anujprajapati11 I don't even see them separately Atleast in India we never had a fight between religion and science You r right 
2:43 AM - 23 Sep 2015|Wow Looks Great #Does_God_Exist Trending in India Look Like a Healthy Discussion pic twitter com UHKPII2Uma 
2:42 AM - 23 Sep 2015|#Does_God_Exist Trending In #India Congrats @Evolutionofgods @anujprajapati11 pic twitter com k2c1heLnRR 
2:42 AM - 23 Sep 2015|Congratulations Team #Does_God_Exist is trending in India @anujprajapati11 @Evolutionofgods pic twitter com 9btIv89li6 
2:22 AM - 23 Sep 2015|Science has the evolution big bang They are against the existence of God https twitter com ManishSEO status 646614861540016129 
2:28 AM - 23 Sep 2015|@Ta_mar__ Science has cleared many superstitions and will be clearing wrong believe @anujprajapati11 @Evolutionofgods #Does_God_Exist 
2:19 AM - 23 Sep 2015|@Ta_mar__ Science is behind and One Power People have started calling them God @anujprajapati11 @Evolutionofgods #Does_God_Exist 
2:15 AM - 23 Sep 2015|@Evolutionofgods I believe in What i see I don't what i never seen #Does_God_Exist @anujprajapati11 
2:10 AM - 23 Sep 2015|Humans Created Gods to Explain Mysteries of Nature @Evolutionofgods http goo gl MtGdHP #Does_God_Exist 
2:08 AM - 23 Sep 2015|Another Question Do you believe that god really exists #Does_God_Exist pic twitter com zvrUTOuyxo 
1:52 AM - 23 Sep 2015|If you have any doubts about GODS then this book is for you @Evolutionofgods #Does_God_Exist http goo gl MtGdHP 
1:44 AM - 23 Sep 2015|@Evolutionofgods for me self-believe is the only way to feel God existence #Does_God_Exist @anujprajapati11 @ManishSEO @KantMourya 
2:05 AM - 23 Sep 2015|#Does_God_Exist One of the big and confused question Love to discuss on this topic @Evolutionofgods 
1:57 AM - 23 Sep 2015|This book may explain all your rational Irrational beliefs about god Read @Evolutionofgods http goo gl MtGdHP #Does_God_Exist 
