3:55 AM - 1 Dec 2015|What a #Fantastico campaign for upcoming car @TataMotors Read Full Detail - http goo gl kZQegP pic twitter com C5PfQ426Xs 
3:14 AM - 1 Dec 2015|Recall my old memories pic twitter com yNhJZuu1Ju 
2:27 AM - 1 Dec 2015|Do you know are PM Well 10 Best Selling Books On Our PM Narendra Modi http goo gl CqKAoo @ManishSEO @anujprajapati11 @rrashmisinhaa 
9:42 PM - 30 Nov 2015|Amazing #discount #coupons as well as #deals Check Here http goo gl 5aZ3Pu pic twitter com rM4UyqIwlu 
8:51 PM - 30 Nov 2015|Let your blood flow through different hearts Donate Blood #KnowAIDSNoAIDS @MoHFW_INDIA 
4:13 AM - 30 Nov 2015|5 Best Social Media Marketing Tips http beforeworks com 5-best-social-media-marketing-tips #socialmedia #marketing pic twitter com QbvHWiBUBF 
1:55 AM - 30 Nov 2015|Whatever you are be a good one 
12:30 AM - 30 Nov 2015|Respect people s feelings Even if it does not mean anything to you it could mean everything to them 
9:01 PM - 29 Nov 2015|Check Today's Deal Of the Day https goo gl SToiDx #coupon #discount pic twitter com Yn2m7B2IEQ 
2:31 AM - 29 Nov 2015|Unforgettable Moments with Friends LIVE on #fame Watch me LIVE on #Others http dl livfame com m NClmOIOGTo pic twitter com ri2KXH1QPj 
1:55 AM - 29 Nov 2015|Be ready to watch my #famestar video at today 4 30 PM You Will Find Something crazy as well as interesting http dl livfame com social 
11:25 PM - 28 Nov 2015|MY Another #famestar Video will be launch on 29th November 4 30 PM Download to watch http dl livfame com social 
9:40 PM - 28 Nov 2015|MY #famestar Video on How you Celebrate Your Weekend will be launch on 29th November 11 30 AM Download to watch http dl livfame com social 
9:10 PM - 28 Nov 2015|How you celebrate your weekend LIVE on #fame Watch me LIVE on #Others http dl livfame com m lHwh6cQjTo pic twitter com nxi3MGpbGX 
9:10 PM - 28 Nov 2015|MY Another #famestar Video will be launch on 29th November 11 30 AM Download to watch http dl livfame com social 
6:16 AM - 28 Nov 2015|#SixWordsStory When your parents check your laptop 
5:17 AM - 28 Nov 2015|Kind God is Silent on Terrorism #SixWordsStory 
2:05 AM - 28 Nov 2015|Nowadays more people are ''Feeling Blessed'' On facebook than in temples 
2:20 AM - 28 Nov 2015|#Mumbai is going gaga over the little black box at #DineoutPlus launch in @TheSC_Project pic twitter com naWjHCvVHH 
1:50 AM - 28 Nov 2015|It's funny how you actually think you mean something to someone and they just turn around and prove you wrong 
1:02 AM - 27 Nov 2015|Check Today's Deal Of the Day https goo gl SToiDx pic twitter com zuFk4BgU2M 
1:58 AM - 26 Nov 2015|UC mobile browser is now the world s second most popular browser #UCBrowserNo2 http goo gl qVd2bx pic twitter com L6REMpNjpz 
12:01 AM - 26 Nov 2015|UC becomes world's No 2 Browser Beats Safari grabs over 17 market share #UCBrowserNo2 http goo gl qVd2bx pic twitter com ECN7vuJLAb 
10:46 PM - 25 Nov 2015|Hey Friends Check Today's Deal Of the Day https goo gl SToiDx pic twitter com kmQ0LeUxCs 
9:45 PM - 25 Nov 2015|#Does_God_Exist One Of the most asked question but still confused in answer 
9:21 PM - 25 Nov 2015|I'm not perfect but at least I'm real 
2:44 AM - 25 Nov 2015|At Morning #BootOutSnapdeal Trending Then @snapdeal Comes up with #SnapdealForIndia That called as Promotional Strategies 
2:39 AM - 25 Nov 2015|Family Member What are you doing with your life Me It's a surprise 
1:07 AM - 25 Nov 2015|How to Discover Social Media Insights About Your Competitors http www socialmediaexaminer com how-to-discover-social-media-insights-about-your-competitors via @SMExaminer pic twitter com 91nhpyC0M3 
1:03 AM - 25 Nov 2015|Amazing Discount Offers and Discount Coupons Grab It At http goo gl 78mD9X #DiscountCoupons #coupons pic twitter com enQGFscaZr 
12:10 AM - 25 Nov 2015|SHOP THIS LOOK - AT FLAT 50 DISCOUNT http goo gl 0WLhfd @anujprajapati11 @ManishSEO @rrashmisinhaa pic twitter com gbwq7oPJoE 
12:55 AM - 24 Nov 2015|Dear #AamirKhan Your Identity Created because of this country You didn't do anything for this country for free You Wanted to leave then Go 
11:02 PM - 23 Nov 2015|Koi Bhi Desh Perfect Nahi Hota use perfect banana padta hai Aamir khan dialogue in Rang De Basanti But Now he Wants to leave the Country 
6:30 AM - 23 Nov 2015|This guy is saving the rainforest using old cell phones http dw com p 1H9bz #doingyourbit #dyb #conservation pic twitter com nMlRu6yTyv 
5:03 PM - 23 Nov 2015|MY Another #famestar Video on Top Indian Website will be launch on 24th November Morning 8 AM Download to watch http dl livfame com social 
9:44 AM - 23 Nov 2015|MY Another #famestar Video on Top 10 Indian Website will be launch on 24th November Download to watch http dl livfame com social 
9:32 AM - 23 Nov 2015|Most Visited Website pic twitter com r89kPqIBEJ 
1:26 AM - 23 Nov 2015|Yamraj Your Time is Up Any Last Wish Pappu -I want to see Manmohan Singh speaking with Salman Khan's wife at Narendra Modi's wedding 
10:49 PM - 22 Nov 2015|Time never comes back the irony is that history repeats itself 
10:11 PM - 22 Nov 2015|We declare the #MakeUsSmile contest open Its simlpe Check out this photo and come up with a quirky caption pic twitter com YoxR3UG0cu 
10:41 PM - 22 Nov 2015|how Music can take you to another place Honey Singh song playing in cafe so I moved to another cafe 
9:10 AM - 21 Nov 2015|MY Another #famestar Video will be launch on 22th November Download to watch http dl livfame com social 
9:39 PM - 20 Nov 2015|Wow Paytm Gives You 35 Cash Back Check Here https paytm com utm_source Affiliates utm_medium Paritycube utm_campaign Paritycube utm_term 9132CL8441XcwgC_5171 
2:12 AM - 20 Nov 2015|Grab The Best Discount Coupon over here http beforeworks com coupon 
2:30 AM - 19 Nov 2015|Get 50 C ash back on Bus ticket bookings https paytm com offer bus-ticket-discount utm_source Affiliates utm_medium Paritycube utm_campaign Paritycube utm_term 9132CL8441XcwgC_5175 
1:44 AM - 19 Nov 2015|@ChilisIndia #Foodie #HotOnDineout is here 4 amazing deals #Bangalore Reserve Now Limited Seats #DontWaitOut pic twitter com FAr7r60XfG 
11:30 PM - 18 Nov 2015|@ChilisIndia #HotOnDineout is here 4 amazing deals Hurry #Bangalore Reserve your table today #DontWaitOut pic twitter com QJ6AkIhlZU 
10:31 PM - 18 Nov 2015|WITHOUT CROSSING the worst situations No one can touch the best corners of life Dare to face anything in life WINNERS never quit 
4:23 AM - 18 Nov 2015|Man cannot discover new oceans unless he has the courage to lose sight of the shore 
1:24 AM - 18 Nov 2015|You will Love it What is #SocialMedia http digiskore com what-is-social-media Via @anujprajapati11 @digiSkore #SMWMumbai 
12:41 AM - 18 Nov 2015|Check Amazing Discount Coupons Get Up to 60 Discount http beforeworks com coupon #Discount #coupons pic twitter com eilyD5PQkY 
2:31 AM - 17 Nov 2015|All You Need To Know About Smartphone Changes http beforeworks com all-you-need-to-know-about-smartphone-changes #technocrats #Smartphone #Funny pic twitter com 6f3J4TPmvQ 
8:05 PM - 16 Nov 2015|Tempting Tuesdays Free @foodpandaIndia Coupons http goo gl Gq5MBx @ManishSEO @anujprajapati11 @rrashmisinhaa pic twitter com 0yh3kEI669 
6:47 PM - 16 Nov 2015|fall in love with your Best friend LIVE on #fame Watch me LIVE on #Love n Relationships http dl livfame com m OwMyWaOezo pic twitter com JCYiavyaTK 
3:07 PM - 16 Nov 2015|#famestar Video On Why you can fall in love with your best friend Will be Launch 13th November Download to watch http dl livfame com social 
10:13 AM - 16 Nov 2015|MY Another #famestar Video Will be Launch 17th November Download to watch http dl livfame com social 
10:05 AM - 16 Nov 2015|Why You Can Fall in Love with your Best Friend Any Idea pic twitter com brJsizXl2Q 
7:34 AM - 16 Nov 2015|Terrorism is a short cut to heaven Read how http theevolutionofgods blogspot in 2014_05_01_archive html 
3:56 AM - 16 Nov 2015|Need some energy to work at office @redbull pic twitter com dx0SK0jxPm 
10:29 PM - 15 Nov 2015|All You Need To Know About Smartphone Changes http beforeworks com all-you-need-to-know-about-smartphone-changes via @beforeworks @anujprajapati11 
5:03 AM - 15 Nov 2015|Best Affiliate Program that Every Blogger have to try Check Here https share payoneer com nav GE-MmO1Y5l-j2_kExnf-Aa5gLeYm5l0fzTzgGo8chTlNFDNsUFLattF39xlTYzB-7G2tya1QvkrAZ3nTXEBpLg2 
1:04 AM - 15 Nov 2015|MY Another #famestar Video On Bangalore Life Will be Launch 13th November Download to watch http dl livfame com social 
11:43 PM - 14 Nov 2015|All You Need To Know About Smartphone Changes Some Funny Smartphone Changes #Technocrats http beforeworks com all-you-need-to-know-about-smartphone-changes 
11:40 PM - 14 Nov 2015|MY Another #famestar Video Will be Launch 15th November Download to watch http dl livfame com social 
3:12 AM - 14 Nov 2015|#NoMoreExcuses On Religions Just Check This Link and You Will Get all your Answers http goo gl MtGdHP pic twitter com RD7cLRCdW5 
1:48 AM - 14 Nov 2015|Don't Ever Let Some Idiots Ruin Your Day 
2:05 AM - 13 Nov 2015|PRDP Movie Review LIVE on #fame Watch me LIVE on #Entertainment http dl livfame com m MpmGoFq6so pic twitter com EuyGmWdUcc 
7:42 AM - 12 Nov 2015|MY Another #famestar Video On How to increase your website views Will be Launch 13th November Download to watch http dl livfame com social 
6:02 AM - 12 Nov 2015|Hello Friends MY Another #famestar Video ON Blogging Tips Will be Launch 13th November Download to watch http dl livfame com social 
5:05 AM - 12 Nov 2015|Hello Friends MY Another #famestar Video on PRDP Movie Review Will be Launch 13th November Download to watch http dl livfame com social 
5:04 AM - 12 Nov 2015|Hello Friends MY Another #famestar Video Will be Launch 13th November On PRDP Review Download to watch http dl livfame com social 
3:37 AM - 12 Nov 2015|Lunch with friends pic twitter com J3zpPi4cn9 
11:33 PM - 11 Nov 2015|What is Your Life Purpose or Dream #RandomChat http digiskore com thoughtoftheday-choice-is-yours-life-is-yours #Entrepreneur #startup pic twitter com cGSBhi6Nq7 
10:10 PM - 11 Nov 2015|Happy New Year to All My Gujarati Friends 
8:30 PM - 11 Nov 2015|'Life is too short to wear boring Jewelry'- Get 70 Off http goo gl sr33BG @anujprajapati11 @ManishSEO #Jabong pic twitter com 58I6IDjPpp 
8:27 AM - 11 Nov 2015|Dinner at @PizzaHutIN pic twitter com FLeLsDVwwk 
3:36 AM - 11 Nov 2015|Travelling in India Aeroplane 1 suitcase 1 laptop bag 1 passenger Train 4 suitcases 2 hand baggages 1 passenger 160 waiting list 
1:30 AM - 11 Nov 2015|Have you ever tried talking to a quiet person Maybe they do want to talk They just don't know how to start 
1:04 AM - 11 Nov 2015|Facebook Fact The Number of Fake Accounts of girls on Facebook is greater than the Number of original account of girls 
12:59 AM - 11 Nov 2015|Wish you all Happy Diwali and Prosperous NEW YEAR from pic twitter com Wfi4ZVktsg 
7:07 PM - 9 Nov 2015|King @WadeBarrett and @WWESheamus just got SERVED by @WWECesaro and @ManUtd's @WayneRooney #WWETitle #RAW http snpy tv 1iPn2XE 
3:38 AM - 10 Nov 2015|With Friends pic twitter com LyquiRiMGz 
4:11 AM - 6 Nov 2015|That which can be asserted without evidence can be dismissed without evidence Christopher Hitchens 
3:22 AM - 10 Nov 2015|I'm not an atheist How can you not believe in something that doesn't exist That's way too convoluted for me 
10:13 PM - 9 Nov 2015|Check This Link If You want to Earn Money Work From Home http bit ly 1MpP9Zs 
10:09 PM - 9 Nov 2015|More Than 50 Discount Available on all the products Download for know more http fkrt it dBq4PuuuuN 
8:41 AM - 9 Nov 2015|Hello Friends MY Another #famestar Video Will be Launch 13th November Download to watch http dl livfame com social 
1:45 AM - 9 Nov 2015|Maggi is back on @snapdeal M surely registering for it tomorrow #SnapdealWelcomesMAGGI https www youtube com watch v 9os3aOOcz7c 
10:47 PM - 8 Nov 2015|These days If India loses a match - BLAME DHONI If anything bad happens anywhere in India - BLAME MODI #BiharResults 
2:40 AM - 8 Nov 2015|Hello Friends Check the Amazing Discount Offers of Dhanteras Check This Link https goo gl TBtdTQ #AmazonDhanterasDay1 @amazonIN 
11:30 PM - 7 Nov 2015|Guardians of the Galaxy premieres now on Star Movies #GuardiansOnStarMovies pic twitter com 8hBb2wl7ok 
12:50 AM - 8 Nov 2015|Perfect Sunday Watching Guardians Of The Galaxy on @StarMoviesIndia Much fun #GuardiansOnStarMovies 
11:48 PM - 7 Nov 2015|Watch the biggest blockbusters on Star Movies Kick start your Diwali with #GuardiansOnStarMovies https amp twimg com v 5aafa315-c307-4d24-bade-2774d11a0615 
12:32 AM - 8 Nov 2015|@saleemgaur @anujprajapati11 students in bihar cheat during thr exam now they can cheat with full support of govt 
11:16 PM - 7 Nov 2015|Bihar Wants Jungle Raj #BiharResults NO One Can Stop Nitish and Lalu Now It's Time to cheat pic twitter com rRnNWNnepZ 
10:45 PM - 7 Nov 2015|Take Surveys For Cash - Brand New Paid Survey Site For 2015 Check Here http bit ly 1MpP9Zs 
9:49 PM - 7 Nov 2015|Here's the 3rd vote-off for today folks Pick the deal you'd like to get your hands on #AmazonDhanterasPoll 
9:05 PM - 7 Nov 2015|Once Again Jungle Raj Upgraded Version 2 0 coming Back BJP - 98 JDU - 123 Others - 10 What's Your View #BiharResults #NarendraModi 
8:56 PM - 7 Nov 2015|Looks Like Jungle Raj Upgraded Version 3 0 coming Back BJP - 94 JDU - 125 Others - 8 #BiharResults #NarendraModi #NitishKumar 
8:37 PM - 7 Nov 2015|Dramatic Change in #BiharResults BJP - 97 JDU - 99 Others - 6 Can't Believe 
8:29 PM - 7 Nov 2015|BJP Hit Century in #BiharResults BJP - 100 JDU - 85 Others - 7 RT If You Think BJP Will Make the Government in Bihar #NarendraModi 
8:18 PM - 7 Nov 2015|Interesting Numbers Comes Up in #BiharResults BJP - 87 JDU - 73 Others - 4 RT If You Think BJP will make the Government #NarendraModi 
7:57 PM - 7 Nov 2015|BJP - 65 JDU - 48 Others - 4 #BiharResults #NarendraModi #LaluPrasadYadav #NitishKumar 
10:21 AM - 7 Nov 2015|Love the smile of sehwag and sachin while playing #Allstars2015 match going interesting as well as amazing 
10:17 AM - 7 Nov 2015|Really great to see sachin and sehwag playing after a long time #Allstars2015 
10:34 PM - 6 Nov 2015|Take Surveys For Cash - Brand New Paid Survey Site For 2015 Check Here http bit ly 1MpP9Zs 
4:11 AM - 4 Nov 2015|Philosophy is questions that may never be answered Religion is answers that may never be questioned 
3:07 AM - 6 Nov 2015|In last one year People say You Learnt You Earned You Enjoyed 
12:49 AM - 6 Nov 2015|In the end your success will speak up itself Never give up 
10:38 PM - 5 Nov 2015|I have no idea which Govt Central State will make a Good Hard law Against Rapists in India #Bangalore #nirbhayakand 
1:34 AM - 2 Nov 2015|Tell us #WhatsNewThisDiwali for you Tweet if you are planning to do something different this Diwali 
2:39 AM - 2 Nov 2015|Some pictures of the Digital Diwali from the onground activation we had in Delhi #WhatsNewThisDiwali pic twitter com ibJBMN4YzG 
5:45 AM - 5 Nov 2015|Such a perfect way to make someone start a healthier life http bit ly 1MBsIMk #WhatsNewThisDiwali 
3:01 AM - 4 Nov 2015|So what's your celebration plan for #Diwali 2015 Share your plans join us as we #discuss few simple questions pic twitter com gB8RIfNmnV 
11:42 PM - 4 Nov 2015|Celebrate a safe Diwali with us Join us in our chat session today @aadil @MajidAKMph @anujprajapati11 @akathmadevi @BrittanyLee2819 @CSR_RT 
8:40 PM - 4 Nov 2015|After T20 and ODI loss India were like pic twitter com rN18wxJiE5 
6:44 AM - 4 Nov 2015|3 Big Reasons Why Maggi banned in India http ln is govtvia com 2015 10 Lp3j0 #Maggi @ManishSEO @anujprajapati11 Maggi lovers 
8:31 PM - 4 Nov 2015|This Diwali 'Go Green Go Clean' Shop Now http goo gl dqXUDd @ManishSEO @suhasfranky1 @anujprajapati11 pic twitter com CUf7YHA9ta 
10:38 PM - 3 Nov 2015|Do ReTweet Now @anujprajapati11 Win Google Nexus 5x Phone #InstaDiwali #GizbotGiveaway http goo gl G9TzLJ 
2:35 AM - 3 Nov 2015|How to Create a #facebookvideo Ad That Moves People to Action http www socialmediaexaminer com how-to-create-a-facebook-video-ad-that-moves-people-to-action via @smexaminer @anujprajapati11 
1:25 AM - 3 Nov 2015|To you I'm an atheist To God I'm the loyal opposition 
1:13 AM - 3 Nov 2015|That which can be asserted without evidence can be dismissed without evidence 
5:47 AM - 2 Nov 2015|WTF still people send this type of message behalf of @BMW Seriously pic twitter com Qcmnaxtffd 
11:19 PM - 1 Nov 2015|Behind every successful person there are lots of unsuccessful years 
9:44 PM - 1 Nov 2015|In this diwali Burn crackers as well as your ego Have a safe diwali 
2:13 AM - 31 Oct 2015|Russian airliner with 224 aboard crashes in Egypt's Sinai http ln is www reuters com arti byVb9 #Russiacrash @ManishSEO @anujprajapati11 
10:48 PM - 30 Oct 2015|Here is the video of alleppy falls in Coorg beautiful travel place https www youtube com watch v EEgIhyCmqg4 #TravelSkills #travel #tourism @makemytrip 
4:19 AM - 30 Oct 2015|You can't get a caring boyfriend on @ChimneeApp but you can certainly get alternative ideas pic twitter com hAfxFWoJzV 
3:22 AM - 30 Oct 2015|Podcast to Book Deal How to Turn Your Passion Into Profit http www socialmediaexaminer com podcast-to-book-deal-how-to-turn-your-passion-into-profit-lewis-howes via @smexaminer @anujprajapati11 
12:32 AM - 30 Oct 2015|Sad story of a healthy mother died in operation child also died due to doctors negligence @naikprasad http kannada oneindia com column pain aparnas-soul-will-not-rest-in-peace-if-culprits-not-punished-098083 html 
6:11 AM - 29 Oct 2015|Be Ready to watch MY #famestar Video at Tomorrow 30th OCT 8 AM Download the fame app to watch http dl livfame com social 
4:59 AM - 29 Oct 2015|Two hands working can do more than a thousand clasped in prayer 
11:11 PM - 28 Oct 2015|Be Ready to watch MY #famestar Video at Today 30th OCT Morning 8 AM Download the fame app to watch http dl livfame com social 
7:41 PM - 28 Oct 2015|Crazy Logic LIVE on #fame Watch me LIVE on #Comedy http dl livfame com m CeASOp7G3n pic twitter com gI13HWKdof 
7:36 PM - 28 Oct 2015|crazy logic LIVE on #fame Watch me LIVE on #Comedy http dl livfame com m oEgObSNG3n pic twitter com eVALkqP6IX 
6:42 PM - 28 Oct 2015|Be Ready to watch MY #famestar Video at 29th OCT 8 PM Download the fame app to watch http dl livfame com social 
11:05 AM - 28 Oct 2015|Be Ready to watch MY #famestar Video at Tomorrow 29th OCT 8 AM Download the fame app to watch http dl livfame com social 
5:07 AM - 28 Oct 2015|Book which explain how we people invented the god http goo gl MtGdHP #TheEvolutionOfGods @Evolutionofgods pic twitter com 1lzV8LtMJ2 
5:05 AM - 27 Oct 2015|Travel Experience Golden Temple Coorg http beforeworks com travel-experience-golden-temple-coorg #Travel #Tourism pic twitter com h0SzMUO3A5 
3:01 AM - 27 Oct 2015|10 Must Have Bihari Dishes To Try Before You Die http goo gl qJhku2 #Bihar #Foodiechats #food pic twitter com tIgXQbTAx5 
10:30 PM - 24 Oct 2015|#MphasisJobs Asset Management Analyst Walkins from 26th Oct-15th Nov 10am-2pm http bit ly AManalyst #Bangalore pic twitter com NQ6LQmTSXO 
5:05 AM - 26 Oct 2015|Monday is a consistent reminder of 'how miserable my life is 
4:23 AM - 26 Oct 2015|Please Retweet What to do During an #earthquake #EarthQuakeInPakistan pic twitter com 9nZ0HgnPJO 
2:49 AM - 26 Oct 2015|#Earthquake Terminology Safety Precautions http goo gl xAT0Br pic twitter com uoPihoVWYk 
2:51 AM - 26 Oct 2015|Massive #earthquake hope you are safe 
2:43 AM - 26 Oct 2015|Chhota Rajan arrested in Indonesia likely to be deported to India 
11:02 PM - 25 Oct 2015|So many products to choose from Loving shopping on #SnapdealFashionMonday @snapdeal 
9:55 PM - 25 Oct 2015|The Complete Guide to New #TwitterPolls What They Are How They Work and 9 Ways to Use Them http b2c news q0Trm4 via @B2Community 
9:14 PM - 24 Oct 2015|#Bollywood Celebrities Who Passed Away in 2015 http goo gl 95zKoI pic twitter com 2i7OaopVwq 
4:16 AM - 24 Oct 2015|Top 10 Social Media Tips to Build Your Blog http beforeworks com top-10-social-media-tips-to-build-your-blog via @beforeworks 
3:50 AM - 24 Oct 2015|Thought for the day Time Health and Relationships These 3 things don't come with price tag But we realize their cost When we loose them 
5:21 AM - 15 Oct 2015|Self confidence is a small Lamp in a dark tunnel It does not show everything at once but gives enough light for the next step 
12:01 AM - 24 Oct 2015|The hard reality of life When you need advice everyone is ready to help you But when you need help everyone is ready to advise you 
8:41 AM - 23 Oct 2015|At @BurgerKing Bangalore with friends pic twitter com KbK3BDyo4p 
3:50 AM - 23 Oct 2015|Top 10 Blogging Tips LIVE on #fame Watch me LIVE on #Others http dl livfame com m ml5HPuHiUn pic twitter com zylubZ4HJq 
9:17 PM - 22 Oct 2015|Be Ready to watch MY #famestar Video at Today 4 PM Download the fame app to watch http dl livfame com social 
9:15 AM - 22 Oct 2015|My New #famestar Video Launch Will be Tomorrow at 4 PM On Blogging Tips Download the fame app to watch http dl livfame com social 
7:17 AM - 22 Oct 2015|My New #famestar Video Launch Will be Tomorrow 23th Oct at 4 PM Download the fame app to watch http dl livfame com social 
10:22 PM - 21 Oct 2015|Learn To Fight For Good Cause #happydussehra pic twitter com w4kS8XQSJL 
7:33 AM - 21 Oct 2015|Selfie with friend I #DonateaSelfie to friendship @videowalebaba Get your ZenfoneSelfie at http bit ly DonateaSelfie pic twitter com YwHP8C4AMH 
8:25 PM - 21 Oct 2015|#happydussehra everyone @dEeYaJ12 @Deepakpal @snehakanchan @videowalebaba @anujprajapati11 pic twitter com ymkediqkde 
5:53 AM - 21 Oct 2015|Gr8 initiative by @GoodDayCookies make adults smile like children https www youtube com watch v -dx5HD4P9go #SmileForAGoodDay @rulerofmind 
8:31 AM - 21 Oct 2015|Upper Cast - Lower Cast North Indians - South Indians Hindu - Muslim Bhakt - Aaptard Welcome to India #IHatePoliticians 
6:52 AM - 21 Oct 2015|Vote For me http blogistan in default aspx 
3:01 AM - 21 Oct 2015|I Love clicking selfies with it #DonateaSelfie @ASUSIndia Donate to someone you love https youtu be b3GtrayzDR4 pic twitter com sZAPPVksFZ 
2:42 AM - 21 Oct 2015|32 Free WordPress Themes For Effective Content Marketing http neilpatel com 2015 09 03 32-free-wordpress-themes-for-effective-content-marketing via @neilpatel likes AMPLE @anujprajapati11 
1:52 AM - 21 Oct 2015|Love the way you make this Video @ASUSIndia #DonateaSelfie https youtu be b3GtrayzDR4 
11:08 PM - 20 Oct 2015|Hey @priyasharma108 Check this Video Its Pretty Cool https youtu be b3GtrayzDR4 
9:49 PM - 20 Oct 2015|I am using ASUS ZenFone Selfie I Love clicking selfies with it #DonateaSelfie @ASUSIndia Donate to someone you love https youtu be b3GtrayzDR4 
4:16 PM - 20 Oct 2015|Here are some interesting strategies to boost your social media performance https twitter com anujprajapati11 status 654988161806766080 
10:46 AM - 20 Oct 2015|I am using ASUS ZenFone Selfie I Love clicking selfies with it y #DonateaSelfie @ASUSIndia https youtu be b3GtrayzDR4 
9:42 AM - 20 Oct 2015|Really A Best Video Loved the way #DonateaSelfie celebrated https youtu be b3GtrayzDR4 
5:20 AM - 20 Oct 2015|#ThankYouSehwag for memories pic twitter com FsylOMvjVY 
4:49 AM - 20 Oct 2015|I #DonateaSelfie to peace and love Get your Zenfone Selfie at http goo gl nIEY @ASUSIndia pic twitter com tUGivVwNCT 
3:30 AM - 20 Oct 2015|Last but the most important question - Q6 How can we make time to follow your #passions #PassionatelyMe @MphasisCareers 
2:55 AM - 20 Oct 2015|Q2 Is having a passion in life important why so #PassionatelyMe @MphasisCareers 
3:02 AM - 20 Oct 2015|@anujprajapati11 What do you think you must do to become famous 
2:33 AM - 20 Oct 2015|If your ready for the Chai time #Chat here goes Q1 What are the passions in your life #PassionatelyMe @MphasisCareers 
2:50 AM - 20 Oct 2015|Money can buy Everything https twitter com anujprajapati11 status 656406423467790336 
4:37 AM - 19 Oct 2015|Chai time session on 'Passions of your life' tomorrow from 3-4 pm Be there to chat and answer few questions pic twitter com yrZ43NnK9z 
1:25 AM - 20 Oct 2015|4 Methods To Get More Blog Traffic From Twitter - @ProBlogger http www problogger net archives 2015 10 15 4-methods-to-get-more-blog-traffic-from-twitter utm_source sumome utm_medium twitter utm_campaign sumome_share via @anujprajapati11 
2:47 AM - 19 Oct 2015|#SEO Google Panda d High Risk of Using Aggressive or Deceptive Advertising by @glenngabe http goo gl cbI4Oo pic twitter com kw8ud86vAG 
11:46 PM - 18 Oct 2015|Get a chance to win Taj gift vouchers worth Rs 5000 by simply telling us why should #AbsolutIndia roll to your city first Get going 
11:49 PM - 18 Oct 2015|Don't forget to mention #AbsolutIndia #Absolut city name in your tweet Get going people 
12:05 AM - 19 Oct 2015|We are the tech capital Come and experience all the tech here #AbsolutBangaluru #AbsolutIndia 
11:43 PM - 18 Oct 2015|Number of Dot balls has been bowled are almost equal to 27 overs by South African bowlers Time to replace raina by Yuvraj Singh I guess 
10:44 PM - 18 Oct 2015|I will Respect Indian Politician Only When their Son or Daughter will ready to Join Army instead of politics 
10:35 PM - 18 Oct 2015|Shiv Sena are very active against Pakistan Dear modi Ji please send them on Border for a month #BCCI #mondaymotivation 
7:41 PM - 17 Oct 2015|My New #famestar Video Launch Will be Tomorrow 18th Oct at 4 PM Download the fame app to watch http dl livfame com social 
8:34 AM - 17 Oct 2015|Hello Friends My New #famestar Video Launch Will be Tomorrow 18th Oct at 4 PM On Pyar Ka Panchnama 2 Movie review http dl livfame com social 
7:32 AM - 17 Oct 2015|Hello Friends My New #famestar Video Launch Will be Tomorrow 18th Oct at 4 PM http dl livfame com social 
11:21 AM - 5 Aug 2015|Calling all #SocialRecruiters to Join #RecruitersChat to talk about your #SocialMedia worth Please RT https goo gl ojZ66d 
