12:31 PM - 11 Dec 2015|FashNerd Can The Apple Watch 2 Make The IPhone Obsolete http bit ly AppleWATCH2 #WearableTech #Wearables pic twitter com 91v2TJOTza|17|6
9:54 AM - 11 Dec 2015|Let's Add Some More Eco WearableTech Egosystem http bit ly SubscribeGo We Are YOUR Future #Wearables #IoT pic twitter com wv5o8AXYk9|21|9
11:51 AM - 10 Dec 2015|FashNerd All About Merging Fashion Technology Through INsight http 10ng co INsights #FashionTech #FashTech pic twitter com Mrq4cYDIPE|6|11
10:30 AM - 9 Dec 2015|Secretive Augmented Reality Startup @MagicLeap Raising 827 Million http 10ng co 1NMzBLr #WearableTech #Wearables pic twitter com 2KC7aFnKiV|21|14
9:42 AM - 10 Dec 2015|FashNerd The Rise Hearables Will Ignite New Era Fashion http bit ly HearableTech #WearableTech #Wearables pic twitter com plRQvpbDcQ|11|10
4:00 AM - 10 Dec 2015|25 Fashionable Tech Gifts Add Your Holiday Wish List Now http 10ng co TheGuide15 #WearableTech #Wearables pic twitter com 1Bc4mtdcs0|25|15
12:13 PM - 9 Dec 2015|FashNerd The Ultimate GiftGuide Any FashionTech Lover http 10ng co TheGuide15 #FashTech #Wearables #XmasGift pic twitter com Oyu5BVbo1x|15|12
6:57 AM - 9 Dec 2015|Did You Miss #TCDisrupt We Got You Covered http 10ng co TECHcrunch #InternetOfThings #FashionTech #Wearables pic twitter com AX8hY9nwjR|15|11
12:57 AM - 9 Dec 2015|3 Challenges For The Hearables Future http 10ng co 1IE53j1 #HearableTech #Wearables #WearableTech @wearableGuru pic twitter com TIAVnj9lHd|22|12
2:50 PM - 8 Dec 2015|Day2 Discovering #TCDisrupt #StartUpAlley http 10ng co TCdisrupt2 @TUIM_fashtech @UpRightPose @NeuroonMask @Hamwells pic twitter com CFC6JuKm5v|10|14
10:50 PM - 7 Dec 2015|We looking forward day 2 #TCDisrupt meeting #StartUps #StartUpAlley @TUIM_fashtech @imogenheap pic twitter com BHLeOO32f9|3|7
4:35 AM - 7 Dec 2015|FashNerd http bit ly KISSYour Purse Goodbye Apple Watch A Straight Success #WearableTech #Wearables pic twitter com 6UdpCfXPxW|12|13
7:53 AM - 8 Dec 2015|FashNerd DAY 1 #TCDisrupt In The Eye Of The Tech Storm http 10ng co TCdisrupt1 #FashionTech #FashTech pic twitter com QFR3EEvilC|7|9
7:30 AM - 8 Dec 2015|FashNerd Not #TCDisrupt We Got You Covered http 10ng co TCdisrupt1 #WearableTech #LifeStyleTech pic twitter com L0YoK67okp|7|5
6:19 AM - 8 Dec 2015|FashNerd Watching @Blippar #TCDisrupt stage @TechCrunch Want Know More http 10ng co ARblippar #AR #Apps pic twitter com 2paALP39jV|10|9
3:10 AM - 8 Dec 2015|#TCDisrupt Finalists Startup Battlefield @Jukedeck @YOOBIC @Lystable @MAXDeliveryNG @TechCrunch Good stuff pic twitter com Ejv4cZb6Oc|12|20
11:42 PM - 7 Dec 2015|#TCDisrupt Meet @OllyRobot He Been Programmed get Know YOU http 10ng co TCdisrupt1#SmartHome #InternetOfThings pic twitter com VOITG2vSQ8|19|19
10:31 PM - 7 Dec 2015|FashNerd DAY 1 #TCDisrupt In The Eye Of The Tech Storm http 10ng co TCdisrupt1 @farfetch @Snapfashion @TechCrunch pic twitter com ITFSTbp9yl|4|7
9:57 AM - 7 Dec 2015|LIVE #Periscope Thierry Henry Tech Investor takes stage #TCDisrupt https www periscope tv w aTW__zUzNTUyMXwxWmtLendiVm9Odkd2Lg3AnNPSLUds1Zi8GoUmTV2Ag0ktMytUR3rjVap7HZY|10|3
8:15 AM - 7 Dec 2015|FashNerd Disrupting Retail Technology And Fashion Technology http 10ng co definetech #FashionTech #RetailTech pic twitter com FoeYTXqUxG|5|8
1:02 AM - 7 Dec 2015|#StartUP #WearableTech #FashionTech #LifeStyleTech Space Lets Meet #TCDisrupt Help us Help YOU @FashNerd pic twitter com 1tf3puHiuE|12|14
3:52 AM - 7 Dec 2015|#FashionTech Representing #RetailTech #TCDisrupt2015 @snapfashion @chicbychoicecom @farfetch @TechCrunch pic twitter com uYxHsyq95L|7|10
8:45 AM - 7 Dec 2015|FashNerd The Death Of The Standalone Activity Tracker http 10ng co ATrackers #WearableTech #Wearables pic twitter com DRd9ECvci9|14|11
8:37 AM - 7 Dec 2015|The StartUp Battlefield Gets Some Cool Stage #TCDisrupt Rock @JukeDeck @TechCrunch #Muscians #AI #Tech pic twitter com Dwe6utEood|11|11
7:41 AM - 7 Dec 2015|#SmartHome Remote StartUp @seven_hugs picking gloves #TCDisrupt Battlefield @TechCrunch #homeautomation pic twitter com 9rFYegAp0f|12|15
6:48 AM - 7 Dec 2015|It's @VeyoCare Battlefield #TCDisrupt #Caretaking 2 0 Home Healthcare Tomorrow #digitalhealth #mHealth pic twitter com DoPQskIKMR|4|4
3:33 AM - 7 Dec 2015|On stage Jenny Griffiths @SnapFashion @filipacneto @chicbychoicecom @Farfetch_jose @farfetch #TCDisrupt pic twitter com 23wZwdBndE|5|10
2:44 AM - 7 Dec 2015|Any security privacy startups working #digitalhealth #mHealth present #TCDisrupt Get touch pic twitter com WkSlO20OOr|7|4
3:42 AM - 7 Dec 2015|94 #luxury goods still sold brick mortar stores Says @farfetch_jose @farfetch #TCDisrupt #FashionTech pic twitter com lA92Y8fFhF|10|12
4:12 AM - 7 Dec 2015|Don't miss meeting @FashNerd #TCDisrupt #LifeStyleTech #StartUps #LondonDisrupt pic twitter com dkw9P9zLKE|4|8
12:04 AM - 5 Dec 2015|The Best GiftGuide Line Up The Fashion-Forward Techie http 10ng co TheGuide15 #WearableTech #Wearables #XmasTech pic twitter com nlvVZCzZog|21|27
10:37 PM - 6 Dec 2015|Should Worried Homes Soon Smarter Than us http 10ng co 1Nd2jWu #SmartHome #IoT #InternetOfThings pic twitter com SOYwmRHKdy|9|9
12:52 AM - 7 Dec 2015|#StartUP #WearableTech #FashionTech #LifeStyleTech Space Lets Meet #TCDisrupt Help us Help YOU @FashNerd pic twitter com o0QrPukJ6I|12|10
11:58 PM - 6 Dec 2015|FashNerd Disrupting Fashion Technology Retail Technology http 10ng co definetech #FashionTech #RetailTech pic twitter com HuJuQMfPXy|5|8
10:02 PM - 6 Dec 2015|Merging Tech Which Can Change Yearly Basis w Long Lasting Jewellery THE Challenge Hand #WearableTech pic twitter com 7KzDwxbdbB|7|5
11:52 PM - 6 Dec 2015|We Ready Bring Some Fashion Tech-centered #TCDisrupt Today #London Feel Free #AskFashNerd pic twitter com wMpC4JeXly|14|3
12:12 AM - 7 Dec 2015|Are Talking About Clothes Digital Skin http 10ng co 1LWofU2 -Future Fashion WearableTech @innovateuk pic twitter com GPfvyIHZlK|28|25
7:55 AM - 6 Dec 2015|FashNerd Disrupting Retail Technology Fashion Technology http 10ng co definetech #FashionTech #RetailTech pic twitter com 0T6dGwQEsx|19|21
6:24 AM - 6 Dec 2015|FashNerd Not able attend @TechCrunch #TCDisrupt We Got You Covered http bit ly RSVPnews #FashionTech pic twitter com DpSIqvVwia|7|13
7:17 AM - 4 Dec 2015|Wearables Are Booming But Anyone Still Wearing Them http 10ng co 1NLGQJW #WearableTech #Wearables pic twitter com wdcx8bkFM5|21|14
10:06 PM - 4 Dec 2015|Jawbone's @YvesB har Tech Can Save Us Our Screenshttp 10ng co 1RuZPId #WearableTech #Wearables @VanityFair pic twitter com 3fNhz66MX6|8|8
11:07 AM - 4 Dec 2015|I Am Loving #TCDisrupt App Download Connect http bit ly RSVPNews @TechCrunch #TechEvents #Startup pic twitter com qX9FBOjUo1|2|4
11:05 PM - 3 Dec 2015|FashNerd Holiday Gift Guide 2015 #FashionTech #Wearables #SmartJewelry More http 10ng co TheGuide15 pic twitter com 8o2DhcP2tn|13|12
11:20 AM - 3 Dec 2015|Innovation Close d Never http FashNerd com #FashionTech #IoT #Insights #StylingTech #Wearables #TechNews pic twitter com hpkUQMQt3W|5|4
2:04 AM - 3 Dec 2015|We Are Ready go Mi Mu Over @ImogenHeap #TCDisrupt London http 10ng co MiMuGloves #AskFashNerd @TechCrunch pic twitter com eY5BbCkxvU|5|32
10:09 PM - 2 Dec 2015|The 1st Step Beyond Wearables Skin Deep Wireless Sensors http 10ng co 1XAItP7 #WearableTech #WearableTechnology pic twitter com W50vvoVJoa|45|35
1:49 PM - 2 Dec 2015|FashNerd @Misfit Shine 2 Fashionably Control Your SmartHome http bit ly MisfitSHINE2 #WearableTech #Wearables pic twitter com oxLrElrjkl|23|19
9:18 AM - 2 Dec 2015|WearableTechStylist Exudes Confidence That Speaks To Women http bit ly WTechStylist #WearableTech #Wearables pic twitter com 8oa8bYUrpb|15|16
10:18 AM - 2 Dec 2015|If Fashion Won Come Wearables WearableTech Must Come Fashion' http bit ly PGenesis #FashionTech pic twitter com YdCsYpg73L|10|9
6:05 AM - 2 Dec 2015|The Death Of The Standalone Activity Tracker http 10ng co ATrackers #WearableTech #Wearables #FitnessMotivation pic twitter com gFZsbiueZ1|28|16
3:31 AM - 2 Dec 2015|Are Consumer Wearables Running Wall http bit ly ConsDem #WearableTech #DesignThinking pic twitter com B2tgNOZvbE|18|19
9:41 AM - 1 Dec 2015|FashNerd Maxi Trend Styled With Normal @TheSmartbag 2 0 http 10ng co TechBAG Shop style @_ClothingLounge pic twitter com LymhwbzrZn|16|11
12:21 AM - 1 Dec 2015|FashNerd http bit ly UPgradeYour Favorite Watch SmartWatch #WearableTech #Wearables @WearChronos pic twitter com fRL9Ft8qW1|23|19
6:47 AM - 1 Dec 2015|FashNerd Click Some Style Your Kicks http 10ng co Shiftwear #FashionTech #SneakerTech @ShiftWear pic twitter com HXAm1Ou2mN|27|26
12:01 AM - 1 Dec 2015|Our Healthcare Needs WearableTech Guardians Gadgets http 10ng co 1IlprW7 #Wearables #DigitalHealth pic twitter com 85SCyNrxcT|40|20
9:50 PM - 30 Nov 2015|FashNerd Will The Term WearableTech Soon Become Obsolete http ow ly V8sq7 #Wearables #WearableTechnology pic twitter com Bn1MIbQCiU|21|4
8:01 AM - 30 Nov 2015|The Rise Hearables Will Ignite New Era Fashion http bit ly HearableTech #WearableTech #Wearables pic twitter com sFgTiCnzpz|44|31
5:35 AM - 30 Nov 2015|Overburdened System Yet Another Obstacle To Getting #Wearables To Those In Need @JennElias6 http 10ng co 21oAXGH pic twitter com E8A4NinGMJ|11|10
1:10 AM - 30 Nov 2015|The Body Next Digital Platform http 10ng co 1lpmOrQ #3DBodyModeling #FashionTech @BodyLabsInc pic twitter com hCTlG9ppLp|18|18
10:14 AM - 29 Nov 2015|Don't Believe Hype WearableTech Little More Than Novelty far http 10ng co 1Nh0Bma #Wearables pic twitter com jwhjBfA8HO|26|13
10:05 PM - 29 Nov 2015|FashNerd Can Apple Watch 2 Make iPhone Obsolete #WearableTech #Wearables http ow ly V8nov pic twitter com dUtdS9zhFU|10|14
10:49 PM - 29 Nov 2015|New @Google Glass Device Could Resemble A Monocle http 10ng co 1l1s5WQ #Wearables #WearableTech pic twitter com yr3F6Prbs4|22|13
1:35 PM - 29 Nov 2015|Hoko A Wearable Without The Bells Whistles http 10ng co HokoTech #BabyTech #Wearable #StylingTech #Hoko pic twitter com tZI2t2Nk9k|13|8
12:03 PM - 29 Nov 2015|The Death Of The Standalone Activity Tracker http 10ng co ATrackers #WearableTech #Wearables @Novealthy @FashNerd pic twitter com mmoEuaUOIB|32|25
10:23 AM - 29 Nov 2015|#SundayViewing Blurring The Lines Between Fashion Art http 10ng co irisVH #IrisVanHerpen #FashionTech pic twitter com XDTQwOIGbr|8|9
11:34 AM - 28 Nov 2015|FashNerd The Fitbit Band More Brains Than Beauty http 10ng co fitbitFLEX #FitnessTracker #Wearables #Review #Tech pic twitter com 7qhg6f7D2g|15|15
6:54 AM - 28 Nov 2015|Time For Weekend Catch Up With Whats HOT http FashNerd com #FashionTech #Collaborations #StartUps pic twitter com glOJxEzuFz|5|10
10:40 PM - 25 Nov 2015|Fashion DigitalHealth Collide At Internet Of Things http bit ly IoTFash #IoT #Wearables #WearableTech pic twitter com a4rZ5yNj2P|15|10
9:42 AM - 26 Nov 2015|Will Apple Putting Ring http bit ly AppleRing #WearableTech #Wearables #iRing pic twitter com rbAEtEoV40|37|19
12:36 AM - 27 Nov 2015|HeadTracker Knows What You re Doing Helps Multitasking http 10ng co HeadTracker #WearableTech #Wearables @sinzianam pic twitter com hEkyYusXnY|10|11
8:17 AM - 27 Nov 2015|FashNerd @CATClutch This Season's Conversation Starter http 10ng co CATLED #FashionTech #Startup #LED #Clutch pic twitter com QgSZpaWxi7|15|19
12:49 AM - 27 Nov 2015|Wearables Carrying Cortana Making @Microsoft http bit ly HearableTech #Wearables #ArtificialIntelligence pic twitter com 1zF1H9NQNQ|10|21
1:04 AM - 27 Nov 2015|WearableTech Devices Our Portal Control Internet Things http bit ly IoTFash #WearableTech #Wearables pic twitter com BY0fSU1T1T|29|28
11:07 PM - 26 Nov 2015|FashNerd StartUPs We Championed Where Are They Now http 10ng co STARTuP @Unaliwear @RideonVision @Kickstarter pic twitter com b3Lnk0tc7d|16|28
12:55 PM - 25 Nov 2015|Thanks @FashNerd awesome article We appreciate support Read http bit ly BionicNerd|4|6
2:16 PM - 25 Nov 2015|FashNerd Hearables No Longer Whispering Wearables http bit ly HearableTech #WearableTech #FashTech #FashionTech pic twitter com j7oDCyGoWZ|5|9
4:45 AM - 26 Nov 2015|The #WearableTechStylist Exudes Confidence That Speaks To Women http 10ng co StylingTECH #FashionTech #StylingTech pic twitter com LlYvFU7kwJ|11|10
8:38 AM - 25 Nov 2015|FashNerd FashionTech Collab Aims To Save Our Oceans http 10ng co BionicYARN #FashionTech @GStarRAW @BionicYarn pic twitter com WQvwUpIYNt|32|49
5:28 AM - 25 Nov 2015|#StartUPs #WearableTech #FashionTech #Hardware #MakersSpace Lets Meet #TCDisrupt Help us Help YOU #StartUp pic twitter com L3Z71TRmlr|13|34
2:05 AM - 25 Nov 2015|FashNerd The Death Of The Standalone Activity Tracker http 10ng co ATrackers #WearableTech #Wearables pic twitter com X0t4G4HEjn|9|8
11:25 PM - 24 Nov 2015|WearableTech Can Help Save Senior's Life @SheynaSteiner http 10ng co 1lJ0oSG #Wearables #DigitalHealth pic twitter com RQBvUJrT5y|24|20
11:38 PM - 24 Nov 2015|#WearTechStylist Styling Iris van Herpen Crystallization Dress http bit ly TheEdit7 @LauraLeeJewel @BiondaCastana pic twitter com XycShddAKo|9|8
10:45 PM - 24 Nov 2015|If Fashion Won Come Wearables WearableTech Must Come Fashion http bit ly PGenesis @DragonAlliance pic twitter com 945FAKlwXq|13|13
12:46 PM - 23 Nov 2015|Wearables Carrying Cortana Making @Microsoft http bit ly HearableTech #WearableTech #ArtificialIntelligence pic twitter com amYJxnaUVC|10|12
10:50 PM - 23 Nov 2015|Biometric Tattoos Explored @ChaoticMoon For Medicine Military http 10ng co TechTats #WearableTech #Wearables pic twitter com mLgLdHd57M|35|24
9:08 PM - 24 Nov 2015|Customizable Watch Faces New Maintenance Release @Huawei Watch http bit ly HuaweiOct15 #WearableTech #Wearables pic twitter com NeGozYRA8K|11|8
10:41 PM - 23 Nov 2015|3Dprinting 4DPrinting http 10ng co 1N5j1WS Will Allow Clothing Consumer Products Think For Us #FashionTech pic twitter com 8Bjrn4vYvV|15|19
11:03 PM - 23 Nov 2015|As Technology Advances Shrinks Demand Performance Body Will Grow http 10ng co ATrackers #Wearables pic twitter com PkZekWGC5Q|43|40
10:29 PM - 23 Nov 2015|Introducing http 10ng co 1SYyQD9 New @RebeccaMinkoff x @NormalEars #3Dprinted Rose Gold Earbuds #FashionTech pic twitter com niNeTgbZNZ|18|10
9:22 AM - 23 Nov 2015|The Death Of The Standalone Activity Tracker http 10ng co ATrackers #WearableTech #Wearables #FitnessMotivation pic twitter com NDjoGDDTB1|29|23
7:10 AM - 23 Nov 2015|FashNerd The Features Stacked Up @Plantronics Backbeat Sense http 10ng co TheGuide15 #GiftGuide #Hearables pic twitter com NhqRvmsxhF|8|11
4:49 AM - 23 Nov 2015|Writing Tech Startups Where Are They Now Any consumers experience @MyBranto @Pebble #journorequest pic twitter com 0zsltSCrz7|5|7
2:46 AM - 23 Nov 2015|FashNerd Neyya A Smart Ring To Rule Them All http 10ng co NeyyaRing #WearableTech #Wearables @MyNeyya pic twitter com 48wqo73lit|13|13
2:12 AM - 17 Nov 2015|#rawfortheoceans repurposes approx 700 000 PET plastic bottles season http goo gl NHMdnT @bionicyarn pic twitter com WyqnqGawvC|11|12
11:13 PM - 22 Nov 2015|#WomenInTech Together We Can Change The Ratio http 10ng co 1N7UDs4 @SURGEConfHQ Defining Ecosystem pic twitter com SR0gxl58uj|11|11
10:41 PM - 22 Nov 2015|It Day 1 For The Gestures Defining Apple Watch http bit ly APPleLove #WearableTech #Wearables pic twitter com ifsmOKn4om|28|21
4:39 AM - 17 Nov 2015|FashNerd The Rise Hearables Will Ignite New Era Fashion http bit ly HearableTech #WearableTech #Wearables pic twitter com NmkieruqFx|21|18
4:05 AM - 16 Nov 2015|Hearables No Longer Whispering Wearables - http ow ly UGZBW via @FASHNERD #FashionTech #Wearables pic twitter com 479GuoOnnu|10|8
9:56 AM - 21 Nov 2015|FashNerd @Samsung Gear S2 Competes Your Wrist http bit ly SGEARS2 #WearableTech #Wearables pic twitter com 1fwTERjHkD|15|15
8:37 AM - 21 Nov 2015|Get Your Periodic Table Of WearableTechnology http bit ly 1GgHMip #Wearables #WearableTech #BYOD @APXLabs pic twitter com uoYvmvf0Ov|22|15
12:32 PM - 20 Nov 2015|FashNerd LG Urbane 2nd Edition Pulled From Stores http bit ly 1zHuyEP #WearableTech #Wearables pic twitter com s5gM3V1ZA2|11|18
10:49 AM - 20 Nov 2015|FashNerd Caeden Bridging Design Software Engineering Fashion http 10ng co CAEDEN @CaedenOfficial #FashTech pic twitter com CRtZ8z0D9T|18|20
3:02 PM - 16 Nov 2015|infinity pic twitter com AggB67sADC|4K|3.5K
10:59 AM - 19 Nov 2015|FashNerd #TechThatPhoto All About Artistic Creation http bit ly TechThat #FashionTech #DigitalArt #Innovation pic twitter com z29qNSyRvZ|7|8
11:58 PM - 18 Nov 2015|Wearables Carrying Cortana Making @Microsoft http bit ly HearableTech #Wearables #WearableTech #AI pic twitter com HT6kfc5xyB|13|14
9:28 AM - 19 Nov 2015|New #StarWars #TheForceAwakens trailer shows Finn action lightsaber-proof weapons http pops ci fL3YR5 pic twitter com 4QXwUQVxCa|45|50
7:28 AM - 19 Nov 2015|Read About http bit ly WhatsHOT This Week http FashNerd com #Wearables #mHealth #InternetOfThings pic twitter com zEIsQwQZ5O|8|11
10:15 AM - 19 Nov 2015|Which 'Tech The City' Rocks Your Style http 10ng co TheGuide15 @BaubleBar @EnkoShoes @ouraring #HolidayGiftGuide pic twitter com amn9hPe6bW|17|18
2:38 AM - 19 Nov 2015|Stylish Breathing Masks That Actually Protect You From Pollution http 10ng co 1Ndpa9Q #FashionTech #Environment pic twitter com doBSaOnreC|26|22
3:07 PM - 17 Nov 2015|Read About http bit ly WhatsHOT This Week http FashNerd com #Hearables #DigitalHealth #SmartHome pic twitter com TNREDtSiaw|13|10
9:44 AM - 18 Nov 2015|Wearables today missing lot none may important community-based approach http onforb es 1Od2vHO|3|0
2:15 PM - 18 Nov 2015|FashNerd The Guide Tech The City http 10ng co GIFTGuide15 #GiftGuide #HolidayGiftGuide #FashionTech #XmasGifts pic twitter com WwSMeU0NyG|50|68
10:53 PM - 18 Nov 2015|MIT Develops WearableTech Device You Can Swallow http 10ng co InGestables #WearableTech #Wearables #Research pic twitter com 8IthktLe3g|34|22
12:15 PM - 18 Nov 2015|The Rise Hearables Will Ignite New Era Fashion http bit ly HearableTech #WearableTech #Wearables pic twitter com sFgTiCnzpz|31|28
1:09 AM - 18 Nov 2015|The Best Headphones For Earrings Glasses Makeup-Wearers http 10ng co 1SCKDXC #FashionTech #Hearables pic twitter com 88nkcDGZdc|14|22
12:01 AM - 18 Nov 2015|FashNerd All About Merging Fashion Technology Through Insight http 10ng co INsights #FashionTech #FashTech pic twitter com XOJ4xqUp7O|12|11
10:44 PM - 16 Nov 2015|New Google Glass 2 Models Screen Screenless http bit ly GoogleJoke #WearableTech #Wearables pic twitter com 6JObwMdQai|32|22
1:37 PM - 17 Nov 2015|Have You Found Your Killer Device Yet http bit ly SubscribeGo We'll Notify You When We Launch #WearableTech pic twitter com TcPQlBfqtH|7|5
12:28 AM - 18 Nov 2015|How To Get Kids To Turn The Volume Down And Save Their Ears http 10ng co 1QtNeWk #Wearables #Hearables pic twitter com AnlctBeZiV|14|11
12:19 AM - 18 Nov 2015|Let's Put Face http FashNerd com 's #WearableTech Stylist http bit ly WTechStylist #FashionTech #Wearables pic twitter com iXF9kyoJQO|12|10
11:49 PM - 17 Nov 2015|It Was @Microsoft That Created First Real Life Dick-Tracy Watch http 10ng co WristPDA #WearableTech #Wearables pic twitter com CFyPrRl2Xv|35|30
1:34 PM - 17 Nov 2015|The Neyya SmartRing Objective Your Digital Companion http 10ng co NeyyaRing #FashionableTech #SmartJewelry pic twitter com npbuTv5ujE|18|19
11:00 AM - 17 Nov 2015|What happens @MarsCuriosity find life Mars http pops ci CMVU75 pic twitter com fuOwuNuVEW|45|68
10:36 AM - 17 Nov 2015|Faurecia self-driving car seat knows need massage http bit ly 1OdN0PS pic twitter com okRdtHydnK|71|83
9:50 AM - 17 Nov 2015|Neyya A Smart Ring To Rule Them All @Mano10Napel http 10ng co NeyyaRing #WearableTech #Wearables @MyNeyya pic twitter com 0J8ner1Jyn|25|26
7:45 AM - 17 Nov 2015|Nothing like little #aurora get things started Good morning @space_station #YearInSpace pic twitter com xMDGoWqXoy|4.1K|7.6K
3:03 AM - 16 Nov 2015|FashNerd Wearable Haute Couture Appreciation Of Unconventional Craftsmanship http 10ng co WTcouture #FashionTech pic twitter com oMJJCYVAU0|28|33
10:55 PM - 15 Nov 2015|LG's Wearable Taking Calls Without Your Smartphone http bit ly 1zHuyEP #WearableTech #Wearables @LGUS pic twitter com U4IhgUCF02|25|16
9:31 PM - 15 Nov 2015|#InternetofThings Predictions 'Pie Sky' 'Unrealistic' http 10ng co 1HNXpSN #IoT #IoE pic twitter com zjDYP1M5ow|34|17
3:47 PM - 14 Nov 2015|If Fashion Won Come Wearables WearableTech Must Come Fashion http bit ly PGenesis @MarchonEyewear pic twitter com 6tdLSDfCJk|10|13
3:22 PM - 14 Nov 2015|Catchup With Week's Headliners http bit ly HeaDLines #FossilMisfit #TagHeuer #Revols #JamesBond #FashionTech pic twitter com CGQO667jFB|3|6
3:25 AM - 14 Nov 2015|Fossil Has Been Pioneering Wearables Since 1999 http 10ng co WristPDA #WearableTech #Wearables @Fossil @SonnyVu pic twitter com ncW4aMW6GS|36|27
11:22 PM - 13 Nov 2015|FashNerd Can The Apple Watch 2 Make The IPhone Obsolete http bit ly AppleWATCH2 #WearableTech #Wearables pic twitter com hp5W4FmQOl|24|26
11:57 PM - 13 Nov 2015|The Future Wearable Tech According 1992 http 10ng co MakeZine #Wearables #WearableTech @make pic twitter com U9lNIyKyzC|21|9
4:53 AM - 14 Nov 2015|FashNerd @Misfit Shine 2 Fashionably Control Your SmartHome http bit ly MisfitSHINE2 #WearableTech #Wearables pic twitter com SxeJdSJ7sw|22|10
11:45 PM - 13 Nov 2015|Can Women's Wearables Do More Than Look Pretty http 10ng co 1HPaSo3 #WearableTech #Wearables #FashionableTech pic twitter com diSXAIAhJr|16|15
10:39 PM - 13 Nov 2015|FashNerd Amsterdam FashionTech Capital Europe http bit ly 1LBs7Nb #FashTech #StartUP #Innovation pic twitter com QEY6ssQ3oQ|9|25
