1:26 PM - 19 Aug 2012|SU women's soccer comes back from 2 goals down to win 3-2 A hard fought game but a great way to start the season Congrats Ladies 
12:19 PM - 19 Aug 2012|WSoc Alyscha Mottershead scores with 21 seconds left in the first OT to give SU a 3-2 win against Colgate in its season opener 
5:27 AM - 19 Aug 2012|Today is the day We are announcing the official #JUICEJAM lineup TODAY at 10p m Follow us for official updates 
5:43 PM - 18 Aug 2012|@SyracuseSCPS @UUInsider my money is on this stellar act for Juice Jam http www youtube com watch v oHg5SJYRHA0 
5:33 PM - 18 Aug 2012|Who could it be RT @UUInsider we will be announcing the Juice Jam 2012 co-headliners tomorrow at 10 00 pm Stay tuned #JUICEJAM 
4:50 PM - 18 Aug 2012|Student Lead Training Day 2 complete Here is a highlight from one of our G A 's at the ropes course http fb me 1z5eULcTL 
1:48 PM - 18 Aug 2012|Watch our GA Henoc Free Fall http youtu be 2If8v8Cx8A0 via @youtube 
1:05 PM - 17 Aug 2012|Reminder to all- this Twitter account is NOT a help desk option For legit problems requests call 2677 LB 
7:31 AM - 17 Aug 2012|Daily Orange-Free Advertising https orgsync com 10755 events 284211 via @OrgSync 
7:21 AM - 17 Aug 2012|Pulse Presents Jennifer Holliday https orgsync com 10755 events 396402 via @OrgSync 
7:16 AM - 17 Aug 2012|Pulse Presents River North Dance Chicago https orgsync com 10755 events 396388 via @OrgSync 
7:36 AM - 17 Aug 2012|Can't wait to be back with @SyracuseSCPS today 
6:30 AM - 17 Aug 2012|How funny are my co-workers -_- #sufarewelltour http instagr am p OblB2TMZGc 
2:16 PM - 16 Aug 2012|Apparently I don't know my own strength #SuFarewelltour @ Schine Student Center http instagr am p OZ1lypsZMf 
12:04 PM - 16 Aug 2012|Counting down the days to you all get here 
8:37 AM - 16 Aug 2012|My certificate for my 10 years of service to @SyracuseU @latinegro said this officially makes me old #ibleedorange pic twitter com Psc2HlFV 
6:12 AM - 16 Aug 2012|FOUR DAYS TILL CUSE Ahhh 
5:57 AM - 16 Aug 2012|Last Division of Student Affairs Breakfast @ Goldstein Auditorium w @davepennock http 4sq com N2wCpL 
4:57 AM - 16 Aug 2012|Division of Student Affairs annual breakfast this morning #SummerIsOver 
8:20 PM - 15 Aug 2012|Ask @SU_ITS RT @lhdumitru Why can't I add my Syracuse email account to my iPad Server What server 
8:19 PM - 15 Aug 2012|I know right RT @OReally_ @Latinegro How you ditch Cuse like that Smh 
1:25 PM - 15 Aug 2012|Looks like we need another #SafetyCheck from @Panthbro and @Latinegro http lockerz com s 234953995 
6:56 AM - 15 Aug 2012|DanceWorks NYC tickets go on sale today http www danceworksnewyorkcity com tickets Buy your tix only 15 http theregoeskatie com 2012 08 15 danceworks-new-york-city #DWnyc #ThereGoesKatie #LoveNYC 
5:37 AM - 15 Aug 2012|All new first-year students must attend a session of Everyday Heroes on Aug 27 or 28 You must register at http orientation syr edu _forms everyday-heroes-signup php 
3:31 AM - 15 Aug 2012|Today may be the first time in 9 days that #Phoenix will see a high temp below 110 degrees 6 daily record highs set in the last 9 days 
9:00 PM - 14 Aug 2012|Happy Birthday to @Panthbro You getting old man lol 
3:50 PM - 14 Aug 2012|Heavy rain and thunder looking to move into the area @reebokroo called it somehow 
2:00 PM - 14 Aug 2012|Safety Checks Part 4 in the Schine Featuring @latinegro and @panthbro Too bad @BabaloBanks wasn't there http fb me 1VpAiWbmZ 
1:53 PM - 14 Aug 2012|Safety Checks Part 3 in the Schine Featuring @SyracuseOSA @latinegro and @panthbro http fb me 1QFbuvsDv 
1:46 PM - 14 Aug 2012|Safety Checks Part 2 in the Schine Featuring @SyracuseOSA @latinegro and @panthbro http fb me 1CFub4ReJ 
1:34 PM - 14 Aug 2012|Safety Checks in the Schine Featuring @SU_OMA @latinegro and @panthbro http fb me 1eEfZH7tR 
12:55 PM - 14 Aug 2012|I had to check out the new equipment @syracuseSCPS @ Schine Student Center http instagr am p OUiuckMZM9 
9:24 AM - 14 Aug 2012|Parents and incoming Students no need to pack a fan for your Dorm Room We have a wide selection on hand pic twitter com XNTJdBnu 
9:22 AM - 14 Aug 2012|It was great seeing @brenivy back in the @SyracuseSCPS office today 
9:01 AM - 14 Aug 2012|We're going there Saturday @Cuse WSoc SU takes part in team-building exercises at Orenda Springs 
9:01 AM - 14 Aug 2012|We're going there Saturday WSoc SU takes part in team-building exercises at Orenda Springs 
6:14 AM - 14 Aug 2012|The OMA planners are in Stop by our office - Schine 105 - to pick one up pic twitter com 1nOM5kpv 
4:19 PM - 13 Aug 2012|@SyracuseSCPS Right so excited 
4:13 PM - 13 Aug 2012|Oh good orientation is the 21st RT @reebokroo Looks like I'll be back in Syracuse from the 20th-24th The things I do for @karminmusic 
8:13 PM - 11 Aug 2012|Theatre House Management #fail RT @universalhub Be very very careful if you see a show at the Central Square Theater http is gd Oz3nmF 
5:48 PM - 10 Aug 2012|Watching the 10m diving from the #Olympics Ever been in #GoldsteinAuditorium It's the equivalent of jumping out of the catwalks 
10:19 AM - 10 Aug 2012|Save the date- RSO Student Involvement Fair 9 12 reserve your spot now https orgsync com 10755 forms 34740 
10:02 AM - 10 Aug 2012|@scottcasanova called dibs and marked his territory in my office @ Schine Student Center http instagr am p OJ7u_9MZKK 
8:43 AM - 10 Aug 2012|Did you check out our updated website lately http studentactivities syr edu 
7:41 AM - 10 Aug 2012|Orange FanFest is still on It has been moved to inside the Carrier Dome http bit ly S7lBQj 
6:02 AM - 10 Aug 2012|Free cookies at Hendricks take some fresh chocolate chip cookies at the counter of Peoples Place and have a nice day #FreeFood @SyracuseU 
1:44 PM - 9 Aug 2012|USA wins gold 2-1 Go USA 
1:34 PM - 9 Aug 2012|Congrats @ussoccer_wnt #Gold 
9:40 AM - 9 Aug 2012|Something broke Please tell us Would You Know If Your Candy Machine Was Broken Butts In the Seats - http www insidethearts com buttsintheseats 2012 08 07 would-you-know-if-your-candy-machine-was-broken 
8:57 AM - 9 Aug 2012|Becky made a new friend at #GoldsteinStudentCenter @SU_South http lockerz com s 232851950 
3:46 AM - 9 Aug 2012|This is a day when dreams come true Good luck to the USWNT Dare To Dream #GoforGold #USAvJPN 
7:20 PM - 8 Aug 2012|Side Eye to the co-workers already calling dibs on the items in my office 
5:48 PM - 8 Aug 2012|Congratulations to our own @Latinegro on his new position as Reservation Scheduling Manager for @BarnardCollege #AlreadyMissed 
11:27 AM - 8 Aug 2012|It's 90 in #Syracuse making it the 23rd 90 degree day of the year -- average is 7 record is 28 via @PeteWeatherBeat 
11:15 AM - 8 Aug 2012|OCC cashier charged with stealing students' tuition payments http ow ly cPDtt 
9:23 PM - 7 Aug 2012|Two women injured after car crashes into @SyracuseU steps - http bit ly Nc3eey 
5:09 PM - 7 Aug 2012|Have you downloaded your new student move-in pass yet If not do it before Friday at noon http readyset syr edu orientation move-in-pass html 
8:08 AM - 7 Aug 2012|Prospective students there s still time to visit SU this summer Join us for a Summer Campus Day on 8 10 or 8 17 http bit ly qAl5j8 
2:17 PM - 6 Aug 2012|Final form @Trafford_2012 #USWNT 4 @CanadaSoccerEN 3 Morgan's goal in the 123rd minute puts the USA in the Gold Medal Match #London2012 
2:15 PM - 6 Aug 2012|USA looking for one more chance O'Reilly crosses for Morgan She heads it in #USWNT 4 CAN 3 #babyhorse 
2:55 PM - 5 Aug 2012|Better watch out for that wet spot in the elevator #worktweet http lockerz com s 231613248 
10:35 AM - 5 Aug 2012|Volunteers raising money to put markers on graves of former slaves buried in #CNY http ow ly cKiPJ 
5:36 PM - 4 Aug 2012|If your work doesn't make you happy on a daily basis ditch it immediately and find what does There's no better feeling #grateful 
1:41 PM - 4 Aug 2012|Breaking Lollapalooza shut down being evacuated due to impending thunderstorms http tinyurl com ckhgpxn #weightwiresweather 
3:48 PM - 3 Aug 2012|Currently at @destinyusa and there is a lot of spandex @SyracuseSCPS would be proud 
3:52 PM - 2 Aug 2012|#USAbasketball with one of the most incredible performances in hoops anywhere ever #29threes 
3:48 PM - 2 Aug 2012|Carmelo Anthony sets U S men's Olympic record with 37 points http sbn to NWHhPr 
10:57 AM - 2 Aug 2012|I like the @SyracuseSCPS office for many reasons Today I LOVE them because I was jonesing for chocolate they came through with a brownie 
7:20 AM - 2 Aug 2012|@ACUItweets here are our Mity-lite chairs set up They look great #ACUI pic twitter com uaapuLYn 
2:59 AM - 2 Aug 2012|Now Hiring - Storeroom Attendant - Schine Student Center http bit ly QhSRXC 
9:09 AM - 1 Aug 2012|The new student move-in pass system is now open thru August 10th at noon http readyset syr edu orientation move-in-pass html 
9:11 AM - 1 Aug 2012|Our brand-new conference chairs arrived today and this was on the box #GoodSign http lockerz com s 230226664 
6:00 AM - 1 Aug 2012|@NealCasey One step ahead of you - Thank you I want more students to hear about this and voice their opinions too 
5:48 AM - 1 Aug 2012|@SyracuseSCPS Thanks You bet I'll be contacting them - #CUSE #concernedstudent 
5:42 AM - 1 Aug 2012|@SyracuseSCPS Why build only a bookstore I'd rather the funds be used towards a new remodeled student center or even better Nicer dorms - 
5:40 AM - 1 Aug 2012|@SyracuseSCPS Thanks Though I'm all for a new bookstore but this one sounds like it's more off campus which isn't helpful - 
4:19 AM - 1 Aug 2012|Wondering if this is ever getting fixed or if they're just going to leave it until they start building the bookstore http lockerz com s 230157420 
2:35 PM - 31 Jul 2012|Be sure to review the Student Handbook which is your guide to all of the University's rules regulations and policies http syr edu currentstudents studenthandbook index html 
6:54 AM - 31 Jul 2012|18 Days until Student Lead Orientation #schinecamp 
4:19 AM - 31 Jul 2012|#BeenThereDoneThat Locks changed after UK police lose keys to Wembley Stadium http cnn com 2012 07 30 world europe olympics-wembley-stadium-lost-keys index html #cnn 
9:46 PM - 30 Jul 2012|Remember we are the only official source for any #JuiceJam updates Keep your eyes here for upcoming announcements 
6:22 PM - 30 Jul 2012|#random RT @Latinegro wow rain 
4:07 PM - 29 Jul 2012|Another View For more on the Trees Cocooned in Webs After Flood photo http bit ly dQ3mSP pic twitter com XmgD2aXl 
7:32 AM - 29 Jul 2012|16 pt lead at the half not to shabby #TeamUSA #Hoops 
6:32 AM - 29 Jul 2012|We have our first #Boeheim sighting #TeamUSA 
9:48 AM - 28 Jul 2012|Great first half from the US Dominant play 1-0 up but could be more Good job ladies 
5:57 AM - 28 Jul 2012|No way that actually happened RT @KellyLux Wait I m confused Did the Queen ACTUALLY parachute into the stadium 
8:22 PM - 27 Jul 2012|Tragedy ends Opening Ceremony when giant Terry Gilliam animated foot crushes participants athletes #thathappenedright #montypython 
5:59 PM - 26 Jul 2012|Both of our session proposals have been submitted to @ACUIConference Discover how we discovered our discoveries 
3:26 PM - 26 Jul 2012|#CAPSmobile RT @_alyssamckinley Attn Syracuse Anyone available to drive me to le airport tomorrow around 3 
1:22 PM - 26 Jul 2012|#OrangeCentral RT @theryancampbell Never thought I'd be using spandex as a building material #summerstock 
11:12 AM - 26 Jul 2012|Meet the Orange Olympians #SUOlympics #London2012 http bit ly OMrikn 
9:58 AM - 26 Jul 2012|2012 Summer Olympics Orange Fans Keeping Eye On Basketball Field Hockey http sbn to QdzaNb 
7:29 AM - 26 Jul 2012|Lots of severe weather watches and warnings for today Make sure you've got an umbrella and be prepared to take shelter if necessary 
5:43 AM - 26 Jul 2012|Keep an eye on the sky today Cuse Looks like severe thunderstorms are coming our way Nat'l Weather Service says high winds likely 
5:30 AM - 26 Jul 2012|The Arcade Fire reminds me of those early morning admissions receptions @SyracuseU #foreverorange cc @SyracuseSCPS 
5:07 AM - 26 Jul 2012|You're welcome #WeKnow RT @_alyssamckinley Thanks for the ride to work @SyracuseSCPS #youdabest 
10:58 AM - 25 Jul 2012|The @BookstoreSU will close at 3pm for the day 2 2 
10:56 AM - 25 Jul 2012|The power in Schine will be shut down at 3 30pm for roughly 15 minutes Please shut down your computers The building will remain open 1 2 
10:30 AM - 25 Jul 2012|POWER UPDATE Schine will again lose power at 3 30pm this afternoon to accommodate electrical work The outage will last approx 15 mins 
5:22 AM - 25 Jul 2012|We're still expecting a second power outage at or after 3 30p We will try our best to give you as much notice as possible 2 2 
5:21 AM - 25 Jul 2012|Sorry about the second outage folks Physical Plant didn't give us a heads up as promised 1 2 
10:22 AM - 24 Jul 2012|Big thanks to Scott Catucci from Rec Services for helping us learn to throw Boomerangs GO @megtoom http lockerz com s 227926017 
10:09 AM - 24 Jul 2012|Can it get any better RT @tracytilly About to do a presentation that involves a beach ball amp a stuffed elephant #ilovemyjob 
10:09 AM - 24 Jul 2012|Hmmmm where is @kinstersays 
7:27 AM - 24 Jul 2012|In anticipation of the second power outage @BookstoreSU will be closing at 3 00pm tomorrow 
7:26 AM - 24 Jul 2012|There will be a second power outage NO EARLIER than 3 30p WEDNESDAY afternoon We will do our best to let people know when it will be 
7:24 AM - 24 Jul 2012|There will be a brief power outage in Schine WEDNESDAY morning at 6a for approx 15 mins to accommodate some electrical work 
8:31 PM - 23 Jul 2012|Storm coming in http lockerz com s 227763386 
3:40 PM - 23 Jul 2012|If I was emailing somebody about a job I probably wouldn't use the terms hit me up and mah # is but that's just me 
12:53 PM - 23 Jul 2012|Why tweet a link to a non-mobile story RT @syracusedotcom Less is More Remove these from your resume http ow ly crhok #JobAdvice 
8:47 AM - 23 Jul 2012|DanceWorks @NewhouseSU @SyracuseSCPS RT @SyracuseU We d like to hear from our alumni what made SU special for you 
6:10 AM - 23 Jul 2012|RT @ap BREAKING NCAA hits Penn State football with 60 million fine vacates Paterno's wins from 1998-2011 -BW 
5:16 AM - 23 Jul 2012|There will be a brief power outage in Schine WEDNESDAY morning at 6a for approx 15 mins to accommodate some electrical work 
7:47 AM - 22 Jul 2012|New student move-in begins one month from today What are you most excited about #SUWelcome 
9:22 PM - 21 Jul 2012|#OrangeToGold RT @be11ieve boarded the plane to London #olympics2012 
1:59 PM - 20 Jul 2012|Back on RT @CarrierDome44 We are pleased to announce that Zac Brown Band will be rocking the Dome on November 16th 
12:54 PM - 20 Jul 2012|On behalf of the Student Association our hearts go out to @Scubarton Stephen Barton and his friends family http www syracuse com news index ssf 2012 07 syracuse_university_graduate_w html 
11:26 AM - 20 Jul 2012|For those who don't know Stephen Barton was SU's student commencement speaker in May So glad to hear that he will be okay 
11:22 AM - 20 Jul 2012|This brings the Colorado tragedy close to home @SyracuseU grad Stephen Barton wounded in shootings at Batman movie http ow ly co0Uy 
9:46 AM - 20 Jul 2012|#Syracuse police to increase security at Carousel Center theaters after #theatershooting http syracuse com http ow ly cnV4s 
10:15 AM - 20 Jul 2012|Control your air conditioner from your phone http cnnmon ie Nn4YD4 via @CNNMoney 
7:10 AM - 20 Jul 2012|Our thoughts and prayers go out to the victims and families in #Aurora Colorado 
5:45 AM - 20 Jul 2012|July 20 1969 One small step Neil Armstrong 1st man to set foot on the moon 
5:35 AM - 20 Jul 2012|would like to welcome all prospective @SyracuseU students to campus today #SUreception 
7:13 PM - 19 Jul 2012|Dark Knight Rises spoiler Bane is short for Greg Robaneson Explains how the football field implodes 
12:15 PM - 19 Jul 2012|44 days until kick off Get your tickets NOW #orangenation pic twitter com yFX15SQ2 
11:18 AM - 19 Jul 2012|Someone has been playing with our microphones http lockerz com s 226459866 
4:09 AM - 19 Jul 2012|Hoping @kinstersays can work this afternoon - 
2:12 PM - 17 Jul 2012|Once you go ETC you never go back #TechieProblems 
4:25 AM - 18 Jul 2012|Open early for special bookstore hours today Come join us 
10:34 PM - 17 Jul 2012|Why aren't socks called undershoes #unansweredquestions 
8:00 PM - 17 Jul 2012|Thunder in the distance lightning on the horizon #ReliefOnTheWay 
4:47 PM - 17 Jul 2012|The Internet Has Spoken Pitbull Is Headed to Alaska And He's Taking Along the Prankster Who Sent Him There - @Gawker http gawker com 5926746 the-internet-has-spoken-pitbull-is-headed-to-alaska-and-hes-taking-along-the-prankster-who-sent-him-there 
7:49 AM - 17 Jul 2012|In case you were wondering Why We Wear Pants http www businessinsider com why-we-wear-pants-2012-7 
7:26 AM - 17 Jul 2012|Both the Schine and Goldstein student centers will be open till 8pm tonight for relief from the heat #freeairconditioning 
7:24 PM - 16 Jul 2012|Update Zac Brown concert at Carrier Dome 'not set in stone' http ow ly 1lpENN 
2:09 PM - 16 Jul 2012|You know what smells even tastier than the underground The loading dock #rebeccaclosesschine 
1:44 PM - 16 Jul 2012|Always thinking ahead #JUICEJAM pic twitter com jklgwRfi 
9:53 AM - 16 Jul 2012|Thank you SU financial aid for being so nice to me on the phone and giving me my work study back so I can keep my job at @SyracuseSCPS 
8:33 AM - 16 Jul 2012|Syracuse and BIG EAST reach agreement for Orange to move to ACC in 2013 http bit ly MzcMvw 
4:46 AM - 16 Jul 2012|Forecasters differ on just how hot Tuesday will be in Syracuse http syracuse com http ow ly cgigl 
7:01 PM - 15 Jul 2012|#truth RT @Emmendez42 @SyracuseSCPS it gets pretty crazy at those skybarn parties 
6:56 PM - 15 Jul 2012|For all those times it rains in the aud RT @Emmendez42 Hey @SyracuseSCPS can we have #SCPS ponchos 
11:06 AM - 15 Jul 2012|What's wrong with this picture Love that University Ave @syracuseu lol http instagr am p NHGcxesZHs 
9:35 AM - 15 Jul 2012|The spoof the world has been waiting for Thanks @Hen0c Star Wars Call Me Maybe http www youtube com watch v dBM7i84BThE sns tw via @youtube 
7:47 AM - 15 Jul 2012|Everyone has to follow the rules Don't make us do this to you Springsteen encore with McCartney cut short http us cnn com 2012 07 14 showbiz music springsteen-mccartney-power-cut index html 
5:57 PM - 14 Jul 2012|So i guess you're excluding the final poll #ShareTheRules RT @Cuse Winner #CuseTrivia @Andrew_Milner @Cuse #11 
5:55 PM - 14 Jul 2012|Beautiful pic #ProductPlacement RT @LaSongstress To be above the clouds I live life up there #nofilter http instagr am p NFFmtsx6ji 
2:05 PM - 14 Jul 2012|test 
9:55 PM - 13 Jul 2012|The reason safety cables exist Also why no one should use a 12 inch wrench http instagr am p NDG60noAc_ 
5:52 AM - 14 Jul 2012|High drama behind Syracuse council's vote on bookstore tax break http syracuse com http ow ly ceLFJ 
2:07 PM - 13 Jul 2012|Power outage on main campus Traffic lights are out be careful while driving We have officers directing traffic 
1:00 PM - 13 Jul 2012|#IATSE offers to provide U S #Olympic team uniforms http www iatse-intl org news iatse-offers-provide-us-olympic-team-uniforms 
7:30 AM - 13 Jul 2012|Time for an upgrade #NotReally http lockerz com s 224643437 
5:01 PM - 12 Jul 2012|I know it's Act 2 and this is crazy but your light has been on stand in it maybe 
10:52 AM - 12 Jul 2012|We wish Kay Farrell a wonderful retirement She's dedicated many years to SU as Manager of Housekeeping for the FIXit Zone You'll be missed 
7:00 AM - 12 Jul 2012|WICE next RT @Cuse For the first time in program history Orange volleyball will play in the Carrier Dome http bit ly Njz4mx 
6:58 AM - 12 Jul 2012|Great way to start the day RT @reebokroo Star Wars crawl to start off #GRA617 Maybe a 9am class won't be so bad 
4:35 PM - 11 Jul 2012|Actors my first responsibility is to make sure you are safe Making you happy is my second #Priorities #TechieProblems 
12:13 PM - 11 Jul 2012|SA wants you to have the best possible summer So go on a road-trip these apps can help you with everything you need http ow ly c8Fly 
11:19 AM - 11 Jul 2012|All that means is ticket sales which have been lacking RT @NunesMagician Has fan support been lacking at Syracuse http espn go com blog ncfnation post _ id 62698 ranking-the-coaching-jobs-in-the-big-east 
6:15 AM - 11 Jul 2012|Great story I was at the game wish I'd known about this before fast forward to 21 18 http fb me 1w5mtbhPq 
3:57 PM - 10 Jul 2012|Run put of #SchineClosed signs RT @reebokroo #facepalm 
1:11 PM - 10 Jul 2012|Daily Buzz 'Independence Day 2' in the works Cookie Monster sings 'Call Me Maybe' http ow ly c91ZX 
11:33 AM - 9 Jul 2012|BREAKING #Syracuse councilors pass 30-year tax deal for proposed @SyracuseU bookstore http ow ly c7lTj 
11:17 AM - 9 Jul 2012|Worker falls 12-15 feet at @SyracuseU's Watson Hall http ow ly c7k8K 
7:37 AM - 9 Jul 2012|#Syracuse councilors to decide fate of SU bookstore project today http ow ly c6PqV 
12:57 PM - 8 Jul 2012|Anyone planning to go abroad this year @HuffPostCollege 10 things to keep in mind when you are traveling abroad http huff to LwUJvW 
12:58 PM - 6 Jul 2012|Need some tips on smart apartment searching and renting Visit our website http occs syr edu #offcampusliving 
6:47 AM - 6 Jul 2012|Syracuse city councilors to vote Monday on 30-year tax deal for SU bookstore http bit ly Nbadnb 
4:48 AM - 6 Jul 2012|RT @SAatSU Let your voice be heard and become a member of the Student Association Email jpbacolo@syr edu for more information 
1:40 PM - 5 Jul 2012|City councilors to vote Monday on 30-year tax deal for Syracuse University bookstore http ow ly c2LDB 
4:45 AM - 5 Jul 2012|All signs point to open #TheRueIsOn 
11:58 AM - 3 Jul 2012|RT @Cuse SU ice hockey takes on Niagara this weekend in the final weekend of the regular season http bit ly y3ks7f 
11:35 AM - 3 Jul 2012|RT @theryancampbell @lhdumitru is coming to the Walpole Fireworks You're all probably incredibly jealous especially if you're @jcorbett11 
