9:07 PM - 9 Dec 2015|Art thou ready #sex #football #Shakespeare Check latest report @OkCupid http bit ly 1m8z0Ok|0|0
3:39 PM - 22 Nov 2015|Need home Kolkata adorable duo DM details RT till reaches person giant heart pic twitter com oj1aWn3YBx|0|0
9:15 PM - 17 Nov 2015|How Math Genius Hacked OkCupid Find True Love http www wired com 2014 01 how-to-hack-okcupid via @WIRED|0|0
7:30 PM - 17 Nov 2015|Comedians make sad Computer Science grads laugh they're real shit Watch @mulaney The Comeback Kid you're rough day|0|0
3:14 PM - 16 Nov 2015|Now that's threat https twitter com BBCWorld status 666392820228464640|0|0
6:49 PM - 14 Nov 2015|If slice picture 3D surroundings slices represent timeline looking 4 dimensions pic twitter com iQ1zIKEDDl|0|0
