1:14 PM - 2 Dec 2015|Trevor Kidd met @MapleLeafs G Garret Sparks today talk similar pad design http www tsn ca nhl video sparks-meets-trevor-kidd-in-winnipeg 761665 pic twitter com upTuVtATw9|9|23
7:12 AM - 30 Nov 2015|Starting week right another #naizil #canadianmade #customcolour #cuttingmachine pic twitter com KruCgaJiKH|1|1
4:49 PM - 25 Nov 2015|Concordia President Alan Shepard Katherine Purchase Stingers AD Patrick Boivin FAEQ gala pic twitter com qvtpeiA0xp|4|5
4:10 PM - 25 Nov 2015|Stingers goaltender Katherine Purchase named top academic female athlete FAEQ gala tonight Congrats #stingersunited|5|15
9:28 AM - 18 Nov 2015|2-time Olympic gold medalist Marie-Philip Poulin practiced WHKY team today We pretty cool friends pic twitter com sUCSYZIRH9|6|14
6:30 AM - 18 Nov 2015|ATHLETES WEEK - Congrats Katherine Purchase women's hockey team basketball's Ken Beaulieu pic twitter com ckwlY2cg1C|5|12
