5:17 AM - 2 Dec 2015|Hunker get work done dig deep don't asshole -Kiran Mani @google @MICA_ahmedabad #MICALectures pic twitter com Fuzjb5C6NK|6|2
2:08 AM - 12 Dec 2015|British Army vs Jaipur Polo Team today Rambagh Polo Ground @WeAreRajasthan @We_Are_Jaipur pic twitter com fKVLNL0o1n|12|14
2:13 AM - 12 Dec 2015|For men it's easy winters it's hard|20|13
1:46 PM - 11 Dec 2015|Announcing formation @open_ai https openai com blog introducing-openai|3.6K|4K
9:21 PM - 11 Dec 2015|What suppose means pic twitter com vZs7gmZeti|455|670
9:17 PM - 11 Dec 2015|BREAKING Voting starts first Saudi Arabia poll open women AFP|33|47
7:59 AM - 11 Dec 2015|Be someone's backspaced feelings|2|2
1:35 AM - 10 Dec 2015|Will MoonMoon get justice deserves The voice unheard needs listened @JalComm18 #Bhandaricase|2|2
1:33 AM - 10 Dec 2015|Innocent moonmoon convicted case @JalComm18 #bhandaricase|2|2
1:23 AM - 10 Dec 2015|@JalComm18 moonmoon ke sath galat hua Murder self defence calls investigation #bhandaricase|2|2
8:34 AM - 11 Dec 2015|Our team nominated multiple awards CT Video awards Show us support @m_gunjn @bare_beer_bear @shikshasingh13|1|1
8:22 AM - 9 Dec 2015|On tonight's Newshour debate Arnab Noswami Mr Lakshman Jethmalani air views #BhandariCase Tell us think|2|2
8:00 AM - 9 Dec 2015|A moving talk Peter Singer altruism http fb 70CRj0lH3|3|2
2:24 AM - 9 Dec 2015|If I travel east I ll always travel east If I travel north awhile I ll travel south|1|0
7:48 PM - 4 Dec 2015|Before give Think held long|2.7K|2.7K
10:52 AM - 8 Dec 2015|Some might call sexist Seagram's 'Men men' campaign sheer brilliance https youtu O4nTDi4lnCs|1|6
1:46 AM - 7 Dec 2015|hard action get days smh|14|23
12:28 AM - 8 Dec 2015|I hope write thing woman shares story - http toi UW86KY|18|6
5:51 PM - 7 Dec 2015|Star Wars meets Calvin Hobbes pic twitter com 9l8rSMmaH0|708|1.2K
1:01 AM - 7 Dec 2015|What call transformation healthy individual goes excessive consumption sweets -Meethamorphosis|10|9
5:17 PM - 6 Dec 2015|Stats show average person sex 89 times year Looks like I'm store wild December|8|29
8:49 AM - 6 Dec 2015|Is bit absolutely fucking gorgeous pic twitter com DIG0ra0kHH|9|14
10:47 AM - 2 Dec 2015|https www facebook com UdaanAtIRMA photos 518134131670915 1073741827 516436788507316 531166717034323 type 3 theater -Congrats students Aneek Das Nitin Pillai winning case study Udaan IRMA pic twitter com zjbMtmKGtc|1|4
4:37 AM - 2 Dec 2015|First acknowledge professors assist various subjects - Mr Kiran Mani Managing Director-Global Client Solutions Google|9|4
5:36 AM - 1 Dec 2015|The underdog forgot breathe He lost|2|1
9:44 PM - 29 Nov 2015|Dean @ProfAtish take aspirant questions Dec 2 1800-2030 hrs Tweet #AskMICADean Partner @Mbauniverse pic twitter com e9FOczJlZZ|15|25
4:38 AM - 27 Nov 2015|What date launch serious Alcohol ban Guess everyone way celebrating April Fool's Day #BiharAlcoholBan|10|7
4:16 AM - 27 Nov 2015|Make Out In India|2|3
1:10 AM - 27 Nov 2015|Actually every sentence double meaning But beauty lies beholder's eyes|2|2
10:39 PM - 26 Nov 2015|Every maa rage correct age marriage|3|4
11:19 AM - 26 Nov 2015|Strange ring observed around moon @rimjhimr92 @theredhorcrux @bare_beer_bear @ashisrocking #MICApture pic twitter com 3THi4GTQhW|2|5
4:33 AM - 26 Nov 2015|She loves He loves She loved He loves #HeSheStory|6|2
12:59 AM - 23 Nov 2015|If stops making fuss I'm sorry bro you've lost|4|7
11:27 PM - 22 Nov 2015|Sex dirty people say Get broom guys|5|7
1:03 AM - 22 Nov 2015|You know C stands Chutya That's #spectre|2|2
9:20 PM - 21 Nov 2015|What moral story according pic twitter com JXrSrwvzmA|5|4
11:30 PM - 20 Nov 2015|@SANKALP_MICA 's 'Rim Apocalypse' set premiere tonight Say hello June #RimOfApocalypse pic twitter com xBVHb7QFDC|6|7
10:11 PM - 20 Nov 2015|@warriors stay perfect season 14-0 #TheGoldenStreak #LoveNBA pic twitter com RbuJfTwnib|5|11
3:59 PM - 20 Nov 2015|@bare_beer_bear There going back human chips|1|1
2:57 AM - 20 Nov 2015|Unconditional love chill|1|1
7:41 AM - 19 Nov 2015|Celebrated Men's Day staring boobs day|509|507
2:22 AM - 20 Nov 2015|The long route supporting anshan supporting corruption|17|13
2:02 AM - 20 Nov 2015|Getting ready weekend pic twitter com kvorx3fWBk|3|2
1:55 AM - 20 Nov 2015|Finally OML gets deserves Thanks @narendramodi sir You've got new notebank pic twitter com V0n6vjJ6x4|12|44
8:04 PM - 19 Nov 2015|Aaj mausam Botswana hai Clouds ka Ghana saaya hai Thought sab Chad ke relax karunga But got work Sudan What Kenya|426|377
8:40 PM - 19 Nov 2015|saxophone player's pony tail grows 3 inches every solo|405|1.1K
3:56 AM - 19 Nov 2015|Michael Weiss No terrorist identified #ParisAttacks SyrianRefugee No doubt inconvenient fact many fact nonetheless|2|1
2:45 AM - 19 Nov 2015|Ho Ho Ho To bottle I go To heal heart drown woe|2|3
8:56 PM - 18 Nov 2015|A good night invariably leads good morning|6|11
12:36 PM - 18 Nov 2015|Boobs brass|1|4
2:01 AM - 18 Nov 2015|Mr Ahnn using small contributions Internet greater good Duolingo #TEDxMICA #2016Chapter http www ted com talks luis_von_ahn_massive_scale_online_collaboration|4|2
12:25 PM - 17 Nov 2015|This https twitter com YeatsDaily status 666368115681288192|2|2
11:34 AM - 16 Nov 2015|Sometimes affections need displayed publicly Sometimes keyword|1|1
7:41 AM - 16 Nov 2015|Make feel safe make feel loved make feel orgasms|52|93
10:21 AM - 16 Nov 2015|Too much feeling enough thinking|4|5
7:57 PM - 15 Nov 2015|Meanwhile somewhere ISIS base camp Whew pic twitter com zUZXFGo53f|23|54
