10:38 PM - 10 Dec 2015|Welcome new home Justin Trudeau greets Syrian refugees arriving Canada http snpy tv 1TEtPjw|214|237
6:35 PM - 10 Dec 2015|Bill 6 debate ends emotional #ableg talk bullying threats http calgaryherald com opinion columnists braid-bill-6-brought-bullying #yyc #yeg #abpoli|7|7
8:41 PM - 10 Dec 2015|Gaudreau scores winner overcome Ristolainen hat trick Flames edge Sabres 4-3 #NHL http bit ly 1NQoNfm pic twitter com QZY18bvD2f|13|35
6:08 PM - 10 Dec 2015|Maybe white Christmas The @CTVCalgary 5 day forecast #yyc #Calgary pic twitter com EVPiOjkyfE|7|8
6:23 PM - 10 Dec 2015|COP21 Canada's new goal limiting global warming 'perhaps dream' http ift tt 1Qhkct3 pic twitter com dgUKRVN3Dj|26|11
9:30 PM - 10 Dec 2015|Albertans heckle Leonardo DiCaprio climate change remarks http glbn ca VJlWY pic twitter com lZKWtAKya3|16|17
9:34 PM - 10 Dec 2015|Canadian visually impaired swimmer Nicolas Turbide sets record U S Paralympics Open http cbc ca 1 3360367 pic twitter com HNBkrNB9DD|14|27
9:35 PM - 10 Dec 2015|We finally know mysterious bright spots dwarf planet Ceres #space http ow ly VJPRi pic twitter com sV9WrVJLmR|5|7
