7:26 PM - 9 Dec 2015|What I imagine whenever someone says radical muslims pic twitter com kcQWYQACdg|292|802
5:20 PM - 4 Dec 2015|I want learn new slang Hello #twitter people's new cool words today|47|272
11:05 AM - 5 Dec 2015|Some people's tell listen adell car I listening songs sad want cry|82|367
12:20 PM - 6 Dec 2015|I liking justin beeber songs much Such nice music tunes I also singing good good boy #whatyoumean #manjeet|76|327
4:59 AM - 16 Nov 2015|Count shadows #DoctorWho #TheLibrary pic twitter com D3KyZqO3Ze|15|46
9:14 AM - 17 Nov 2015|The Doctor's real name revealed 1980 comic book #DoctorWho pic twitter com 7rkh9pwM7j|217|270
2:37 AM - 19 Nov 2015|Prepping Christmas #DoctorWho pic twitter com jvLwohYPMa|32|77
12:31 AM - 21 Nov 2015|Oh yes #DoctorWho #Whovian pic twitter com 0Y3HRzR5Gv|70|138
11:15 PM - 29 Nov 2015|The Official #DoctorWho Classic Edition 2016 Square Calendar arrived - http amzn 1TmA6kx pic twitter com X5w2v2HQ7S|21|50
11:21 PM - 29 Nov 2015|#DoctorWho A tribute The Impossible Girl SoniaMatas pic twitter com Vpylycmt1c|31|102
2:23 AM - 7 Dec 2015|Hot Topic Exclusive #DoctorWho TARDIS Queen Comforter - http amzn 1TS6Q5c #Christmas #Shopping pic twitter com bPaZ65k6M8|18|56
10:09 AM - 7 Dec 2015|This Whovian get - #DoctorWho pic twitter com Bx1TD748iD|34|84
9:45 AM - 10 Dec 2015|Please don't sewing supplies please don't sewing supplies pic twitter com boRAAP8OLl|21|34
3:45 PM - 11 Dec 2015|Rosamund Pike Gone Girl 2014 pic twitter com cLjc65Eaqg|51|114
4:01 PM - 11 Dec 2015|500 Days Of Summer 2009 pic twitter com VoCv7IZl5N|182|242
4:52 PM - 11 Dec 2015|concept kissing river phoenix holds tells contagious laugh mindset flows purely|48|167
4:55 PM - 11 Dec 2015|In March @barackobama @repjohnlewis led commemorative march Selma Coming soon The Year Pictures pic twitter com Qx4QZPMXkC|205|461
6:28 PM - 11 Dec 2015|Thank tragedy I need art - Kurt Cobain pic twitter com 2OopUFy6mC|184|336
6:35 PM - 11 Dec 2015|Jennifer Aniston 90s pic twitter com c1GbY2u3c8|448|708
4:54 AM - 11 Dec 2015|Are ones slightly freaked #AngelTrail trending http bbc 1QApbUh #DontBlink pic twitter com 8ByzGZL9uS|287|561
9:05 AM - 25 Nov 2015|Iceland books published read per person anywhere else world pic twitter com PwjUi13KPA|168|277
5:05 PM - 26 Nov 2015|Sidewalk art pic twitter com NwawwEZco7|350|657
5:05 AM - 2 Dec 2015|Actor Mark Wahlberg school dropout got High School Diploma 42 example kids pic twitter com Umf3VfUOlX|211|529
9:05 PM - 3 Dec 2015|A single LEGO brick take 432 kg 950 lbs pressure cracks pic twitter com yljSgYkl2Y|152|266
9:05 AM - 5 Dec 2015|Coca-Cola second widely understood term world Ok pic twitter com f5ew3c80dJ|163|269
5:05 AM - 6 Dec 2015|It would take light 100 000 years travel one end Milky Way galaxy pic twitter com XoTpzE0gq7|146|205
5:05 PM - 6 Dec 2015|Salt pepper microscope pic twitter com QIRufKDEHH|125|284
9:05 PM - 6 Dec 2015|Some day die pic twitter com bvMU4L21s1|601|944
9:19 AM - 20 Nov 2015|Avocate South Central 1972 Robin Coste Lewis featured Poetry Motion LA collab w Metro Arts pic twitter com ZSG3qy0azq|4|8
4:27 AM - 11 Dec 2015|Do think universe fights souls together Some things strange strong coincidences|2K|3.2K
5:03 AM - 11 Dec 2015|WORLDWIDE COMPETITION RT Follow chance win new #DoctorWho book The Legends Ashildr pic twitter com Fsp4mJ9wMw|282|66
5:35 PM - 10 Dec 2015|I anti-biotic But lately I've pro-biotic reading culture|7.7K|18K
8:15 PM - 9 Dec 2015|YES OMG pic twitter com 6UOo9JEwdl|961|2.2K
9:00 PM - 9 Dec 2015|When start draw don't feel like continuing http 9gag com gag am8EDKd ref tp pic twitter com T07MHS5Olf|4.8K|6.8K
8:00 PM - 6 Dec 2015|rt picture turns u pic twitter com Ae7gmyh9xI|4.4K|4.7K
10:38 PM - 8 Dec 2015|Boy said fuck words While singin Christmas song bunch white people Bieber savage pic twitter com AQnNSPFQLr|6.2K|7.9K
