10:04 AM - 10 Dec 2015|Your Skin Will Crawl Watching The Most Disgusting Thing Come Out Of This Guy's Head https cards twitter com cards 18ce53xhlxh 19gfm|11|11
9:44 AM - 10 Dec 2015|Dolphins sometimes try rescue people drowning|196|657
9:15 AM - 10 Dec 2015|My hearty congratulations @NSaina scripting remarkable victory Carolina Marin BWF Super Series Finals You make us proud|210|541
6:18 AM - 10 Dec 2015|While game might Chennai still playing game hearts #PlayingForChennai pic twitter com oknqbu6Amz|253|605
8:58 AM - 10 Dec 2015|These pics sent Dr Trehan Left pic -Lung 55yr old HP Right pic- Lung 52 yr old Delhi pic twitter com FstcFOocoQ|2.7K|1.8K
8:53 AM - 10 Dec 2015|See inside North Korea's gigantic 24 Million art museum Cambodia http artnt cm 1Z1og2m pic twitter com dyMIkh51Tk|21|22
1:15 AM - 1 Dec 2015|NEW VIDEO 15 years HRITHIK ROSHAN - Watch 1080 HD please RT like let's make watch https youtu 74_U364IboQ @ihrithik|281|380
8:45 PM - 9 Dec 2015|You cannot taste food unless mixed saliva|54|81
8:22 PM - 9 Dec 2015|Have seen Aishwarya Rai Bachchan's new ad L'Or al Excellence Creme She looks fab #Bollywood pic twitter com 32jwxA5STJ|29|65
9:25 PM - 8 Dec 2015|Rani Aditya Chopra become proud parents baby girl named Adira Congratulations|446|1.1K
8:21 AM - 8 Dec 2015|Think hold true aspiring youth pic twitter com DrhQ9wJqJg|189|458
9:22 AM - 9 Dec 2015|It takes person 15-17 months get breakup someone love|504|1.3K
11:19 PM - 3 Dec 2015|Meaning lost many words RUMI|68|108
8:41 AM - 9 Dec 2015|Crying good It flushes unhealthy bacteria body strengthens immune system relieves stress|440|879
8:03 AM - 9 Dec 2015|Incredible India We Net Chatting way back 1970 Raj Kumar Sahab Meena Kumari Sahiba - original chatters pic twitter com bQjUHZZY5q|488|1.2K
