3:33 PM - 12 Dec 2015|@WastedPrince Hi Check new single YOU SHOULD BE feat Esther tell think https soundcloud com gozzoofficial gozzo-you-should-befeat-esther|1|0
4:13 PM - 9 Dec 2015|days since shit came|295|318
1:48 PM - 7 Dec 2015|@regulator LIVE IN CONCERT Friday Dec 11th @Harbour_VanCity Tix http www spotlightconcerts ca pic twitter com 7wKkmR0KC7|2|2
9:05 PM - 29 Nov 2015|Kobe Bryant announced he's retiring basketball season http bit ly 1NWN0B7 pic twitter com yIPqQx758s|102|92
1:35 PM - 29 Nov 2015|And wraps North America Tour Houston Dallas Santa Ana Montreal Calgary Vancouver Love http fb 3ZUzNrop8|8|29
3:03 PM - 29 Nov 2015|tomorrow 10 PT @AppleMusic pic twitter com laJZxJnPjl|1.2K|2.6K
2:00 PM - 29 Nov 2015|After 40 years Stevie Wonder finally cut BRAIDS via MTO http tmz OpeTHLI|53|60
4:00 PM - 28 Nov 2015|Oprah spent holiday weekend treating South African students play dinner http bit ly 1Nfcc56 pic twitter com ldU5JlULrr|27|40
3:59 PM - 28 Nov 2015|How Robert Herjavec escaped poverty became millionaire 'shark' @robertherjavec http bit ly 1MysecY pic twitter com SSlj2GOHes|36|46
