11:00 PM - 10 Dec 2015|Remember ships pass day touching life sending better direction life headed|24|30
11:08 PM - 10 Dec 2015|The name cat Hercules feline Liger cross Lion Tiger pic twitter com QeWNoBMXmr|2|2
10:15 PM - 10 Dec 2015|I feel song come|1|1
10:20 PM - 10 Dec 2015|#EU #US citizens don't believe influence foreign #policy infographics http sptnkne ws apxH pic twitter com 47p4latnqI|19|9
10:22 PM - 10 Dec 2015|Run ordinary|1|1
3:32 PM - 10 Dec 2015|It fifth night Hanukkah Only one shopping day sixth night Hanukkah #LSSC https amp twimg com v f473f2be-42e1-4c00-980c-3ca3581e1a75|210|600
10:33 AM - 10 Dec 2015|Courtesy @GhostPanther half pretty good improv scene #LSSC https amp twimg com v e32d44c4-2586-418c-8a04-790f191fea66|25|128
4:37 PM - 10 Dec 2015|Tonight I give buddy Jon Stewart makeover #LSSC https amp twimg com v 48bdad84-556f-4ca9-ac03-22c910b0d4bb|784|2K
3:28 PM - 6 Dec 2015|It's like Funky Friday Sunday night #GeorgeClinton #Flashlight #XPNSoul http wx pn listen pic twitter com e2NAxuLqfa|3|7
3:28 PM - 6 Dec 2015|Yea actually exactly I make music Thank making heart feel warm You strong Love pic twitter com 3rdJMuOln9|37|193
3:29 PM - 6 Dec 2015|You're allergic cats can't go see Broadway shows -my boyfriend #whyimdatinghim #zing #adorable|1|3
3:30 PM - 6 Dec 2015|Justice Department To Investigate Chicago Police Practices http n pr 21HUAcJ|83|80
3:30 PM - 6 Dec 2015|man essay taking forever pic twitter com BUiF4GjLaB|2|2
3:15 PM - 2 Dec 2015|Nice http bit ly bJDEos Though I prefer urban setting And ending solid 87mph kick Scarecrow's spinal column|104|5
7:34 AM - 17 Nov 2015|If see one cat perform avant-garde negative soundscape year make one #LSSC https amp twimg com v 45581597-fa88-4ef4-9747-51f6f570983f|389|793
5:10 PM - 17 Nov 2015|Gov @nikkihaley I helping South Carolinians rebuild flood-damaged homes could use help https goo gl PRszg6|270|711
5:21 PM - 17 Nov 2015|Burt Reynolds reflects career accomplishments #LSSC https amp twimg com v 1a782cf0-a424-48db-9a2e-af00bce5ad50|84|317
7:52 PM - 18 Nov 2015|Don pay attention @lydonofficial kids Smoking post-punk haircut dangerous #LSSC https amp twimg com v 038a3b33-947c-4abd-ba0c-da1f5d40e972|108|333
9:02 PM - 20 Nov 2015|@themichaelcaine one impression pretty spot-on #LSSC https amp twimg com v 2900af0f-63cf-491a-9f28-f1096905734c|250|612
4:28 PM - 23 Nov 2015|You ll never argue family members take @larrywilmore advice #LSSC https amp twimg com v 254ddaff-8978-41f4-ab87-01a2e59f78db|170|442
12:37 PM - 24 Nov 2015|Ted Koppel brings stories media reality aren't covering #LSSC https amp twimg com v 9d05db9e-96a2-47df-8148-1b3c3d08826f|106|312
2:00 PM - 6 Dec 2015|Happy Hanukkah @colbertlateshow got something special year Not evil King Antiochus https amp twimg com v 39bd4b2b-3745-4e44-8596-463b7fa80035|744|1.5K
6:36 PM - 30 Nov 2015|MONDAY NIGHT HOMEWORK|144|295
3:15 PM - 6 Dec 2015|#AxelJob Director #Operations #Africa #Job #Safari #YouTube http ow ly VlV8q pic twitter com dMS8NGjQFE|2|11
12:34 PM - 6 Dec 2015|never thought pic twitter com WAzsD40f2P|45|81
6:12 AM - 29 Nov 2015|Learn appreciate everything|11|24
4:35 PM - 28 Nov 2015|Jam sesh pic twitter com y88ucCyXeg|97|167
6:33 PM - 2 Dec 2015|On day '95 Victorville #Sublime #FacetoFace #Chuck pic twitter com evw3Q1sD4D|45|68
3:01 PM - 3 Dec 2015|#TBT days Hong Kong Phooey #Sublime #HongKongPhooey pic twitter com FyWOjWAwI7|62|89
1:54 PM - 5 Dec 2015|Rougher rhythm must Sublime pic twitter com QK4pu7Y6Av|67|105
12:47 PM - 6 Dec 2015|person you're blocking view view|1|1
7:00 PM - 1 Dec 2015|88 5 WXPN 200 new member pledges today 50k feeding hungry Philabundance #GivingTuesday http donate nprstations org wxpn default pic twitter com SglUGQF3Du|1|2
12:32 PM - 6 Dec 2015|everyone okay everyone look tired everyone look upset everyone look confused everyone sick IT'S MY FACE|1|3
12:27 PM - 6 Dec 2015|SNL Highlights Ryan Gosling Struggles To Keep A Straight Face But Manages To Believe In Santa http bit ly 1NzI6Oi|91|280
5:33 PM - 27 Nov 2015|I don't believe perfect @Whitcah pic twitter com KtAWzdGUPD|71|133
12:11 PM - 6 Dec 2015|always love pic twitter com bbQPt825Jq|174|284
7:21 PM - 4 Dec 2015|Important Message burn phone number holders Periscope @ 11pm Brooklyn time pic twitter com x5gg8xUIEb|105|368
8:40 PM - 4 Dec 2015|Per AMANDA's Request Btw she's lady u worrying dallas trying 2 figure # Here Burn Out # B1G DRIZOSS|90|241
8:41 PM - 4 Dec 2015|A ho never gets cold|7K|5.5K
10:50 PM - 4 Dec 2015|Don't need certified verified people -Badu|2.6K|3.2K
12:02 PM - 6 Dec 2015|INSANELY AWESOME Someone made bunch famous movie characters sing @Adele #Hello WATCH http ow ly Vuzq4|4|9
3:53 PM - 3 Dec 2015|Another #TBT Reading Festival 1993 https www instagram com p -2UofwHy54|62|149
5:15 PM - 3 Dec 2015|Killer Mike return politically engaged rapper http bit ly 1O6btnH pic twitter com Ip4JUCRuaf|63|86
7:48 PM - 3 Dec 2015|Hey @AlterasBand Christmas cover|1|2
10:26 PM - 3 Dec 2015|Rest peace Scott Weiland|6|25
4:35 PM - 3 Dec 2015|Are new song writer trying find place Im world musician seeking This book pic twitter com GzcOkhPOWn|1|1
6:49 PM - 3 Dec 2015|Do like pictures cats Well check Instagram No cats we're cute like sorta https www instagram com thebrokenstoolsband|2|8
10:30 AM - 3 Dec 2015|The World Changed But Rates Stayed The Same|1|1
6:57 PM - 1 Dec 2015|When friends sober you're high af pic twitter com Lyp683wBgt|931|1.6K
4:58 PM - 2 Dec 2015|Shout whoever invented grinder pic twitter com eYA8RtUuVL|466|1K
5:48 PM - 3 Dec 2015|Imagine beach filled kief instead sand|323|545
5:55 AM - 3 Dec 2015|Be change want see world good day everyone|1|1
8:32 AM - 3 Dec 2015|Karma makes Naughty Nice list|1|1
8:52 AM - 3 Dec 2015|Who wants see us post tour footage videos last couple tour runs|2|34
10:33 PM - 3 Dec 2015|Who wants see us covers popular songs https www youtube com watch v MNPSqpONHtU #rude|5|34
12:39 PM - 1 Dec 2015|Wetnight #CanItRainAllNight|1|1
3:26 AM - 28 Nov 2015|u ever make scenarios head never happen makes happy keep imagining|3.3K|5.4K
12:45 PM - 1 Dec 2015|@Yfm My birthday D Who wants work special day|2|2
10:02 PM - 3 Dec 2015|maybe pic twitter com 33YUtaCNtE|204|276
10:02 PM - 3 Dec 2015|Lastly amazing seeing @puptheband hometown Best band side universe|27|249
8:23 PM - 3 Dec 2015|My life My choices My mistakes My lessons Not business|1|2
8:24 PM - 3 Dec 2015|I hate I flex shirt rips|132|176
8:26 PM - 3 Dec 2015|This oil sucks dick Just dropped 2 I'm even phased Time another|2|1
9:21 PM - 2 Dec 2015|OMG that's class Sooo Adorable pic twitter com JREj3dnnXx|1|10
3:21 AM - 3 Dec 2015|Look like free spirit sexy look pic twitter com IRx4Celegg|2|19
9:21 AM - 3 Dec 2015|Going shopping coffee simply sharing sometime friend - perfect pic twitter com 64g9CnEzF9|2|9
3:22 PM - 3 Dec 2015|Fabulous Classic Chic Style pic twitter com zVkTx70Rcw|4|11
8:12 PM - 3 Dec 2015|Shout guy https twitter com _deeahnah status 672627179155415040|45|359
