1:40 PM - 11 Dec 2015|iN ELEMENTARY SCHOOL WAS VOTED MOST LiKELY TO HARLEM SHAKE THROUGH THE PRESSURE|1.2K|1.6K
6:13 AM - 11 Dec 2015|it's long week deserve fuckboy free friday fav u agree #stopfuckboys2k15|8|46
12:15 PM - 11 Dec 2015|Squidward wasnt invited house party|719|1.4K
1:01 PM - 11 Dec 2015|slamming tongue car door|484|849
9:32 AM - 11 Dec 2015|someone makes u mad it's Christmas time pic twitter com ehUvaij6X1|5.8K|9K
6:44 AM - 11 Dec 2015|Don forget grab Achievement Hunter Holiday Print https store roosterteeth com collections achievement-hunter products achievement-hunter-2015-limited-edition-holiday-print-14-x-11 pic twitter com UGnvat9Xey|153|866
7:51 AM - 11 Dec 2015|beginning year vs finals week pic twitter com 2NgPWnVNDi|567|875
7:16 PM - 10 Dec 2015|Nothing says fancy night theatre like white wine chocolate brownie pic twitter com FF2a25HAc3|12|247
7:20 PM - 10 Dec 2015|honest self okay never|805|1.5K
7:39 PM - 10 Dec 2015|today's stats -gained 5 pounds -pretending it's tits|460|1.4K
7:45 PM - 10 Dec 2015|shout anyone finals right proud getting educated AF|9|60
7:53 PM - 10 Dec 2015|fall love fall asleep|1.2K|1.6K
7:54 PM - 10 Dec 2015|ball anxiety|1.1K|1.3K
8:24 PM - 10 Dec 2015|sephora abyss memoir|469|879
8:35 PM - 10 Dec 2015|Livin la vida broka|1.5K|1.9K
8:45 PM - 10 Dec 2015|dear santa want ur credit card thnx|1.5K|2.3K
5:11 PM - 10 Dec 2015|stalking tweets won't tell u anything I could tweet I'm upset talking someone ate last mac n cheese|1.7K|2.1K
5:30 PM - 10 Dec 2015|Squad Goals pic twitter com UejUhX6awh|382|301
5:11 PM - 10 Dec 2015|middle school boys like pic twitter com Gy6O3yjh7K|119|385
6:21 PM - 10 Dec 2015|ain't dad first it's dad right|12|22
3:05 PM - 9 Dec 2015|CEO obsessive thoughts|579|940
6:20 PM - 9 Dec 2015|take feelings trash|1.6K|1.5K
8:50 PM - 9 Dec 2015|delete memory thanks|1.4K|1.7K
10:06 AM - 10 Dec 2015|feed cliches happiness know it's real|395|785
12:00 PM - 10 Dec 2015|My kind dessert pic twitter com kRoIZApRoU|428|409
3:51 PM - 9 Dec 2015|someone nominate award I buy tuxedo|5|38
11:00 AM - 9 Dec 2015|May holiday vacation drag @egoraptor pic twitter com pozoHduVmh|2.1K|5.6K
10:06 AM - 9 Dec 2015|hot singles area looking people complete ways one ever|369|975
10:37 PM - 8 Dec 2015|throw bed feed burritos|791|1.1K
11:18 PM - 8 Dec 2015|never don't think i'm dying|567|908
1:19 AM - 9 Dec 2015|rejected|1.4K|2.1K
6:11 PM - 8 Dec 2015|Myers Briggs type DILF|33|80
9:45 AM - 8 Dec 2015|nick's really gone downhill since parks rec guys advice welcome @Nick_Offerman pic twitter com DyW7IsHelx|1.6K|3.8K
9:29 AM - 6 Dec 2015|conversation goals pic twitter com wzIaoH0P2Y|769|944
10:28 PM - 5 Dec 2015|year end list -tried leave house -made mistakes 2014 -still don't know manage feelings -internet|1.9K|3K
5:19 PM - 24 Nov 2015|Someone said christmas tree ugly today It like called dog ugly Our relationship never #DontFwMyTree|381|1.7K
12:41 PM - 25 Nov 2015|I think I bought 8 hat Lol https twitter com theeemann status 668899615442206720|81|610
5:33 PM - 5 Dec 2015|kind piece chit wouldnt put leavin la vida loca top ten albums 2015|20|118
12:21 PM - 5 Dec 2015|Our favorite pizzas Danny 14 sausage Ninja Brian fuck|444|1.9K
12:22 PM - 5 Dec 2015|Gluten free pizza like roller coaster goes straight|377|783
10:39 PM - 4 Dec 2015|don't change anyone unless really hot ignoring|1.7K|3.4K
1:30 PM - 4 Dec 2015|I like girls look like bagels|693|1K
1:39 PM - 4 Dec 2015|r u europe europiece shit|1.9K|2.6K
12:16 PM - 4 Dec 2015|told needy love story|875|1.5K
9:36 AM - 4 Dec 2015|Wrinkles add character pic twitter com jtJlcbBxK5|39|75
7:34 PM - 2 Dec 2015|It's come point semester I care I take another nap|13|19
3:20 PM - 3 Dec 2015|can't wait tell grandchildren time I solved Americas gun problem 140 characters waiting Chipotle order|657|1.8K
9:20 PM - 3 Dec 2015|u ever go school confident ur wearing u actually get ur kind like wow well awful idea|286|616
4:26 PM - 3 Dec 2015|We're headed #TheGameAwards we're gaming royalty pic twitter com qAGVY7CGzy|85|1.1K
5:02 PM - 2 Dec 2015|ignore slower|911|1.5K
11:05 AM - 2 Dec 2015|body type cake|863|1.2K
8:14 AM - 2 Dec 2015|must remind u joke mean someone dont know internet mean mean|33|117
6:24 AM - 2 Dec 2015|Tired become personality trait point|3|2
8:57 PM - 1 Dec 2015|Damn I look swolled https twitter com curvedbubbles status 671915460011536384|115|659
7:23 PM - 1 Dec 2015|doesn't matter yesterday felt like dying didn't die today i'm definitely dying|759|1.4K
2:35 PM - 1 Dec 2015|iM ADiCKTED TO MONEY SHOPPiNG GRiLLED SHRiMP HOT CHiCKS|1.2K|1.7K
5:10 AM - 1 Dec 2015|ominous jingling distance Is TIME pic twitter com v0FxIgKZoP|34|126
6:45 AM - 1 Dec 2015|I wish wish heart get next weeks without falling apart pic twitter com Jmmt65MD3A|6.2K|7.1K
3:40 AM - 1 Dec 2015|everyone OMG you're glowing get look I cry 2 hours school|6|19
8:01 PM - 30 Nov 2015|destroyed want|651|1.6K
6:40 AM - 30 Nov 2015|I beautiful sleep last night I'm heartbroken I go class|2|3
7:05 PM - 29 Nov 2015|theory i'm totally|974|2.2K
9:56 PM - 29 Nov 2015|lila wHY pic twitter com ux5w6mv77H|32|352
7:59 PM - 29 Nov 2015|looks deep doesn't mean|706|1.7K
7:21 PM - 28 Nov 2015|She beauty grapes she's miss United steaks pic twitter com e9r01E7gPr|70|92
4:02 PM - 28 Nov 2015|hi weight world it's fault|1.3K|2.4K
3:02 PM - 28 Nov 2015|tweets subtweets self-esteem|691|1.6K
7:49 AM - 28 Nov 2015|there's many places I can't wait see I travel world pic twitter com vp9Lbi4VkL|961|2.1K
12:54 AM - 28 Nov 2015|mambo number|4|35
7:23 AM - 28 Nov 2015|Group chats consist pic twitter com ZJp98ixRTO|8.1K|14K
8:05 AM - 28 Nov 2015|treat yo self bank account DO NOT TREAT YO SELF|3.1K|4.2K
9:47 PM - 26 Nov 2015|team cry sleep|1.4K|2.3K
4:53 PM - 26 Nov 2015|I'm related people I don't relate|1.1K|2.4K
3:05 PM - 26 Nov 2015|shall pass come back worse|945|1.4K
12:01 PM - 26 Nov 2015|mom gonna bring thanksgiving dinner negative attitude sparkling personality|1.7K|3.2K
9:23 AM - 26 Nov 2015|Because it's Thanksgiving I'm going shave past 3 weeks|66|270
6:15 PM - 25 Nov 2015|i'm buffet bad ideas|1.2K|1.3K
6:54 PM - 25 Nov 2015|Long Island's predominant religions lacrosse strip malls bagels|1|10
6:40 PM - 24 Nov 2015|When bunny applies eyeliner better pic twitter com QKJDWNPGrr|5.7K|7.3K
7:05 PM - 24 Nov 2015|you're emotionally available you're probably type|748|1.6K
7:10 PM - 23 Nov 2015|fun like break heart|1.4K|2.1K
7:10 PM - 23 Nov 2015|love mistakes bring pain|500|929
7:19 PM - 23 Nov 2015|Use y mx b calculate slope hill life going|2.5K|3.3K
7:49 PM - 23 Nov 2015|many licks take get center core underlying issues|1.7K|2.6K
1:20 PM - 23 Nov 2015|disappoint sexy way|1.1K|1.6K
5:38 PM - 19 Nov 2015|Friday ya @ Thanksgiving ya @ Birthday ya @ Christmas ya @ New Years ya @ Summer 2k16 ya @|1.3K|1.3K
8:13 AM - 23 Nov 2015|haiku If wake there's huge weird hat bed course wear|49|196
5:55 PM - 22 Nov 2015|well day already ruined might well destroy|749|1.2K
6:03 PM - 22 Nov 2015|art museum date coffee shop date library date walk park date downtown date concert date|1.4K|2.9K
5:36 PM - 22 Nov 2015|I feel safe pic twitter com bPO2RMloJ5|50|76
4:30 PM - 22 Nov 2015|roll club dizziness terror suffocating nausea doom mourning palpitations unexplained weeping|242|663
5:03 PM - 22 Nov 2015|run banana mario kart|1.1K|1.7K
3:12 PM - 22 Nov 2015|sec goes internet 100 years pass everyone dead ok coming|756|2K
2:55 PM - 22 Nov 2015|want invisible also hot|1.3K|1.8K
10:47 AM - 22 Nov 2015|When u take good selfie pic twitter com OOKqvF2H2R|1.3K|2.9K
10:28 PM - 21 Nov 2015|I need man also wants Guy Fieri Otherwise never|15|16
10:16 PM - 21 Nov 2015|sometimes even fun seems unappealing bad|51|116
5:18 PM - 21 Nov 2015|chill bro I go 0 hard boiled egg real fuckin quick|1.3K|1.5K
5:00 PM - 21 Nov 2015|friend u big spoon little spoon im knife|910|1.5K
5:47 PM - 21 Nov 2015|want hot body also want hot wings|1.5K|2.2K
8:19 PM - 20 Nov 2015|ur girl writin poems soups|451|721
2:05 PM - 20 Nov 2015|Let fucking leave body second fuck|793|1.4K
6:21 PM - 21 Nov 2015|falls trashcan nice good finally home|1.2K|2K
6:45 PM - 21 Nov 2015|crying cvs art|534|1.3K
10:10 AM - 21 Nov 2015|want make also create new personality|808|1.9K
4:21 PM - 21 Nov 2015|contextual fuckboy n - fuckboy relation mistakes fuckboy universalis n - eternal inherent all-inclusive fuckboy|553|1.4K
3:50 PM - 21 Nov 2015|I need pic twitter com DN3cHHcple|2.7K|4K
8:00 PM - 20 Nov 2015|semester pic twitter com zjj00fKjS4|2.9K|2.9K
4:05 PM - 21 Nov 2015|really totally sucks|641|1.2K
7:32 AM - 21 Nov 2015|wake morning feeling like hi I'm scared everything|729|1.2K
9:06 PM - 20 Nov 2015|Definition puppy dog eyes pic twitter com SCFgr9DJIH|48|85
9:39 PM - 20 Nov 2015|eating spaghetti forgetti regretti|3.4K|4.7K
8:55 PM - 20 Nov 2015|fall love every ten seconds|714|1.5K
6:55 PM - 20 Nov 2015|googling pill found drawer new going|105|392
7:13 PM - 20 Nov 2015|wanna come exist together|1.5K|1.9K
7:14 PM - 20 Nov 2015|hotline never blings|1.6K|2.4K
7:25 PM - 20 Nov 2015|open relationship existence|543|1K
10:39 AM - 20 Nov 2015|Me takes selfie I'm sends @ashleyvernola even though she's sitting next room|1|1
4:05 PM - 19 Nov 2015|Holy moly https twitter com ModernBaseball status 667490862855655424|35|136
3:15 PM - 19 Nov 2015|don't text --jesus|2.1K|3.6K
7:00 AM - 18 Nov 2015|yeah ok money https twitter com liveatfirefly status 666979166127054848|2|3
7:01 PM - 18 Nov 2015|college like looking ways cross street getting hit airplane|1.3K|2.5K
7:32 PM - 18 Nov 2015|My ex texted today I can't breathe pic twitter com 703Rf8TLrF|9.8K|16K
7:33 PM - 18 Nov 2015|Fieri godmother appears Bippity boppity boo shall go flavortown ball pic twitter com G6W6hxzApK|44|68
8:31 PM - 18 Nov 2015|olden days glimpse stocking looked something shocking heaven knows #boners hilarious awesome|154|843
8:36 PM - 18 Nov 2015|Dishes Um it's time play pic twitter com tJDeh2vzxm|68|124
9:01 PM - 18 Nov 2015|fuck I|1.3K|931
6:55 PM - 18 Nov 2015|someone called loser i'm like can't argue one|1.4K|2K
8:01 PM - 18 Nov 2015|talents include checking anxiety every five seconds make sure it's still|936|1.8K
7:02 PM - 17 Nov 2015|sext wish never met|1.3K|2K
4:11 PM - 17 Nov 2015|like blame everything case|1.6K|1.9K
10:03 AM - 17 Nov 2015|December looking good #SNL pic twitter com URafpplRR3|4K|7K
10:04 AM - 17 Nov 2015|gazes abyss terrified everything therapist i'm great|1.2K|2.5K
8:56 PM - 16 Nov 2015|Guy Fieri would win bar fight Gordon Ramsay hands|8|9
9:06 PM - 16 Nov 2015|Hi cutie pic twitter com BO1AFS0At8|34|70
9:39 PM - 16 Nov 2015|hotline bling hits decline|1K|2.1K
9:55 PM - 16 Nov 2015|built hell i'm gonna decorate|2.3K|3K
2:47 PM - 16 Nov 2015|calls daddy sheets fuckin dumb ass streets|2.3K|3.2K
9:41 PM - 15 Nov 2015|My life series Spongebob episodes tbh lol|2|0
10:31 PM - 15 Nov 2015|don't like respect enjoy company find attractive still need like|622|1.9K
10:46 PM - 15 Nov 2015|voices you'll meet inside head -you're dying -you're fucked -you're ok -everything's|1.1K|2.5K
9:42 AM - 15 Nov 2015|bringing another person world isn't nice|688|1.5K
8:30 AM - 15 Nov 2015|I call The Cat Who Jumped Toilet Aftermath pic twitter com De9TuftHZP|201|1.7K
8:39 AM - 15 Nov 2015|Thanks everyone came see Adam @birbigs @carnegiehall It dream come true pic twitter com 3PyeyI7Y0T|36|249
9:15 AM - 15 Nov 2015|I DID THIS THIS WEEKEND LMAO https twitter com TheFunnyTeens status 665939319484506112|1|0
