6:45 PM - 11 Dec 2015|weather pic twitter com q9AUyCOZvy|152|1K
6:26 PM - 10 Dec 2015|Any fan supporter mine hoping Meek Mill goes jail solely fact beefing wit Drake I can't cosign u Sorry|449|424
10:14 AM - 10 Dec 2015|Meek Mill responds Internet niggas clowning joking possibly going jail Probation Violation pic twitter com gzIAXzIudL|422|370
12:49 PM - 7 Dec 2015|@wale I SEE WHY U NOT MMG SMH|7K|4.3K
5:03 AM - 1 Dec 2015|Real 90s kids know http vine co v Mj7wYdzppeI|724|1.1K
1:20 PM - 30 Nov 2015|Very excited announce #TheIncredibleWorldTour Tickets sale Friday pic twitter com fRkxc3a8I7|8.1K|10K
4:09 PM - 29 Nov 2015|NUT OIL OH DAMN pic twitter com 9qS5qXHuD0|166|912
12:33 PM - 28 Nov 2015|Just walked past man Gorilla suit man Banana suit smoking outside pub casually 3PM Is heaven hell|967|3.8K
3:00 PM - 24 Nov 2015|Cover Story @YG Unscripted http www thefader com 2015 11 24 yg-cover-story-still-krazy-album-interview pic twitter com GZb5BzhVng|934|1.1K
3:55 PM - 24 Nov 2015|tfw musicians like shows near|4|3
8:32 AM - 21 Nov 2015|Rake leaves get money|73|176
5:56 AM - 20 Nov 2015|fuck world also save world|13K|11K
9:48 PM - 19 Nov 2015|Praise God #SOD AVAILABLE NOW https instagram com p -S6K5ZBmNg|50|52
3:17 PM - 19 Nov 2015|Logic solving Rubik's cube without looking freestyling pic twitter com FtTLyGrJDz|16K|16K
5:19 PM - 17 Nov 2015|Bro serious @trvisXX pic twitter com ij1aPXb952|3.8K|3.9K
7:57 AM - 14 Nov 2015|Regarding events Paris thoughts I believe good people outweigh bad don't let win remain peaceful strong|4.2K|7.9K
