10:39 PM - 10 Dec 2015|I wish I blind confidence Michael Scott|2|4
8:51 PM - 10 Dec 2015|Hungry Hungry Hippos made durable plastic|273|1.1K
4:23 PM - 9 Dec 2015|Holiday tip avoid Moroccan themed office parties pic twitter com ECET1LqBbP|130|251
9:55 AM - 9 Dec 2015|Congrats @SagAwards nomination Amy Poehler puts photo Leslie's inspiring women wall #ParksandRec pic twitter com VzCceVdNja|351|1.4K
5:03 PM - 8 Dec 2015|Three cool ladies #TinaFey #AmyPoehler @MayaRudolph #SistersPremiere #SistersMovie pic twitter com eI1lWHCTxu|181|547
5:16 PM - 8 Dec 2015|This literally @AudreyPalumbo pic twitter com 6XF12zMMvb|1|1
10:26 AM - 8 Dec 2015|They divide us Categories something called buzzfeed quiz|1.2K|1.7K
11:32 PM - 7 Dec 2015|For cat I could get kid|1|1
12:19 PM - 7 Dec 2015|Elaine But high five stupid Puddy Oh yeah I ll tell stupid You stupid|271|391
8:15 PM - 5 Dec 2015|I loved playing Memphis tonight #thatsignthatsaidletmeseeyoudancemademenervousinagoodway Love @stjude|58|436
11:01 AM - 4 Dec 2015|This week I booked @theavettbros tickets next week @springsteen goes sale 2016 setting well epic experiences|1|2
11:23 AM - 4 Dec 2015|holy Seth Avett|2|6
9:01 AM - 4 Dec 2015|Frank Let's Festivus back I'll get pole crawl space|491|447
2:32 PM - 3 Dec 2015|u never call #NotBitter #LostOne #TweetingYouWhileYoureOnTheCouch #IllBeFine #DamnItWasOneDinner #Psssssh #ImPetty https twitter com mindykaling status 672524660114898945|32|272
2:46 PM - 3 Dec 2015|I went get new car battery mechanic replaced rear view mirror wendy's coupons Is normal pic twitter com X2D44qXMaF|5|70
12:30 PM - 3 Dec 2015|Stay little late watch @FallonTonight|166|1.7K
10:17 PM - 2 Dec 2015|You something Sign petition Limit botshttps www change org p congress-pass-legislation-making-ticket-scalper-bots-illegal source_location petition_footer algorithm recommended_share grid_position 4 @theavettbros|6|23
2:01 PM - 2 Dec 2015|Kramer Frank offence holiday little makes series noises|189|320
10:29 PM - 1 Dec 2015|The office gets day|2|2
8:41 PM - 1 Dec 2015|What u smoke You smoked much https twitter com c_rachioppi status 671900890597613568|3K|6.5K
12:03 PM - 1 Dec 2015|Brett hitting road w @theavettbros spring Tickets on-sale Friday All dates http fb 1SuVGSY pic twitter com kU3ARiE0u1|6|22
6:20 AM - 1 Dec 2015|RT we'll see one announced spring shows http bit ly 1l54m8a #theavettbrothers pic twitter com S0Qs3R47sh|280|252
7:37 PM - 30 Nov 2015|used think smh meant sell ham like yea got ham guy need|263|810
4:52 PM - 30 Nov 2015|The place shop pic twitter com WGsSckr0JU|67|388
9:41 PM - 27 Nov 2015|BUZZFEED Four Disney Princesses Re-Imagined Extinction-Level Asteroid Impacts pic twitter com RGfSF1xXgw|2.1K|1.8K
11:30 AM - 30 Nov 2015|George You know take everything I've done entire life condense one day looks decent|688|686
8:40 AM - 30 Nov 2015|When @EW asked #TheMindyProject writers fill form Enjoy pic twitter com 6JxRqWBI6Z|344|2.1K
11:00 AM - 29 Nov 2015|B J Novak The Office Creative Process Handling Rejection Good Comedy http bit ly 21mY5oS|72|363
10:14 AM - 29 Nov 2015|way block anything regarding Justin Bieber timeline|4|17
10:37 AM - 29 Nov 2015|Over 100 000 lists already @thelistapp Sign search terms see variety Here 4 examples pic twitter com tZQJlDAIlX|88|521
11:14 AM - 25 Nov 2015|So blessed whole family together holiday #mindfulness pic twitter com OCG5yL1dyA|4.2K|8.4K
7:15 PM - 23 Nov 2015|So @tayloranneadams I need tickets Avett NYE #plzhelp|3|0
5:11 PM - 22 Nov 2015|memorial mrs ringen tomorrow morning 7am flag pole|9|17
2:54 PM - 22 Nov 2015|one worst things could ever make fun someone else's happiness|1|4
8:17 AM - 20 Nov 2015|Jerry Hey look - Puddy Elaine My Puddy But broke Jerry And yet continues live|316|617
6:46 AM - 20 Nov 2015|I can't even guy Apple Music head Jimmy Iovine believes finding music difficult women http bit ly 1MXHGwk|1|1
1:39 PM - 18 Nov 2015|Get https twitter com huffpostlive status 667090004317892608|18|44
12:33 PM - 18 Nov 2015|@mindykaling may best thing you've ever written besides handful text messages I've screenshotted|116|1.2K
5:27 PM - 17 Nov 2015|LIVE #Periscope I going attempt play Office Theme Song bassoon next rooftop pool P https www periscope tv w aRvLlTFyYVFaSnZCclJRekx8MXZBR1JvbW93ak5KbLBq-HcaAAZyY5j0FjOhmrb-w3eN9Fz4KDxrvAQNQFpr|46|151
8:22 PM - 15 Nov 2015|26 words Arrested Development fans really understand http bzfd 1PB4J5o pic twitter com ZJ9rBjw6c4|344|703
8:01 AM - 17 Nov 2015|There Squirrel Cop everything else #20yearsofTAL|36|152
