7:34 PM - 6 Dec 2015|Spongebob Mr Krabs sold 0 62|2.6K|3.7K
7:34 PM - 6 Dec 2015|pop lock dropping school|2.8K|3K
7:35 PM - 6 Dec 2015|i'm already tired tomorrow|3.4K|2.9K
7:50 PM - 6 Dec 2015|people student parking lots school http vine co v e09vZUiYY3r|2.3K|4K
8:19 PM - 6 Dec 2015|I feel like christmas shopping like 50 000|588|1.4K
8:47 PM - 6 Dec 2015|momma would love @justinbieber|1.9K|2.2K
4:06 PM - 7 Dec 2015|Stress level Drake Josh sushi conveyer belt|4.4K|5K
6:39 PM - 7 Dec 2015|I'm syllabus week kind person|1.4K|1.9K
6:37 PM - 7 Dec 2015|im hot blooded Romeo im comin back vogue|38K|64K
4:37 PM - 4 Dec 2015|Us cast Star Wars who's Lol @starwars pic twitter com f18JQWqAnM|33K|59K
6:39 PM - 4 Dec 2015|Donut dreams pic twitter com TVJ5HzFgJf|31K|53K
5:47 PM - 5 Dec 2015|us yesterday pic twitter com 0G33AqOYMa|31K|57K
9:48 AM - 1 Dec 2015|Sometimes I stress band things I remember fans favorite song 43 second long song called Pizza|59K|83K
6:03 AM - 21 Nov 2015|A field turns orange green harvesters pick Marigold flowers Los Mochis Mexico 1967 pic twitter com zi9vv4wqWU|1.1K|2.6K
6:05 PM - 21 Nov 2015|@joshuadun new phone sorry who's|17K|33K
4:10 PM - 16 Nov 2015|harry styles best|2.3K|2.9K
10:43 AM - 20 Nov 2015|20 freakin years old thanks everyone birthday wishes|73K|110K
