7:49 PM - 9 Dec 2015|If wish make apple pie truly scratch must first invent universe -Carl Sagan|1|1
6:30 PM - 9 Dec 2015|Gone Like internment camp https twitter com realdonaldtrump status 674777043163332608|483|1.1K
4:03 AM - 4 Dec 2015|@bobbytastical Because nothing says Happy Birthday like sinking ship people die #HappyBirthday #Titanic pic twitter com hckorvh15z|1|1
11:51 AM - 29 Nov 2015|Miss Piggy shows Kermit he's missing Adele Hello parody http huff 1XphRka pic twitter com w2mfQL2Cnc|157|254
8:13 PM - 25 Nov 2015|A clear uncluttered mind always one take highest heights|349|355
10:23 AM - 19 Nov 2015|Hey @realDonaldTrump I'm American Muslim I already carry special ID badge Where's #SemperFi #USMC pic twitter com QSf2O9PTi2|39K|51K
