7:25 PM - 10 Dec 2015|UP CLOSE One hand painted Navy helmets weekend's Army game via @waveclem pic twitter com RcHpvtGYyd|669|810
2:22 PM - 26 Nov 2015|Jerry Jones' wife looks like person would spit poor people Titanic lifeboat floated away half full|949|1.9K
11:46 AM - 26 Nov 2015|Things get worse Riley Cooper tomorrow Black Friday|574|783
9:13 AM - 21 Nov 2015|Late breaking best Gameday sign pic twitter com oewQXCX3BZ|521|622
8:06 AM - 17 Nov 2015|Mastermind Let's shoot crowd blow Ocean's 11 intricate genius plan fit tweet|272|433
10:12 PM - 14 Nov 2015|And sit back wait hear @FloydMayweather lie much won betting Ronda Rousey|315|493
