5:53 AM - 11 Dec 2015|I called Trump's donors find thought ban-Muslims proposal I got much http www thedailybeast com articles 2015 12 11 donald-trump-s-donors-asked-me-if-i-was-muslim html|104|114
8:37 AM - 9 Dec 2015|Forget 2M easily interesting part whole deal Wu-Tang Martin Shkreli pic twitter com 5nSshXhjnJ|9K|7.3K
10:40 PM - 8 Dec 2015|Wilderness lost great ally Chao #Tompkins y gracias North Face Founder Dies Kayaking Accident http nyti ms 1YXmMpV|1|0
11:01 PM - 8 Dec 2015|Mr Trump statement Paris basis fact http www nytimes com 2015 12 09 us politics donald-trump-muslims html hp action click pgtype Homepage clickSource story-heading module first-column-region region top-news WT nav top-news _r 0 pic twitter com Nc89LDocNx|10|7
12:06 PM - 5 Dec 2015|takes glasses pic twitter com q7mYl3HkSH|472|572
10:13 PM - 8 Dec 2015|I'm late game SNL alien abduction sketch tears confirmed love #KateMcKinnon https www youtube com watch v PfPdYYsEfAE|6|11
10:38 AM - 8 Dec 2015|Basically Twitter extremely well-capitalized One Direction fan site http www buzzfeed com krystieyandoli here-are-the-most-popular-tweets-from-2015|15|12
9:35 AM - 8 Dec 2015|NOBODY WANTS @twitter TO BE FACEBOOK FACEBOOK IS ALREADY FACEBOOK HOW HAVE YOU NOT FIGURED THIS OUT|24|41
7:50 AM - 8 Dec 2015|I hate Illinois Nazis https twitter com wvjoe911 status 674253402696740864|56|40
12:42 PM - 2 Dec 2015|Please stop asking us help We clearly can't shit Sincerely Thoughts Prayers|6.5K|9.2K
12:28 PM - 2 Dec 2015|Congress doesn't care tweets care votes money Tell yr rep they'll get neither til guns gone http www house gov representatives find #listrep|36|24
3:20 PM - 1 Dec 2015|Spain's national team vs @starwars BB-8 droid http es pn 1NGgSHA pic twitter com lwrhMgzmAo|54|98
12:21 PM - 29 Nov 2015|You sleep Twitter take shower Instagram raise child Facebook http ow ly VeCgk|1|0
12:23 PM - 29 Nov 2015|Two insights 1 worse past 2 worse mainly bc IRA ETA via @paul1kirby pic twitter com A4U4ukTHph|229|107
11:45 AM - 26 Nov 2015|Poverty literacy Here 26 charts maps thankful http bit ly 1FsJSsO pic twitter com 0bUE1acblL|108|99
8:00 AM - 25 Nov 2015|You re better giving small things time deserve Marcus Aurelius|58|99
9:47 AM - 24 Nov 2015|How give thanks like Marcus Aurelius http austinkleon com 2015 11 24 giving-thanks pic twitter com p0WTmTAgXh|11|25
9:25 AM - 24 Nov 2015|This might favorite Trump story far http mobile nytimes com 2015 11 25 us politics in-renovation-of-golf-club-donald-trump-also-dressed-up-history html _r 0|2|0
9:35 AM - 24 Nov 2015|Hint avoid Spirit Airlines basically like one wagons Oregon Trail Mabel gets dysentery http 53eig ht 1Nqm9Dd|375|439
12:59 PM - 23 Nov 2015|Gingerbread cookies top searched holiday cookie More #thanksgiving data https www google com trends story US_cu_PcHtFlEBAACBVM_en pic twitter com isCF84JrhW|9|5
9:08 AM - 23 Nov 2015|Share people voting Trump polls share think Apollo moon landings faked http 53eig ht 1I6udGG pic twitter com bJgB1IqOMg|1.1K|687
12:52 PM - 23 Nov 2015|Do better pretty good approximation national security policy debates https twitter com jialynnyang status 668894688242499584|9|5
12:46 PM - 23 Nov 2015|If Belgium traveling anywhere else enroll STEP security updates http ow ly UZvv3 http twitter com usembbrussels status 668886128326541313|57|24
2:42 AM - 23 Nov 2015|United States requests station armed border officials Madrid-Barajas airport http cort ZV9A pic twitter com 9o4hLzOcV3|6|0
9:10 AM - 22 Nov 2015|Donald Trump logical conclusion media enabled people lie unchallenged national stage|106|122
1:55 PM - 21 Nov 2015|Exactly https twitter com madridsports_ status 668130921875423232|31|26
11:01 AM - 21 Nov 2015|We got #HalaMadrid emojis Thanks @Twitter|14|4
9:12 AM - 21 Nov 2015|Here go pic twitter com ukI7L5vqHj|65|67
2:59 PM - 20 Nov 2015|On 40th anniversary former dictator's death EL PA S examines remnants Franco era Spain http cort ZOqc|11|7
2:18 PM - 20 Nov 2015|I love Russia tried close Lebanese airspace sending fax http www naharnet com stories en 194991-lebanon-airspace-risks-3-day pic twitter com oJk7h6gU8Z|139|92
10:02 AM - 20 Nov 2015|Dots #Syrians seeking asylum EU Red Dots show police think may terrorists http bos gl uBbS0D0 pic twitter com 77lRBGOxUy|228|117
3:05 AM - 20 Nov 2015|Alabama Governor Agrees Allow Syrian Refugees Who Can Run Sub-4 5 40 https medium com sportspickle alabama-governor-agrees-to-allow-syrian-refugees-who-can-run-a-sub-4-5-40-3caced68c1db# f61ucpele|1|1
1:15 AM - 20 Nov 2015|The awfulness daylight saving time mapped http bit ly 1QQVUW4 pic twitter com ky3TMqxyfP|15|27
12:05 AM - 20 Nov 2015|Fury Spain tributes anniversary Franco death - via @Telegraph http www telegraph co uk news worldnews europe spain 12006647 Fury-in-Spain-over-tributes-on-anniversary-of-Francos-death html|10|6
2:34 PM - 19 Nov 2015|TRUMP LEADING POLLS anagram GIN'D UP TROLL SAMPLE|524|631
3:19 AM - 19 Nov 2015|Reuters bans freelance RAW photography boost speed preserve reality' http www theverge com 2015 11 19 9759620 reuters-raw-photos-ban-worldwide utm_campaign theverge utm_content article 3Afixed utm_medium social utm_source twitter via @verge|4|4
2:18 PM - 18 Nov 2015|Give gift #believeinfilm Love Film Processing http oldschoolphotolab com product gift-certificates-2 Make someone happy Save pic twitter com 8Fw66r1Jkz|5|3
12:15 AM - 19 Nov 2015|Beaujolais Nouveau become 2015 occasion slightly meaningful fun http ow ly UOXFK|5|2
1:37 AM - 18 Nov 2015|Pride prejudice pic twitter com RIEVvuFWSe|217|106
12:01 AM - 18 Nov 2015|F ck We champagne says @Charlie_Hebdo_ cover week http nym ag 1X6Dgco pic twitter com lVyDaH4ccJ|76|72
12:54 PM - 16 Nov 2015|FRIGGIN OBVIOUSLY https twitter com ACLU status 666356921885134849|33|35
1:01 PM - 16 Nov 2015|would love wake smelling falafel tbqh https twitter com ThisIsFusion status 666345946016587777|7|26
6:12 AM - 16 Nov 2015|Sophisticated attacks Paris reveal strategic limits ISIS http mobile nytimes com 2015 11 17 opinion the-attacks-in-paris-reveal-the-strategic-limits-of-isis html smid tw-share referer|17|19
2:53 PM - 14 Nov 2015|Security Stade de France saved scores lives http www wsj com articles attacker-tried-to-enter-paris-stadium-but-was-turned-away-1447520571 alg y|11|13
8:50 AM - 14 Nov 2015|Why western leaders calling ISIS Daesh http www vox com 2015 11 14 9734894 daesh-isis-isil utm_campaign mattyglesias utm_content chorus utm_medium social utm_source twitter pic twitter com fl8Bh1lC2U|59|37
