10:08 AM - 11 Dec 2015|There's spider He's deep soul http wormhat com news go-fuck-yourselves pic twitter com hcMwwbKkmZ|76|138
7:42 AM - 11 Dec 2015|We tired hypocrisy hatred forward progress civilization #p2 #tcot #NoMoreNRA pic twitter com dpgIiBm1Gy|782|876
6:36 AM - 11 Dec 2015|A purrfect picture society http ift tt 1OX5FQf pic twitter com Kfq3zVYHHO|85|251
2:22 PM - 8 Dec 2015|Everything's opportunity SCIENCE pic twitter com szfwkn7gar|66|75
11:38 AM - 25 Nov 2015|We ve got thing get holiday spirit PEANUTS Retweet #SendCheer whole gang https amp twimg com v 2dd63b23-2347-48a2-b168-4f18ecc850d7|295|327
4:14 AM - 8 Dec 2015|Answering @realDonaldTrump @HussamA @CAIRLA argues he's work ISIS @MorningEdition @npr pic twitter com 3YUbPOHXCb|391|454
2:18 PM - 7 Dec 2015|Donald Trump unhinged His policy proposals serious|3.7K|4.4K
8:12 AM - 6 Dec 2015|C Peele Rose Hennessy way convent human life ended true life began vampire http www amazon com White-Rose-Nightfall-Carla-Peele dp 1466414782 ref sr_1_2 ie UTF8 qid 1448471989 sr 8-2 keywords Carla Peele tag 7654-20|8|2
1:03 PM - 4 Dec 2015|Cat covered concrete makes incredible recovery http bit ly 1O5UQZj pic twitter com WyDXGmtdtv|39|81
12:31 PM - 3 Dec 2015|Family finds frozen kitten brings back life http thedo 1SAfRPD pic twitter com ZcWd5TnuzM|82|110
12:23 PM - 3 Dec 2015|My new pet Sadly Not housebroken https www instagram com p -18rVsRxZh|156|668
8:12 AM - 2 Dec 2015|Carla Peele Fan #Prepping #ZombieApocolypse jokes Want keep prepare food without refrigeration http www amazon com Zombie-Apocalypse-Emergency-Preparedness-Cookbook dp 1516854373 ref sr_1_1 ie UTF8 qid 1448471989 sr 8-1 keywords Carla Peele tag 7654-20|5|3
1:44 PM - 1 Dec 2015|While cleaning garage today I thrilled find long-lost photo meeting @PaulMcCartney 1984 pic twitter com 4LG45bF77c|530|2.6K
4:57 PM - 24 Nov 2015|They know exactly they're pic twitter com yddvifxkJX|488|890
2:23 PM - 30 Nov 2015|The 13 Most Ridiculous Things From Last Night's #TheWalkingDead Midseason Finale http bit ly 1jvgVbh pic twitter com fWDxU6mULc|171|312
5:00 PM - 30 Nov 2015|Welcome back How break pic twitter com f15GvO9ZAf|215|631
3:04 PM - 30 Nov 2015|Sorry delay I'm #Gotham City right Just shenanigans go https twitter com gothamaddicts status 671464381021069312|118|388
9:08 PM - 30 Nov 2015|Sometimes I get angel dressed orange http fb 7IEwNUXrL|1|3
11:36 AM - 30 Nov 2015|This puppy punished horrific way - chewing cell phone http thedo 1ToqW6U pic twitter com icRttCKm9B|127|68
6:34 AM - 30 Nov 2015|She's strong independent cat knows wants http ift tt 1QPr15i pic twitter com zMjZGyUm65|52|157
6:36 AM - 27 Nov 2015|This dog NOT want get bed - blame http thedo 1OnTvQ9 pic twitter com GqYrwKT5bW|14|41
6:19 AM - 28 Nov 2015|Dad Hands Mom Newborn Girl But Watch What's Written H http url9 co 2W pic twitter com ddzGTuwWMd|173|23
1:48 PM - 26 Nov 2015|The best #recipe leftover turkey Turkey A La King http bit ly 1N2uP2c pic twitter com 7JZYnV3Ea2|16|41
7:28 AM - 26 Nov 2015|Happy Thanksgiving boy @kenjeong pic twitter com x6TFWLIY8s|7|23
1:34 PM - 26 Nov 2015|C Peele Rose Hennessy way convent human life ended true life began vampire http www amazon com White-Rose-Nightfall-Carla-Peele dp 1466414782 ref sr_1_2 ie UTF8 qid 1448573586 sr 8-2 keywords Carla Peele tag 7654-20|3|1
8:12 AM - 26 Nov 2015|C P Rose Hennessy way convent human life ended true life began vampire http www amazon com White-Rose-Nightfall-Carla-Peele dp 1466414782 ref sr_1_2 ie UTF8 qid 1448471989 sr 8-2 keywords Carla Peele tag 7654-20|6|1
12:03 PM - 23 Nov 2015|We #Gotham RT you're watching @Gotham tonight 8 7c @FOXTV pic twitter com GKMhXQScd4|138|164
4:53 AM - 22 Nov 2015|ICYMI This pic taken back deck house The boys settled Awesome sight http www whosay com l KtMbgbg wsref tw|7|73
5:14 PM - 21 Nov 2015|@SethMacFarlane @FamilyGuyonFOX drinking local establishment #petergriffin #epicqoute pic twitter com e3ZCUgBzEZ|122|751
9:57 AM - 20 Nov 2015|There powerful force unleashed young people resolve make change #JaneGoodall http janegoodall ca get-involved rootsandshoots pic twitter com XO7bLerGXt|5|6
9:11 PM - 19 Nov 2015|Me watching Jason Statham movie https twitter com janawhipple status 667567231019053056|35|313
1:02 PM - 19 Nov 2015|My dog taught everything I know love - childhood http thedo 1kFw4Z8 pic twitter com 8svvnu3vIk|36|68
6:26 PM - 17 Nov 2015|Ronnie Rainwater's bone-in bacon idea whose time come @emeril 's #Delmonico https instagram com p -NZdMpmd3v|7|12
11:28 PM - 16 Nov 2015|Heartbroken bird can't accept friend really gone http thedo 1LhYdu7 pic twitter com vjZJoIERyo|27|37
