8:30 AM - 10 Dec 2015|Retweet Follow @boosterjuice chance win 50 gift card #justforyou pic twitter com l02LAGiC6K|748|115
7:08 PM - 2 Dec 2015|It's time year want less everything worth #uni|43|27
6:15 AM - 8 Dec 2015|I'll incredibly upset green Christmas|2|0
10:00 AM - 7 Dec 2015|ANOTHER GIFT CARD GIVEAWAY STARTS NOW RETWEET Follow @boosterjuice chance win 25 GC pic twitter com AAHr7V4LC6|559|99
8:43 PM - 6 Dec 2015|ideal situation like fight club like im fighting someone im actually kicking ass like know also die|1|5
2:30 PM - 6 Dec 2015|#BoosterJuice Holiday Gift Card Giveaway 50 gift card grabs follow us retweet enter draw pic twitter com k7ncc2m9kD|490|80
10:00 AM - 5 Dec 2015|#JustForYou @boosterjuice giving away 100 gift card RETWEET FOLLOW US enter chance win pic twitter com sad2gCqN7w|718|127
6:09 AM - 25 Nov 2015|As student comforting words you'll ever hear I haven't started either|21K|17K
10:31 PM - 21 Nov 2015|princess diaries movie came mia's bushy eyebrows super freaky 2015 everyone's like want|7.2K|18K
6:51 AM - 19 Nov 2015|i'd rather 933 pic twitter com izB1Ntx4eL|135|259
11:43 AM - 15 Nov 2015|art museums n chill pic twitter com Q2YcUpokxm|5.3K|6.9K
