10:16 PM - 11 Dec 2015|Two old-timers Two all-timers pic twitter com 8LN6H8uXQI|2.9K|5.4K
6:20 PM - 11 Dec 2015|@smosh #WhenTheyAskYouHowFinalsWent I THINK I PASSED pic twitter com lPGz73lnrQ|54|263
2:01 PM - 11 Dec 2015|Sharks swim toward storms instead running away like animals|322|870
10:56 PM - 30 Nov 2015|You call prison There ladder I healed broken back 5000 pushups make impossible jump pic twitter com LF2KpSw9hU|42|72
8:00 AM - 11 Dec 2015|GPA won't matter heaven GPA won't matter heaven GPA won't matter heaven|2.8K|4.4K
12:15 AM - 11 Dec 2015|NOOO NOT THE DOG pic twitter com ZhyQHZfQxd|1.2K|2.2K
8:51 PM - 10 Dec 2015|Vikings really call bad play fatal last play They definitely didn't QB favors many crossing routes|2|19
2:11 PM - 10 Dec 2015|James Bond savage pic twitter com 24Nwfbsz5a|1.5K|4K
7:07 AM - 9 Dec 2015|College finals VS High school finals pic twitter com MlILCFGfWP|1.6K|1.6K
10:14 AM - 6 Dec 2015|I'll believe Jimmy Carter's brain cancer gone I hear someone doesn't brain cancer|388|1.4K
9:36 AM - 10 Dec 2015|Lord Nearquaad Lord Farquaad Lord wherever arequaad pic twitter com R9dxl36Yjo|179|341
9:29 AM - 10 Dec 2015|Just admiring Cenary pic twitter com QuEUIa6Jty|645|1K
6:07 AM - 10 Dec 2015|Walking teachers office hours finals week pic twitter com CXujYqQWh1|4.4K|5.8K
7:07 AM - 10 Dec 2015|I don't always drink beer But I Most people feel quite strongly I shouldn't Stay thirsty friend #rejectedbeercommercial|1.1K|3.9K
7:03 AM - 10 Dec 2015|I don't always drink beer But I I'm licensed commercial airline pilot Stay thirsty friend #rejectedbeercommercial|827|3.2K
9:23 PM - 9 Dec 2015|I'm Feliz Navidone semester|2.1K|2K
5:50 PM - 6 Dec 2015|When someone asks I've started studying finals http vine co v eDe3Lg5LhlF|14K|12K
11:15 AM - 9 Dec 2015|Me Falcons fan year pic twitter com nzr1lpBR1I|7.9K|7.8K
4:57 PM - 9 Dec 2015|Me walking last final pic twitter com Hp8d5Vu4vz|2.3K|3.8K
3:07 PM - 9 Dec 2015|Cover 4 Madden 16 pic twitter com PNoatCp81r|13|74
12:59 PM - 9 Dec 2015|The No 1 play Wk 13 Oh longest offensive game-winning TD final play regulation since 1983 pic twitter com U8Kwb6wuKp|166|281
4:26 AM - 9 Dec 2015|When you're Christmas af still finals take pic twitter com 9N5GOFjTQ5|1.8K|2.4K
11:43 PM - 8 Dec 2015|People Facebook like pic twitter com 94XC57rnOi|1.2K|2.5K
8:00 PM - 8 Dec 2015|Forever hilarious https vine co v i7XPiH6WYnQ|1.5K|2.8K
7:12 PM - 8 Dec 2015|WATCH Sparring Camera Ryan Coogler Discusses Long Take CREED http goo gl BVnVXG pic twitter com zuGuzt31th|76|164
6:43 PM - 8 Dec 2015|The effective way handle problems pic twitter com B3NakddjwQ|1.5K|3.3K
5:52 PM - 8 Dec 2015|Accurate pic twitter com eHSUDC7lfq|1.1K|1.9K
2:04 PM - 8 Dec 2015|Toby trying talk Pam|1.3K|2.1K
8:09 AM - 8 Dec 2015|When prof ask I didn't hw weekend pic twitter com fT0dxLN3cj|1.7K|3.8K
9:51 AM - 8 Dec 2015|How finals going pic twitter com qs8bAhKfyE|4.2K|5.5K
6:43 AM - 8 Dec 2015|When u finally go room night roommate's alarm goes 5 mins later Yeah I stayed night|1|3
11:05 AM - 8 Dec 2015|With finals next week pic twitter com zW3JZ3TpZw|9|11
10:15 PM - 7 Dec 2015|Bruh pic twitter com 4KernsJ2SG|2|3
2:40 AM - 7 Dec 2015|Girls days pic twitter com s7VhvbaCZh|1.4K|2.8K
12:34 AM - 7 Dec 2015|I'm gonna talk Bosh whatever he's background pic twitter com Y5CHSq0aZA|11|41
10:34 PM - 6 Dec 2015|I'm gonna chill watch episode Game Thrones -me 12 episodes ago|202|753
9:07 PM - 6 Dec 2015|It's point semester pic twitter com 6RvqXdZ4ZM|1.2K|1.1K
9:34 PM - 6 Dec 2015|I say hi Lebanese fans https twitter com IbrahimHanna21 status 673727601173643264|247|929
7:49 PM - 6 Dec 2015|im person 11 11 dreams living 11 12 life|1.7K|2.9K
4:35 PM - 6 Dec 2015|Another #19 drops pass This time Brandon LaFell Amendola also dropped pass None Brady's fault Dudes can't catch|1.6K|1.3K
4:45 PM - 6 Dec 2015|Tom Brady defensive player year http vine co v i7J5bLEzqOH|3.4K|4.3K
4:12 PM - 6 Dec 2015|Why people leave early #Dopes #FairweatherCunts|215|857
3:56 PM - 6 Dec 2015|This happens O line gets decimated lose Gronk Edelman Dion Lewis Amendola doesn't look 100|1.5K|1.4K
4:11 PM - 6 Dec 2015|Christmas movies chill|1.3K|1.8K
4:07 PM - 6 Dec 2015|Patriots' top receivers 1 Danny Amendola 62 yards 2 Scott Chandler 47 yards 2 Tom Brady 36 yards #PHIvsNE pic twitter com UJfrmmxLKd|344|399
3:38 PM - 6 Dec 2015|Brady needs stick playing WR QB thing|13|46
11:21 AM - 6 Dec 2015|OBJ ALERT Beckham bursts 72-yard TD And busts INSANE hurdles dance end zone http snpy tv 1TuibI5|5.2K|5.9K
11:00 AM - 6 Dec 2015|Jimmy You're thinking dick #SouthPark|608|1.5K
11:34 AM - 6 Dec 2015|Anyone want help design market 'drone accident first aid kit' We'll millionaires February|3|12
6:23 PM - 5 Dec 2015|Netflix would leave choice|1.5K|2.6K
5:09 PM - 5 Dec 2015|The Mount Etna eruption looked insaaane pic twitter com 3LHCY64mfn|1.3K|2.7K
2:40 PM - 5 Dec 2015|#Rambo New Blood TV Show Is In The Works --- http tmto es Vv1Jc pic twitter com C2yBz6APmf|41|34
3:09 PM - 5 Dec 2015|I never make mistake twice I make 5 6 times sure|1.2K|1.5K
4:06 PM - 5 Dec 2015|We see Reggie https twitter com usc_athletics status 673290680932806658|38|69
7:45 PM - 4 Dec 2015|Saying Kobe shoot something trashcan longer means thing|1.4K|2.5K
12:43 PM - 4 Dec 2015|Show cock pic twitter com Bm1Wj3V10a|1.7K|3.2K
11:08 AM - 4 Dec 2015|The Chicago Bull dynasty 1990s pic twitter com ARHrIFquFj|354|502
10:46 AM - 4 Dec 2015|Jimmy thinks ads may bad - Watch full episode FREE @ http cart mn TruthAndAds https amp twimg com v 7ed6da02-78ef-4a71-951f-4729fea01a9a|220|452
9:36 AM - 4 Dec 2015|Why funny pic twitter com 9KQ2E9NSdG|211|359
8:18 AM - 4 Dec 2015|Richard Rodgers recaps game-winning #touchdown WATCH http pckrs com 294a pic twitter com z0GR0dzcAh|122|558
6:13 AM - 4 Dec 2015|Why Peter Pan always flying He neverlands I like joke never grows old|743|1.3K
12:52 AM - 4 Dec 2015|Aaron Rodgers You live days like WATCH http pckrs com aun9 pic twitter com oHrH8fDwAU|696|2.3K
12:45 AM - 4 Dec 2015|The difference South Park The Simpsons pic twitter com xCd2r9JSu8|1.5K|3K
10:48 PM - 3 Dec 2015|#HailMary Reactions @richeisen @marshallfaulk @SteveMariucci @michaelirvin88 Edition http snpy tv 1NubrFt|358|513
10:42 PM - 3 Dec 2015|Over course walking 7 11 ive seen police chase fire truck ambulance lol|1|2
9:48 PM - 3 Dec 2015|We'll watching espn classic long time come|463|2.1K
10:01 PM - 3 Dec 2015|#Packers pull miracle win Detroit RECAP http pckrs com d7f5 pic twitter com RbBJIInbWG|613|1.5K
10:18 PM - 3 Dec 2015|There nothing better rushing field big @packers win #GoPackGo #dogpile pic twitter com KpPo8bRmqS|903|2.9K
10:19 PM - 3 Dec 2015|Can't stop watching #GoPackGo pic twitter com JlzhRiyD5S|2.3K|3.3K
10:34 PM - 3 Dec 2015|Always pic twitter com DwuSiVgDKH|622|1.2K
10:37 PM - 3 Dec 2015|home win #GoPackGo pic twitter com XG50fOGxhC|692|3.1K
9:32 PM - 3 Dec 2015|Rodgers draft day Brett amazing QB he's favorite QB since Joe Montana retired #TheTimeline pic twitter com GpTep4yRGQ|157|526
9:25 PM - 3 Dec 2015|When lead Packers 4th-largest comeback 20 points franchise history pic twitter com YhDVDtOOQf|898|2.5K
9:23 PM - 3 Dec 2015|Rodgers We kept fighting pushed adversity I'm proud guys|364|1.3K
8:48 PM - 3 Dec 2015|Aaaaaaaaaahhhhhhhh He's Baaaaaaaaaaaddddddd Man Packers win baby Do hear @RealSkipBayless Haaaaaaa|4.4K|5.7K
8:44 PM - 3 Dec 2015|Go Pack f'n Go|6.4K|9.2K
8:56 PM - 3 Dec 2015|I lost voice|2.9K|7.8K
9:05 PM - 3 Dec 2015|When says shes pregnant http vine co v iWPWHYxKguv|873|1.9K
9:08 PM - 3 Dec 2015|I knew could throw far amazing play --Richard Rodgers Motown Miracle pic twitter com clAODTpFEU|656|1.9K
7:00 AM - 3 Dec 2015|Watch Truth Advertising FREE http cart mn TruthAndAds pic twitter com rGc0j9wbTX|397|883
9:47 PM - 29 Nov 2015|If Justin Bieber make big come back grades|3.9K|6.4K
7:39 PM - 2 Dec 2015|When someone asks I've started studying finals https vine co v eDe3Lg5LhlF|7.3K|7.3K
10:45 AM - 2 Dec 2015|My death probably caused sarcastic wrong time|1.5K|1.8K
7:10 AM - 2 Dec 2015|So much truth hurts pic twitter com RFsWgzhbZA|520|1.5K
8:15 AM - 2 Dec 2015|Hoes like pic twitter com U91x5WEN50|647|2.1K
4:15 AM - 2 Dec 2015|The 2016 Bugatti Vision I'm literally drooling pic twitter com c3M6beH4Af|2.8K|5.5K
8:30 AM - 2 Dec 2015|Kobe Kobe ICYMI 76ers fans showed hometown star Kobe Bryant love final game Philly http es pn 1LNYQvN|512|1K
8:24 PM - 1 Dec 2015|When you're quit job pic twitter com i0PxhxUAVr|1.3K|2.6K
8:42 PM - 1 Dec 2015|life social experiment|604|1.1K
7:45 PM - 1 Dec 2015|No one likes soccer pic twitter com FYroS6zj16|3.1K|2.8K
8:21 PM - 1 Dec 2015|XMAS IS COMING pic twitter com 0JHGW5maKi|45|53
9:58 PM - 1 Dec 2015|I went marijuana dispensary you'll never guess happened next https www youtube com watch v vi844BAIBPE|7|12
10:05 PM - 1 Dec 2015|Sorry I'm king webserieses|1|9
11:15 AM - 1 Dec 2015|How Kobe fare last game Philly @RealSkipBayless predicting vintage Mamba http es pn 1jxh3XP|138|369
5:00 AM - 23 Nov 2015|#ChooseYourSide awaken Force within http google com starwars pic twitter com yFhEDJVmcp|4.8K|11K
3:32 PM - 30 Nov 2015|We gotta go 1-0 week Randall Cobb talks #GBvsDET http pckrs com 53qv pic twitter com Pt0R7EAEGj|86|319
3:35 PM - 30 Nov 2015|Played game And beat Pats The @Broncos title buzz back via @jeffrichadiha http nfl com 1XCYqiE pic twitter com X3eTWtpwRL|237|813
3:28 PM - 30 Nov 2015|LIVE #MundyNightRaw w @creedmovie composer @ludwiggoransson 30 min Watch http ScreenJunkies com SKYPE IN pic twitter com QxLaX6A7m6|9|53
9:31 AM - 30 Nov 2015|It's time u take sit back relax enjoy u built Love u lil bro @kobebryant pic twitter com zDcNjWHBDp|28K|31K
10:01 AM - 30 Nov 2015|Cyber Monday Skynet|30|100
9:30 AM - 30 Nov 2015|The difference girl friend girlfriend little tiny space called friend zone|1K|2K
9:36 AM - 30 Nov 2015|Last minute papers due finals coming lowkey becoming broke food fun studying can't focus pic twitter com Hb7qydVnwe|284|362
8:29 AM - 30 Nov 2015|Outside QBs Gronk NFL's important Jenga piece Take Patriots' puzzle implodes https twitter com SteveDelSports status 671364242940035072|7|21
8:59 AM - 30 Nov 2015|WATCH Furiosa Road The Biggest Badass MAD MAX Isn't Mad Max http goo gl jch3P8 Created @kiva_jane pic twitter com c4eECJBtt6|90|225
9:00 AM - 30 Nov 2015|This picture opening someone pic twitter com 5JlsdGIHCt|554|1K
9:21 PM - 29 Nov 2015|To one greatest ever Thank You #BlackMamba #TreasureToTheGame|4.8K|5.6K
9:33 PM - 29 Nov 2015|We miss Kobe Bryant Thanks fun years http www theplayerstribune com dear-basketball|548|763
8:31 PM - 29 Nov 2015|THIS pic twitter com C75sz4D68W|8.9K|12K
10:10 PM - 29 Nov 2015|When Kobe told Michael Jordan season would last No 23 advice No 24 Just enjoy pic twitter com iqaTQfDScu|3.2K|5.8K
10:13 PM - 29 Nov 2015|It took forever Oakland @RAIDERS finally found man - @michaelirvin88 pic twitter com AzoQXsyXag|651|1.3K
10:30 PM - 29 Nov 2015|There never another Kobe Bryant Magic Johnson Kobe NBA legacy http es pn 1NhCUu0|1.8K|2.6K
9:19 PM - 29 Nov 2015|Congrats Black Mamba Of moments you've provided game greatest attribute never ever cheated|4.1K|5K
9:20 PM - 29 Nov 2015|You always game play On rare occasions fell always went swinging What asked great ones|1.4K|2.1K
7:30 PM - 29 Nov 2015|Romo needs nomo pic twitter com OKcql12BEy|396|815
7:15 PM - 29 Nov 2015|Love hate Kobe leave behind one NBA's impressive legacies http es pn 1XqxRlR pic twitter com h86NyhAg5t|2.9K|3.9K
7:29 PM - 28 Nov 2015|Christian McCaffrey moved past Reggie Bush all-purpose yards season Pac-12 history pic twitter com Ix988qA9JM|809|1.5K
8:09 PM - 28 Nov 2015|Michael B Jordan's Air Jordan game CREED strong #infrared6s #bred11s|18|80
6:59 PM - 28 Nov 2015|Lebron made game winner don't see everyday Nice shot took wasn't fadeaway jumper left|4|28
3:29 PM - 28 Nov 2015|THIS MAN IS UNIFIED HEAVYWEIGHT CHAMPION #KlitschkoFury https vine co v Ov97EpXbIHK|856|511
4:31 PM - 28 Nov 2015|I finally found use old Austin Powers clip The joke works well pic twitter com ydytoseGmJ|215|495
4:15 PM - 28 Nov 2015|What Roll Tide #JeopardySports pic twitter com cXmbDv9nhn|817|1.1K
3:21 PM - 28 Nov 2015|A new heavyweight champion 6-foot-9 Tyson Fury upsets Wladimir Klitschko unanimous decision #klitschkofury pic twitter com hKPKqKwPMR|897|986
3:45 PM - 28 Nov 2015|Never leave bro behind pic twitter com PkqysSyFu5|1.1K|3.1K
12:08 PM - 28 Nov 2015|Only people severe head trauma buying tickets Concussion|2|7
3:55 PM - 28 Nov 2015|LA belongs Trojans USC snaps 3-game drought UCLA earns first trip Pac-12 title game 40-21 win pic twitter com X41x5cFQhJ|1.8K|1.8K
9:30 AM - 28 Nov 2015|True squad goals pic twitter com I9yBW5qYcz|688|1.4K
10:55 PM - 27 Nov 2015|How Sally Mae really feels pic twitter com 5s96tZKahg|640|1.7K
5:26 PM - 27 Nov 2015|Aaron Rodgers became fastest QB NFL history 250 #touchdown passes Read http pckrs com 672r pic twitter com 24oiZbXeox|477|755
2:10 PM - 27 Nov 2015|Can I get amen pic twitter com dHPeQBiEwf|2.3K|4.2K
12:10 PM - 27 Nov 2015|Hey @Shakira My Hips Don't Fib would've better choice GOD BLESS|252|920
12:46 PM - 27 Nov 2015|Are ready #StarWars #TheForceAwakens pic twitter com ZnBlTQGVzN|5.2K|6.8K
12:51 PM - 27 Nov 2015|Happy birthday great Bruce Lee #BruceLee75 #legend|5.6K|12K
10:30 AM - 27 Nov 2015|How come every time talk somebody it's betraying somebody else #BlackFriday pic twitter com oSSMtwCV2m|375|988
10:06 AM - 27 Nov 2015|Go scoop last Barbie doll break bitch half checkout|108|741
7:00 AM - 27 Nov 2015|Sony announced offering special Black Friday Bundle called Brack Friday Bunduru #SouthPark pic twitter com BqkcpTuwje|1.5K|2.4K
9:49 AM - 27 Nov 2015|Happy Black Friday pic twitter com seU3Ukajm4|1.5K|1.9K
12:05 AM - 27 Nov 2015|Schwarzenegger paid approximately 21 429 every word said Terminator 2|42|154
8:24 PM - 26 Nov 2015|Tonight's attendance Lambeau 78 488 #CHIvsGB|166|395
8:23 PM - 26 Nov 2015|Come #packers It's 4 22am I'm starting hallucinate sleep deprivation|14|36
8:05 PM - 26 Nov 2015|He's coming back I looking passport|8|18
8:06 PM - 26 Nov 2015|Hard believe Brett Favre Aaron Rodgers hug halftime ceremony ended completely sincere|224|887
7:44 PM - 26 Nov 2015|Give jersey back I go - Brett Favre|680|977
7:46 PM - 26 Nov 2015|Nooooo Please injuries|2|11
7:25 PM - 26 Nov 2015|Favre shakes hands hugs Rodgers Gives final waves crowd exiting Lambeau tunnel|646|1.9K
7:25 PM - 26 Nov 2015|I grew Wisconsin watching awe #4 every Sunday He left field every single week That's made special|4.8K|17K
7:26 PM - 26 Nov 2015|Cool scene Lambeau - Starr Favre Rodgers NFL's all-time best QB trinity|50|124
3:18 PM - 26 Nov 2015|Black Friday deal college tuition thing|2.7K|4.1K
7:13 PM - 26 Nov 2015|That's rain Green Bay That's God crying tears joy Brett Favre jersey retirement - John Madden|2.1K|2.2K
7:17 PM - 26 Nov 2015|I've decided I want play - Brett Favre jersey retirement|870|1.4K
7:21 PM - 26 Nov 2015|Bart Starr Brett Favre Incredible #TH4NKSGIVING pic twitter com z7hiaM8Kg9|10K|15K
6:30 PM - 26 Nov 2015|@rejectedapclass Where going college Do girlfriend Why crying table|145|457
6:13 PM - 26 Nov 2015|Rodgers Lacy Touchdown #TOUCHDOWN @packers 7 @ChicagoBears 0 #CHIvsGB http snpy tv 1Il2QU7|118|235
6:01 PM - 26 Nov 2015|Eddy Lacy producing fantasy team real life|2|28
11:22 AM - 26 Nov 2015|Green Bay I m coming home Tell world #4ever #OurColors @TideNFL pic twitter com 0XfopiFNSj|11K|13K
3:56 PM - 26 Nov 2015|Aaaahhhhhhhh What I tell @RealSkipBayless Huh Not 1 Pick-6 ROMEO - 2 Hey How 'Bout Dem Cowboys Aaaahhhhhh|2.9K|4.1K
1:34 PM - 26 Nov 2015|PICKKKKKKKKK-6 And @Panthers board #CARvsDAL|1.5K|1.7K
1:30 PM - 26 Nov 2015|4 hours #CHIvsGB #TH4NKSGIVING pic twitter com xVEMiCwZMJ|1.1K|1.4K
10:52 AM - 26 Nov 2015|Happy Thanksgiving Enjoy family today And family I mean football|146|327
11:20 AM - 26 Nov 2015|Happy Thanksgiving America|489|1.5K
11:27 AM - 26 Nov 2015|HAPPY THANKSGIVING family|702|1.8K
9:35 AM - 26 Nov 2015|Random acts kindness worst thing like fuck honestly|4.7K|16K
5:00 AM - 26 Nov 2015|Family Friends Food And Football Happy Thanksgiving pic twitter com 3V3UXBDXVk|3.7K|3.9K
5:08 AM - 26 Nov 2015|Happy #TH4NKSGIVING happy GAMEDAY #GoPackGo pic twitter com 1eNQsaGfJA|1.5K|1.7K
7:18 AM - 26 Nov 2015|Hope great day Watching football eating enjoying family doesn't get much better @nflnetwork pic twitter com OSDHn1QlWH|139|250
7:41 AM - 26 Nov 2015|Please find help need today Someone waiting talk today You alone 1-800-273-8255 #suicideprevention|693|1.2K
8:45 PM - 25 Nov 2015|Sliding crush's DMs like https vine co v e9jB1ZTbbB6|1.5K|2.7K
2:18 PM - 25 Nov 2015|You used call shell phone pic twitter com 66MysuD8A1|1.7K|2.7K
2:06 PM - 25 Nov 2015|OH SNAP The Very Best #ThanksgivingClapBack Hashtag http www smosh com smosh-pit photos very-best-thanksgivingclapback-hashtag pic twitter com svbw0J0wmF|670|2K
7:55 AM - 25 Nov 2015|Fun Thanksgiving Game At dinner pick grandma's gravy boat pour generous amount living room carpet say That homies|28|59
9:31 PM - 24 Nov 2015|After seeing young people sold Pittsburgh show I realize I'm female Betty White|123|415
9:17 PM - 24 Nov 2015|Here's trailer looking #CaptainAmericaCivilWar https amp twimg com v 3c1c85a0-6603-43b4-b9af-b55725c9ba52|64K|55K
9:19 PM - 24 Nov 2015|Divided fall #CaptainAmericaCivilWar pic twitter com 9J2KmPNtxK|6.1K|5.8K
9:30 PM - 24 Nov 2015|He tried lol https vine co v eHPY661bOJA|3.2K|5.2K
7:52 PM - 24 Nov 2015|THE NUMBER 1 PLAY OF WEEK 11 @packers WR James Jones' toe-dragging 27-yd TD pic twitter com bBJUSQ35yP|172|364
9:01 PM - 24 Nov 2015|#CREED Certified Fresh 94 --- http tmto es V37Ir pic twitter com dyrPt8ghDl|252|334
3:05 PM - 24 Nov 2015|When find @DrakeBell guest starring new episode @grandfathered #grandfathered #cancelchristmas pic twitter com HWItgydK6b|2K|7.9K
10:30 AM - 24 Nov 2015|MOM BATHROOM Watch classic Make Love Not Warcraft http cart mn Mom_Bathroom pic twitter com DvstKH71X9|264|876
4:38 PM - 23 Nov 2015|You know The Pack back I think Packers definitely win NFC North - @SteveMariucci pic twitter com 3Vwe9MClv8|109|221
3:30 PM - 23 Nov 2015|On Stephen Colbert show tonight pic twitter com gNXV9BtBhe|201|857
4:10 PM - 23 Nov 2015|10 minutes said I'll ready 5 minutes pic twitter com vhbRxSPkog|832|1.8K
3:47 PM - 22 Nov 2015|THATS LIKE THE AVERAGE PERSON GETTING FINED 25 CENTS pic twitter com gKXmTUJtZU|2K|3.9K
3:59 PM - 22 Nov 2015|Aaron Rodgers throwing darts run James Jones #ToeDragSwag Touchdown #GBvsMIN http snpy tv 1YorRqO|847|1.3K
6:40 PM - 22 Nov 2015|Sounds right pic twitter com Y3ytTZTnVr|700|1K
4:28 PM - 22 Nov 2015|Chants #GoPackGo fill TCF Bank Stadium|1.1K|1.7K
12:32 PM - 22 Nov 2015|Hi I'm college Chip Kelly I DirecTV And I'm NFL Chip Kelly I cable|1.5K|1.5K
12:09 PM - 22 Nov 2015|Fingers crossed A-Rod Packers get mojo back today Let's make weekend owls packers double|3|21
10:03 AM - 22 Nov 2015|DONNY YOU SAVAGE pic twitter com Ieickjmek2|4.2K|8.4K
12:52 AM - 22 Nov 2015|My daily struggle pic twitter com swbOsXu8OY|1.5K|2.1K
9:33 PM - 21 Nov 2015|What fight Round Bigtime Canelo gets Bigtime power shots If Cotto away HE WILL FALL|176|269
9:39 PM - 21 Nov 2015|Man I NOT miss Mayweather|1.5K|1.7K
9:41 PM - 21 Nov 2015|Damn good fight But Cotto small Canelo Just small Every single shot Canelo power shot Damn Canelo|471|573
9:50 PM - 21 Nov 2015|Good fight Just I predicted Canelo Alvarez won 7-5 Flat-footed threw power shots Connected Cotto valiant lost|419|629
9:51 PM - 21 Nov 2015|Canelo grown boxer|720|869
8:49 PM - 21 Nov 2015|@cjpro7 I wonder challenge anyone game Basketball|1|1
3:39 PM - 21 Nov 2015|Fight legacy #CREED #Thanksgiving pic twitter com xFG4jwBvCb|1.4K|2K
4:06 PM - 21 Nov 2015|Leaving school Thanksgiving Break like https vine co v izzzuUVQnHn|8.4K|9.8K
4:55 PM - 21 Nov 2015|College protests race riots police violence Islamic terrorism Clinton Bush running president-- general public ideas|10|29
7:45 AM - 21 Nov 2015|Lightning storm space basically one coolest things could ever see https vine co v MFzIvZBq6M7|3.2K|5.2K
1:25 PM - 21 Nov 2015|24 hours #GBvsMIN pic twitter com 7uu9KXNrOQ|558|989
1:30 PM - 21 Nov 2015|I'm filming Social Experiment I throw live babies volcano prove throwing babies volcano wrong #SocialJustice|244|609
12:13 PM - 21 Nov 2015|Would anyone look upon I told I 0 36 K D ratio black ops 3|6|54
11:13 AM - 21 Nov 2015|When feels like you're watched #SpongeBobMovie pic twitter com RM805EXqJQ|144|430
8:45 PM - 20 Nov 2015|When go girl house watch movies actually puts movie pic twitter com cOTsuUPO6X|582|2K
9:13 PM - 20 Nov 2015|EMPLOYEES WE WANT 15 AN HOUR MCDONALDS pic twitter com Kpk4JlWExt|1.7K|3.8K
9:29 PM - 20 Nov 2015|This game @AaronRodgers12 put team back http nfl com 1I2DhfU pic twitter com lRe1BSOHoB|239|625
7:15 PM - 20 Nov 2015|What Mike Tyson take he's sick pic twitter com oJwLOykkcs|485|715
7:25 PM - 20 Nov 2015|When touch booty first time pic twitter com L2sPnp9lKq|1.3K|2.8K
2:18 PM - 20 Nov 2015|When F-bomb used appropriately pic twitter com Jpk7AuMLN7|1.8K|3.1K
8:52 AM - 20 Nov 2015|My life romantic comedy except I'm one knows|932|2.3K
6:58 PM - 19 Nov 2015|In dorm slight crack wall Open crack find Wow pic twitter com ZeV2wdEu2t|412|972
8:34 AM - 20 Nov 2015|The Hangover pic twitter com oWfknTLfKF|187|365
8:46 AM - 20 Nov 2015|More people visit France country world http 53eig ht 1SM5bNp pic twitter com XO475SO49Z|20|24
9:49 PM - 19 Nov 2015|Realest goat 2015 https vine co v OXAUvbKQWOw|2.1K|3K
8:04 PM - 19 Nov 2015|48-shot revolver 1855 pic twitter com Kh5PIID4B6|91|191
8:27 PM - 19 Nov 2015|GOOD WILL HUNTING 1997 DoP Jean-Yves Escoffier Dir Gus Van Sant http goo gl hcAVNy pic twitter com VIUcFTYi0T|143|267
8:07 PM - 19 Nov 2015|Hey @creedbratton Enough people thought I telling go see band Creed I think next concert's lineup|269|2K
8:19 PM - 19 Nov 2015|Hey Titans wanna actually win game tonight pic twitter com 3xve0RoEkA|22|52
3:13 PM - 19 Nov 2015|I know Tony Romo coming back Eli best QB NFC East - @SteveMariucci pic twitter com ZCBejOAhi5|526|586
2:38 PM - 19 Nov 2015|Hey @google When I type word I want link http dictionary com websters sucks freedictionary sucks Stop sellout|2|7
1:02 PM - 19 Nov 2015|Mysterious Florida walk-on Jim Jebow excels tryout wins starting position pic twitter com 8R0F0ANmFf|1.5K|2.4K
9:30 PM - 17 Nov 2015|love one direction pic twitter com RSQenIO56i|9.2K|18K
11:29 PM - 16 Nov 2015|Puberty hit like bus pic twitter com yFqA62yUOL|748|893
9:15 PM - 18 Nov 2015|No-Shave November going well pic twitter com bH5SJgpnGz|2.4K|3.8K
8:58 PM - 18 Nov 2015|I get used nothing ever working|906|1.6K
5:51 PM - 18 Nov 2015|I'd like take moment appreciate love life Food|2|5
5:28 PM - 18 Nov 2015|James Jones We need win period WATCH http pckrs com k6al pic twitter com UR7Oj6cRUj|135|443
9:06 AM - 18 Nov 2015|Kevin McHale fired tough James Harden https vine co v OHxx0jiaJMz|2K|1.8K
8:26 AM - 18 Nov 2015|Mad Muggin' The ZOOLANDER 2 Trailer Is Here http goo gl cgxe4w pic twitter com 9FVz1DDopP|82|99
6:29 AM - 18 Nov 2015|#Packers go back road big NFC North battle Get ready #GBvsMIN http pckrs com y4dd pic twitter com 2hZWHfK0Bu|156|334
8:30 PM - 17 Nov 2015|Almost 9pm Now's good time start day|2|13
7:15 PM - 17 Nov 2015|Crazy girlfriends like https vine co v iBgvQwrJOg1|2.8K|4.4K
5:34 PM - 17 Nov 2015|He's baaaack DOG-RIDING MONKEY ALERT DOG-RIDING MONKEY ALERT DOG-RIDING MONKEY ALERT via @espn http snpy tv 1YfFsRc|2.3K|2.7K
5:50 PM - 17 Nov 2015|When you're ready go home mom keeps talking friends pic twitter com d2Ng3HGW7e|1.6K|3.5K
5:58 PM - 17 Nov 2015|Packers-Vikings rivalry intensifying http pckrs com tg3m #GBvsMIN pic twitter com 2FncPwq69Q|92|294
6:06 PM - 17 Nov 2015|When internet connection weak start regretting life whole|8|20
3:44 PM - 17 Nov 2015|Watch all-new episode tomorrow night Comedy Central pic twitter com 6t05CGzZjW|309|669
4:20 PM - 17 Nov 2015|Jordan year #illest pic twitter com zmjCWTU4V2|1.4K|3K
1:46 PM - 17 Nov 2015|I've watched every good movie TV show I knew day would come I'm moving USA TNT|1|12
10:45 AM - 17 Nov 2015|u know u failed test ur teacher gave u paper like pic twitter com LxWBECZBGT|2.1K|3.9K
11:00 AM - 17 Nov 2015|Barney #HIMYM pic twitter com GGwe8FyHwZ|245|591
11:11 AM - 17 Nov 2015|Can I add I hate commercials I've seen 40 million maybe 6 relevant|1|8
2:24 AM - 17 Nov 2015|Drunk Zeke I'm nazi I find shwasticka aesthetically appealing|1|1
7:49 PM - 16 Nov 2015|Randall Cobb It's us WATCH http pckrs com 7w7b pic twitter com VejW9SeY3p|53|220
8:15 PM - 16 Nov 2015|This good pic twitter com 1bSnxapvTo|509|1.2K
5:50 PM - 16 Nov 2015|After LONG Monday https vine co v ex5hjbbaW96|1.7K|2.4K
3:45 PM - 16 Nov 2015|I m never sure I actually free time I m forgetting everything I|1.8K|2.1K
2:50 PM - 16 Nov 2015|you're @AaronRodgers12 can't lose hapless @Lions http es pn 1l0jDGM|53|172
2:25 PM - 16 Nov 2015|Sunday's loss sets important NFC North meeting Minnesota http pckrs com hubu pic twitter com FQdbxow1xg|41|129
1:20 PM - 16 Nov 2015|basically pic twitter com Bwlk4B38IE|1.2K|2.1K
8:16 AM - 16 Nov 2015|Today like pic twitter com A1ebw4ZjmC|451|314
11:12 AM - 16 Nov 2015|You guys JJ JJ Abrams stands Jar Jar pic twitter com VaweNjIJ3t|108|222
7:44 PM - 15 Nov 2015|Never cocky pic twitter com sL8oxUKx7C|5.6K|7.6K
7:40 PM - 15 Nov 2015|When beers left https vine co v hx3LPmXzX5i|1.7K|2.7K
7:25 PM - 15 Nov 2015|HALF The Cardinals lead Seattle #AZvsSEA pic twitter com NG8V0YfoSN|95|213
4:28 PM - 15 Nov 2015|That's I give Eli owns Brady|1.4K|1.5K
2:14 PM - 15 Nov 2015|This strangest weekend|1|1
2:14 PM - 15 Nov 2015|WE LIKE THAT http snpy tv 1RXBHfs|5.1K|7.7K
1:49 PM - 15 Nov 2015|Doesn't every coach defer toss nowadays lol https twitter com realskipbayless status 666009475925598208|6|23
1:41 PM - 15 Nov 2015|I'll tell man I would Aaron Rodgers kick ball man - Jon Gruden|321|518
1:07 PM - 15 Nov 2015|Maybe Packers try tackle #TryingToRipTheBallAway|50|131
