11:30 AM - 15 Nov 2015|Hillary Clinton said campaign donations small #DemDebate lol wut http slate 1StPjPr pic twitter com JoiWvtRqTz|109|79
11:32 AM - 15 Nov 2015|Kirk Cousins half 17-of-20 296 YDs 3 TDs You like You like pic twitter com 9v9Y1FrVN7|470|808
11:39 AM - 15 Nov 2015|I haven't sworn Twitter Damn I'm f king good sh Find naughty nice http socialsanta co user BlackNerd|11|50
10:48 AM - 15 Nov 2015|Had one many last night Woke totally Rousey'd|2|14
8:40 AM - 15 Nov 2015|Tale Tape Cam Newton 6'5 245lbs Average NFL Linebacker 6'2 247lbs pic twitter com IlrVxfxf70|642|732
10:00 PM - 14 Nov 2015|Midnight Titletown It's officially gameday #DETvsGB pic twitter com A7b0NtJPmB|618|1.3K
9:52 PM - 14 Nov 2015|See that's I run fights - Floyd Mayweather|1.5K|1.2K
10:10 PM - 14 Nov 2015|Watch Ronda Rousey get knocked one shocking moments UFC history http uproxx com sports 2015 11 holly-holm-ronda-rousey-knockout-ufc-193 pic twitter com 8HXRCBS8KK|51|67
10:49 PM - 14 Nov 2015|Floyd Mayweather still 49-0|43|59
12:52 AM - 15 Nov 2015|Soon people internet won't understand picture pic twitter com H5zqRMNNrU|1.5K|2.3K
