8:48 AM - 10 Dec 2015|Seek respect attention|79|68
2:27 PM - 6 Dec 2015|Don sit around try change past entire future look forward|140|176
9:59 PM - 8 Dec 2015|Something I've learned today A true friend stick side matter Be person|126|302
6:31 AM - 26 Nov 2015|Nobody ever busy If care make time|4.4K|3.8K
2:55 PM - 5 Dec 2015|I wish 'Sorry' like 20 min long @justinbieber|21K|36K
1:24 PM - 5 Dec 2015|A relationship act weird together best relationship|231|361
2:57 PM - 2 Dec 2015|people leave life goes|1|1
