11:25 PM - 7 Dec 2015|Am I going fly away pic twitter com pDwCyPGyOA|2.1K|3.3K
6:44 PM - 3 Dec 2015|We re making Psychonauts 2 But need help Back Psychonauts 2 http www fig co pic twitter com Ag2553VrAK|3.4K|3.1K
12:07 PM - 27 Nov 2015|Never related anything pic twitter com 4kFyupKWBK|19|37
3:34 PM - 26 Nov 2015|Happy Thanksgiving pic twitter com q5cBS7D00k|67|50
4:58 PM - 20 Nov 2015|If you're reading You awesome I hope amazing day|17|107
7:27 AM - 14 Nov 2015|When ur trying best nothing going right pic twitter com 2X59hm5HHy|1.9K|2.5K
