11:19 PM - 10 Dec 2015|Sleep well 'X-MEN APOCALYPSE' trailer tomorrow|487|708
8:39 PM - 10 Dec 2015|When friends know Christmas @crazycaden pic twitter com H7TG8ytIcP|1|5
7:44 AM - 30 Nov 2015|wish wish heart get next weeks without falling apart pic twitter com SAyhQupqV2|991|788
6:48 PM - 9 Dec 2015|REAL BEST FRIENDS WEAR EACH OTHER ON THEIR FEET pic twitter com 1EYmCkQCjM|628|782
12:51 PM - 10 Dec 2015|BRIGHTEN pic twitter com fKrqwIGqQO|5|8
2:58 PM - 9 Dec 2015|Orangutan reacts seeing magic trick pic twitter com utKDoa7BSb|2.8K|3.3K
9:48 AM - 9 Dec 2015|today third anniversary Ikea Monkey pic twitter com PspbtNH9nr|1.7K|1.7K
11:18 PM - 7 Dec 2015|@EddyBaker dear eddy baker look like eddie kickin pic twitter com T9ST1vxQ8S|15|27
6:33 PM - 9 Dec 2015|Girls 90's kids understand|4|2
9:47 AM - 25 Nov 2015|suck another dick' pic twitter com LIRDbNPeLn|7.1K|7.8K
6:19 PM - 9 Dec 2015|I m saying pic twitter com WMjatSusXp|626|849
2:53 PM - 22 Nov 2015|Technology really come long way pic twitter com p3xUSHSUfQ|1K|992
5:40 PM - 9 Dec 2015|Nothing - Would Change Their Fate The Choice - They Couldn't Make To Say - Enough Is Enough|101|214
5:38 PM - 9 Dec 2015|Nothing - Will Break This Faith The Choice - I Have Made To Stay - Free From Addictions|150|326
3:25 PM - 1 Dec 2015|lovers 1928 lovers 2015 pic twitter com 8WWp1bFe9C|2.3K|3.6K
5:50 PM - 9 Dec 2015|Love four letter word|666|844
5:56 PM - 9 Dec 2015|These condom fails pic twitter com ICSUPeSelE|1.8K|1.7K
5:56 PM - 9 Dec 2015|Thanks Uncle Kanye pic twitter com QIfuvUqLk4|563|1.8K
6:09 PM - 8 Dec 2015|damn obstacle overcome pic twitter com lDDkE5jkTj|21K|29K
5:46 PM - 9 Dec 2015|My thoughts final week pic twitter com HlnDg7aXpo|1.4K|3K
5:08 PM - 9 Dec 2015|Hey donald trump check pic twitter com eWW2FEGDys|415|562
7:04 PM - 8 Dec 2015|rip star wars pic twitter com fQ1AdRka8t|509|521
1:37 PM - 1 Dec 2015|The Most Wonderful Time Of The Year https vine co v OrHdJ65nD7v|3.8K|3.1K
6:11 PM - 7 Dec 2015|Wow got something crazy otw @boilerroomtv|8|16
5:05 PM - 7 Dec 2015|@itsTheJoJohnson big brudda keep #respect|2|0
5:18 PM - 7 Dec 2015|What play @JohnnyCashVU23 #DALatNYK http vine co v i7D7IwBzz5g|87|146
8:23 AM - 7 Dec 2015|IF THIS GETS 40 RETWEETS I WILL DROP MY VIDEO TODAY|42|7
4:15 PM - 7 Dec 2015|@crazycaden it's sign https twitter com hoezodiacs status 660876963712794625|1|1
4:26 AM - 7 Dec 2015|Its time year http vine co v h2zFQr7iMPF|2.7K|3.4K
10:56 PM - 6 Dec 2015|Fuck anybody feel|1.2K|872
5:40 PM - 6 Dec 2015|THIS IS EXACTLY WHAT I EXPECT AS THE 'BATMAN V SUPERMAN' POST CREDIT SCENE pic twitter com eLXg2TnbGO|1K|1.5K
11:07 PM - 5 Dec 2015|oh bad y'all ain't beat http vine co v MVzeqEPBp1M|4K|5K
8:12 AM - 6 Dec 2015|Slug Christ actually kinda good he's screaming like fucking idiot track|1|1
3:37 PM - 5 Dec 2015|don't understand pic twitter com fgph6ncDUQ|361|309
1:30 PM - 15 Nov 2015|THIS BY FAR THE GREATEST INTRO TO A PORN SCENE pic twitter com gWUyvcDUYf|13K|16K
3:04 PM - 4 Dec 2015|longer childish pic twitter com VcPdRZHEEo|1.6K|2K
7:18 PM - 3 Dec 2015|We safe pic twitter com ySzpQGOTbG|3.7K|3.9K
5:13 PM - 4 Dec 2015|We got jawbreakers got jawbreakers pic twitter com 10f2H2Wx6D|331|363
6:05 PM - 4 Dec 2015|When white friend tries act black https vine co v eYbXTaiquEm|921|1K
8:10 PM - 4 Dec 2015|You wanna see friend #FreeGucci pic twitter com s6sG5hXD15|1.5K|1.7K
7:17 PM - 4 Dec 2015|Made @CleanSkateCo pic twitter com rkN1HhsDMv|7|18
7:01 PM - 4 Dec 2015|Judge I don't know sentence District Attorney WHAT Judge THE SON OF A BITCH STOLE A HOLIDAY I AINT NEVER SEE NO SHIT LIK|51|239
4:04 PM - 4 Dec 2015|Elton John fan Young Thug's work http bit ly 1XHlUIy pic twitter com 8Ggbp2B1Ml|2.2K|1.8K
3:10 PM - 4 Dec 2015|Pull @deltoroshoes babes pic twitter com 1s2wiEdqy4|44|156
7:09 PM - 3 Dec 2015|let's keep goin|230|313
6:34 PM - 3 Dec 2015|When grade moves point pic twitter com 5SIgAdduT2|1.2K|1.7K
1:08 PM - 30 Nov 2015|I Am The P-O-P-E repping Team G-O-D Lyrically turn clock around like Year 1 A D #PopeBars pic twitter com oo8Wnmw7ar|1.1K|913
6:21 PM - 3 Dec 2015|lmao girl roasted tf pic twitter com muRYZdLiCZ|9.7K|14K
