12:52 PM - 11 Dec 2015|Filming new ootd video today I'm feeling pretty self conscious|5|232
11:03 AM - 11 Dec 2015|Have someone stumped gift Why taxidermy http etsy 1Y2LtnD|13|128
9:43 AM - 11 Dec 2015|Giftcember 08 @Mort3mer I LOVE YOU You're style goals 3 classy n beautiful pic twitter com A2cECUZIvw|89|607
10:21 AM - 11 Dec 2015|All cuddles https vine co v iZvd3IjlVjT|83|385
8:46 AM - 11 Dec 2015|Oh @HollyConrad really cute pic twitter com gcxUw156eP|83|618
2:19 PM - 10 Dec 2015|More fashion featuring @HollyConrad time little closer actual dress style pic twitter com x8oGL1y8Xz|44|354
7:05 AM - 10 Dec 2015|Bad Game Covers #10 - Ghost Lion NES https www youtube com watch v UxL3LBEPuEs I think I love one|29|72
1:56 PM - 10 Dec 2015|Watch new Game Grumps Animated @jarrettriley get A GENTLE HANDY https www youtube com watch v 69rEK_H07yg|75|561
8:01 PM - 9 Dec 2015|My custom plushies arrived @DaronNefcy @edensher @_AdamM #StarVsTheForcesOfEvil #Svtfoe #starco pic twitter com v0EgwCSzc3|27|91
11:04 PM - 9 Dec 2015|I love Planned Parenthood I hate going way Blockbuster|22|151
9:04 AM - 10 Dec 2015|NEW Mortem3r Merch UPDATE http youtu U5ylf4WtO2w via @YouTube|7|67
2:28 PM - 9 Dec 2015|So I finally mustered courage post little doodle @Mort3mer cause she's awesome #gamegrumps #art pic twitter com 3s5naqQQPG|15|158
12:58 PM - 9 Dec 2015|Ross #YouTubeRewind video year Watch https www youtube com watch v KK9bwTlAvgo|319|1.7K
10:09 PM - 9 Dec 2015|RT you're #buttstuff hit like lying|3|5
5:44 PM - 9 Dec 2015|NSFW-ish Alphonse mucha inpired @egoraptor I drew many moons ago forgot upload twitter pic twitter com boygyzU7qG|277|1.6K
4:08 PM - 8 Dec 2015|Board James mythology explained https www youtube com watch v qE6Gmy2t-Es @Mike_Matei @ReallyBLBootsy @kylejustin|44|132
12:56 PM - 9 Dec 2015|Board James SEASON 2 2011-2013 Marathon version viewing convenience https www youtube com watch v CCb-Puv1fuU|20|95
11:25 AM - 6 Dec 2015|Super proud bro https twitter com atmosgames status 673254563479187457|5|90
5:44 PM - 8 Dec 2015|For tweethearts Please listen @HollyConrad @mrskimyadawson I Like Giants-Kimya Dawson Lyrics https youtu pyJChP-mzqw|6|54
1:47 PM - 9 Dec 2015|@HollyConrad love pigeon gifs Keep pic twitter com KqENRxepKt|18|206
3:03 PM - 9 Dec 2015|Happy #turfwarzine day Here's Octoling image special idol pic twitter com YTse9ffgDc|357|1.3K
11:39 AM - 8 Dec 2015|Don't insecure Coffee Shop You're least 3 5 pic twitter com c3wZVvD70D|349|1.9K
11:04 AM - 8 Dec 2015|Star Wars Battlefront Trailer - Acapella Parody @TeamGE0 best thing you'll see day https www youtube com watch v lz8z_9g9Dbs|5|5
10:21 AM - 8 Dec 2015|Another early Star around 2010 http tmblr co ZfnEjv1zYsGnX|17|73
2:13 PM - 7 Dec 2015|Come scrublord I'm ripped @RubberNinja @GameGrumps pic twitter com xJF6Q5hq1c|204|1.1K
11:42 PM - 7 Dec 2015|@DaronNefcy hi star butterfly wearing traditional costume Okinawa-japan say hello Princess pic twitter com 2IWhOnuC9n|12|106
8:35 PM - 7 Dec 2015|@Mort3mer pretty love - pic twitter com dHHdFqQYXy|9|159
9:18 PM - 7 Dec 2015|This Gravity Falls themed Christmas light show made night 80 jolly http www youtube com watch v Jm3ecAnuBz0 sns tw|729|2.3K
5:19 PM - 7 Dec 2015|Check second video LEGO Dimensions series Arin made @gamespot https www youtube com watch v bzvcE9IMy9U|46|371
1:34 PM - 5 Dec 2015|I met @JoshRadnor today Amazing guy Thanks pic pic twitter com W5tgOaW04J|1|8
12:11 PM - 4 Dec 2015|This high school friend @atmosgames Watch story consider pre-ordering Pinstripe http bit ly 1QkQRfZ We cant wait play|32|239
