2:54 PM - 11 Dec 2015|I handed livestream @hankgreen skunk See hours Live Sunday noon EST http projectforawesome com live|79|366
10:33 AM - 11 Dec 2015|Livestream second back soon We're coming 115 000 #p4a indiegogo http projectforawesome com donate|71|358
8:09 AM - 11 Dec 2015|The countdown 2015 Project Awesome officially begun http projectforawesome com live|96|437
4:28 AM - 9 Dec 2015|Good morning The 2015 Project Awesome's indiegogo Lots amazing perks https www indiegogo com projects project-for-awesome-2015--2#|151|627
4:30 AM - 9 Dec 2015|All proceeds split Save Children UN's High Commission Refugees https www indiegogo com projects project-for-awesome-2015--2#|171|622
10:02 AM - 8 Dec 2015|ISIS raises money taxing people areas controls selling oil illegally They make 1 5B around much revenue Valve Software|152|436
9:50 AM - 8 Dec 2015|If 3D movies give headaches friends booked Star Wars tix 3D reminder 2D glasses 8 http store dftba com products 2d-glasses -rhr|207|756
9:42 AM - 7 Dec 2015|'do like wellies ' - lady gaga glastonbury 2009 - last night stage|377|2.5K
9:40 AM - 7 Dec 2015|What Green Day written Hello You don't imagine anymore https www youtube com watch v DNPto4GFwx4|284|760
10:13 AM - 6 Dec 2015|video hatsune miku performing enthused crowd made emotional|379|2.5K
7:58 PM - 2 Dec 2015|OUT OF THE BEARDED BARLEY https www youtube com watch v 8N-qO3sPMjc|32|245
7:56 PM - 2 Dec 2015|What's 90's song girl singer there's maybe map trail swing it's saccharine lots words|32|404
9:03 PM - 27 Nov 2015|Escape last bits conversation w relatives listening week's #NotTooDeep w @funforlouis https soundcloud com nottoodeepwithgrace ep-47-funforlouis|121|1K
7:54 PM - 27 Nov 2015|Hark herald Angels sing Get HILLYWOOD #BLACKFRIDAY SPECIAL ALL WEEKEND http www ShopHIllywood com pic twitter com Vnc2C8z7iD|17|109
4:29 PM - 26 Nov 2015|Happy Thanksgiving y'all I love PIE pic twitter com MRSBQg513f|12K|37K
2:04 PM - 26 Nov 2015|Ok antenna plugged thing I want watch @petersagal documentary constitutional law|12|271
12:37 PM - 26 Nov 2015|#PINOF7 Will ever collab @HillywoodShow I would LOVE see|21|69
12:40 PM - 26 Nov 2015|Not mignolets finest moment|10|37
11:05 AM - 26 Nov 2015|#PINOF7 reaction saw @HillywoodShow dressed acted like guys|21|92
12:32 PM - 26 Nov 2015|Today I grateful Liverpool Football Club|65|181
8:52 AM - 26 Nov 2015|My Grandfather Oil Baron A Story Delayed Thanks https medium com @hankgreen a-story-of-delayed-thanks-557f17e707df# 2xj7yho0t Thanks Paw Paw|31|191
11:51 AM - 25 Nov 2015|Thanksgiving video choice Lets see shit show works|58|565
11:01 AM - 25 Nov 2015|PREMIERING THIS THANKSGIVING WEEKEND The Witch back hell pay #HOCUSPOCUSPARODY pic twitter com ekFh3a4NKK|81|339
5:05 PM - 24 Nov 2015|pewdiepie voice hey bros|1.3K|4.7K
4:45 AM - 23 Nov 2015|If ever feel remember Life death sentence resent parents #mondaymotivation|8.7K|22K
2:26 PM - 18 Nov 2015|Our new deluxe version That's Christmas To Me 5 new tracks https itun es us waYH-|737|3.4K
2:33 PM - 18 Nov 2015|I'm excited tomorrow Feel better @ColleenB123 pic twitter com pl3a0pJkdu|172|1.5K
2:58 AM - 18 Nov 2015|Read @lumos blog post fighting sexual abuse #children #institutions #EndChildSexAbuseDay @coe @CoE_children http bit ly 1j5hVm7|216|616
1:04 PM - 17 Nov 2015|The phandom prefers|176|742
12:47 PM - 17 Nov 2015|I going cutting close today's Pizzamas video aaahhhh|29|721
3:13 PM - 16 Nov 2015|Dan Phil return America probably nap two weeks straight|569|2.1K
3:22 PM - 16 Nov 2015|Actually leave 3 days shortly Are mosquitos Nicaragua https twitter com mishacollins status 666376042081222656|136|659
2:09 PM - 16 Nov 2015|Thought provoking video @johngreen I could listen talking anything http youtu wSOuKxLjO0k pic twitter com R6OkNKf3hy|130|443
2:03 PM - 16 Nov 2015|1 day left Proceeds support trip build school Nicaragua We leave next week I forget get shots https twitter com osricchau status 666335208648503296|1.8K|5.7K
1:38 PM - 16 Nov 2015|Just shot Gatorade stranger's belly button Happy Monday #Dirty30Movie|182|1.7K
10:17 AM - 16 Nov 2015|Tell us Which Sanderson Sister think @HillyHindi play #HocusPocusParody pic twitter com YSxI3Tucek|28|147
9:25 AM - 16 Nov 2015|Any graphic artist hire Send portfolio plez|1.6K|11K
5:24 PM - 15 Nov 2015|Singing last night If u look faces closely u tell photo taken 1 us farted https twitter com monicadphoto status 665991964500733958|2.3K|6.9K
6:45 PM - 14 Nov 2015|I'm loving YouTube Music I listening @jtimberlake station played Alan Jackson|53|631
1:59 PM - 14 Nov 2015|hey look remembered password side channel - THE A TO Z OF DAN https youtu Kb_529QCIQc behind scenes audiobook|9.4K|26K
8:54 AM - 14 Nov 2015|ISIS churning anti refugee propaganda summer Their mass murder Paris refugees secondary target|685|868
8:21 AM - 14 Nov 2015|Hating Muslims happened Paris like hating Christians gay-hating Westboro Baptist Church|32K|38K
