2:10 PM - 11 Dec 2015|I promise end first term won't people jail country @BernieSanders https www reddit com r SandersForPresident comments 3welw8 i_promise_at_the_end_of_my_first_term_we_wont ref share ref_source twitter|4|3
2:30 AM - 11 Dec 2015|When help others respect Don't look Serve human beings compassionate intent|8.2K|10K
11:15 PM - 10 Dec 2015|Members Of Donald Trump Christian Denomination Are Trying To See If They Can http thinkprogress org politics 2015 12 10 3730849 trump-presbyterian-excommunication utm_source dlvr utm_medium twitter #UniteBlue pic twitter com kknGr4fuhC|3|1
2:18 PM - 10 Dec 2015|A new poll finds 57 Americans oppose Trump's proposed Muslim ban 25 favor http www wsj com articles wsj-nbc-poll-finds-majority-opposes-trump-plan-to-ban-muslims-1449784927 pic twitter com cUOJ9mZTGD|40|25
9:50 AM - 10 Dec 2015|Doesn't happen without bro https twitter com thefredsavage status 674964484918644737|30|361
7:57 AM - 10 Dec 2015|Watch @NinaTurner explain supports campaign https amp twimg com v a61c1035-4534-4a23-a306-d06c3fc7a41f|719|1.3K
6:07 AM - 10 Dec 2015|We bailed Wall Street It's time bail middle class help kids able go college tuition-free|2.4K|5.1K
6:43 PM - 8 Dec 2015|A Few Illinois Women Bernie Meeting Past Weekend @Illini4Bernie #Illini #IllinoisValues pic twitter com 99k0z9vMlp|5|5
12:57 PM - 8 Dec 2015|Finally succinct explanation @HillaryClinton less electable @BernieSanders #FeeltheBern http www huffingtonpost com calvin-sloan political-wisdom-during-politically-uncertain-times-clinton-vs-sanders_b_8739336 html|8|6
2:33 AM - 8 Dec 2015|Please pass renew funding permanently Zadroga Act @SenateMajLdr @SpeakerRyan #WorstResponders #shameworks|2|0
1:04 PM - 6 Dec 2015|We one world one people And belief leads conclusion cannot turn back human suffering|2.2K|3.6K
5:15 AM - 6 Dec 2015|Finally screwdriver back #DoctorWho pic twitter com DuqldeKdoG|20|36
7:48 PM - 4 Dec 2015|Just little humor pic twitter com n6LSL1teP2|4|4
6:20 PM - 3 Dec 2015|Quinnipiac baby A stunning new poll Quinnipiac suggests Bernie Sanders electable candidate http fb 6TIfu28NY|12|8
9:55 PM - 2 Dec 2015|Co-workers say Syed Farook recently traveled Saudi Arabia returned new wife met online http www latimes com local lanow la-me-ln-syed-farook-had-traveled-to-saudi-arabia-married-appeared-to-live-american-dream-co-workers-say-20151202-story html utm_source dlvr utm_medium twitter dlvrit 649324|206|103
7:16 PM - 28 Nov 2015|Since reboot Doctors least touch whimsy 11 90 whimsy I love 'em But ONLY 12 could've tonight's ep|16|51
7:33 PM - 29 Nov 2015|Bernie Sanders Scares The Hell Out Of Corporate Democrats The Ring Fire http ln trofire com 2015 11 3zk6i via @The Ring Fire|16|18
5:19 PM - 27 Nov 2015|Did guys news We're catching Iowa according CBS #FeelTheBern RT http www cbsnews com news clinton-extends-iowa-lead-amid-strong-ratings-on-commander-in-chief pic twitter com fr2EdvVUsz|83|97
9:45 PM - 25 Nov 2015|RT @LollipopCrumbs We agree Killer Mike H T Women Bernie Sanders 2016 #Bernie2016 #feelthebern pic twitter com WEn7eDBSf8|20|15
10:14 AM - 26 Nov 2015|Remembering made country #Vets4Bernie #VeteransDay #Election2016 #VetsForBernie pic twitter com ly4eUDKnpu|1|1
6:56 AM - 26 Nov 2015|As gather loved ones give thanks let us reflect fact families lucky http bernie Immigration|634|1.3K
9:05 AM - 26 Nov 2015|Too often Native American brothers sisters seen corporate profits put ahead sovereign rights pic twitter com UddYqGxuxf|2K|3.7K
4:27 PM - 26 Nov 2015|Put cookie @Schwarzenegger #Schwarzenegger Vine @ToddDracula https vine co v iamF7mliLqO|5|3
11:38 AM - 26 Nov 2015|There 6 crew members @Space_Station right make Thanksgiving dinner Check https amp twimg com v e226db40-e3b8-4931-9921-58e9bd0975cb|1.4K|2.1K
1:09 PM - 24 Nov 2015|Love Truth Hope Bernie Sanders @BernieSanders @CharlesMunn1 @BerniesHomie @People4Bernie pic twitter com PyGEoQlIoW|26|37
6:21 AM - 24 Nov 2015|Iron workers union endorses Bernie Sanders New Hampshire https shar es 1ct72p via @sharethis|8|6
9:44 AM - 18 Nov 2015|Bernie makes cover Rolling Stone #FeelTheBern #Bernie2016 pic twitter com 1QAr25ZRvE|28|29
1:08 PM - 25 Nov 2015|All Americans sickened video Laquan McDonald murder https berniesanders com press-release sanders-statement-laquan-mcdonald|1.3K|2.1K
1:16 PM - 24 Nov 2015|BREAKING @BernieSanders Introduces Families First Immigration Plan https berniesanders com press-release sanders-introduces-families-first-immigration-plan via @BernieSanders|25|22
3:28 AM - 24 Nov 2015|Turkey shoots Russian plane http politi co 1I835aj AP Photo pic twitter com RGap5BIQAA|90|27
11:58 PM - 23 Nov 2015|Hamster world domination begins http imgur com gallery 5uWT1lD pic twitter com yezCsXwgZa|97|152
6:05 PM - 23 Nov 2015|Joyce Carol Oates Twitter Is nothing joyous ISIS http nyti ms 1Xn0xqu|66|120
12:53 PM - 22 Nov 2015|Whites killed blacks 15 Whites killed whites 82 Blacks killed blacks 91 https www fbi gov about-us cjis ucr crime-in-the-u 2014 crime-in-the-u -2014 tables expanded-homicide-data expanded_homicide_data_table_6_murder_race_and_sex_of_vicitm_by_race_and_sex_of_offender_2014 xls https twitter com realDonaldTrump status 668520614697820160|103|94
8:38 PM - 16 Nov 2015|Hillary's answer takes millions Wall Street NOT GOOD ENOUGH #Vets4Bernie #FeelTheBern pic twitter com NqxAggh9rC|33|41
8:04 PM - 21 Nov 2015|Hillary Clinton democratic candidate skipped today's criminal justice #BlackLivesMatter forum I want point|189|232
12:04 PM - 21 Nov 2015|Bernie Sanders Black Lives Matter Movement #2020Approach pic twitter com 4INMjSW79n|1.6K|2.3K
12:00 PM - 21 Nov 2015|We deal urgent obvious issue killing African-Americans police deaths custody #2020Approach|2.5K|3.9K
12:23 PM - 21 Nov 2015|We must address lingering unjust stereotypes lead us label black youths thugs super-predators|3.4K|5.3K
12:04 PM - 21 Nov 2015|Michael Brown Eric Garner Walter Scott Freddie Gray Sandra Bland Tamir Rice Samuel Dubose Rekia Boyd many|5.6K|7.7K
10:43 PM - 20 Nov 2015|interesting http m csmonitor com USA Latest-News-Wires 2014 0227 Republicans-block-Senate-bill-to-boost-veterans-benefits|12|14
2:58 PM - 20 Nov 2015|Clinton brings Big Pharma money 2016 field #SheLIES said pharma biggest enemy takes http thehill com policy healthcare 257234-clinton-brings-in-most-big-pharma-money-of-2016-field|1|0
3:00 PM - 20 Nov 2015|Poll @realDonaldTrump leads @realBenCarson drops @TedCruz moves http politi co 1kLUTCB Getty pic twitter com jc3y8Cax4W|15|12
3:06 PM - 20 Nov 2015|Can Democratic Socialism Pass Electability Test It Already Has http www thenation com article can-democratic-socialism-pass-the-electability-test-it-already-has #BlackLivesMatter #BLM #UniteBlue #FeelTheBern|15|13
3:06 PM - 20 Nov 2015|Adele disguised Adele impersonator Adele impersonators lost shit http bzfd 1NhyYzB https vine co v iuQgDjjiB6p|1.5K|2.7K
7:13 PM - 19 Nov 2015|Cops put away military gear Community responds cha cha slide #Justice4Jamar #4thPrecinctShutDown pic twitter com zGl6wlC1LC|118|106
4:04 PM - 18 Nov 2015|Now time best Americans fighting racism fighting xenophobia fighting fear|2.9K|5.5K
8:41 AM - 18 Nov 2015|We provide refuge least 10 000 refugees fleeing violence Syria next year pass highest security checks|7.8K|13K
5:38 PM - 18 Nov 2015|BernieSanders RT SymoneDSanders Check BernieSanders cover #RollingStone pic twitter com SKvFjvyLW5 pic twitter com eIrnzNzPhV|5|5
8:49 AM - 18 Nov 2015|Slamming door face refugees would betray deepest values That's And it's we're going|49K|66K
7:28 PM - 17 Nov 2015|Two AirFrance flights diverted anonymous phone threats One landed Salt Lake City one Halifax https twitter com ClaudiaKoerner status 666819303547781121|145|73
7:55 PM - 17 Nov 2015|White House says Syrian refugees face rigorous screenings http wsj com 1ltVid5 pic twitter com bK70qlpKQK|148|151
7:57 PM - 17 Nov 2015|Texas man jailed social media messages allegedly threatening shoot mosque http nbcdfw com Kmy57jZ pic twitter com OovX2swM5T|3|4
12:15 PM - 17 Nov 2015|BernieSanders I want Lakesia know I never waiver #FightFor15 Twelve https twitter com SEIU status 666660472083447808 pic twitter com DCgi3I7Fx0|3|1
6:54 AM - 16 Nov 2015|#HillaryClinton Has Few Fans Military http tinyurl com pr9gdjc pic twitter com JUUBXTBz7p|30|17
4:36 PM - 16 Nov 2015|Hillary Clinton's Big Debate Gaffe Bizarrely Linking Her Wall Street Donors 9 11 Reconstruction http bit ly 1MRoJvx #HillaryClinton|23|17
5:07 PM - 16 Nov 2015|There rational explanation women making cents dollar compared men That plain sexism pic twitter com M9Iy4XCyXj|3.5K|7.6K
5:27 PM - 16 Nov 2015|Bernie Sanders Tamir Rice I want read see children shot toy gun #BernieInTheCLE|708|1.2K
3:05 AM - 16 Nov 2015|Europe falls silent one minute remember victims #ParisAttacks http bbc 1PIfO4J http snpy tv 1kzUlj7|1.7K|1.8K
11:12 PM - 15 Nov 2015|ICYMI Blake Shelton came rescue group stranded near Oklahoma river http eonli ne 1kzvX0W|31|118
9:09 PM - 15 Nov 2015|Tags clothing drive crazy #itsmy2cents|66|139
9:10 PM - 15 Nov 2015|Is Old Hampshire #itsmy2cents|121|155
8:42 PM - 15 Nov 2015|Being actual Highlander I can't believe it's taken long watch Highlander|283|2.2K
9:49 PM - 15 Nov 2015|John Oliver Goes Epic Profane Rant Over Paris Attackers F--- These Assholes http thr cm Z3IBi6 pic twitter com ofsrAZqCvx|82|158
7:20 PM - 14 Nov 2015|Wow Hillary Clinton using 9 11 deflect justify millions campaign contributions Wall Street firms Gross #DemDebate|1K|1.9K
8:17 PM - 14 Nov 2015|@HillaryClinton I know woman So|9|48
8:18 PM - 14 Nov 2015|@HillaryClinton I want BEST CANDIDATE regardless gender Resent Gender Card @BernieSanders #BernieOrBust #HillNo|13|58
8:52 PM - 14 Nov 2015|The toughest question #DemDebate came Twitter http slate 1kW8WVA pic twitter com uGiQeYyGss|65|96
9:02 PM - 14 Nov 2015|If election held today would vote #DemDebate|231|151
9:04 PM - 14 Nov 2015|Fact checking @BernieSanders' #DemDebate claim 500 000 troops PTSD http cnn 1OLolVZ http cnn 1Ybu2hv|389|559
9:45 PM - 14 Nov 2015|A satisfied @TitusNation crowd pic twitter com dpEbq7yylx|1|1
11:07 AM - 14 Nov 2015|I #paris covering @airbnb 1 #videos #SalutetoTroops http ireport cnn com docs DOC-1282245 @HLNTV #AirbnbOpen @RobinMeade|88|47
11:09 AM - 14 Nov 2015|Muslims across world condemned #ParisAttacks killed least 127 people many wounded http usat ly 1QDcWH5|297|243
