7:46 PM - 1 Dec 2015|@DrakeH14 Cody never seen Miracle That changes tonight|1|1
9:00 AM - 1 Dec 2015|WBB Congratulations order GSC Freshman Week Baylee Johnson #chargerpride pic twitter com 0jjmHojGlb|18|39
7:25 AM - 27 Nov 2015|Yesterday today everyday I'm thankful game means pic twitter com BG8fX7zC21|1|8
7:15 AM - 20 Nov 2015|It's GAMEDAY UAH vs Stillman Spragins Hall Tip 5 pm Watch listen live http uahchargers com pic twitter com Bdm0n6BP4H|19|24
10:56 AM - 19 Nov 2015|BASE Logan Pierce joins UAH baseball coaching staff 2016 #chargerpride Info http bit ly 1kIa9jM pic twitter com fTUHpFV2EV|22|14
7:58 AM - 18 Nov 2015|Congratulations @Swalve23 signing UAH #BearcatNation @cullmancats @CullmanToday @rketcham @CullmanSense pic twitter com EdBivXzkOg|20|25
12:37 PM - 14 Nov 2015|Excited say I committed play baseball Auburn University God good #WarEagle @AuburnTigers @Auburn_Baseball|23|73
