8:29 PM - 11 Dec 2015|I think it's important friends different ages The end|16|104
5:20 PM - 11 Dec 2015|Now @LanguageLog The subtle difference Love trumps hate Love Trump's hate http languagelog ldc upenn edu nll p 22801|11|13
4:20 AM - 23 Nov 2015|Stop trying cool Microsoft Office You're embarrassing pic twitter com B114u1d2gw|2|3
7:13 PM - 3 Dec 2015|This Norman Doesn't bark much Very docile pup Up date current events Overall nifty pupper 6 10 pic twitter com ntxsR98f3U|706|1.4K
11:19 AM - 10 Dec 2015|Armed privilege indignation man got approach cougher He strode aisle scorn beat #QuietCar|1|4
1:44 PM - 9 Dec 2015|This well written It's either funny sad NY Times understands street culture better Spike http nyti ms 1NGCayy|133|171
2:07 PM - 9 Dec 2015|Here's another edition -- best one yet -- Tweet My Corrections http nyti ms 1XWC7Ki pic twitter com ixD9eJ8ylE|12|31
1:49 PM - 9 Dec 2015|Reminder element looking 'Avatar' called 'unobtainium' I guess 'tktktktk' wouldn't work|1|5
1:26 PM - 6 Dec 2015|INTERVIEWER u want work pun zoo KOALA well u coud say im koala-sponsible wait qualif INTERVIEWER oo im sory sir|1.7K|3.7K
11:17 PM - 8 Dec 2015|13 800-Year-Old Engraving May Be First Depiction Man-Made Landscape - http bit ly 1Tzaal9|5|8
11:05 PM - 8 Dec 2015|Now seems like good time remind Howard Dean make funny noise|38|59
5:15 PM - 8 Dec 2015|'Tear bitters' new cocktail lets drink sorrows literally http nowth ix2|6|6
8:00 PM - 8 Dec 2015|These dentists flew Jordan give free dental care Syrian refugees http nowth ixh|25|26
10:38 PM - 8 Dec 2015|Nothing 2015 felt real|2.8K|4.4K
7:24 PM - 8 Dec 2015|@ski day you'll tell kids Troll Wars|1|6
10:29 PM - 8 Dec 2015|I took break writing Pete Seeger biography give llama shot I feel pretty American today|15|72
10:00 PM - 8 Dec 2015|We must react hatred sense R I P John Trudell poet activist truth-teller pic twitter com LijpemaeTO|22|23
10:08 PM - 8 Dec 2015|can't sleep much #content|22|41
10:11 PM - 8 Dec 2015|A Modest Proposal Donate Muslim Charities Behalf Social Media Haters https medium com @stribs a-modest-proposal-donate-to-muslim-charities-on-behalf-of-social-media-haters-858ac7c4d377# rt8mfppks|3|1
3:38 PM - 8 Dec 2015|Dear Santa santa little boy didn't punch little brother VA1900 pic twitter com 2xeWW9GJRZ|84|136
3:19 PM - 8 Dec 2015|Grand Central Terminal NYC 1929 The sun can't shine like due surrounding tall buildings pic twitter com dDxatKLp5s|419|868
1:26 PM - 8 Dec 2015|Unbelievable For year USS Wyoming submariners filmed female shipmates every time showered @MeghannReports http www navytimes com story military 2015 12 08 report-sailor-ring-repeatedly-filmed-undressing-women-sub 75924474|28|9
9:26 AM - 29 Nov 2015|A semi colon comma chameleon #PunctuationTweets|8|34
1:55 PM - 8 Dec 2015|Donald Trump's gift ISIS -- short take @NYDailyNews http nydn us 1OOvALS|1|3
2:39 PM - 7 Dec 2015|Most staff National Crime Agency Britain's FBI can't access internet work http www buzzfeed com tomwarren national-crime-agency-warned-over-serious-flaws-in-money-lau# ttYKm6LLOv pic twitter com NJyV1vMeAK|14|8
9:29 PM - 7 Dec 2015|The strange beauty Sisyphean robots http m fastcompany com 3054143 watching-these-robots-perform-pointless-tasks-is-oddly-mesmerizing partner rss utm_content buffer14197 utm_medium social utm_source twitter com utm_campaign buffer via @rbtrends|3|4
3:01 PM - 7 Dec 2015|I'd really like see GOP leader one brave bold enough visit mosque stand Muslim-Americans right|144|302
11:45 AM - 4 Dec 2015|It's big universe make little distant squeaks booms Who hears Who cares And finally counts https twitter com SciencePorn status 672862953704681472|32|95
8:06 PM - 7 Dec 2015|Donald Trump hates Muslims invented Algebra math caused four bankruptcies|898|1.2K
7:06 PM - 7 Dec 2015|This great https twitter com grasswire status 674061147268608001|5|5
5:01 PM - 7 Dec 2015|The fact America global empire thus deal w types people big barrier openly discriminatory laws|26|41
5:18 PM - 7 Dec 2015|Artists turning NYC's ugly metal gates stunning street art http buff ly 1RAoWcM pic twitter com JFWzZsLhHF|49|55
3:02 PM - 23 Nov 2015|website tells long took create story idea publishing long takes read|2|1
8:57 AM - 2 Dec 2015|Teachers Please make students use synonyms 'said ' blurted http www slate com blogs lexicon_valley 2015 12 02 teachers_banning_simple_words_like_said_is_a_bad_idea html wpsrc sh_all_dt_tw_top|55|56
1:15 PM - 7 Dec 2015|A good time mention fuchsia named one Leonhart Fuchs STOP TRYING TO SPELL IT FUSCHIA https twitter com julichilliard status 673972211947069444|7|22
10:36 PM - 6 Dec 2015|Thanks odd combination skill luck stupidity greed hope - https twitter com darklordoftheIT status 673752466081587200|10|96
7:22 PM - 6 Dec 2015|This Ted Cruz sweatshirt pretty great https store tedcruz org product cruz-limited-edition-christmas-sweater|23|29
9:50 PM - 6 Dec 2015|@realDonaldTrump deport|152|715
9:28 PM - 6 Dec 2015|dont u hate ur productive time day 3am 3 01am|942|2K
8:40 PM - 6 Dec 2015|I wonder it's like giraffe #itsmy2cents|475|423
8:52 PM - 6 Dec 2015|Miami billionaire bought newspaper ad attacking Donald Trump http www miamiherald com opinion editorials article48299810 html|3|4
2:03 PM - 6 Dec 2015|Swiss artists programmed laptop randomly buy items dark web http ind pn 1Q8c4ek|21|25
12:08 PM - 6 Dec 2015|What happens read people Bible tell Koran http trib al h6zsFU9 pic twitter com lCqPFWntvG|141|105
12:12 PM - 6 Dec 2015|Everyone stop trying coin ingenious insults The contest won Forever https twitter com NightPhysics status 673553118471176192|135|270
12:09 PM - 6 Dec 2015|On service jobs privileged perspectives What I Learned Four Years Working McDonalds @NorquayKate https medium com @katenorquay what-i-learned-from-4-years-working-at-mcdonalds-f278ad27faee# pbpoksaxf|8|7
11:48 AM - 6 Dec 2015|someone ask u ur name pic twitter com lvHlKv3FVf|16|39
12:54 PM - 5 Dec 2015|All NYU student films set Tompkins Square Park|2|38
5:46 PM - 5 Dec 2015|What hell Potter even sitting board meeting Bailey Building Loan|1|0
5:27 AM - 4 Dec 2015|What beautiful selection wax paper seals found John Murray Archive @natlibscot @nlsarchives pic twitter com jOECr2OSIJ|8|11
8:45 AM - 4 Dec 2015|Make 30-second film Submit @jennyslate Here's @Studio360show's example http wny cc VuJ9i pic twitter com X0Hu7CAKAh|7|17
11:17 PM - 4 Dec 2015|The biggest threat safety comes weapons protect Neat eh|17|28
6:28 PM - 3 Dec 2015|thinkpiece thinkpiecers|21|112
10:37 AM - 4 Dec 2015|Honestly I think guy's main problem organs big Yeah I said https twitter com ScientificIdeas status 652841657944043520|26|93
6:57 PM - 3 Dec 2015|#WNDBChat Q4 Being Choctaw makes 4 crazy author visits Do live TeePee last week Indians don't laptops yesterday|7|11
5:12 AM - 24 Nov 2015|Attacks British Muslims 300 since #ParisAttacks Most victims girls women http bit ly 1lfGpuo|102|24
1:05 AM - 30 Nov 2015|@hansgldnl @Pontifex u srsly ask pope read bible|382|636
10:13 PM - 3 Dec 2015|#OnThisDay 1791 Britain's Observer oldest Sunday newspaper world first published pic twitter com QwjwUiDEBi|117|72
8:15 PM - 3 Dec 2015|One stray thought The Wiz 1970s culture still believed telling stories collective destiny groups lone heroes|41|115
5:50 PM - 3 Dec 2015|Meet Hubble Space Telescope's photo editor http ted com dIQvEvt pic twitter com c6jSp8JpTt|152|292
9:53 AM - 3 Dec 2015|Another perspective Is scale anonymity weighs comments sections http www cbc ca 1 3348541 cc @CBC_Aboriginal @cbcnews|2|5
10:25 PM - 2 Dec 2015|The Founding Fathers believed witches bloodletting medicine yeah I totally trust assault weapons public safety|3|31
8:48 PM - 2 Dec 2015|Two greatest self-assuring myths tell include 1 evolve morally 2 rational https twitter com suddeneternity status 672275799379075072|9|16
6:10 PM - 2 Dec 2015|Good daily news pic twitter com mXeQyO7z4I|30|40
5:07 PM - 2 Dec 2015|Follow @igorvolsky right|92|40
3:04 PM - 2 Dec 2015|During Obama's second term Sunday-to-Saturday calendar week passed without mass shooting incident https www washingtonpost com news the-fix wp 2015 10 01 theres-been-no-calendar-week-without-a-mass-shooting-during-president-obamas-second-term postshare 8101449094374015 tid ss_tw|22|4
1:51 PM - 26 Nov 2015|Alice Brock Alice Alice's Restaurant studio Provincetown 2009 Still lovely brilliant pic twitter com af2lBexQaL|14|23
5:54 AM - 26 Nov 2015|Thanksgiving moon sets behind Chrysler Building today's morning twilight #NYC pic twitter com KIaCyAn4KW|144|240
5:56 AM - 26 Nov 2015|Here How We ll Probably Make Gene-Edited People http bit ly 1N9TziR|25|24
5:59 AM - 26 Nov 2015|Hunger costs US extra 160bn year treat chronic illnesses study http trib al 0uj2Jwm|6|4
6:52 PM - 22 Nov 2015|So Trump tweeting literal neo-Nazi propaganda http littlegreenfootballs com article 45291_We_Found_Where_Donald_Trumps_Black_Crimes_Graphic_Came_From comments|9|9
7:05 PM - 21 Nov 2015|But everything think real still always fiction We re fiction writers Chris Ware http bit ly 1yJtKQo|79|146
2:09 PM - 20 Nov 2015|Objectivity bans opinions particularly disfavored among wield greatest power https theintercept com 2015 11 20 cnns-punishment-of-refugee-defending-journalist-highlights-media-abdication|19|18
1:56 PM - 20 Nov 2015|You lead horse water Dogs We dominion beasts Lead nearest body water|43|121
9:07 AM - 20 Nov 2015|AP Style tip She stanched flow blood He staunch supporter equality|29|24
4:50 PM - 17 Nov 2015|I think success determined long maintain make awesome mindset get done kicks|1|7
10:11 PM - 19 Nov 2015|Millennials Future Mars Colonization|16|26
2:38 PM - 19 Nov 2015|Troy Fell Let It Perish With Its Name Jupiter Decides Fate Refugees From East http sententiaeantiquae com 2015 11 19 troy-fell-let-it-perish-with-its-name-jupiter-decides-the-fate-of-refugees-from-the-east|4|0
1:08 PM - 19 Nov 2015|Just made profile pic fb I may engaging trolls much fb pic twitter com wi8hhlelaj|6|23
1:06 PM - 19 Nov 2015|America How Trump leading GOP primary GOP Govs GOP House 47 House Dems Oh God Syrian refugees going kill us|10|11
10:14 PM - 18 Nov 2015|If I learned anything buy flowers|5|11
9:57 PM - 18 Nov 2015|@IBM Wants Help Professional Sports Teams Enter The Digital Age http tcrn ch 1SZZ74I cc @SEATconference #crm #ensw #sportstech|2|0
2:26 PM - 18 Nov 2015|It's Wonderful Life 2015 ending George's friends home begrudgingly contributing 10 GoFundMe rolling eyes|146|350
5:34 PM - 18 Nov 2015|And entering Newspaper Corrections Hall Fame http mobile nytimes com 2015 11 19 arts music adele-25-album html pic twitter com IUVRgxok0I|43|42
11:31 AM - 18 Nov 2015|Just clear I sing You're So Vain karaoke it's still SOMEONE ELSE WHO IS VERY SPECIFIC AND WHO HAS WRONGED ME PERSONALLY|20|40
12:05 AM - 18 Nov 2015|A CNN reporter young refugee shared sweet moment camera http i100 io mL8uvhV pic twitter com 2ZDFRFSIj1|61|62
8:52 PM - 17 Nov 2015|Dear everybody RE everything-- Nope|4|20
9:38 PM - 17 Nov 2015|holds hand gonna okay babe|3K|4.9K
5:46 PM - 17 Nov 2015|The Guggenheim Puts Online 1600 Great Works Modern Art 575 Artists http goo gl vg0woP pic twitter com iOQg46CNTR|219|254
2:54 PM - 17 Nov 2015|Via @robtempio unused cover The Lonely Crowd designed Edward Gorey Fantastic https www dropbox com 7dahydn620opc3i Screenshot 202015-11-17 2017 52 50 png dl 0 pic twitter com HKHQjbEL9k|5|6
10:49 AM - 16 Nov 2015|Do like books culture writing books culture VF may job http condenast avature net careers JobDetail New-York-Books-and-Culture-Editorial-Associate-VanityFair-com 6007|28|39
11:42 AM - 17 Nov 2015|Yaaas @paulfeig You go boy Ghostbusters Director Paul Feig Blasts Hollywood Sexism We ve Gotta Fix Scripts http ow ly ULRHT|1|4
8:38 PM - 16 Nov 2015|beautiful https twitter com JasStanford status 666471625542385664|88|168
8:16 PM - 14 Nov 2015|Most people go life using half energy trying protect dignity never Raymond Chandler The Long Goodbye|4|12
