8:36 PM - 10 Dec 2015|Is weird I want get stethoscope I listen heart asleep pic twitter com JU8YNILgyQ|245|2.5K
2:00 PM - 9 Dec 2015|Smokeshow pic twitter com Pn0UWMRxOj|323|883
9:04 AM - 7 Dec 2015|Large Broken Headphones Earmuffs|173|484
2:09 PM - 6 Dec 2015|hanukkah DENY NOTHING @nathanfielder pic twitter com S02ZIzOy2u|2.2K|8.4K
3:16 PM - 1 Dec 2015|besfrenz birthday today happy birthday tyler bday I extended least 1 year friendship pic twitter com gRkISIpYTY|29K|47K
3:03 PM - 30 Nov 2015|show Orlando visited Disney World search place stay night https amp twimg com v cde7dd0f-7bad-4acd-a5b0-fada8457adf2|8.8K|18K
9:00 PM - 29 Nov 2015|Relatable https instagram com p -sksc6xRfh|152|633
4:42 PM - 29 Nov 2015|Not sure Glee favorite show anymore https instagram com p -sHLp5taTB|1.5K|2.6K
10:07 PM - 25 Nov 2015|heavydirtyhotlinebling It's real https soundcloud com zack-hocker heavydirtyhotlinebling|1.3K|1.7K
5:37 AM - 28 Nov 2015|Tour starts soon Like next week December 4th Soon|67|201
1:53 PM - 26 Nov 2015|launching bunch new limited items store tomorrow 10am EST go fast wait pic twitter com CpUlmHWTxS|1.1K|3.3K
5:42 PM - 25 Nov 2015|@joshuadun remember swam together many underwater bflips pic twitter com Frd8XL9Bej|13K|36K
6:54 PM - 25 Nov 2015|@tylerrjoseph oh yeah I remember remember photoshoot pic twitter com 5cvK2zOcQp|12K|28K
1:47 PM - 25 Nov 2015|always hunt little time #friday pic twitter com JUivAOgv5c|1.1K|5K
3:40 PM - 24 Nov 2015|I like|19K|24K
3:31 PM - 24 Nov 2015|growing beard really trying today especially extra grueling remember nothing great comes without challenges|8.2K|24K
1:05 PM - 24 Nov 2015|Y'all know we're gonna announce US dates world tour right Just hold tight we'll news soon|552|1.5K
10:32 AM - 24 Nov 2015|blankets socks ornaments oh clique frick merch holidays http smarturl top_store pic twitter com fh1Aai8o1g|4K|11K
7:22 AM - 24 Nov 2015|The #AH10 merch line presented gif viewing pleasure pic twitter com LeKkTaxiYE|755|288
10:10 PM - 22 Nov 2015|We're really lucky fans let alone dedicated ones Thank much|7K|17K
9:48 PM - 22 Nov 2015|@MTV I away computer right|1K|4.2K
11:04 AM - 21 Nov 2015|Roses red Violets blue Garlic bread blink-182|23K|25K
7:04 PM - 21 Nov 2015|@Michael5SOS @joshuadun best friends years edited candid sleeping pictures phones pic twitter com T2tRXGI8o2|28K|44K
2:09 PM - 20 Nov 2015|The power friendship pic twitter com u4tFeTlWrK|354|1.6K
7:24 PM - 17 Nov 2015|Find grocery store fruit section eating samples|3.3K|7.6K
3:59 PM - 20 Nov 2015|You used call sidekick|9.3K|18K
8:16 PM - 19 Nov 2015|take object place someone attempts thwart effort -sports|2.3K|3.9K
1:14 PM - 19 Nov 2015|Heard next month's @AltPress slippery wet Get hits stands http bit ly APnewissue pic twitter com Yl2oYD3q0a|1.6K|4.7K
4:38 PM - 18 Nov 2015|quick update straight back work beard beard looks OK|8.6K|25K
2:32 PM - 18 Nov 2015|Maybe they're making awesome spin-off starring John Snow Glenn Walking Dead Justin Thoureaux The Leftovers|589|1.6K
7:15 AM - 18 Nov 2015|imagine falling love someone discover later say things like 'ATM machine' 'PIN number '|1.9K|3.6K
7:24 PM - 17 Nov 2015|Shark Tank Me It's like shirt legs Mark Cuban You mean pants Me 1 000 000 2 company|2.6K|5.4K
4:00 PM - 16 Nov 2015|mom feels mistold story internet radio show here's real scoop said I hate Jews 1986 pic twitter com jw1EJiID9x|2.2K|8.2K
2:13 PM - 16 Nov 2015|gonna take little break tweeting give beard time attention deserves grow|11K|33K
