6:57 PM - 8 Dec 2015|gonna first Christmas cookie DIY tonight @trishapaytas @mytoecold I'm ready hahaha|441|3.3K
1:09 PM - 11 Dec 2015|Trisha Paytas' Twitter got suspended Hopefully she'll back I miss getting 35 notifications per minute rambling Twitter|4|7
6:15 PM - 11 Dec 2015|UNSUSPEND TRISHA PAYTAS|14|27
6:22 PM - 11 Dec 2015|what's favorite subject going home|1.4K|1.7K
6:01 PM - 11 Dec 2015|seen todays new vid WEARING CRAZY CONTACT LENSES https www youtube com watch v nEyJvjJ-CEk RT pic twitter com J350Lev4c1|332|1.7K
5:20 PM - 11 Dec 2015|TIS THE SEASON pic twitter com 9cR3TmNHZP|1.2K|1.4K
4:25 PM - 11 Dec 2015|December 11th 2015 pic twitter com 5KFgL3VE4A|1.4K|1.6K
1:15 PM - 11 Dec 2015|Calm mind break X-Men Apocalypse trailer http nerdi st 1UdbIC8 pic twitter com 2dg3q0WGjl|26|58
1:15 PM - 11 Dec 2015|On 69th birthday 6 things may know UNICEF http uni cf 1Y2cTtY @myUNICEF pic twitter com Os8n2CKFKI|190|203
10:30 AM - 11 Dec 2015|tis season spread holiday cheer pic twitter com ij49tP4eLu|1.1K|1.5K
12:06 AM - 11 Dec 2015|2016 The Year Get The Fuck Away From Me|39|128
9:59 PM - 10 Dec 2015|She fighter mad lover lovin -Brad Paisley|663|1K
9:30 PM - 10 Dec 2015|Victoria secret fashion show cute hell Calvin Klein underwear model fashion show men|982|2.3K
6:39 PM - 10 Dec 2015|DON'T FORGET TO EAT pic twitter com nYlru8xlcf|1|1
2:37 PM - 10 Dec 2015|work feels sun sets early pic twitter com MS4BYz1aZC|29|69
2:38 PM - 10 Dec 2015|Steve-O released jail eight hours SeaWorld stunt http rol st 1Z27GPY pic twitter com jK8qhdMhd1|93|226
2:38 PM - 10 Dec 2015|#payequality needed address long-term effects inequity https twitter com SandraFluke status 675080225034776576|1|0
2:40 PM - 10 Dec 2015|I'm alive ironically|5|9
2:41 PM - 10 Dec 2015|Never trust person chipped nails #IAMJUICYCOUTURE @juicycouture pic twitter com TxbRpJGMDd|14|28
1:49 PM - 10 Dec 2015|Every time Twitter changes angel cries #pleasestop #iamold #dontlikechange|26|95
1:53 PM - 10 Dec 2015|Check Grace Potter LIVE ON AIR studio 94 3 The SHARK right moment Come see|2|2
1:53 PM - 10 Dec 2015|What's going|1|0
1:54 PM - 10 Dec 2015|California Nights @BestCoast also one albums year|663|3.3K
1:55 PM - 10 Dec 2015|Master None's No l Wells Working With Aziz Ansari Overcoming Insecurities http bit ly 1Qz148J pic twitter com y8GsLBqvGW|11|56
6:22 PM - 9 Dec 2015|Kourtney Kardashian Scott Disick spotted leaving lunch together http huff 1RFsFpq pic twitter com ppHaiwjfwt|22|73
6:33 PM - 8 Dec 2015|Facebook responds critics policies terrorism http mash 1IT5Lnf pic twitter com F1Jq2dQajq|21|22
6:35 PM - 8 Dec 2015|A #Pisces trouble making decisions|14|21
6:35 PM - 8 Dec 2015|Happiness found darkest times one remembers turn light|321|366
10:04 AM - 9 Dec 2015|My choice responsibility win lose I hold keys destiny -Elain Maxwell|11|9
10:28 AM - 9 Dec 2015|Want jacket pic twitter com SSPmJYBtdE|1.3K|4.6K
11:29 AM - 9 Dec 2015|The way see results stay consistent|9|12
8:05 AM - 9 Dec 2015|The suns bright sky blue beers cold thinkin bout -Kenny Chesney|605|1K
11:39 AM - 9 Dec 2015|Rocking Around The Christmas Tree That Grows Brooklyn #BookACarol|8|17
7:05 AM - 9 Dec 2015|8 ways you're decorating holidays wrong http cosm ag 6011BTcHd pic twitter com 9Gau8tbw9n|5|15
7:03 AM - 9 Dec 2015|Sorry @taylorswift13 @katyperry topped @Forbes' 2015 list highest-paid musicians http nwsdy li 1OQptq9 pic twitter com jGyR2gbFof|5|10
6:33 PM - 8 Dec 2015|The lights dimmed cookies baked Let's #VSFashionShow pic twitter com HhAhGpYm5r|53|68
5:26 PM - 8 Dec 2015|Presidential candidates selling ugly Christmas sweaters Perfect family arguments http mash 1YWLA14 pic twitter com gJiaPe23oj|47|40
7:22 PM - 30 Nov 2015|Accurate pic twitter com rWPqtwehH0|2.5K|3.1K
8:34 AM - 30 Nov 2015|Anyone else pic twitter com xlLDbAuVDN|1.7K|2.8K
11:04 AM - 8 Dec 2015|Whenever I introduce someone pic twitter com J20sFO4fDO|112|176
3:26 PM - 8 Dec 2015|emailing professors like late say sorry pic twitter com UUDTW5tokp|6.2K|11K
5:07 PM - 8 Dec 2015|It's like Drake Gets Grammy Nom Diss Song check Or click see holocaust might happen|20|74
10:09 AM - 8 Dec 2015|generation obsessed hating love sappy buy gifts hold hands public God forbid love someone|741|1.3K
10:05 PM - 7 Dec 2015|Hotline Bling Christmas Shop Here http christmas af shop hotline-bling-christmas-sweater Hurry Sale ends tonight pic twitter com tKhkJYyv5x|74|205
10:01 AM - 8 Dec 2015|The new Little Mermaid going blonde people aren happy http bzfd 1TyY63g pic twitter com oPBe32Zw25|129|426
10:01 AM - 8 Dec 2015|Dream kitchen views city pic twitter com 1XizvPQTNS|121|258
10:02 AM - 8 Dec 2015|In stock This contemporary YA title deals mental health issues http buff ly 1PUUCdI @MatthewQuick21 pic twitter com e2Q1hOEGoF|1|2
8:27 PM - 7 Dec 2015|Kosher #MidnightBreakfast Carlos Gabby's #sbueats http ift tt 1NeV7sT #stonybrook pic twitter com DAA5Q4rYHT|2|5
4:32 PM - 7 Dec 2015|What It Feels Like Living With A Mental Disorder #MHW2015 https amp twimg com v 32ed743f-895a-4038-ae11-0dce7abeafa4|564|981
6:42 PM - 7 Dec 2015|When you're middle game w friend parents holiday party make greet th https vine co v i7DPD3u6t1L|300|1.6K
9:15 AM - 7 Dec 2015|The love lifetime worth least million tries -Chris Young|550|870
10:33 AM - 7 Dec 2015|A little messed re alright -Kenny Chesney|408|583
11:49 AM - 7 Dec 2015|I ve sleepwalking wondering night trying take lost broke make right -Cam|457|957
12:53 PM - 7 Dec 2015|She holding together falling apart breaking rules broken heart -Jason Aldean|466|846
1:39 PM - 7 Dec 2015|Flying high living careless edge wild reckless hold tight I m bout show one hell night -Dustin Lynch|395|774
2:30 PM - 7 Dec 2015|She Saturday town church girl Sunday cross around neck cuss word cause Monday -Brad Paisley|549|934
3:30 PM - 7 Dec 2015|Mind biscuits life gravy -Kacey Musgraves|403|467
6:18 PM - 7 Dec 2015|It ain style I care I d anything anywhere -Lee Brice|544|897
5:44 PM - 7 Dec 2015|I would drive million miles see little smile real life baby worth drive -Scotty McCreery|497|838
9:46 PM - 6 Dec 2015|Christmas Sweater Sale Shop Here http christmas af Hurry Sale ends tonight pic twitter com tFpwtjQWS1|139|352
6:30 PM - 7 Dec 2015|Best ever Shop best sellers http bit ly 1SKJUnQ pic twitter com PppBxwF1Mw|29|195
2:12 PM - 4 Dec 2015|We meet @jiffpom pic twitter com ETLXaPMkSh|5|57
2:43 PM - 4 Dec 2015|All clear Go launch|10|13
2:47 PM - 4 Dec 2015|Great looking cookies damn fine cause https twitter com YahooFood status 672906226628472832|7|13
7:46 PM - 4 Dec 2015|Take sticky roll lint remover pic twitter com QX7Z8ngfOe|3|11
3:20 PM - 4 Dec 2015|As student comforting words you'll ever hear I haven't started either|938|1.7K
8:38 AM - 5 Dec 2015|Believe THAT girl The one others envy The one guys want The one w killer body YOU CAN Work hard confident|3|22
4:50 PM - 5 Dec 2015|How pretty #Christmastree #Shadowhunters event pic twitter com ogbvvbWDmA|194|610
6:53 PM - 5 Dec 2015|My order @chromegirlnails came today even prettier person @jaimeboreanaz @David_Boreanaz pic twitter com D8YuYZhJxn|22|116
7:01 PM - 5 Dec 2015|Here today Canada pic twitter com sCwEQW5o4U|613|2.4K
7:03 PM - 5 Dec 2015|#Exercise natural environment boost mental well http ahealthblog com fy6i pic twitter com q4iAk1WXqU|6|3
7:07 PM - 5 Dec 2015|Don't follow dreams - chase|101|144
12:28 PM - 6 Dec 2015|seeing guy walk around flowers hands adorable cause know he's gonna making girl happy|1.5K|6.5K
2:27 PM - 6 Dec 2015|Between sets take 20 30 seconds stretch muscle worked|5|13
2:27 PM - 6 Dec 2015|Once reach goals make|10|18
2:30 PM - 6 Dec 2015|Tummy goals pic twitter com z4GtE1qVTH|121|360
2:31 PM - 6 Dec 2015|Rover Rover pic twitter com xYgDrUhHX1|121|187
2:30 PM - 6 Dec 2015|You re kind different I never seen nothin nothin like -Dan Shay|362|778
2:30 PM - 6 Dec 2015|Twitter amazing names Kim Kanye name baby http r29 co 1llCTiH pic twitter com u09KS7XO5e|9|29
12:45 PM - 6 Dec 2015|I'm going @djkhaled birthday party tonight Miami I'm gonna learn keys success|510|1.4K
7:28 PM - 5 Dec 2015|OMG I MOVED yep that's big news I moved parents house last time https www instagram com p -727s8jWpX|1|50
7:04 PM - 5 Dec 2015|Most @Starbucks #holiday drinks easily made #vegan Here's http peta2 starbucks pic twitter com MfQohko8lK|47|65
7:49 PM - 4 Dec 2015|Parents What want Christmas Me More seasons The Office|1.7K|2.8K
7:54 PM - 4 Dec 2015|The wonderful time year https vine co v OrHdJ65nD7v|1.4K|1.4K
2:46 PM - 4 Dec 2015|George Zimmerman allegedly Tweeted nude photos ex http r29 co 1XHbitm pic twitter com aFsZjzDPHu|3|6
12:56 PM - 3 Dec 2015|The skin you're soft|11K|18K
12:56 PM - 3 Dec 2015|Retro holiday commercials know love http bit ly 1m01KJ1 pic twitter com 2CepYHzyAJ|7|16
12:24 PM - 3 Dec 2015|The 50 best songs 2015 http rol st 1Rqasfv pic twitter com pJvigwraZt|184|334
8:20 PM - 1 Dec 2015|u realize it's less 4 weeks till christmas pic twitter com R3mAHjnu0x|1.3K|1.6K
12:35 PM - 1 Dec 2015|one biggest goals kids wonder they're going mom's dad's house first holidays|2.1K|3.2K
1:00 PM - 1 Dec 2015|struggle still caring grades lacking motivation type work|696|1.1K
1:00 PM - 1 Dec 2015|Reflecting raising awareness moving forward people marking #WorldAIDSDay https twitter com moments 671733242857447424 pic twitter com MPZnrrJXLj|426|912
1:00 PM - 1 Dec 2015|Whoever thought good idea seriously disturbed http cosm ag 6019BrmfF|14|24
1:00 PM - 1 Dec 2015|@shanedawson OMG Huge thanks Shane Dawson friends fans future fanatics please share|10|38
12:06 PM - 1 Dec 2015|NEW VID PSYCHIC READING The Psychic Twins https www youtube com watch v 26vknLr16_U RT pic twitter com zMVGGEYPf4|521|2K
9:34 AM - 1 Dec 2015|Hello pic twitter com xy32LnCSNz|21|75
7:01 AM - 1 Dec 2015|trying make things right 2016 pic twitter com pSTgeCI6JC|667|1.1K
8:00 PM - 30 Nov 2015|wish wish heart get next weeks without falling apart pic twitter com MVUbIKPrJh|1.8K|2.1K
6:07 PM - 30 Nov 2015|you're ready Christmas still take finals pic twitter com o8sRpilr1Y|11K|11K
7:55 AM - 30 Nov 2015|You used give extra frosting Late night I need buns #HotlineBling #Remix credit @RogLaw pic twitter com L6U4NzBfyV|75|125
8:18 AM - 30 Nov 2015|Today I hope find 20 I hope crush something sweet I hope situation you're stressing 180 favor|3.6K|6.7K
12:59 AM - 30 Nov 2015|For next hour get 50 coats Missguided using code 'COVERUP' http bit ly 1Ah8MPR|3|5
2:51 AM - 30 Nov 2015|That awkward moment someone really loves relates one songs it's real life #MCM pic twitter com dyoXm46f0j|1|53
3:46 PM - 29 Nov 2015|The storms already killed 14 people across Plains Midwest http huff 1NWEOkf pic twitter com W9HFOGV6Ro|56|37
3:12 PM - 29 Nov 2015|Tomorrow's gonna rough|1|3
2:30 PM - 29 Nov 2015|I hope I wake tomorrow lot happier I today|36|40
2:31 PM - 29 Nov 2015|KILLING IT FAMOUS YOUTUBER - MUSIC VIDEO https www youtube com watch v TvAqcCyIOno RT pic twitter com wHadjVLitU|603|2.4K
2:37 PM - 29 Nov 2015|Rt can't adult|344|175
2:38 PM - 29 Nov 2015|Everybody watches ya back you're front|551|1.4K
2:23 PM - 27 Nov 2015|Cyber Monday Deals Week Starts Today - Shop Now http www amazon com b ie UTF8 node 5550342011 tag tsa030-20 ascsubtag ptw-NUL-1-5-1448662965724rF ref_ ptw_NUL_1_5_1448662965724rF pic twitter com 3X46Okg1Mg|133|237
2:01 PM - 29 Nov 2015|BREAKING Subway announced huge menu change coming soon http bit ly 1Sk2VwB pic twitter com 1kfTlKbFcw|5|7
12:45 PM - 29 Nov 2015|20 everything Office using code 'SNOW' Trainers boots heels http bit ly 1eZHQKv|1|1
12:20 PM - 29 Nov 2015|2 studies call police shooting 12-year-old Tamir Rice Cleveland unreasonable http nyti ms 1MNXEMB pic twitter com SACo8jVYUy|230|242
10:10 AM - 29 Nov 2015|@trishapaytas much fun last night #podcast Kalien 51 come|2|5
11:21 AM - 29 Nov 2015|Sunday meet|31|108
11:23 AM - 29 Nov 2015|This pic twitter com 5BZJbG8AM9|252|385
11:23 AM - 29 Nov 2015|We must confess Bon lookin' fresh Yep we're impressed #FifthHarmony pic twitter com HQ0DtHmxhK|132|206
11:09 AM - 29 Nov 2015|realize tomorrow monday pic twitter com iSIOSosFWB|236|238
5:46 AM - 29 Nov 2015|If we're good terms December 31st you're left 2015|4.7K|4.5K
6:00 AM - 29 Nov 2015|less 4 weeks Christmas pic twitter com 6m8aE4iQ2J|5.3K|5.7K
7:43 AM - 29 Nov 2015|Now icing doodle strudel Yeah that's roll pic twitter com w8nROCYTTS|44|135
9:30 AM - 28 Nov 2015|Working holiday body like https vine co v M9wBHVWzi9Z|573|1.1K
1:08 PM - 28 Nov 2015|The holiday music need available @WhatsupDanny see video proof buy http www youtube com watch v J4b7reTdLII sns em pic twitter com R8n0mhnf8W|9|26
3:38 PM - 28 Nov 2015|Watch @kanyewest commercial final season @AmericanIdol http p4k co Vdqal pic twitter com lxdJ8kh6ny|31|123
3:20 PM - 28 Nov 2015|Watch Kardashians teenage boy's contour game fleek http huff 1MLwwho pic twitter com 4rTF9nlRis|70|165
3:30 PM - 28 Nov 2015|dressed lookin cute pic twitter com cJJWYlIypT|940|1.6K
3:30 PM - 28 Nov 2015|Maurice Strong pioneering climate sustainability leader dies 86 http mash 1OxbiVd pic twitter com 0WKlZxbW0o|68|40
8:38 AM - 27 Nov 2015|Ten year old Damilola Taylor stabbed death day 2000 He'd 25 today RIP pic twitter com omlruUutt8|1.7K|939
7:24 AM - 28 Nov 2015|On train placing another ASOS order I clearly problem Get 20 using code 'CYBER' http bit ly 1IMSBfF|1|0
7:22 AM - 28 Nov 2015|Bad hair day More like bad hair life|1K|1.3K
7:24 AM - 28 Nov 2015|love always wins|245|573
12:30 AM - 28 Nov 2015|IT'S THE WEEKEND pic twitter com bFSpkChTq9|600|1.1K
1:04 PM - 27 Nov 2015|#CinnaPack Time reward deals snagged today pic twitter com kyMKb1c3QT|19|52
7:46 AM - 27 Nov 2015|Last minute papers due finals coming lowkey becoming broke food fun studying can't focus pic twitter com NUKCBZm3Hn|1.6K|2.5K
3:19 AM - 27 Nov 2015|Watch M I A @MIAuniverse travel band refugees Borders video http p4k co V8oOP pic twitter com ZcYSyUYfc7|521|638
3:21 AM - 27 Nov 2015|#Pisces love passionate kisses loving embrace|13|30
3:04 AM - 27 Nov 2015|Before shop today Here's handy guide brands DON'T test animals #BlackFriday pic twitter com nZOxDdLkQz|469|549
1:06 AM - 27 Nov 2015|Imagine lobsters sounded like Dr Zoidberg escaping divers http mash 1IdUMKh pic twitter com VI3eBrYxA9|33|39
8:56 PM - 26 Nov 2015|You aren wealthy something money buy -Garth Brooks|731|959
10:53 PM - 26 Nov 2015|thankful small dogs big dogs medium dogs puppy dogs old dogs fluffy dogs fluffy dogs cute dogs cute dogs dogs|5.1K|7K
11:09 PM - 26 Nov 2015|Why Adele cross road To say hello side|1.8K|2.8K
7:59 PM - 26 Nov 2015|Now I'm like pic twitter com CivxT6SyC3|36|168
8:03 PM - 26 Nov 2015|trying relax thanksgiving break knowing I 3 papers 5 finals cure cancer due I get back pic twitter com W9ymi1h5IX|650|785
8:06 PM - 26 Nov 2015|thankful small dogs big dogs medium dogs puppy dogs old dogs fluffy dogs fluffy dogs cute dogs cute dogs dogs|2.8K|3.1K
8:07 PM - 26 Nov 2015|Enjoy savings ALL WEEKEND get 30 ENTIRE WEBSITE This crazy good deal happens year waiting|10|24
8:10 PM - 26 Nov 2015|There's always room MORE PIE|32|93
6:01 PM - 26 Nov 2015|No animal born live tank cage #BoycottTheZoo|57|79
1:49 PM - 26 Nov 2015|Just Added new #Gift Sets Tonight's #BlackFriday SALE http MooshWalks com mark items wait pic twitter com MrJpCdmV0v|6|41
1:53 PM - 26 Nov 2015|Thanksgiving marvelous time year loving family show memes dinner table instead texting|807|2K
1:56 PM - 26 Nov 2015|Celebrating Thanksgiving @Snapchat Discover Check pic twitter com m1uiHLeag7|51|138
11:17 AM - 26 Nov 2015|I cant wait pic twitter com Yeu52dfkQf|3.4K|4.1K
2:00 PM - 26 Nov 2015|Enuff said #HappyThanksgiving pic twitter com 6dmcc1xtWI|4|6
2:00 PM - 26 Nov 2015|Happy Thanksgiving Seawolves Fans We couldn't thankful support dedication|2|3
2:02 PM - 26 Nov 2015|Thanksgiving great time reunite family pic twitter com 7aYj9HMrf2|140|426
2:01 PM - 26 Nov 2015|happy thanksgiving everyone|1|1
2:02 PM - 26 Nov 2015|Let's say grace pic twitter com xatx7FRzHq|50|79
7:38 AM - 26 Nov 2015|Awkward pic twitter com 31P39nNM2O|126|314
10:27 AM - 26 Nov 2015|doesn't make happy idk pic twitter com oo4W7VtUUW|651|1.6K
2:02 PM - 26 Nov 2015|If re planning braving Black Friday madness tomorrow ll want read first http bit ly LCxShppngLst1126|24|59
7:30 AM - 26 Nov 2015|Nerdist Presents The Gobble Games #HungerGames #Thanksgiving parody - http nerdi st 1NqWWbG pic twitter com sm8LYkeLwC|9|21
7:30 AM - 26 Nov 2015|Happy #Thanksgiving everyone pic twitter com zdKr8xvb4A|17|38
7:30 AM - 26 Nov 2015|These regional Thanksgiving traditions kind crazy http r29 co 1lzVU0J pic twitter com MMxbWPd3YK|8|14
7:30 AM - 26 Nov 2015|Via @HiddenBrain How To Survive And Maybe Even Enjoy Thanksgiving Dinner http n pr 1PQpqvD|39|49
3:44 AM - 26 Nov 2015|Happy American Thanksgiving pic twitter com tyZJe3EnOu|2|5
7:03 AM - 26 Nov 2015|What giving thanks today pic twitter com hrLr3BEnZt|20|66
5:41 AM - 25 Nov 2015|All best Black Friday deals blog 6am Friday morning ITS ABOUT TO BE ON|6|33
9:02 PM - 24 Nov 2015|I super hero|5.1K|5.4K
12:58 AM - 25 Nov 2015|The Bomb Factory Dallas fucking epic adventure|926|1.9K
3:06 PM - 24 Nov 2015|MORE MOVIES FOR 2016 pic twitter com 6h8hWKW281|2.7K|2K
2:53 PM - 24 Nov 2015|MOST ANTICIPATED FILMS FOR 2016 pic twitter com WYWl7F2h4H|11K|12K
3:29 PM - 24 Nov 2015|ANIMATED FILMS FOR 2016 pic twitter com 9NVRIiMhog|3.3K|2.8K
1:12 PM - 24 Nov 2015|Bindi Irwin breaks moving DWTS finale performance honoring late father http huff 1Tcl3JS pic twitter com UJ3SHZwHj9|29|102
1:12 PM - 24 Nov 2015|#ImNotAGrinchBut I green grumpy pic twitter com LPkcnDNbKY|87|154
9:50 AM - 24 Nov 2015|2012 Turkeys Gobbler died less 1 year ceremony Cobbler euthanized less 1 year ceremony #TurkeyPardon2015|14|40
7:21 AM - 17 Nov 2015|next week thanksgiving break pic twitter com eMJjUmCLmU|13K|11K
8:03 AM - 24 Nov 2015|Today Listen I walrus @thebeatles celebrate #walrusday pic twitter com qOHW2KdWyL|248|361
4:50 PM - 23 Nov 2015|It's time year https vine co v hT2wKni63Km|1.7K|2.7K
7:09 AM - 24 Nov 2015|Stop afraid could go wrong start positive could go right|17|20
8:05 AM - 24 Nov 2015|I learned everything I needed know John Cougar John Deere John 3 16 -Keith Urban|324|723
8:05 AM - 24 Nov 2015|She done @Adele '25 officially broken U S single-week sales record http go spin com 1Nq8mwd pic twitter com 51ysb72k7K|42|60
7:09 AM - 24 Nov 2015|Hello It's pic twitter com NBuyKGsl1b|97|159
7:50 AM - 24 Nov 2015|whenever someone brings school pic twitter com kMb5iqG6F1|1.7K|3K
5:17 PM - 23 Nov 2015|When get way hits anything princess pic twitter com yKJJGLZBCq|5.8K|13K
4:47 PM - 23 Nov 2015|New #GameOfThrones Season 6 poster teases bloody Jon Snow April premiere http mash 1I6t8Pa pic twitter com FixKhLkHRt|226|175
2:30 PM - 23 Nov 2015|Jaguar Commercial #TheAudition #XE Full Commercial facebook page http Facebook com LoveLianeV pic twitter com E3xRfpKI3R|11|87
2:30 PM - 23 Nov 2015|Ain reason running something already gone -Luke Bryan|620|934
1:49 PM - 23 Nov 2015|This great http www buzzfeed com chelseamarshall awkward-dogs-of-2015 bffbmain utm_term lelmV7k5Z# xnlzV3YLK|18|29
2:28 PM - 23 Nov 2015|Todd can't iPad thanksgiving seriously stop asking thanksgiving presents|139|399
12:42 PM - 23 Nov 2015|THESE WERE SO CUTE https www youtube com watch v x6UiwSKVblw Come hangout comments D|499|2.3K
12:42 PM - 23 Nov 2015|Reason #582 Because parking lot bootleg tee isn quite right #ReasonsYouNeedNewTees Black Friday coming pic twitter com yo2yGkpGjX|124|502
7:43 AM - 23 Nov 2015|Mornin' Let's get weird Patti Cake Make You Shake Bitch https youtu pMUwn2vToDo https amp twimg com v 5d847964-352f-42d4-80e5-76b0eae3bdfd|15|130
12:35 PM - 23 Nov 2015|It's amazing I'm able get done I need something else|534|672
12:38 PM - 23 Nov 2015|Here another really good 2015 end-of-the-year mashup http bzfd 1kQoNFO|10|34
12:37 PM - 23 Nov 2015|@BBCOne @bbcdoctorwho @DoctorWho_BBCA happy 52th anniversary I love show bits https vine co v izrit1lbQeJ|19|75
9:26 AM - 23 Nov 2015|NEW VIDEO 2015 #AMAs Recap Meghan Charlie Make Out Ariana Slays Bieber Back LOTS OF JOKES I'M ON POINT https youtu x8KtEIyjH_k|42|27
9:27 AM - 23 Nov 2015|Just posted 10th AMA recap RE-TWEET previous tweet DM - day WHEEEE Thanks sexy XO|5|20
9:20 AM - 23 Nov 2015|Orca behaviors #SeaWorld calls natural -Floating listlessly -Tankmate bullying -Killing humans -Swimming circles|165|216
9:20 AM - 23 Nov 2015|#Miami paradise beaches night life nature art food plenty #FlightDeals http bit ly 1TalzrV pic twitter com ifFJ4xo3kO|5|10
9:20 AM - 23 Nov 2015|Adele's something NO woman done http cosm ag 6012BRWOY pic twitter com AkZhrSOYvb|33|61
9:20 AM - 23 Nov 2015|Every day World Fisheries Day https twitter com EDFOceans status 668115203171737601|2|4
9:21 AM - 23 Nov 2015|We're screening #CanYouDigThis 12 3 7PM @DowntownIndie w @RonFinleyHQ tix avail http thugkitchen com dig_this pic twitter com u79S4POlaI|9|11
9:22 AM - 23 Nov 2015|Last month declared hottest October record monster El Ni o gathers strength http bit ly 1Ta7MS4|13|4
9:29 AM - 22 Nov 2015|Hello watersliiiiiide|3.1K|4.9K
5:07 PM - 22 Nov 2015|Carrie Underwood slayed entire life #AMAs pic twitter com BUP7W3vrn0|2.8K|5.3K
5:45 PM - 22 Nov 2015|Miss Piggy Adele GAME guys #AMAs|11|33
7:00 PM - 21 Nov 2015|2015 weird ass year like hella shit happened changed within one year like damn|1.7K|3K
3:00 PM - 21 Nov 2015|This life size wedding cake bride groom haunt http cosm ag 6012BRece|10|10
3:30 PM - 21 Nov 2015|18 problems phone addicts understand http cosm ag 6017BRemd|28|34
7:02 AM - 22 Nov 2015|@OfficialJLD @SnoopDogg @Kumailn gettin' together world premiere latest spot #onemillthrill https amp twimg com v 455068da-f4ab-45b2-9e0c-45874b803869|564|1.1K
7:12 AM - 22 Nov 2015|How cuddle owl pic twitter com me75ImRk5w|158|351
7:04 AM - 22 Nov 2015|#CrocodileHunter ended day 2004 Thinking Steve Irwin pic twitter com wLJrdbJyMR|31|79
7:06 AM - 22 Nov 2015|Get head|3K|2.4K
7:10 AM - 22 Nov 2015|1960s holiday shopping displays absolute corniest http mash 1OhWU31 ht @theretronaut pic twitter com 0zOto6R1Ka|59|60
6:00 AM - 22 Nov 2015|HANNAH MONTANA'S ID EXPIRES ON 11 23 15 RETWEET THIS BEFORE ITS TOO LATE pic twitter com dwzcuWmFTA|3.2K|2.3K
6:04 AM - 22 Nov 2015|What's going|1|0
7:06 PM - 20 Nov 2015|Let's breakfast pic twitter com 2oPTLA8EZM|38|86
1:33 PM - 21 Nov 2015|When love @QuestNutrition PB Quest peanut butter protein muffins chocolate PB quest bar chunks pic twitter com 8yZyKXYrVd|13|35
2:00 PM - 21 Nov 2015|This cute pic twitter com OqiLyD8ZOG|748|1.7K
2:46 PM - 21 Nov 2015|college like http twitter com girlposts status 668192660390346752 photo 1pic twitter com m2dXG5GEUN|979|1.9K
2:50 PM - 21 Nov 2015|I would never wear https twitter com irwinxsmash status 668199250778390528|352|1.5K
3:34 PM - 21 Nov 2015|I two moods pic twitter com CnP2OguzIw|3.8K|4.2K
3:45 PM - 21 Nov 2015|Seeing stars Little White Lies X UO dress http bit ly 1QSZkHF pic twitter com 9ltAuoFisc|40|266
5:36 PM - 21 Nov 2015|Drink water Eat healthy Be fit Live happy|93|181
5:37 PM - 21 Nov 2015|Age guarantee maturity -Lawana Blackwell|224|235
5:40 PM - 21 Nov 2015|Lunch pic twitter com Avh6GAwsZq|281|865
7:40 PM - 21 Nov 2015|life 1 photo pic twitter com 24LydJOFfD|919|1.7K
7:31 PM - 21 Nov 2015|Military green pic twitter com WwQjoo6XzA|116|188
7:30 PM - 21 Nov 2015|Train Eat Repeat pic twitter com pvGBzTJ53T|44|245
5:40 PM - 21 Nov 2015|Do right easy|152|157
7:39 PM - 21 Nov 2015|Talent God given Be humble Fame man-given Be grateful Conceit self-given Be careful|35|48
7:40 PM - 21 Nov 2015|I used word dope adjective Wtf wrong|29|354
7:44 PM - 21 Nov 2015|Get away BITCH|51|174
7:44 PM - 21 Nov 2015|appreciation post tolerated every second existence|2.3K|3K
7:46 PM - 21 Nov 2015|Penny vase pic twitter com TnIMQk8S6Y|7|16
7:49 PM - 21 Nov 2015|Want pic twitter com XdMPiyYiws|4|18
7:47 PM - 21 Nov 2015|mood minus carrot suck https instagram com p -X12ZjQDtN|3|9
7:40 PM - 21 Nov 2015|Do re mi fa done semester|1.8K|2.1K
5:32 PM - 21 Nov 2015|Steel-jaw traps BANNED 88 countries RT want banned ALL U S|64|39
5:38 PM - 21 Nov 2015|Britons killed NZ crash named http bbc 1MuWaXv|76|89
5:40 PM - 21 Nov 2015|When says I never pic twitter com Yfybk1U1nz|193|596
3:30 PM - 21 Nov 2015|Your timeline needs Great Danes pic twitter com 6cWBq9Bpsb|2.3K|4.7K
3:34 PM - 21 Nov 2015|You used call shellphone #TIUteam @Drake pic twitter com FazPvXMhLK|26|120
3:45 PM - 21 Nov 2015|Get The Be rewarded barrels burritos towers tacos eat http ow ly UVwCy pic twitter com JEvOLSVYFD|1|4
3:45 PM - 21 Nov 2015|Fruit lover life pic twitter com Y3GLH6zsDV|106|246
3:48 PM - 21 Nov 2015|There mistakes life lessons|468|499
3:51 PM - 21 Nov 2015|mom won't stop talking pic twitter com 6PJ2Omy5De|1.6K|2.9K
3:49 PM - 21 Nov 2015|You far valuable like rest Never settle Never give You amazing person deserves world|14|12
9:36 AM - 21 Nov 2015|96 cars buy LI right 5 000 http nwsdy li 1O8OUmA pic twitter com z2cpRmTiHj|2|3
2:55 PM - 21 Nov 2015|The difference excellence mediocrity commitment|52|84
3:00 PM - 21 Nov 2015|That's putting lightly #Gotham pic twitter com g3vILhGCBB|155|366
3:00 PM - 21 Nov 2015|You charge feel|329|407
3:01 PM - 21 Nov 2015|Forcing animals perform tricks entertainment it's cruelty #BoycottTheCircus|61|59
7:04 PM - 20 Nov 2015|Last minute cruises 199 Now that's sweet deal get board Pun intended http expd us SrdAqV pic twitter com wyM8Mu9OxZ|6|18
7:05 PM - 15 Nov 2015|look absolutely adorable happy awe @trishapaytas pic twitter com WBy7YzWp5t|9|115
7:29 PM - 15 Nov 2015|Watching Ellen YouTube I see @trishapaytas looking super cute pic twitter com wYOYDHUTP3|23|224
7:36 PM - 15 Nov 2015|An actual picture @trishapaytas looking 8 yrs ago pic twitter com 4pdGeHJeP2|48|345
8:22 PM - 15 Nov 2015|everything going wrong u pretend everything ok pic twitter com 7G3IYplsJu|1.7K|2.5K
5:36 AM - 16 Nov 2015|@GraceFVictory Yasssssssss girl yasssssss pic twitter com wGxPVWcMCb|11|20
