5:43 AM - 16 Nov 2015|Step away scale focus health happiness|25|47
5:45 AM - 16 Nov 2015|Love pic twitter com LvmtmzaPsA|15|64
5:53 AM - 16 Nov 2015|#Spinach Weight Loss http aboutnutritionfacts com 6lbt pic twitter com uFZYHIOsRA|4|3
5:50 AM - 16 Nov 2015|#Pisces get close others fast amp amp amp things go sour devastated|5|27
5:57 AM - 16 Nov 2015|One important key success self-confidence An important key self-confidence preparation - Arthur Ashe|496|544
5:57 AM - 16 Nov 2015|What today make proud year|83|118
7:37 AM - 16 Nov 2015|Wow modern romance beautiful pic twitter com q5Hqy9V26b|1.4K|2.4K
10:31 AM - 16 Nov 2015|Some things black white pic twitter com ivTeC1NgY6|162|189
10:42 AM - 16 Nov 2015|mom asks u going start passing ur classes pic twitter com fDYAMYO6XT|1.4K|2.4K
10:45 AM - 16 Nov 2015|Train booty pic twitter com iDFy3ypvZi|51|174
10:45 AM - 16 Nov 2015|Off set Driving jam All Eyes You St Lucia http spoti fi JHOaTx|58|682
12:01 PM - 16 Nov 2015|Infinity hot tubs view pic twitter com YiP7NWYnlX|155|268
3:01 AM - 17 Nov 2015|Imagine able take bath view every day pic twitter com hUsVXSevOl|83|163
11:46 AM - 17 Nov 2015|#Pisces people bipolar don't know|16|36
3:31 PM - 17 Nov 2015|Want pic twitter com FWBA6TYwML|92|133
10:01 AM - 18 Nov 2015|Nice pic twitter com D6Ls0sjTe7|113|175
10:31 AM - 18 Nov 2015|Porsche paint job pic twitter com FQVbTD3pwt|197|329
11:43 AM - 18 Nov 2015|@TBSOfficial x @SweetRelief offer exclusive autographed backdrop #charity Bid http bit ly 1SW7jDa pic twitter com RnpG8tZ7tB|23|52
12:58 PM - 18 Nov 2015|GIF skills #madewithtumblr http tumblr co UOJNb pic twitter com zMgOAd2mPt|19|93
12:58 PM - 18 Nov 2015|What mean I can't believe you've read whole book already What else it's open|14|26
12:58 PM - 18 Nov 2015|When stop chasing wrong things give right things chance catch|154|197
12:01 AM - 19 Nov 2015|I need go massive indoor beach pic twitter com Y94UWyJSNS|186|182
5:00 AM - 19 Nov 2015|Life hacks pic twitter com 9DdKw2Vk2B|435|659
5:01 AM - 19 Nov 2015|Money wealthy man's curtain hides defects world|215|279
5:02 AM - 19 Nov 2015|Reality http tumblr co UOH7Z pic twitter com mZ1samBbHc|141|413
5:04 AM - 19 Nov 2015|You actually burn calories eating celery take It also helps lower blood pressure|8|9
5:11 AM - 19 Nov 2015|It's November right Well feels like spring|1|1
9:54 AM - 19 Nov 2015|Never get busy making living forget make life|350|399
5:36 AM - 20 Nov 2015|Song day Die something beautiful @PalayeRoyale pic twitter com Wx7QFmBSf0|4|12
8:29 AM - 20 Nov 2015|November 20th 1982 I born 2 months premature I couldn't wait least try dominate world pic twitter com gyUuMXRBmx|26|176
8:25 AM - 20 Nov 2015|RT chance win @JohannaBasford's new Inky Adventure #ColoringBook #LostOcean http po st lostoceanbk pic twitter com LoPpXRUrdm|576|127
8:28 AM - 20 Nov 2015|Eve Picks For Black Friday http goo gl fb j1f0K9|1|0
6:03 PM - 19 Nov 2015|I really wanna wearing husband's t-shirt flipping pancakes pretty house good job 2 dogs That's|3.6K|8.2K
4:01 AM - 20 Nov 2015|RT want stay villas pic twitter com AAqo8plXcG|111|143
9:55 AM - 19 Nov 2015|Jim 100 pic twitter com A5eNGohzzz|827|2.1K
9:55 AM - 19 Nov 2015|Today 2006 Nintendo's Wii first goes sale Ralph Baer father video games http ow ly UJFqJ pic twitter com W5u1Kvocjg|10|14
9:00 AM - 17 Nov 2015|'Tis season The Silver Starbucks Card adorned Swarovski crystals available pic twitter com fjQwU1twnA|1.4K|5.3K
9:03 PM - 18 Nov 2015|rlly hope Christmas feels like Christmas year|2K|4.9K
1:40 PM - 18 Nov 2015|This Diesel She 7 year old police dog killed today's hunt Paris attackers R I P pic twitter com LXhR3beOAQ|4.4K|11K
10:01 AM - 17 Nov 2015|boys take education responsibilities seriously much attractive rather boys care|666|1.5K
10:28 AM - 17 Nov 2015|ur trying best nothing going right pic twitter com oe1L2wBwOX|3.2K|5.1K
1:45 PM - 14 Nov 2015|3 mind games get tough runs http spr ly 6010Buon8 via @runnersworld pic twitter com JPIBrL0Iyo|64|113
5:55 AM - 16 Nov 2015|want #CelebrateMonday staying bed day|151|140
