10:59 PM - 6 Dec 2015|Tried brushing teeth toothbrush left hand felt like newborn|15|145
9:56 AM - 7 Dec 2015|11 days pic twitter com BZnbaC3xym|116|126
10:20 AM - 7 Dec 2015|Let stop second realize reindeer dicks|1.7K|3.6K
11:46 AM - 2 Dec 2015|Decker Vs Dracula Behind The Truth Decker Adult Swim http youtu MdVEmJFT8RI|58|230
3:11 PM - 4 Dec 2015|Netflix THRILL Watch ten eps @ComedyBangBang dropped weekend|69|382
11:33 AM - 3 Dec 2015|Jimmy explains advertising evolved sponsored content - watch Truth Advertising FREE https amp twimg com v 22ee5a28-47ff-40b8-8d4d-49a6950ae18f|506|904
11:13 AM - 3 Dec 2015|On Cartoon Network Latin America Powerpuff Girls called Chocolate Bubble Acorn Bomb n Burbuja Bellota|44|107
8:42 AM - 3 Dec 2015|Look I already said I prefer Batman But Superman fly space reverse time He could go back kill Baby Bruce End|1.2K|3.1K
