7:50 PM - 29 Nov 2015|Drinking makes feel bad bad sober interacting people I persevere|30|76
9:22 PM - 27 Nov 2015|thankful friends I thankful friends I've lost|4|6
4:40 PM - 27 Nov 2015|I sexually attracted @PaulyShore There Internet fucking secrets|3|43
9:05 AM - 26 Nov 2015|one day I'll family that's alcoholic I|1|6
4:27 PM - 22 Nov 2015|Harry pulling pants sexual orientation pic twitter com CkSork2404|24|75
7:18 PM - 16 Nov 2015|hey buddy hey I see trying sneak peak knees holes jeans tits|2|3
