3:37 AM - 4 Dec 2015|About time Amy Poehler receives star Hollywood Walk Fame http eonli ne 1RrhTmG|102|352
12:10 AM - 3 Dec 2015|every call shower taking showie mandel 39 happier|278|953
10:16 AM - 23 Nov 2015|UPDATE Belgian PM says Brussels schools metro reopen Wednesday|162|68
8:06 AM - 18 Nov 2015|Please watch funny beautiful show start finish And feel little better world #ConanArmenia https twitter com Splitsider status 666980693344391170|24|54
7:19 AM - 16 Nov 2015|Mom @ingridsilalahi Mexico City pic twitter com 2ATcAIhQsF|1|2
7:11 PM - 15 Nov 2015|#ParisAttacks - France launches air strikes Syria - Manhunt way Belgian-born suspect Salah Abdesalam http bbc 1StBoJt|667|612
12:51 PM - 14 Nov 2015|Paris Attacks far Three teams Frenchman identified three Belgians arrested http eurone ws UEEha pic twitter com NdNKm5lSGm|33|22
