5:03 PM - 11 Dec 2015|December 11th 2015 pic twitter com hoNI2o9ofV|786|1K
5:11 PM - 11 Dec 2015|Is late bring tissues extra credit|929|1.3K
4:43 AM - 11 Dec 2015|How many times nose going bleed today daily challenge|1|1
6:03 PM - 11 Dec 2015|every day pic twitter com T17qGYdRYr|4.1K|8.8K
6:19 PM - 11 Dec 2015|WANT pic twitter com Qde0sF8QO1|2K|3.4K
6:20 PM - 11 Dec 2015|WHO DID THIS pic twitter com lzUW1d5a65|909|1.6K
6:30 PM - 11 Dec 2015|feminism joke pic twitter com aByD51LAYY|633|694
6:51 PM - 10 Dec 2015|FEMINISM IS NOT A DIRTY WORD FEMINISM IS NOT A DIRTY WORD FEMINISM IS NOT A DIRTY WORD FEMINISM IS NOT A DIRTY WORD|25|43
7:05 PM - 8 Dec 2015|This made day pic twitter com rC1o42EM2N|5.6K|11K
6:31 PM - 10 Dec 2015|straight boys even surviving pic twitter com CcG3uNXt2d|2.4K|6.3K
8:19 PM - 27 Nov 2015|I need femism sorry time care men murdering people abortion clinics know starbucks changed CUP DESIGN|2K|3.3K
7:08 AM - 8 Dec 2015|Me social situation pic twitter com kkDZ0NIkfM|3.2K|5.7K
3:59 AM - 8 Dec 2015|How horrible Voldemort nowhere near bad https twitter com BBCNewsbeat status 674170911344455680|220K|200K
5:13 AM - 8 Dec 2015|mornings gross want part|2.1K|3.3K
4:57 AM - 8 Dec 2015|I need ask Kostic fuck he's always yelling I get you're saying even don't make deaf|1|1
5:11 PM - 6 Dec 2015|lost motivation care christmas|868|892
9:20 AM - 5 Dec 2015|There's really dark deeply routed sadness microwaved s'mores|366|1.6K
1:50 AM - 4 Dec 2015|nat king cole like nat king cool|1.6K|4.3K
7:12 PM - 3 Dec 2015|I regret nearly everything I ages birth however old I yesterday|2.2K|4.6K
9:02 PM - 3 Dec 2015|love math teachers put question marks tests cause m like yeah|4.8K|9.2K
9:03 PM - 3 Dec 2015|How close I losing shit pic twitter com pRkN1hIAdf|5.2K|8.6K
2:23 PM - 3 Dec 2015|I'm star stuck I saw dog whisperer|20|76
9:22 AM - 3 Dec 2015|like bed like people|3.1K|3.8K
8:12 PM - 2 Dec 2015|soon think maybe get early finish tomorrow ve already lost|6.1K|12K
1:24 PM - 1 Dec 2015|This plane wifi bad Ugh Or least that's I'm telling one responding texts|227|1.4K
7:17 PM - 1 Dec 2015|When autocorrect texts On way instead omw pic twitter com nVc4bXv7xk|3.6K|7.9K
12:54 PM - 21 Nov 2015|Thanksgiving Christmas foreplay|978|2.3K
7:27 AM - 28 Nov 2015|Team Snapchat one else|1.1K|3K
6:37 PM - 30 Nov 2015|someone physically attractive boring hell pic twitter com qABXy9DIVe|4.5K|10K
5:31 PM - 30 Nov 2015|My mom got 4 10 wrong quizzed whether picture @ShawnMendes|838|3.5K
6:49 PM - 29 Nov 2015|Why didn't throw father Gabriel stairs bait @miilkkk #twd|63|140
6:57 PM - 29 Nov 2015|u realize thanksgiving break almost u go school tomorrow pic twitter com oyKUQyw3ZG|3.8K|6.2K
6:52 PM - 29 Nov 2015|Really Morgan You'd fight maybe kill Carol keep Wolf ALIVE WEAK Morgan might die TONIGHT Carol might kill #TWD|43|180
7:01 PM - 29 Nov 2015|little fucking kid fuck everything|229|540
6:46 PM - 29 Nov 2015|I hope Morgan Carol dont kill eachother well I don't want carol die Morgan dead|86|197
6:46 PM - 29 Nov 2015|Patiently waiting Abraham Daryl show rocket launcher fuel truck #TWD pic twitter com Ujs4TIWjTd|238|372
6:39 PM - 29 Nov 2015|@miilkkk Eugene like Bruh I got finals comin|65|128
6:38 PM - 29 Nov 2015|@miilkkk Carl roasted pic twitter com ZAJPKBAY9a|23|76
6:41 PM - 29 Nov 2015|And one last time mid season finale WHERE THE HELL IS DARYL @miilkkk|31|80
6:12 PM - 29 Nov 2015|I don't know I'm emotionally ready watch TWD right|147|179
8:55 AM - 28 Nov 2015|dressed lookin cute pic twitter com Wk0NOgxUoD|6.1K|7.6K
1:41 PM - 26 Nov 2015|IT'S OFFICALLY SLAPSGIVING HAPPY SLAPSGIVING pic twitter com iA5272LLT0|814|1.3K
2:08 PM - 26 Nov 2015|What kind Black Friday deals guys @FAFSA|4.2K|5.4K
10:16 AM - 26 Nov 2015|Black Friday deal college tuition thing|3.9K|5.9K
9:32 AM - 25 Nov 2015|AP Chem like blankly staring piece paper 40 minutes every day|1|6
2:32 PM - 24 Nov 2015|basically pic twitter com iu7d0GPqg8|1.7K|2K
6:34 PM - 22 Nov 2015|My new job pic twitter com U0Ly3GzGvp|35|58
6:37 PM - 22 Nov 2015|@miilkkk Finding Glenn alive like pic twitter com FrAuCxrZRW|224|378
7:00 PM - 22 Nov 2015|ohhhhhhhh shit omfg|57|141
6:56 PM - 22 Nov 2015|ohhhhhhhhhhhhhhhhhhhhhhhhhh shit|79|165
6:03 PM - 22 Nov 2015|YEP FREAKING KNEW IT DUDE #TWD|145|295
6:04 PM - 22 Nov 2015|2 minutes walking dead I've already gasped Love|149|336
6:10 PM - 22 Nov 2015|THIS IS THE BEST THING EVER THANK YOU FOR BEING ALIVE GLENN|221|401
6:11 PM - 22 Nov 2015|Noooooooo starting look like shane|49|238
6:12 PM - 22 Nov 2015|To everyone gave hope #TWD #GlennIsAlive pic twitter com JT8bCqMHv9|1.1K|1.4K
6:12 PM - 22 Nov 2015|RT reaction found Glenn still alive #TWD pic twitter com JAOExp3Xbk|339|319
12:21 PM - 22 Nov 2015|Already thanksgiving outfit planned pic twitter com h6Tr9vCQli|3.1K|4.8K
6:28 PM - 21 Nov 2015|They went pic twitter com lnHLXcU9ok|1K|2.1K
7:05 PM - 19 Nov 2015|life changed two photos pic twitter com s9fS9jpYkf|1.6K|2K
8:47 AM - 20 Nov 2015|Me changes date homework make seem like I early|460|1.3K
8:47 AM - 20 Nov 2015|A total 60 doors destroyed Jack Nicholson iconic Here's Johnny scene The Shining|485|1.2K
9:57 AM - 18 Nov 2015|grades kinda good someone urge dropping everyday|484|848
10:04 AM - 17 Nov 2015|something stressful comes pic twitter com AziT12qVMg|4.2K|6.2K
1:09 PM - 14 Nov 2015|important pic twitter com YBbsajmCMJ|2.8K|3.9K
