8:19 AM - 12 Dec 2015|I realized Caturday let's see cats|1.7K|4K
11:54 PM - 11 Dec 2015|Do It amazing many things life easy Henry Rollins|692|949
11:45 PM - 11 Dec 2015|We must face choice right easy Dumbledore Harry Potter Goblet Fire|143|170
11:20 PM - 11 Dec 2015|sketchbook quickie pic twitter com RQ76WhhCLq|165|695
11:15 PM - 11 Dec 2015|Sometimes good things fall apart better things fall together|89|173
7:45 AM - 11 Dec 2015|When chips good synth humor disarm situation you're beside oneself #Fallout4 #Puns pic twitter com BRoqKjywS0|36|61
10:18 PM - 10 Dec 2015|Hey @RickandMorty we're huge fans show Be next music video|106|386
9:54 PM - 9 Dec 2015|I clumsy human always loving loving loving And loving And never leaving Frida Kahlo|1.1K|1.7K
9:12 PM - 10 Dec 2015|If I lose job I never blame Asian I always assume it's think I'm fat|12|32
9:17 PM - 10 Dec 2015|The Shawshank Redemption pic twitter com 4AQ950ECgD|585|746
3:03 PM - 10 Dec 2015|EXCL PREVIEW @Doncates @dylrburnett's Interceptor #2 Traps You Vampire Prison http go cbr cc 1OUw5UA pic twitter com 7L8iiYmuyN|11|18
3:00 PM - 10 Dec 2015|lol Spurs bench https vine co v MIga19hWhab|1.3K|2K
9:30 PM - 9 Dec 2015|This one's @JuddApatow #eYEMarty get copy http eyEMarty com #andykaufman #richardpryor pic twitter com MH5ToDCYvs|51|174
7:18 PM - 9 Dec 2015|You ask hangout house eat yogurt never expects anything - Wyatt dating|2|5
8:40 PM - 8 Dec 2015|Overthinking kills|1.2K|1.1K
10:43 PM - 8 Dec 2015|Tricks getting restful night sleep -dont bring ur phone bed u -put far away -do u hear -ur ur phone arent u|69|275
10:51 PM - 8 Dec 2015|Being The #VSFashionShow cool ever eaten Oreo dipped peanut butter|1.7K|3.1K
6:15 PM - 8 Dec 2015|Go Christmas pic twitter com WLCUYiPFwS|203|440
7:11 PM - 7 Dec 2015|King Joffrey Donald Trump|2.1K|1.8K
10:45 PM - 7 Dec 2015|RT you'd like see First Game AZGs come back pic twitter com LuRPXw8ILb|315|292
10:49 PM - 7 Dec 2015|This deal LeBron Nike pretty much secures Nike telling story LeBron Legacy years come|66|97
11:00 PM - 7 Dec 2015|We seem made suffer It lot life C-3PO Star Wars|97|158
11:05 PM - 7 Dec 2015|The Air Jordan 1 5 Gorge Green inspired Milwaukee Bucks http www sneakershouts com news 2015 12 7 official-look-at-the-air-jordan-15-gorge-green-release-info pic twitter com 3anc62Ul3E|34|59
9:30 PM - 6 Dec 2015|Happy Gilmore pic twitter com SvsCEileMK|200|272
6:17 PM - 6 Dec 2015|If anyone would like scoop @Jake_Sutton feel free He's single makes BOMB ASS DINNERS|1|1
2:46 PM - 6 Dec 2015|Welcome Back Hossa pic twitter com EINPtSsvxn|8|21
2:38 PM - 6 Dec 2015|JJ Abrams The Force Awakens It nostalgia trip We went backwards go forwards #starwars|23|32
12:33 PM - 6 Dec 2015|Marcus Mariota 87 yards Wow #JAXvsTEN pic twitter com bjFg5gnWmw|245|308
12:33 PM - 6 Dec 2015|Star Wars comes goes twice first day|390|739
11:35 AM - 6 Dec 2015|@bbicks29 talks media upon return Chicago #CHIvsWPG pic twitter com St0FU0plMU|115|488
11:20 PM - 5 Dec 2015|If hard time life remember force always|600|667
8:51 PM - 4 Dec 2015|The amount energy generated average hockey hit would enough power 47 lightbulbs|30|91
11:56 AM - 4 Dec 2015|It's crazy think you've probably already met person won't marry|5|7
4:50 AM - 4 Dec 2015|Join dark side free pepperoni pizza|260|340
4:45 AM - 4 Dec 2015|My 6 year old summed BvS trailer dad won't Superman turn lights it's dark|100|182
7:30 PM - 2 Dec 2015|The Filson Alaskan Guide Shirt wind-resistant breathable flannel cut mobility http ow ly VoI34 pic twitter com MmrSYX4OaE|2|23
2:34 PM - 1 Dec 2015|Oops This script leaked pic twitter com k4Vn9r7WxV|3.2K|4.4K
8:50 PM - 29 Nov 2015|Breaking News The Referees called offensive pass interference Rob Gronkowski excessive contact MRI machine|207|269
9:38 PM - 28 Nov 2015|@killdeshaan @JamesGunn More Sean Gunn In Vol 2 This individual's thesis strong makes several convincing points|16|140
12:14 PM - 28 Nov 2015|It took 37 years I finally get whole coffee thing|34|266
2:05 PM - 26 Nov 2015|You know there's alternate universe turkeys fuck people|63|109
4:07 PM - 26 Nov 2015|On day 1942 Michael Curtiz's CASABLANCA perhaps beloved film ever made premiered NYC pic twitter com mexKU4pxbY|284|363
1:02 PM - 26 Nov 2015|All living turkeys alone listening Adele right|1.2K|2.1K
10:49 PM - 24 Nov 2015|I'd buy argument therapy never invented wasn't coming OBVIOUS CREEP pic twitter com FkIKp4fCpj|86|338
6:50 PM - 22 Nov 2015|Ramp Jump pic twitter com f4Ae4FRKLB|3.7K|5.6K
9:07 PM - 22 Nov 2015|I want Luke Cage buff|1|12
3:47 PM - 22 Nov 2015|#Packers James Jones insane grab #Timeless @NFLRT https vine co v izhEH3Bemm1|81|110
11:50 AM - 21 Nov 2015|The History NHL Logos pic twitter com Dh6g0F2V0t|614|827
9:25 PM - 20 Nov 2015|Trying make friends like pic twitter com DspNXfYcqk|9|6
3:49 PM - 20 Nov 2015|Totally Unrealistic Suggestion A Donate filmmakers button Netflix movie love movie want help|4|15
2:42 PM - 19 Nov 2015|Today put top 5 romantic dates Nick I We got oil changed drove red pick truck|2|5
9:14 AM - 18 Nov 2015|@jmomstead @Jake_Sutton ok I'm going https twitter com coheed status 667027505539256320|1|2
4:10 PM - 14 Nov 2015|Bare-knuckle boxing UK http bit ly 1HQqkjQ pic twitter com 39z7aYaFAq|73|166
