11:39 AM - 10 Dec 2015|Intentionally ugly Christmas sweaters Sci Fi Channel Original Movies clothing|87|101
9:46 AM - 9 Dec 2015|#LuchaUnderground Season 2 premieres Wednesday January 27 8pm ET @ElReyNetwork See real soon Believers pic twitter com jliniuzQ0O|938|851
4:40 AM - 8 Dec 2015|hey I reviewed @InspireProWres' Undeniable Read buy dang show least tickets EOG 3 http wallsofjerichoholic blogspot com 2015 12 the-hoss-playground-inspire-pro html|3|3
11:41 AM - 7 Dec 2015|We Great Job #MBMBaM 280 We hope like http bit ly 1LZmhlV Thanks RTing|84|71
4:55 PM - 7 Dec 2015|Took break commissions freelance draw #sailormoon pic twitter com MNhrPTjuPe|4|14
12:26 PM - 8 Dec 2015|RT think dog would make better president Trump Fav you're wrong pic twitter com AwZlrt2VxK|139|47
3:26 PM - 6 Dec 2015|FUN FACT sometimes Chinese tourists want take pictures look damn https www instagram com p -9__YgLMTw|2|6
3:02 PM - 5 Dec 2015|Lots fantastic #AnimalCrossing ideas video https youtu wt1LHFlBO6M|1|0
2:35 PM - 5 Dec 2015|This Home Improvement grunt supercut must Frankenstein's Monster sounds like masturbates|2|13
12:54 PM - 5 Dec 2015|Dr Dolittle 5 Million Dollar Mutts pic twitter com i6InAMXB3K|142|288
9:02 AM - 3 Dec 2015|Episode 28 It got return old friends A Fantasy Costco trip Jellyfish friendship http www maximumfun org adventure-zone ep-28-lunar-interlude-ii-internal-affairs RT heroes|175|171
6:25 PM - 4 Dec 2015|trust fall pic twitter com vmNFmOymSR|1.9K|3.9K
7:30 AM - 2 Dec 2015|We 30 Day Power Rangers Challenge 48 minutes https itunes apple com us podcast bonus-the-power-rangers-tag id796785736 358075404 mt 2 Listen tell us answers|1|1
5:04 PM - 1 Dec 2015|If run comic book site pulling together 2015 Gift Guide please consider WAYWARD Deluxe Book 1 pic twitter com qa2AacdKxL|11|26
12:19 PM - 1 Dec 2015|Hey friends It new #TIBAS Harness power http bit ly 1TsfvLD Thanks RTing|31|27
2:28 PM - 1 Dec 2015|Adventure Zone Behind The Scenes https vine co v iWhnHMKzdd1|85|300
12:28 PM - 30 Nov 2015|new floam dis pic twitter com rTKYypdfUJ|25|98
5:16 PM - 26 Nov 2015|Let make pact share Star Wars spoilers Twitter first two weeks release RT agree|181|97
4:10 AM - 26 Nov 2015|Happy thanksgiving Jake Josh Turkey Man X Hope morphenomenal pic twitter com W0HzosdjzH|3|5
3:36 AM - 26 Nov 2015|It 6 35 m EST American Thanksgiving It PERFECT moment launch new podcast #DeathBlart HERE http apple co 1PKJXlo|88|99
8:11 PM - 24 Nov 2015|Friends Read today's Best Worst #Raw featuring jokes wordy lectures http uproxx 1MzRcsy pic twitter com sYRAoZ8BF5|9|12
6:32 AM - 23 Nov 2015|RT help kids St Jude If 500 ppl RT 11 25 @Kmart donate 10K #GiveThanks #TheGivingHat http bit ly 1PtfPcD|866|130
4:42 PM - 22 Nov 2015|I wonder Royal Rumble pre show January #SurvivorSeries|3|1
4:29 PM - 22 Nov 2015|@goldust gives life|280|781
2:53 PM - 22 Nov 2015|zordon congratulations tommy leader power rangers jason _|2|6
3:15 PM - 20 Nov 2015|Hey guys Gravity Falls amazing journey rumors true- reaching finale http shmalexsmirsch tumblr com #GravityFinale|7.6K|11K
2:10 PM - 18 Nov 2015|Episode 6 Vermillion City uploaded A beautiful place raises questions https itunes apple com us podcast pokemon-world-tour id1040735404 mt 2 pic twitter com fFFPHjKfWx|2|1
6:30 AM - 20 Nov 2015|Hey everyone We've got email Q A episode planned weeks you've got anything say ask now's time send|1|3
7:37 AM - 19 Nov 2015|Time finish race Episode 27 #TheZoneCast http bit ly 1HaWbB5 RT heroes pic twitter com 0NqDTJfJMF|137|185
4:17 PM - 17 Nov 2015|Sketching babe Astronema #PowerRangers pic twitter com duxzZoW4dN|3|5
9:05 PM - 16 Nov 2015|I returned talk #SailorMoon ll never see flute way https twitter com SailorBusiness status 666473832182607872|3|6
2:43 PM - 16 Nov 2015|PARTY TIP Do abandon hope Do abandon joy|1.2K|1.9K
6:49 AM - 16 Nov 2015|We re proud present trailer Til Death Do Us Blart new annual eternal podcast http bit ly 1WVJ1yS Please RT|43|42
5:40 AM - 16 Nov 2015|As today officially hiatus And we're bad hiatuses there's new bonus episode http tinyurl com oejvpls|1|1
6:07 PM - 15 Nov 2015|See I see #CesaroSection yes I took photo #IStillBelieve pic twitter com 8XZFNBMskt|792|1.8K
