2:49 PM - 10 Dec 2015|We started search new Chief Police Click learn http www fergusoncity com CivicAlerts aspx AID 436|3|1
11:24 AM - 10 Dec 2015|Tonight Ferguson Christmas Glow Free carriage rides Plaza 501 5 30 9 00 pm Enjoy beautiful weather|3|2
7:20 AM - 7 Dec 2015|Bring 10 canned goods personal hygiene items Ferguson Court office 12 3 - 1 6 skip payment pic twitter com js7yUU3YWN|11|5
11:01 AM - 3 Dec 2015|Mood http vine co v iWzDuDiH6A1|1.1K|1.1K
2:43 PM - 2 Dec 2015|Fans-I appreciate votes All-Star game 3 3 would kill don't want die yet Thank understanding Too old|20K|23K
9:23 AM - 2 Dec 2015|When else get hear EXCELLENT 80-man chorus We'll see Friday Spread word Thanks @gmcstl pic twitter com DQLH35sQLj|3|0
8:17 AM - 1 Dec 2015|Save date Important community meeting regarding City's budget Sat 12 12 10 m noon pic twitter com YliRrXPFps|1|0
12:12 PM - 29 Nov 2015|The full schedule today's @FergCityWalk Northern Lights celebration online http fergusoncitywalk com event ferguson-northern-lights instance_id 274|1|2
11:10 AM - 27 Nov 2015|Eating holiday weekend Watch 5 signs restaurant unsafe http bit ly 1Ht3qEB|18|51
10:29 AM - 25 Nov 2015|Trash service changes follows Thursday routes picked Friday 11 27 Fri routes picked Sat 11 28|1|0
8:46 AM - 20 Nov 2015|Ferguson's Interim Police Chief Submits Resignation http www fergusoncity com CivicAlerts aspx AID 433|4|1
7:44 AM - 19 Nov 2015|Happy see @Starbucks partnership Ferguson business @Ferg_Natalie also expands pic twitter com aIbP38HKDg|5|3
7:20 AM - 19 Nov 2015|Welcoming @Starbucks Ferguson morning pic twitter com ENdYfhLcAj|10|6
12:49 PM - 18 Nov 2015|SHUT IT DOWN #TafferGear Get FREE SHIPPING US orders 50 coupon SHIP50 https cards twitter com cards 38ec0i 16twk|25|59
9:16 AM - 17 Nov 2015|You ought treat dignity respect every freakin' minute I'm boy I make regret https amp twimg com v 820d7af3-79f5-4be6-ba0f-665b0e930fe1|30|76
