7:00 PM - 3 Dec 2015|3 WEEKS UNTIL CHRISTMAS|3.4K|3.2K
9:00 AM - 29 Nov 2015|CRAZY CHRISTMAS GIVEAWAY https youtu 9Q7vBktGQuQ|89K|43K
6:31 PM - 28 Nov 2015|And I stopped playing songs|801|1.2K
12:01 PM - 25 Nov 2015|new fav lyric pray fakes get exposed katrina reason I go bible camp|1|2
7:05 PM - 23 Nov 2015|don't stress irrelevant|640|733
4:07 PM - 23 Nov 2015|mom weeknd black guy hair looks like pineapple mixed palm tree help|1|3
3:00 PM - 19 Nov 2015|time year http vine co v OvBFObqzuXw|319|380
