9:05 AM - 10 Dec 2015|literally pic twitter com DyWQoVeNZW|3.2K|4.5K
7:18 PM - 4 Dec 2015|He said wonderful things pic twitter com NwpF6nHxX9|221|532
12:04 AM - 2 Dec 2015|I don't get people say hate Washington like beautiful diverse lucky wtf|1|15
4:28 PM - 27 Nov 2015|Trouble Coldplay pic twitter com nFdYkk8jDK|530|775
5:12 PM - 17 Nov 2015|Like Real People Hozier pic twitter com Oo1dU8LGPh|1.1K|1.5K
5:10 PM - 15 Nov 2015|Lookin 4 sugar friend If u want distant pal talks u text 2 apprehensive hang irl give money I|1|1
1:16 PM - 14 Nov 2015|um excuse sir you're sitting body also face pic twitter com xW46om6pZW|1.3K|2.4K
