11:16 AM - 10 Dec 2015|SLIMESEASON111 OTW https www instagram com p _H2hjjxz0T|1.4K|992
6:46 AM - 7 Dec 2015|2 moods pic twitter com ZS9fPPkex3|3K|3.5K
11:00 PM - 9 Dec 2015|Plies singing Hello Adele pic twitter com 0GpzyqvZyk|6.4K|5.8K
11:46 AM - 10 Dec 2015|Slime Season 3 https vine co v iZbm6d6HXPr|4.5K|4K
11:54 AM - 10 Dec 2015|Young Thug confirmed Slime Season 3 way pic twitter com nu6eD5DXpj|1.2K|1.3K
3:55 PM - 9 Dec 2015|NETFLIX AND BILL|181|202
2:14 PM - 9 Dec 2015|Bald eagle named Uncle Sam attacks Donald Trump brave show patriotism http trib al 8BUJILE pic twitter com ym8akbByKB|593|524
5:11 AM - 9 Dec 2015|@kisschanel Stop pic twitter com 6FLonBKlPw|129|150
6:17 AM - 23 Nov 2015|When check grades online pic twitter com v9uAsysVFs|10K|9.4K
10:54 AM - 5 Dec 2015|98 realest niggas cry Marvin's Room|1.2K|1.3K
8:43 AM - 16 Nov 2015|Suck ya teeth sucka punch #mamasaid #emmanuelhudson pic twitter com Ay4UYSsaFq|7.5K|6.2K
7:26 PM - 3 Dec 2015|Take shirt show abs like I'm Tupac - Rick Ross pic twitter com tmPH5aulYy|4.4K|3.8K
7:05 PM - 6 Dec 2015|This absurd @RajonRondo @SacramentoKings #NBAvine https vine co v i712Ye3LpBq|3.1K|3.4K
6:50 PM - 5 Dec 2015|I'm officially dead https vine co v eYTLKEzT5ej|5.1K|5.4K
5:23 PM - 2 Dec 2015|thinkin bout going church sundays remember 4 bibles phone pic twitter com lYqgi33ztd|2.3K|2.2K
11:07 PM - 5 Dec 2015|oh bad y'all ain't beat http vine co v MVzeqEPBp1M|4K|4.9K
11:48 AM - 4 Dec 2015|Chicken nuggets fries don't go dates Hits Dab pic twitter com yyAks4QlPx|58K|40K
11:55 PM - 3 Dec 2015|Rick Ross @ Drake pic twitter com GAz2epp9ca|165|279
2:02 PM - 4 Dec 2015|He's back @Migos member @OffsetYRN jail http bit ly 1Ql4lrZ pic twitter com lN3meexsaH|5.1K|3.2K
3:12 PM - 1 Dec 2015|Dove deodorant vibe pic twitter com t4YicDXqIn|3K|2.8K
8:07 PM - 24 Nov 2015|New York City rats don't give af pic twitter com U8mrhsgmwq|1.2K|1.3K
4:02 PM - 17 Nov 2015|Facts pic twitter com KSwWwFL8J6|1.3K|1.4K
5:16 PM - 27 Nov 2015|Mississippi We #YRN pic twitter com MriXK933kO|25|81
1:00 PM - 20 Nov 2015|Too many people suffered many people died us continue hear racist words coming major political leaders|6.5K|9.9K
2:00 PM - 20 Nov 2015|WATCH Man Sees His Family For First Time After 27 Years Holding His Hand Over His Eyes http www clickhole com r 594tsd pic twitter com 3qZ3CsiSZB|381|742
2:08 PM - 24 Nov 2015|#ThanksgivingWithBlackFamilies ur aunt expose cousin hoe y'all haven't even said grace yet pic twitter com kXezHvK6PD|4.3K|7.1K
9:07 PM - 20 Nov 2015|funny https vine co v iBFhUinaKHW|2.5K|2.6K
9:23 AM - 21 Nov 2015|Pipe pic twitter com 7L9gw60jxo|4.4K|5.4K
