1:15 PM - 11 Dec 2015|The MVP-like year Carson Palmer putting together even remarkable seems http es pn 1Q85tAX pic twitter com 1piBd76LO9|161|458
1:45 PM - 10 Dec 2015|Let's-go-clinch-a-play-off-spot #TNF #AZCardinals pic twitter com KjMJYGSxuG|78|229
1:00 PM - 10 Dec 2015|The #DailyShow offers friendly reminder Donald Trump wants bang daughter http cc com 1QyMxtA pic twitter com Zq12E4qCEl|56|72
10:15 AM - 9 Dec 2015|Every time I get texts jimmy joes heart breaks lil bit|1|4
3:57 PM - 8 Dec 2015|I'm getting twice much sleep I high school like I'm definitely college wrong|3|7
3:09 PM - 7 Dec 2015|They say history always repeats pic twitter com XlrJuMFcpP|24K|19K
7:35 AM - 8 Dec 2015|In experience people wearing hijabs always smell great #MakeAmericaSmellGreatAgain|1|10
6:14 AM - 8 Dec 2015|J K Rowling says Donald Trump worse Voldemort http cnn 1ICkPuE pic twitter com xjotZmmuu7|2.1K|1.9K
6:50 AM - 8 Dec 2015|Super Pug Photo @_chuckthepug By worldofpug http bit ly 1TY6Gth #carlino pic twitter com IPZ6zeFonG|17|37
4:23 PM - 7 Dec 2015|Trump Gives Muslim On Fence About Radicalizing Just The Push He Needed http onion com 1R5Zg8D pic twitter com P1GZ74bokX|3.9K|3.7K
3:06 PM - 7 Dec 2015|Arizona New Mexico used play Kit Carson's rifle pic twitter com gzxC9rcfNU|12|18
3:14 PM - 7 Dec 2015|Whenever I talk crap ASU I always count man @kingrussell56 throw RT|1|1
5:40 PM - 6 Dec 2015|SAY IT LOUDER FOR THE PEOPLE IN THE BACK pic twitter com qoLGD4Drmz|24K|22K
2:23 PM - 7 Dec 2015|Wonder @TheSunDevils realize students break selling single game tix UA game mean ANOTHER empty stadium|2|2
2:24 PM - 7 Dec 2015|You care much making hard UA fans get tix you're losing thousands dollars You're bunch clowns @TheSunDevils|1|2
2:27 PM - 7 Dec 2015|I know stoned intern reading doesn't care whatever @TheSunDevils|1|1
11:05 AM - 7 Dec 2015|The #AZCardinals offense keeps rolling pic twitter com jFw4u8v7Nq|173|228
10:45 AM - 7 Dec 2015|National embarrassment Donald Trump doesn't think Muslim sports heroes http bit ly 1QrtgKB pic twitter com 7V93MGwud8|100|62
9:55 AM - 7 Dec 2015|I feel like next semester way better I'll actually know college works|11|34
6:31 PM - 6 Dec 2015|Buuuut every game https twitter com 942crew status 673380166811258881|1|0
12:08 AM - 6 Dec 2015|@ChelseaBrooks10 snores|2|3
8:01 PM - 5 Dec 2015|Great news @CoachRodAZ commit offer S Carolina He's Arizona Wildcat #BearDown|659|718
8:15 PM - 5 Dec 2015|SOURCE RichRod offered #Gamecock job Mulled flight home Realized wanted stay #Zona work|469|316
4:37 PM - 5 Dec 2015|Shout Andrus Peat https twitter com NFL status 673299525205811200|3|5
3:43 PM - 5 Dec 2015|Scarves required today By pugsnkisses84 http bit ly 1R1TOUg #carlino pic twitter com Lv6ocP07qH|22|32
10:00 AM - 5 Dec 2015|In less 24 hours #AZvsSTL begins @NFLonFOX #AZCardinals fans RETWEET ready go pic twitter com PgvnIQDagV|103|104
8:13 PM - 4 Dec 2015|takes drag stale Newport Why vote Bruh My vote doesn't matter complains next 4 years RTs memes frm gov conspiracy accounts|12|17
8:54 PM - 4 Dec 2015|My idea sleep pic twitter com nO5TDSId01|345|440
3:46 PM - 25 Nov 2015|Barber u want Me u knoww 3 33 Barber okeez xD rawr pic twitter com aP1hfSP1I3|5.3K|6.8K
12:52 PM - 3 Dec 2015|Remember https twitter com rantsports status 274271780791808002|4.6K|5K
8:25 AM - 4 Dec 2015|Could A correlation people real college education supporting moron pic twitter com CF08qsa2EB|1|5
10:30 AM - 4 Dec 2015|Cardinals Rams It's grind time #AZvsSTL https amp twimg com v b66fbf16-78b8-4fe9-9e81-82061bfd340e|82|126
10:29 AM - 4 Dec 2015|force strong one pic twitter com Y1sZ8l7yHB|1|2
10:32 AM - 4 Dec 2015|Some facts guns America people don't want know pic twitter com llNf9JxW2s|1.9K|2.1K
9:59 AM - 4 Dec 2015|Oh pizza tree oh pizza tree pic twitter com VpvkpGkNNf|955|1.5K
9:20 AM - 4 Dec 2015|Lol Adultish Gambino pic twitter com IH8V59iMUM|1.2K|1.3K
1:52 PM - 3 Dec 2015|What's point 2nd midterm week finals|2|1
1:32 PM - 3 Dec 2015|Rich Rod plz|1|0
10:27 AM - 3 Dec 2015|Hows semester going pic twitter com 8WIuu9kHUc|1.7K|1.9K
7:39 PM - 2 Dec 2015|When someone asks I've started studying finals https vine co v eDe3Lg5LhlF|7.3K|7.3K
9:24 PM - 2 Dec 2015|Excited say I received offer University Wyoming pic twitter com K0qIIcu9n2|40|89
7:00 PM - 2 Dec 2015|Thank @FootwearNews honoring @adidas @kanyewest #YEEZYBOOST Shoe Year tonight #FNAA pic twitter com SPPnE533ya|858|1.1K
5:56 PM - 2 Dec 2015|I agree @justinbieber pic twitter com Q2TUdg1SM0|386|728
3:20 PM - 2 Dec 2015|We don't like #AZvsSTL pic twitter com 8BO7joesE6|88|207
12:18 PM - 2 Dec 2015|IT'S ALMOST AS IF THOUGHTS AND PRAYERS ARE NOT ENOUGH TO END GUN VIOLENCE|11K|13K
12:55 PM - 2 Dec 2015|Guns don't kill people But sure shit don't favors|3.8K|6.6K
1:06 PM - 2 Dec 2015|Get head ass America We serious problem many levels|83|146
1:08 PM - 2 Dec 2015|Why I quit NRA http ti 1OGICJs|171|167
11:55 AM - 2 Dec 2015|@kingrussell56 I saw u take|1|6
12:44 PM - 2 Dec 2015|@kingrussell56 I saw walk|1|6
9:46 AM - 1 Dec 2015|AIR BALL https vine co v iWqMaEUzFJp|77|144
8:45 PM - 30 Nov 2015|How feels Browns fan #MNF pic twitter com 30hBugRYLZ|12K|12K
6:30 PM - 30 Nov 2015|Get Cardinals-inspired QC25s RT chance win @Bose NFL Edition custom pair pic twitter com yJPZr9owEh|893|228
4:23 PM - 29 Nov 2015|time year I get tired everybody writing X instead Christ I think it's time put Christ back Christ-box 360|108|209
1:09 PM - 30 Nov 2015|Navy football players wear position-specific 'Navy Fleet' helmets Army game http ble ac 1YEdr6b pic twitter com ys6LRPbMch|3.7K|4.2K
1:21 PM - 30 Nov 2015|It little shaken okay http onion com 1LJraiD pic twitter com RfdWvIs5Bs|719|826
9:45 AM - 30 Nov 2015|Just happened #wecantmakethisup #Seriously #love #yourchariotawaits #police pic twitter com rUlnzCfsv9|377|369
8:48 PM - 29 Nov 2015|@kingrussell56 nothing ever accurate https twitter com stevestfler status 670761679345594368|1|1
4:30 PM - 28 Nov 2015|Pretty much pic twitter com SOaHtzwIlS|501|1.1K
6:36 PM - 29 Nov 2015|Excited say I received 3rd offer New Mexico State University pic twitter com M9M0jiCCfI|48|133
8:34 AM - 29 Nov 2015|U A pic twitter com 1dF3eyu9SG|412|908
4:58 PM - 29 Nov 2015|rt u avoided ur responsibilities break ur emotionally prepared return school|5.5K|4K
4:00 PM - 29 Nov 2015|bae 30 years finish paying mortgage kids college http vine co v ePjn23wplW6|137|288
6:11 AM - 26 Nov 2015|EVERYONE JUST WATCH THIS RN pic twitter com HidkOIQKdP|2.6K|2.8K
11:15 AM - 29 Nov 2015|Modern Science Still Only Able To Predict One Upcoming Tetris Block http onion com 21n85yv pic twitter com yawqYp1xlL|797|1.2K
9:09 PM - 28 Nov 2015|u tell bae u gotta leave pic twitter com r7UyI5m9wO|1.6K|1.8K
5:13 PM - 28 Nov 2015|It's time Bedlam https amp twimg com v 2f577de9-fbfc-49b6-b526-15655b7db9a0|706|783
10:30 AM - 28 Nov 2015|Just you're 95 doesn't mean can't dab Ask @Panthers fan NC native Mary Ward via @Cdclarksports pic twitter com eDA8RObk74|2K|2.9K
9:05 AM - 28 Nov 2015|This one greatest days college football|6|16
4:05 PM - 27 Nov 2015|This happened https twitter com coachjim4um status 670379178936672256|174|303
3:10 PM - 27 Nov 2015|Thanks @QuavoStuntin @1YoungTakeoff @Migos supporting Maize Blue pic twitter com WmUvXsUHPB|5.8K|5.2K
6:38 AM - 28 Nov 2015|Fighting words Oklahoma pic twitter com RaKfc3NxPQ|938|1.4K
8:16 AM - 28 Nov 2015|Surrender Cobra The n - pose frequently adopted fans witnessing unfortunate sports happenings - @HollyAnderson http es pn 1NANzq0|1.7K|2.3K
9:15 PM - 27 Nov 2015|survived working 1st black friday look face postage stamp pic twitter com EiZhcMciS7|1|11
6:25 PM - 27 Nov 2015|I don't get Black Friday hype Shouldn't #allfridaysmatter|10|75
6:01 PM - 26 Nov 2015|I've never tempted shoot face right https twitter com time status 670044449737728000|2|8
8:57 AM - 26 Nov 2015|My favorite post year BACK pic twitter com r9fyLo3r12|8K|7.7K
8:39 AM - 26 Nov 2015|National #DogShow competitor Chez plan Pro Plan Sport 30 20 Discover dog's save http puri na 1NR3oTF pic twitter com n0erTSWTyS|95|312
1:19 AM - 26 Nov 2015|I'm getting fever loss chill I rn|3|8
8:46 AM - 26 Nov 2015|Gobble gobble bitches|1|2
11:31 PM - 25 Nov 2015|Russell spent 5 hours making jello playing scrabble grandma today #1 boyfriend|1|9
1:52 PM - 25 Nov 2015|ur family roasting thanksgiving dinner ur grandma steps says leave u alone pic twitter com XvBsiwphG0|2.8K|4.8K
9:17 PM - 24 Nov 2015|Here's trailer looking #CaptainAmericaCivilWar https amp twimg com v 3c1c85a0-6603-43b4-b9af-b55725c9ba52|64K|55K
8:07 AM - 25 Nov 2015|How turkey feels day Thanksgiving pic twitter com lxqi92Qhb6|3.8K|4.2K
7:45 PM - 24 Nov 2015|ASU forgets basketball http www azdesertswarm com 2015 11 24 9796866 asu-forgets-how-to-basketball utm_campaign azdesertswarm utm_content chorus utm_medium social utm_source twitter pic twitter com K0zx2gaqV7|1|10
2:51 PM - 24 Nov 2015|@942Crew @FolsomFrenzy @Pac12Networks Actually @ZonaZooOfficial best student section country pic twitter com 8qT6yL9LXh|52|88
4:58 PM - 24 Nov 2015|When racist grandpa starts annual speech good old days #ThanksgivingWithWhiteFamilies pic twitter com OGvqlZUZh1|74|188
10:27 AM - 24 Nov 2015|Jumpman jumpman jumpman grades go something woooo|1.4K|1.5K
11:11 AM - 24 Nov 2015|Maybe Johnny Manziel dipshit can't play quarterback http bit ly 1P6F06j pic twitter com Xc6KOKY3fS|18|28
8:50 PM - 18 Nov 2015|mosaic donald trump created 5 000 dick pics pic twitter com o28oQ7DnOC|12K|15K
7:35 PM - 20 Nov 2015|Another mascot-centric win 1970 Western Athletic Conference WAC spring sports media guide pic twitter com LTrr31i4wc|58|85
3:08 PM - 23 Nov 2015|BOOM BABY pic twitter com LWOKUJPuni|2|24
7:05 PM - 21 Nov 2015|Meet charlie he's reason isis can't sleep night 10 10 patriotic af pic twitter com NYDEH1OODL|4.1K|6.1K
6:05 AM - 22 Nov 2015|Me trying cook breakfast pic twitter com OqsvLFfVN8|8.6K|10K
5:22 PM - 21 Nov 2015|see Michelle wearing less going pic twitter com ze1D3bAYYa|10K|9.4K
8:30 AM - 22 Nov 2015|My wife cries absolutely anything I mean ANYTHING So started writing reasons reasons pic twitter com 2ZO4gFEfmH|37K|60K
10:12 AM - 22 Nov 2015|ASU fan destroys Arizona band equipment http twib l jepB9RAX9x8 #BearDown https twibble io pic twitter com oN7vulwW7E|11|10
4:26 AM - 22 Nov 2015|They took dog Starbucks birthday pic twitter com pPP1pxvwVP|2.6K|4.7K
7:26 PM - 21 Nov 2015|I'm mad I'm disappointed I feel like parent|1|0
6:00 PM - 21 Nov 2015|I've decided get back together @Tyga|892|2K
4:35 PM - 21 Nov 2015|RichRod got pretty emotional talking injuries bad luck last 12 weeks Having depth today got|5|10
4:28 PM - 21 Nov 2015|Gosh flibbity darn I'm golly riled lost sportball game|1|6
9:15 AM - 21 Nov 2015|Current state UA football pic twitter com IaZPwqf28h|1|6
8:34 AM - 21 Nov 2015|Congrats win ASU https twitter com wildcat_country status 668104847221092353|1|7
6:23 AM - 20 Nov 2015|Trump refuses say Muslim databases would different Nazi IDs Jews http ow ly USSVS pic twitter com doUh0nNQ18|94|44
6:59 AM - 21 Nov 2015|Time See @ArizonaFBall @TheSunDevils came top #MayhemTweetOff https amp twimg com v 6d167923-f640-4a40-9070-40235886111f|626|653
9:46 AM - 20 Nov 2015|What outrageous bigoted statement @realDonaldTrump ashamed https twitter com nytimes status 667676284663832576|9.9K|14K
8:10 AM - 20 Nov 2015|Congrats @dougherty_tommy committing Proud pic twitter com yzb6rTHWkr|1|6
6:50 AM - 20 Nov 2015|@Greg_Byrne 7th grade students Gilbert AZ better U A fans weekend #beardown pic twitter com kNiXeHH1bT|32|66
7:16 PM - 19 Nov 2015|BOISE IS NOT A STATE BRO|78|149
5:24 PM - 19 Nov 2015|ICYMI 10 Things Arizona Wildcats Fans Hate About ASU #rivalryWeek #BEARDOWN #BeatASU http zonazealots com 2015 11 18 10-things-arizona-wildcats-fans-hate-asu pic twitter com N2gwSnHZfo|1|1
1:54 PM - 19 Nov 2015|BRUH THESE KIDS ON JUDGE JUDY STRAIGHT FOOLING pic twitter com YeuyQlIaXE|436|566
12:08 PM - 19 Nov 2015|Meet max yankee candle loving pug Has anxiety slays bitches road 10 10 pic twitter com KuSe2MqdyF|992|1.4K
12:13 AM - 19 Nov 2015|This western brown Mitsubishi terrier Upset leaf ActuaIIy 2 dogs 7 10 would walk shit pic twitter com AuRUflAOGA|159|365
7:47 PM - 18 Nov 2015|@Pac12Networks @SunDevilHoops well weren't playing powerhouse like sac state good 4|2|4
7:20 PM - 17 Nov 2015|Arizona's Best Kept Secret - Tempe Corona del Sol OT Austin Dixon blow http scout com 3829FE|3|1
3:47 PM - 18 Nov 2015|Welp pic twitter com 07YT0n2rkl|5|6
7:56 PM - 17 Nov 2015|How feel college https vine co v e7YiW5JqVit|3.4K|4.5K
8:54 PM - 17 Nov 2015|How I feel point semester pic twitter com RJe2Ik2EDH|282|347
7:05 PM - 17 Nov 2015|Would rather pic twitter com VYqEEW9UIn|202|122
7:04 PM - 17 Nov 2015|Corona OT Austin Dixon blow http www scout com college football recruiting story 1613133-arizonas-best-kept-secret @BrandonHuffman @Dix6n|30|24
5:22 PM - 17 Nov 2015|The Hungry Games pic twitter com 4pLt3X7VwK|570|828
12:01 PM - 17 Nov 2015|@kingrussell56 sneezed feet|1|1
3:24 PM - 15 Nov 2015|Senior Year Highlights #75 LT @jason247scout http www hudl com athlete 4126688 highlights 310472382|26|30
7:49 AM - 17 Nov 2015|Guys Cardinals going win Super Bowl|3|6
7:08 PM - 16 Nov 2015|Christmas Spirit https vine co v iB672iddPJp|8|10
7:35 AM - 16 Nov 2015|barack obama really said folks wanna pop news conference oh wow he's going one Top 3 presidents all-time|5.2K|6K
9:48 AM - 16 Nov 2015|My English professor always includes Kendrick quotes bottom emails pic twitter com PbhANjYiVr|2|12
9:48 AM - 16 Nov 2015|#TerritorialCup - Will trend continue pic twitter com rlD4FrBJGD|3|8
7:57 PM - 15 Nov 2015|Fun fact Russell Johns terrified Were-Cats Scooby Doo @kingrussell56|1|3
4:54 PM - 15 Nov 2015|Everyone giving Tom Brady credit Gostkowski reason won|1|6
12:53 PM - 15 Nov 2015|Cam Newton clowning Titans point #CARvsTEN pic twitter com naG12y4Rqq|3.3K|2.7K
12:53 PM - 15 Nov 2015|@kingrussell56 @LVRyswyk Daily reminder ASU's lone Rose Bowl win us born|1|2
10:50 AM - 15 Nov 2015|Hi @kingrussell56 I think school gonna beat school week football Tempe Just wait #TerritorialHateWeek|1|8
10:25 AM - 15 Nov 2015|Arizona vs ASU Wildcats look defend Territor http twib l yA6xEzA957E #BearDown https twibble io pic twitter com U0xLdp4Kel|7|2
8:37 AM - 15 Nov 2015|Why I find funny pic twitter com GAHwAXSkxY|12K|14K
8:08 AM - 15 Nov 2015|Happy 19th Ridge Miss every day goes pic twitter com IulnpKFuAy|2|38
11:46 PM - 14 Nov 2015|Basically Tucson Canes need Dutch Bros Jimmy Joes I'll never need go home|4|10
10:39 PM - 14 Nov 2015|INCOMPLETE ARIZONA WINS|335|367
10:39 PM - 14 Nov 2015|#Arizona JUST DID IT FINISHED Knocks No 10 Utah 4th year in-a-row RichRod team defeats top10 #BearDown pic twitter com 4ZOTuFPw36|42|72
10:39 PM - 14 Nov 2015|TUCSON upset city|309|391
10:40 PM - 14 Nov 2015|BOWL ELIGIBLE #ARIZONA|20|36
10:40 PM - 14 Nov 2015|ARIZONA WINS ARIZONA WINS ARIZONA WINS|447|433
1:46 PM - 14 Nov 2015|When you're missing tackles means you're ready play I guess UA hasn't ready play since 90s|1|3
6:48 PM - 13 Nov 2015|Wait @SunDevilHoops lost WHO|2|2
