1:53 PM - 11 Dec 2015|#Toronto Pearson smashed high temp record today A super mild 14C - old record 13 2 1979 last year also SNOW ground|3|3
11:21 PM - 8 Dec 2015|French police identify third attacker Bataclan Paris sources say http bbc 1NL1ELt|504|397
3:46 AM - 8 Dec 2015|Mayor bans Trump fully understand dangerous threat posed Trumps http www msnbc com msnbc rick-kriseman-bans-trump-st-petersburg|207|361
11:41 PM - 7 Dec 2015|#OscarPistorius Roux announces intends apply leave appeal highest court land Constitutional Court|23|10
10:36 PM - 7 Dec 2015|Update Air France says flight #AF83 diverted precaution #Montreal due anonymous threat|6|1
9:39 PM - 7 Dec 2015|Eagles Death Metal made emotional return Paris stage U2 http trib al 4wIbUif pic twitter com IMAtzQ3sD6|111|118
4:03 AM - 7 Dec 2015|#OscarPistorius appear court Tuesday legal team argue stay bail new sentencing|45|40
8:50 PM - 3 Dec 2015|Aaron Rodgers' TD pass time left 1st Hail Mary game-winning score since 2012's Fail Mary #Seahawks versus #Packers|21|33
2:12 PM - 2 Dec 2015|Your thoughts steps take stop carnage Your prayers forgiveness nothing -|23K|22K
12:13 AM - 3 Dec 2015|#Oscarpistorius The fact he's taking long explaining panel found Masipa's ruling 'confusing flawed' bodes badly runner|37|32
11:45 PM - 2 Dec 2015|#Oscarpistorius Judge Leach describes 'human tragedy Shakespearean proportions'|6|2
1:14 PM - 2 Dec 2015|Compare contrast pic twitter com vWXoIHd1Uy|5.6K|3.9K
7:06 AM - 1 Dec 2015|Give gift hope 1 600 people wait list Register http www BeADonor ca #Beadonor #GivingTuesday pic twitter com G5g2mcMRby|14|12
4:49 AM - 1 Dec 2015|Just crushed 1st chocolate advent calendar YoLo|19|80
4:15 PM - 30 Nov 2015|Join us tomorrow LIVE @Playdium Bring toy FREE 1 2 hour Playcard More details website http ow ly Vb5uE|2|1
12:39 PM - 30 Nov 2015|NHL exec I guess I real balls I would go public go hard I won https twitter com TSN_Sports status 671426383248273409|15|11
4:12 PM - 30 Nov 2015|Something don't see everyday Teddy Bear Toss goes wrong @KingstonFronts game VIDEO@ http www2 tsn ca bardown Story aspx Teddy 2bBear 2bToss 2bgoes 2bwrong 2bat 2bKingston 2bFrontenacs 2bgame id 566900 pic twitter com XRX56UB0KK|20|38
8:33 AM - 30 Nov 2015|The official release 20th Annual Toy Mountain launches today #TM2015 http bmpr ca 1NDJdOU|2|2
9:00 PM - 29 Nov 2015|UNBEATEN NO MORE @Broncos deal @Patriots first loss season 30-24 overtime win pic twitter com ZGQZ4y91mv|121|160
6:43 PM - 29 Nov 2015|Confusion Edmonton Football fans running around screaming We won big one hockey fans like The draft lottery today|743|794
10:00 AM - 24 Nov 2015|Just send turtle crawling briefcase Here use one Show us went #MasterofNone pic twitter com o23VbJqJDg|497|1.4K
4:23 PM - 26 Nov 2015|#PurdysChristmas Turona ultimate treat wrap gifts #justsaying http smarturl XMasTurona pic twitter com prE9t3Oj2L|4|3
7:50 AM - 26 Nov 2015|Kermit I repeat @KermitTheFrog #ThanksgivingDayParade pic twitter com ZMalonojM2|134|139
7:55 AM - 24 Nov 2015|Pet prescription Unique program allows patients' pets visit hospital http ctv news yt4zm8I pic twitter com ZxnfZcS5iA|23|26
1:48 AM - 24 Nov 2015|More half world's primates facing extinction experts say pic twitter com RG19CRNI9z|111|43
10:00 PM - 23 Nov 2015|White men bulletproof vests shot four civil rights protesters Minneapolis I'm supposed scared Syrian refugee|20K|17K
2:13 AM - 20 Nov 2015|Update Gunmen attack Radisson hotel Mali's capital 170 hostages taken http ow ly USn5h pic twitter com U0kh1YW20E|38|9
10:12 PM - 19 Nov 2015|4th quarter recap pic twitter com bKY7UWyJLK|72|98
6:59 AM - 19 Nov 2015|Russell Westbrook donates 850 Thanksgiving meals OKC youth http cbsprt co 1Oh9ejK pic twitter com 07T1qL1pPL|99|127
12:20 AM - 19 Nov 2015|Trudeau Obama meet face face 1st time Both agree new positive relationship going forward #ctvnews pic twitter com eecsj9WajA|36|71
3:05 PM - 18 Nov 2015|Sean And I @CTVCanadaAM tomorrow producer @mikebickerton talking casting Season 4 #AmazingRaceCanada Tune|4|18
11:15 PM - 17 Nov 2015|To re-cap Police raid Saint-Denis Heavy shooting explosions Reports 3 dead incl woman wearing suicide vest #Paris #ParisAttacks|4|1
10:48 PM - 17 Nov 2015|After several blasts quiet St-Denis neighbourhood Paris #ParisAttacks pic twitter com 0juBEFjusE|7|1
10:26 PM - 17 Nov 2015|Several reports alleged mastermind #parisattacks Abdelhamid Abaaoud may target raid|5|0
10:12 PM - 17 Nov 2015|Well I guess you're NBA champs playing home get calls #notrighttho|1|2
7:00 PM - 17 Nov 2015|All Blacks great legend #rugby Jonah Lomu died suddenly Wednesday He 40 #RIP http thestar com 1kDzQCe pic twitter com feXuOW2LRw|15|7
3:03 PM - 17 Nov 2015|It takes cameraman reporter put quality product air An infuriating day CTV News|44|71
5:03 AM - 17 Nov 2015|@Adele performs latest single When We Were Young new album 25 video http trib al RrmC8A8 pic twitter com gKxcXnbiwu|42|71
4:57 AM - 16 Nov 2015|Father #ParisAttack suicide bomber Samy Amimour went #Syria 2014 try bring son home http www lemonde fr m-actu article 2014 12 18 voyage-amer-sur-les-traces-d-un-fils-djihadiste_4542800_4497186 html via lemondefr|27|2
3:26 AM - 16 Nov 2015|Working LSD Prob think means #OnlyInChicago pic twitter com HQiHCYklDn|2|9
2:26 AM - 16 Nov 2015|In Paris Waiting moment silence pic twitter com IsfCg1RFz5|1|0
12:05 AM - 16 Nov 2015|Somebody calls The Antichrist called newsroom It's funny caller ID says name Lloyd #amnewsers|3|20
11:32 PM - 15 Nov 2015|Sometimes photo says 1000 words #Kurdish female fighter destroys #IS billboard dress instructions pic twitter com NpZAAU03wG|1.2K|1.1K
