7:32 PM - 10 Dec 2015|imagine person u want wanting u back sounds nice unrealistic nice|624|1.4K
6:23 PM - 9 Dec 2015|My poor sister deal w rn view w caution explicit images pic twitter com ZvooHcZiyu|3|4
7:14 PM - 18 Nov 2015|time year https vine co v OvBFObqzuXw|8K|12K
2:16 PM - 10 Dec 2015|This important pic twitter com DJ95WzhB4B|6.1K|6.8K
2:14 PM - 10 Dec 2015|Thanks lot @WildpipM scared crap pic twitter com i1bJRcxPlk|423|1.1K
6:17 PM - 9 Dec 2015|He's magical things @maritoplyn Don't worry he'll back soon http bit ly 21Qr0Sw #CriminalMinds pic twitter com qZUlGMglkq|113|407
8:37 PM - 2 Dec 2015|Waiting new Batman Vs Superman trailer Notice I didn't say I can't wait I'll wait Oh I'll wait|20|207
7:01 PM - 4 Dec 2015|Judge I don't know sentence District Attorney WHAT Judge THE SON OF A BITCH STOLE A HOLIDAY I AINT NEVER SEE NO SHIT LIK|51|239
6:09 PM - 7 Dec 2015|Something familiar I can't put finger pic twitter com TrafAFSDYh|592|662
12:54 PM - 7 Dec 2015|CONGRATS @carmen_carrera became first #trans person marry reality TV http bit ly 1PRziFT pic twitter com yKsP0osrid|95|220
11:11 AM - 6 Dec 2015|Women need If women want respect As woman In opinion women Females pic twitter com hyOH7IZoq5|11K|8.2K
11:19 AM - 6 Dec 2015|@Lucy__Dismore take home love feed ketchup packets never let go|1|3
2:26 PM - 27 Nov 2015|jokes written kids pic twitter com N6jGtxh80O|12K|14K
10:53 AM - 6 Dec 2015|I'm like grills pic twitter com lr0Fhws07o|4|25
8:09 PM - 5 Dec 2015|way lost nose intense sword duel math equation also pet stag kept indoors|645|3.1K
8:00 PM - 2 Dec 2015|Flying jet @GUBLERNATION @aishatyler pic twitter com BgctxNgUVd|2.9K|8.3K
11:27 AM - 3 Dec 2015|Hello Dallas Where Thespians|88|265
11:24 AM - 3 Dec 2015|Jessica Lange pic twitter com nGs7ouj2JG|1.2K|1.9K
8:25 PM - 2 Dec 2015|Everyone beautiful pic twitter com weW1UC45VD|1|13
5:55 PM - 2 Dec 2015|dont think common white girl https twitter com commonwhitegiri status 672222008701231104|1.2K|2.2K
3:44 PM - 1 Dec 2015|Pretty perfect description Ben Feldman TBH #Superstore pic twitter com BR16sjNPri|4|11
7:44 PM - 30 Nov 2015|Hey We feel widdle panda #Superstore|7|19
1:56 PM - 30 Nov 2015|happy B-day homie Mark aka M-tron pleasure hanging @Band_of_Robbers http blogs indiewire com theplaylist filmmaker-adam-nee-talks-mark-twain-caper-riff-band-of-robbers-and-working-with-the-man-himself-20151130 pic twitter com b3SVSxZCu9|577|3.1K
7:40 AM - 30 Nov 2015|Beautiful gross strong thin fat pretty ugly sexy disgusting flawless woman Thank @annieleibovitz pic twitter com kc0rIDvHVi|20K|51K
6:14 PM - 29 Nov 2015|Vancouver best city ever biased|16|204
4:28 PM - 29 Nov 2015|I really want endure next 3 weeks|4|5
12:27 PM - 29 Nov 2015|Don't take pictures pic twitter com qXsMb8MmxT|1|2
9:30 PM - 28 Nov 2015|There term presidential candidates silent killings Planned Parenthood Soft terrorism|4.5K|4.8K
10:44 AM - 27 Nov 2015|Preach pic twitter com tPDer8qNOh|3|17
5:22 AM - 25 Nov 2015|women pic twitter com rgybslS9p0|33K|42K
1:26 AM - 27 Nov 2015|TBT time directed C M ep called Mr Scratch played shadow monster looked like scary turkey pic twitter com eWiUXeGD8o|2K|6.8K
5:47 PM - 23 Nov 2015|i'm excited guys hear play Simon Alvin Chipmunks 4 @20thcenturyfox @AlvinMovies pic twitter com 54p8K9f6yP|3.4K|12K
5:00 PM - 25 Nov 2015|Don mess munk #AlvinMovie pic twitter com 3eex8VGY6s|22|30
4:00 PM - 26 Nov 2015|HAPPY THANKSGIVING pic twitter com WnwE8DFZRk|2.6K|9.2K
9:51 AM - 25 Nov 2015|Be guy ruins lipstick mascara|2.7K|4.7K
9:20 AM - 25 Nov 2015|As US Americans celebrate thanksgiving please sensitive eating disorders This time year hard|76|133
9:20 AM - 25 Nov 2015|Remember important loved make disorder make weak time time safe|34|68
4:58 PM - 24 Nov 2015|Wings good I could fly away pic twitter com 3yMJywS62s|2|16
9:13 PM - 24 Nov 2015|Jim's Diner 11 24 15 @Lucy__Dismore pic twitter com htog8UrS9L|1|13
11:11 AM - 24 Nov 2015|Lucy blonde ball pic twitter com WQw67n06ww|1|3
12:49 PM - 24 Nov 2015|Lucy I watching' Material Girls' Hilary Haley Duff projector yoga room #thegoodlife pic twitter com Ncvz6gkvwy|1|8
5:18 PM - 23 Nov 2015|RT think mozzarella stick would better president Donald Trump pic twitter com xwXui5MeYr|42K|27K
3:31 PM - 23 Nov 2015|Get ready #The100 returns Thursday January 21 9 8c The CW pic twitter com QTyvECKKZn|4.9K|5.2K
3:08 PM - 23 Nov 2015|Come January 21st blood blood #The100 #The100Season3|3.6K|4K
2:35 PM - 23 Nov 2015|#The100 returns Thurs Jan 21st #LegendsOfTomorrow YAY|16|32
5:25 PM - 23 Nov 2015|Trying take hot sister pics pic twitter com kamb3W6keY|2|15
12:04 PM - 23 Nov 2015|This new beard trend gonna make want die inside http bzfd 1kQioKQ pic twitter com ghsQ7cpkq2|9|46
3:38 PM - 17 Nov 2015|It shows world live woman discussing important things people focus nipples pic twitter com jZhfChYWju|12K|9.2K
10:34 PM - 21 Nov 2015|houdini pic twitter com 2jO0T5jYIY|1.1K|8K
9:58 PM - 20 Nov 2015|DISMORE SISTERS ARE REUNITED MUTHAFUCKAS pic twitter com 9O1Pu0fqr3|1|16
6:49 PM - 20 Nov 2015|For say periods aren't bad never actually experienced menstruation pic twitter com nMh2TS4Jns|3.6K|7.5K
5:20 PM - 20 Nov 2015|Stage Manager You 5 minutes places Me pic twitter com WSz6ebzXSN|1|7
1:14 PM - 20 Nov 2015|Lou's Views The dream team back together pic twitter com bb1y5wcQzR|2|19
12:26 PM - 20 Nov 2015|Hannah's bible pic twitter com SQEaNoeiAh|5|18
1:21 PM - 20 Nov 2015|I get see @Lucy__Dismore tonight guys pic twitter com EUI3Xf0UtV|1|10
7:46 PM - 19 Nov 2015|Trump wants Muslims wear special ID badges I thought I'd help make clear pic twitter com HzaFX0OYO1|6K|9.5K
8:13 PM - 19 Nov 2015|Bill Nye never let us This important pic twitter com z3VmsIt1PN|6K|9.5K
2:31 PM - 18 Nov 2015|YEAAAHHH The way go https twitter com lucy__dismore status 667106782012006401|1|2
7:23 AM - 17 Nov 2015|You could say show escalates pretty quickly Come see Nick Hone I play really attractive https instagram com p -MNqUhDMXl|1|1
10:07 PM - 13 Nov 2015|Happy birthday @devbostick Hope like gifts much Jasper liked stick #The100 pic twitter com 2a43H7YSXV|125|374
5:06 PM - 15 Nov 2015|universe love pic twitter com qIqGqWJZ7K|4.7K|10K
5:02 PM - 15 Nov 2015|world love pic twitter com L5Jg8qDcJc|4.3K|11K
3:38 PM - 15 Nov 2015|paris love pic twitter com Dd4dP8q2wo|4.7K|13K
6:54 PM - 14 Nov 2015|Sanders It radical idea single mom earning enough money take care kids #DemDebate|427|715
3:41 PM - 14 Nov 2015|Makes thirty minute Spotify queue 10 minute shower|3|24
12:56 AM - 14 Nov 2015|Remember Islamic State Al Qaeda Boko Haram combined make 0 003 1 6 billion Muslims worldwide|2.3K|2.3K
