11:04 AM - 11 Dec 2015|@united @JetBlue @Delta #TalkinSnack @twitter everything needed Friday #avgeeks pic twitter com P71UFC0VpN|7|18
7:33 AM - 11 Dec 2015|@Delta ban hoverboards begins today airlines follow suit @DeltaNewsHub http bit ly 1jT7McM|14|12
2:00 AM - 11 Dec 2015|NEWS Fire fighters spray foam wrong plane engine fire China @shanghaidaily http ift tt 1Nl3Fi2 pic twitter com lNrkwEMeGU|87|42
1:44 PM - 9 Dec 2015|I already fleet @qatarairways models I'm giving @Airbus A350 model new home Retweet enter pic twitter com 4AXQIOUay6|541|114
5:01 AM - 9 Dec 2015|Der @congstar Chat Support best -D pic twitter com sVXWgTWJkw|23|71
5:14 AM - 9 Dec 2015|Apple adds third-party Lightning headphones online store cool 800 http wp p1xtr9-1ITE|20|30
1:02 PM - 8 Dec 2015|What happened Apple design http www theverge com 2015 12 8 9872746 apple-bad-hardware-design-iphone-case-pencil-magic-mouse utm_campaign theverge utm_content chorus utm_medium social utm_source twitter pic twitter com hdfDeiZwae|200|220
4:47 PM - 8 Dec 2015|CN Tower poking clouds approach Toronto pic twitter com S3oh7IKNMH|251|646
1:13 PM - 8 Dec 2015|According Leipzig Airport Antonov An-225 visit airport 11-12 17-18 Dec https www leipzig-halle-airport de reisende-und-besucher erlebnis-airport spotterbereich-72 html pic twitter com 40QbptC9IT|27|44
8:52 AM - 8 Dec 2015|We put LED charge indicator inside revolutionary new Smart Battery Case fuck pic twitter com 8nv37sxJiH|611|562
6:19 AM - 8 Dec 2015|Wow Apple outdid Magic Mouse 2 lightning port design battery case lol pic twitter com qd68EQQid5|174|645
4:19 AM - 8 Dec 2015|apple's 2015 lineup looking great pic twitter com 302S7jstSp|4.2K|2.4K
4:00 AM - 7 Dec 2015|NEWS #LH1406 passenger threatened open plane door bring aircraft http ift tt 1OOnd0T pic twitter com 9V9PyWpMz3|49|25
8:15 AM - 6 Dec 2015|I believe re still using iPhone 6 You know released shit year ago right Upgrade pic twitter com 61CKqgD4EN|76|224
9:37 PM - 5 Dec 2015|This time-lapse Reagan National Airport looks like pic twitter com BuO1YCTAmF|267|773
4:50 PM - 5 Dec 2015|The Monster Lifts Off pic twitter com PkxrrCcQPS|46|69
9:00 AM - 5 Dec 2015|This biggest unboxing ve ever seen https goo gl 7rdJ20 pic twitter com usDaezZwy5|286|1.3K
6:51 AM - 4 Dec 2015|On day 1991 Pan American World Airways flew final flight Gone forgotten 1927-1991 pic twitter com xAuCKB9BNH|51|42
8:16 PM - 3 Dec 2015|Food thought pic twitter com OWEmG7juVk|741|854
9:54 AM - 3 Dec 2015|Happening NOW @UCBerkeley #MeatIsMurder #GoVeg pic twitter com C1agHPo81t|633|951
10:28 AM - 3 Dec 2015|This B-767 The Spirit Delta came gift-wrapped employees December 1982 #tbt pic twitter com Llws8im7aN|62|194
8:01 PM - 2 Dec 2015|Putting things perspective - Our Milky Way compared largest galaxy known universe pic twitter com qdoUfGgnE6|441|721
11:01 AM - 2 Dec 2015|German supermarket wins emotionally manipulative Christmas ad http www theverge com 2015 12 2 9836624 grandpa-christmas-ad-edeka utm_campaign theverge utm_content chorus utm_medium social utm_source twitter pic twitter com c6zEcsht1m|92|118
4:12 AM - 1 Dec 2015|RT enter draw 5 #A350Finnair model planes Winners announced 24h @FinnishSanta @Airbus pic twitter com zVlGOiDWt9|696|208
6:55 PM - 28 Nov 2015|Just big Milky Way Galaxy pic twitter com LUowA1TuHb|496|753
11:17 AM - 28 Nov 2015|What else #FuturePilot pic twitter com T3xsOMELrh|2|2
