4:30 PM - 9 Dec 2015|Harrison Ford Carrie Fisher Mark Hamill 1977 Star Wars premiere pic twitter com PVUfIYuZ2K|1.4K|2.3K
3:05 AM - 12 Dec 2015|Frank Sinatra born day 100 years ago Happy Birthday Ol' Blue Eyes pic twitter com 4OG3PXNlNu|2.5K|2.8K
12:56 AM - 11 Dec 2015|Why stop replying messages https vine co v iZ5eAqPgixn|596|542
7:25 AM - 12 Dec 2015|Trying OBJ like pic twitter com Jsciombtgn|3K|3.2K
12:08 PM - 21 Nov 2015|without money money root evil things u end owning u money ya get 20 mcchickens|409|642
7:55 AM - 12 Dec 2015|ME tbh I never sure Squints saw Wendy Peffercorn PRIEST that's good confession really sin|16|51
11:07 PM - 11 Dec 2015|okay decided need girl|1|1
12:42 AM - 12 Dec 2015|goes college interview w 5 kilos cocaine backpack|1|3
11:43 AM - 11 Dec 2015|If make make anywhere -Frank Sinatra I'll punch Irish fucking face -Probably also Frank Sinatra|21|75
5:42 PM - 11 Dec 2015|think im nice friend imagine date whew swept feet nd kick open door mcdonalds fo dat dolla menu|1|4
3:39 PM - 11 Dec 2015|Saw @Noxywoxy feed ROFL pic twitter com KYP5QIwwpm|1.4K|1.9K
6:02 PM - 11 Dec 2015|Meanwhile Facebook My dad apparently murdered old Santa Claus take place pic twitter com oBixAaF4ut|3|43
6:28 PM - 11 Dec 2015|California 1960s Photograph LeRoy Grannis pic twitter com vmsaGz0WRY|529|1.5K
9:00 AM - 11 Dec 2015|GET LOST IN THE SAUCE pic twitter com poQBNUQOuH|574|916
11:50 PM - 10 Dec 2015|How write email pic twitter com QTJZGTYkcH|144|521
11:55 PM - 10 Dec 2015|Every time I get drunk I come home turn Amy Schuer stand ups Judge|10|115
11:27 PM - 10 Dec 2015|iN KiNDERGARTEN WAS VOTED MOST LiKELY TO THROW A BRiCK OFF A BALCONY|1.7K|2.7K
10:36 PM - 10 Dec 2015|@mattSgardner6 workin|1|0
10:20 PM - 10 Dec 2015|'Twas nizzle chrismizzle hizzle' pic twitter com Okk3feMDgD|934|1.3K
10:29 PM - 10 Dec 2015|can't beat mamas cooking|1|3
9:57 PM - 10 Dec 2015|Good dinosaur good I think someone chopping onions theater|2|15
9:21 PM - 10 Dec 2015|horse race havin fun date ya announcer keith's prick rounding 2nd u broke heart keith 1st d uhhh m dated announcer|48|169
8:37 PM - 10 Dec 2015|Boobs r chill|1.4K|2.6K
9:08 PM - 10 Dec 2015|thank god 4 parnie|3|4
8:29 PM - 10 Dec 2015|60s Radio DJ pic twitter com jboa0EOrhO|704|1.7K
10:55 AM - 4 Dec 2015|I've found best birth control speaking|1.9K|2.7K
7:50 PM - 10 Dec 2015|@oddfuckingtaco aye man keep kids dude|21|94
7:12 PM - 10 Dec 2015|Every action film sequel unnecessary reboot -First draft Newton's Third Law|9|26
9:10 AM - 9 Dec 2015|The I'm going harass umpire whole game starter pack #TDM pic twitter com pvij2dZFJP|2K|3.4K
3:59 PM - 10 Dec 2015|WHO DID THIS pic twitter com PC5ImEYQXI|22K|32K
3:25 PM - 5 Dec 2015|DJ Khaled reveals another key success pic twitter com czUjIOrSdn|7.4K|6.6K
3:49 PM - 10 Dec 2015|ME hands another tissue Has nosebleed stopped HER Who forgets take sucker going kiss|3|16
6:49 PM - 9 Dec 2015|WIFE need talk drinking problem ME don't drinking problem tries bite glass water|43|122
10:24 PM - 8 Dec 2015|Watching Victoria Secret Models talk heavy wings really puts things perspective #life|1.1K|3K
9:30 PM - 8 Dec 2015|Spurs childish lmao https vine co v MIga19hWhab|1.3K|2.1K
8:18 PM - 8 Dec 2015|Dude I got Burt's Bees every jacket closet #NeverChapped #HardcoreRapperButHesGlossy|484|1.3K
5:56 PM - 8 Dec 2015|Morning Shower pic twitter com v9M7gnNsRN|390|421
3:59 AM - 8 Dec 2015|How horrible Voldemort nowhere near bad https twitter com BBCNewsbeat status 674170911344455680|220K|200K
10:31 AM - 8 Dec 2015|please sign petition replace Olympic flame two parrots windowless room repeating word 'burger' infinite loop|16|58
10:48 AM - 8 Dec 2015|Just donated 10 Wikipedia I better|9|82
6:14 AM - 8 Dec 2015|Jesus take wheel I'm going lay heat fuzz leans car window firing Tommy gun behind us|8|30
6:37 AM - 8 Dec 2015|Ralphie's dad knocks lugnuts air RALPIE Ohhhhhh fuuuuuuuuuuuck NARRATOR Except I didn't say fuck I said fudge|4|21
7:00 AM - 8 Dec 2015|911 what's emergency ME lifeguard saw drowning like big baby laughed hard fell chair broke neck|20|85
11:48 PM - 7 Dec 2015|One advantageous things open minded|4|3
9:08 PM - 7 Dec 2015|WIFE u ME digging trash uh I dropped ring W oh walks M grabs slice pizza actually looking|25|69
11:19 PM - 6 Dec 2015|@mattSgardner6 happy birthday broo|1|0
9:37 PM - 6 Dec 2015|@mattSgardner6 Happy Birthday|1|1
8:49 PM - 6 Dec 2015|happy birthday @mattSgardner6 known u since little ones|1|1
8:36 PM - 6 Dec 2015|@mattSgardner6 happy birthday big guy|1|2
8:18 PM - 6 Dec 2015|Happy birthday big fella 3 @mattSgardner6|1|1
5:58 PM - 6 Dec 2015|happy birthday yungin 3 @mattSgardner6|1|2
5:58 PM - 6 Dec 2015|Happy Birthday duuuuuuuuude good one @mattSgardner6|1|1
6:45 PM - 6 Dec 2015|Happy birthday man @mattSgardner6 The newest bro|1|1
4:56 PM - 6 Dec 2015|happy birthday brother wish nothing best @mattSgardner6 good one man|1|3
4:24 PM - 6 Dec 2015|fuck ur birthday jk love u can't imagine life w o u pal happy birthday @mattSgardner6 pic twitter com nmW0YZ7s6y|1|3
4:05 PM - 6 Dec 2015|happy birthday @mattSgardner6 good one|1|2
4:09 PM - 6 Dec 2015|happy birthday Matt Hope great day love @mattSgardner6 pic twitter com zI3itErwrH|1|6
3:54 PM - 6 Dec 2015|Happy birthday @mattSgardner6|1|1
3:53 PM - 6 Dec 2015|Happy birthday 6th 7th grade lover #rosemontpowercouple @mattSgardner6 pic twitter com yH28mD5aP4|1|22
3:49 PM - 6 Dec 2015|HAPPY BIRTHDAY @mattSgardner6 I LOVE YOU A LOT YOU'RE AWESOME|1|1
3:45 PM - 6 Dec 2015|Panthers pulling away Not fast Drew Brees goes DEEP Brandin Cooks 54-yard TD #NOvsCAR http snpy tv 1RyhiQb|468|919
3:48 PM - 6 Dec 2015|@mattSgardner6 tell brother say happy birthday|1|0
1:58 PM - 6 Dec 2015|Happy Birthday MATTHEW good one|1|1
2:04 PM - 6 Dec 2015|Saints score 1st defensive touchdown since 2012 also vs Panthers That scored Jonathan Vilma officially retired today|399|806
1:32 PM - 6 Dec 2015|@mattSgardner6 happy birthday big boy Can't wait watch play season|1|1
1:34 PM - 6 Dec 2015|@mattSgardner6 @andkyle happy birthday dudes|1|2
1:36 PM - 6 Dec 2015|happy birthday Matt You're great guy I'm sorry lately I'm glad we're homies @mattSgardner6 pic twitter com R7QgZi1Qtr|1|1
2:03 PM - 6 Dec 2015|Happy birthday @mattSgardner6|1|1
1:16 PM - 6 Dec 2015|@mattSgardner6 happy bday matt You hilarious wonderful|1|2
1:18 PM - 6 Dec 2015|happy birthday Matt @mattSgardner6|1|1
12:18 PM - 6 Dec 2015|Happy birthday bb @mattSgardner6|1|3
12:29 PM - 6 Dec 2015|I would like wish happy birthday one genuine guys The Jet @mattSgardner6 pic twitter com byO4okeBbb|1|3
12:13 PM - 6 Dec 2015|Happy birthday bud You true homie I'm glad friend @mattSgardner6 pic twitter com aenX2hMd7r|1|5
11:39 AM - 6 Dec 2015|hey birthday dude live @mattSgardner6|1|1
11:14 AM - 6 Dec 2015|happy birthday matt youre great @mattSgardner6|1|3
11:08 AM - 6 Dec 2015|@mattSgardner6 happy birthday|1|1
11:09 AM - 6 Dec 2015|happy birthday hitta @mattSgardner6|1|0
10:50 AM - 6 Dec 2015|happy birthday good one @mattSgardner6|1|2
10:57 AM - 6 Dec 2015|@mattSgardner6 happy birthday matt hope good one bud|1|1
10:54 AM - 6 Dec 2015|happy birthday matt @mattSgardner6 you're funniest classiest guy I know|1|3
2:17 AM - 6 Dec 2015|@hannahhhkim @mattSgardner6 happy best|1|2
7:58 AM - 6 Dec 2015|Happy fucking birthday stud classy ass gentleman @mattSgardner6|1|3
9:04 AM - 6 Dec 2015|@mattSgardner6 member The Pack #tybg|1|1
9:56 AM - 6 Dec 2015|@mattSgardner6 Happy birthday Matt You're best yearbook squad forever|1|1
10:08 AM - 6 Dec 2015|S o best twins happy birthday @mattSgardner6 tell Kyle|1|1
9:12 PM - 5 Dec 2015|What afraid GUY 1 spiders GUY 2 ghosts GUY 3 bears ME sneezing driving|54|149
6:40 AM - 6 Dec 2015|How I feel younger friends pic twitter com aDVxKlptUL|841|1.4K
1:13 AM - 6 Dec 2015|Maybe like scientist doctor probably https twitter com time status 673419127193735168|37K|48K
1:48 PM - 5 Dec 2015|When's there's bee drums pic twitter com gaprd29AsY|335|523
5:10 AM - 6 Dec 2015|Uncle Rico Brady pic twitter com qaMf5jGlzx|809|1.2K
12:42 AM - 6 Dec 2015|happy bday @mattSgardner6 kyle|1|1
12:16 AM - 6 Dec 2015|@mattSgardner6 Happy Birthday Matthew The kindhearted classy stud I know Hope it's great man|1|2
12:15 AM - 6 Dec 2015|@mattSgardner6 happy birthday bud good one|1|1
12:13 AM - 6 Dec 2015|@mattSgardner6 happy birthdayyy|1|1
7:26 PM - 5 Dec 2015|1 Like 1 Prayer @georgeshapiroo mistreated dog named Chicken pic twitter com OcjQdK4xQy|4|22
1:29 PM - 5 Dec 2015|Jerry Stiller back day 1974 pic twitter com KgiJVIOjRV|538|1.5K
8:28 AM - 4 Dec 2015|Let reverse gif day day Make better pic twitter com HPQlRmePRx|6.2K|7K
1:03 PM - 5 Dec 2015|waitress u want eggs friend orders anything scrambled Didn't know I eating w fucking queen England|78|323
2:28 PM - 4 Dec 2015|My aunts fianc swat team responded recent attack sent Be careful everyone pic twitter com ggE6eR8aO7|556|285
4:24 PM - 29 Nov 2015|ur dedicated detective investigates vicious felonies ur crush walks pic twitter com OBjvIO0UAb|17K|20K
9:00 AM - 5 Dec 2015|touch soul|3.8K|3.9K
7:01 AM - 5 Dec 2015|How I used flirt girls kid pic twitter com IPkB0I7tHE|381|747
7:35 AM - 5 Dec 2015|Sarah won't stop hitting Bro means likes|219|831
11:50 PM - 4 Dec 2015|@mattSgardner6 Dirty Sprite 2 plays background|1|0
6:57 PM - 4 Dec 2015|I first person realize unsettling phrase eat heart actually|195|434
12:39 PM - 30 Nov 2015|How make ex jealous 1 Eat breadsticks 2 Tell ex ate breadsticks pic twitter com uj6luYdQ2d|2.7K|5.2K
5:54 PM - 4 Dec 2015|Merry Christmas Aww These earrings lovely Right Can believe urologist wasn't even gonna let keep kidney stones|3|7
5:35 PM - 4 Dec 2015|DJ HOWS EVERYBODY DOING TONIGHT r u asking u feel like u u honestly wanna know|2.8K|7K
11:00 AM - 2 Dec 2015|The side media doesn't want see pic twitter com N0ZAPFRSp0|7.5K|8.1K
5:24 PM - 4 Dec 2015|HER This ham um interesting ME Thanks It wouldn't fit microwave I cooked duct taping 5 George Foreman grills|9|33
8:16 AM - 4 Dec 2015|THEY BOTH AGED SO NICELY pic twitter com cu10NeUCU1|2.8K|4K
5:07 PM - 4 Dec 2015|Torture Shark Tank Rick it's seesaw breaks tailbone Mean King next cut Rick throwing invention park|13|64
4:40 PM - 4 Dec 2015|Always gotta look brightside pic twitter com uRk5RXjcxg|784|1.3K
6:01 PM - 3 Dec 2015|God helps ur sports team win pic twitter com OIBRVg8hGW|1.5K|2K
9:36 PM - 3 Dec 2015|Face ass that's way I like fuck pic twitter com DfWjOuIN2z|590|959
10:14 AM - 29 Nov 2015|u blessed christmas chan retweet u prosper blessings great jackie pic twitter com 2vumFf6wTy|19K|7.7K
9:15 PM - 3 Dec 2015|@RealSkipBayless you're worst|491|1K
8:32 PM - 3 Dec 2015|Point Stanford Howard's kill gives Stanford 25-17 victory third set Stanford defeats New Mexico State 3-0 25-20 25-13 25-17|25|76
8:39 PM - 3 Dec 2015|I wanna make art see things|1|6
8:11 PM - 3 Dec 2015|Sliding queen's DMs like how's day lizzy Neck hurt wearing crown Shoulders need royal massage How rubies|7|35
8:00 PM - 3 Dec 2015|@nobleleduc noble noble noble noble noble|1|5
7:10 PM - 3 Dec 2015|This absolutely delightful pic twitter com S8wg7ELgze|107|965
7:40 PM - 3 Dec 2015|My grandma took get sac -AO|3|2
7:43 PM - 3 Dec 2015|Mom Clean room company Me Everyone eating room something pic twitter com nDC3bIyh0M|593|1.1K
6:47 PM - 3 Dec 2015|@mattSgardner6 fuck Larry Pinwickle|1|0
8:06 AM - 3 Dec 2015|Astronauts describing space Barry Wilmore seen shit pic twitter com U378MkrMNB|15K|25K
5:18 PM - 3 Dec 2015|Like RT follow stranger internet whose sole intention get exposure manipulating 10 year olds|262|740
4:08 PM - 3 Dec 2015|Shawty get CHIK FIL A sundays|1|1
11:49 PM - 2 Dec 2015|@mattSgardner6 @trevorbeer24 even mean|1|1
9:11 PM - 30 Nov 2015|Santa Claus Santa laus pic twitter com ycCTvDQT8F|5.9K|4.5K
9:32 PM - 2 Dec 2015|WHERE DID I GO WRONG I LOST A FRIEND|3|7
8:00 PM - 2 Dec 2015|@mattSgardner6 ooh I wanna take ya|1|1
1:14 PM - 27 Nov 2015|When tell parents doin homework n walk ya room catch Twitter instead pic twitter com X3PP5iJxkM|1.5K|2.5K
3:19 PM - 29 Nov 2015|sits 27 hours oil canvas portrait omg delete Bartholomew i'm serious fucking hang Great Hall|26K|39K
11:02 AM - 21 Nov 2015|Schwarzenegger Ferris wheel I'll back large crowd roars I'll back small crowd chuckles I'll back Guy boo fuck|129|411
7:55 PM - 1 Dec 2015|PUT HIM ON FUCKING BLAST YES BITCH pic twitter com uQmrQRTlMr|62K|62K
12:28 AM - 2 Dec 2015|@aiqueeen BITCH THROW THE FUCKING @|1|5
8:26 PM - 1 Dec 2015|Your favorite asshole bigger asshole realized pic twitter com FnB3kjL6Gn|3|30
7:33 PM - 1 Dec 2015|If doesn't inspire get 146 final pass class nothing https amp twimg com v 2eee18af-abe9-4b99-bffa-411cc9eac644|12K|12K
6:40 PM - 1 Dec 2015|Typical day volleyball @tyler_cadelina pic twitter com 8iemqDK3kj|3|7
6:10 PM - 1 Dec 2015|considering living 1 ve made also 99|632|2.5K
5:59 PM - 1 Dec 2015|I looked pillow without pillowcase I'm finally ready make drastic changes life|22|170
5:54 PM - 1 Dec 2015|slams book shut rips glasses jove can't read|27|95
4:19 AM - 1 Dec 2015|happy Dec 1st pic twitter com heBiL26tok|2.9K|2.4K
5:19 PM - 1 Dec 2015|Join us building Academy Museum Motion Pictures Give today Receive Museum exclusives #GivingTuesday http osca rs GTAcadMuseum|33|66
12:22 AM - 1 Dec 2015|Me pausing middle reading The Giving Tree children y'all better|39|199
11:29 PM - 30 Nov 2015|The harder try bring people level obvious low really|1|16
11:07 PM - 30 Nov 2015|GET THE LOOK Tommy Hilfiger Swim Trunks 238 Versace Cuffs 220 Acne Studios Tube Socks 105 Prada Boots 795 pic twitter com KewKR3iLRT|417|675
10:47 PM - 30 Nov 2015|Gotta switch grind mode|3|1
12:17 AM - 24 Nov 2015|skipping stones lake DATE it's beautiful evening ME whispering take fucking lake|2.5K|4.7K
6:46 PM - 30 Nov 2015|1 5 million dollars bond means 150 thousands dollars Some people didn't know #JasonVanDyke|1.3K|2.1K
4:44 PM - 30 Nov 2015|Ppl sitting jail weeks months petty crime traffic tickets Yet murderer allowed go free despicable #JasonVanDyke|37|33
6:12 PM - 30 Nov 2015|OK new iPhone 6S winner midnight 3 hours Just RT follow enter pic twitter com M8M7rVF8iA|61K|25K
6:30 PM - 30 Nov 2015|Sometimes it's hard pic twitter com uqul8e9hz8|647|873
5:24 PM - 30 Nov 2015|1 5 Mil Out bail 150k #JasonVanDyke murderer #blacklivesmatter #LaquanMcDonald pic twitter com mE3D9QEfTu|1.3K|864
5:20 PM - 28 Nov 2015|Sometimes animals better humans ok I lied it's time pic twitter com 67JQMBPKvj|31K|29K
7:57 AM - 29 Nov 2015|Black Friday Small Biz Saturday Dyspeptic Sunday Cyber Monday Despondent Tuesday Broke Wednesday Get A Grip Thursday Top Ramen December|36|121
9:51 PM - 29 Nov 2015|Coach dropped gem If girl doesnt push become better man dont waste time w pic twitter com kL712zv5Xy|7.4K|8.9K
9:14 PM - 29 Nov 2015|@mattSgardner6 @notbrandonf Matt I hate|1|0
7:19 PM - 29 Nov 2015|Kobe Bryant I love everything game #ThankYouKobeBryant https vine co v ia05KTL5rlU|726|548
7:03 PM - 29 Nov 2015|Montez Colleen got sting ray coochie You feel Ders Ders Never|211|503
7:00 PM - 29 Nov 2015|YOU AINT REALLY FUCK WITH ME WAY BACK THEN GIRL HOW BOUT NOW pic twitter com pt4A427xA1|3|14
6:46 PM - 29 Nov 2015|BRUHHH pic twitter com W7WTyDrr57|3.7K|6.3K
3:30 PM - 29 Nov 2015|Don't worry little things life pic twitter com 463KJFmyUm|556|738
1:09 PM - 29 Nov 2015|Odell wouldn't known without eli mannings shitty passes|3|10
1:05 PM - 28 Nov 2015|600 million Africans electricity Akon This remarkable pic twitter com zxTuLaDRw6|36K|33K
11:54 AM - 29 Nov 2015|sometimes best thing stop talking let drink iced coffee|276|417
11:51 AM - 29 Nov 2015|'no one either nope one yup that's me' -stephen baldwin's tombstone|8|42
10:21 AM - 29 Nov 2015|Referee emerges challenge booth Upon review Ross And Rachel definitely break|138|321
9:20 AM - 29 Nov 2015|Getting angry kids ornaments aren't spread correctly Christmas tree|148|349
9:06 AM - 29 Nov 2015|Don't watch clock Do Keep going S Levenson #adventure pic twitter com 8GhwfPlSJM|34|88
2:45 PM - 28 Nov 2015|I CAN'T pic twitter com PXMY951hjO|9.7K|16K
8:45 AM - 29 Nov 2015|RT cried https vine co v OeMduFhWlZl|2K|2.5K
8:44 PM - 28 Nov 2015|ME wish finale Lost would better GENIE you're seriously using wish|32|114
5:22 PM - 28 Nov 2015|looking way end relationship pro tip surprise party|198|514
3:17 PM - 28 Nov 2015|How lucky C3PO R2D2 They're best friends that'll never die They might fall swamp dust shoulder|290|612
6:20 AM - 28 Nov 2015|ME ghost You know Bill Nye used say don't try home Well I kicked door shot face|129|384
2:23 PM - 28 Nov 2015|WHAT DID I SAY I'm sorry I just- BLAM|5|13
9:51 AM - 28 Nov 2015|Rich dad discipline https vine co v eaDx6BYw62h|1.7K|3.6K
9:02 AM - 28 Nov 2015|Cam Newton @1future concert guessed #DAB via @joshxspence https amp twimg com v 2e270eb1-948e-4802-bb39-eee6d19a67b2|9.3K|9K
8:49 AM - 28 Nov 2015|1 Condoms hands https twitter com guardian status 670644325039128577|68|315
7:25 AM - 27 Nov 2015|I'm start new life pic twitter com FjzCErZHnC|355|1.1K
8:22 AM - 28 Nov 2015|showed @LILBTHEBASEDGOD progress mixtape personally loves thinks im amazing #TYBG|2|3
9:17 AM - 27 Nov 2015|I care 10 people's opinions I'm good|2|19
1:34 AM - 27 Nov 2015|Vin diesel got man bun Rt https twitter com eifontheshelf status 668805924069507073|1|7
8:13 PM - 26 Nov 2015|Large amounts regret felt Rn #shotgun #is #bad|1|3
3:53 PM - 26 Nov 2015|Come baby lets twist Come babaaaayyyyyyyyyyyy lets twist|5.4K|12K
9:34 AM - 26 Nov 2015|aunt much makeup nobody eating casserole #ThanksgivingClapBack pic twitter com TYd6aMe5m6|5K|7.5K
3:03 PM - 26 Nov 2015|@mattSgardner6 give thanks|1|1
1:55 PM - 26 Nov 2015|I autograph Hot Pockets take paper face|8.1K|23K
1:16 PM - 26 Nov 2015|When uncle eats twice baked potatoes get pic twitter com YeJUlVphib|315|807
11:07 AM - 26 Nov 2015|ok went bathroom go take shower see pic twitter com A7xtUgRaU3|861|940
12:00 PM - 26 Nov 2015|It's gravy pic twitter com UAP45Q9JtJ|326|488
11:02 AM - 26 Nov 2015|Thankful nah fam I Blessed pic twitter com NdjwfWd3np|3|13
11:00 AM - 26 Nov 2015|WHAT A TIME TO BE ALIVE http twitter com WORLDSTARC0MEDY status 669678841753767936 photo 1pic twitter com 3W5KBzMFbw|4K|6.4K
3:30 AM - 26 Nov 2015|Going thanksgiving family like http twitter com WORLDSTARC0MEDY status 669743681197375489 photo 1pic twitter com jzCIpqcoL3|8.8K|12K
8:42 AM - 26 Nov 2015|Cam Newton man pic twitter com QXu0zkxdcH|2K|2.1K
9:45 PM - 25 Nov 2015|Do http vine co v izKr0aW11VO|2.7K|3.9K
10:50 PM - 25 Nov 2015|@notbrandonf wow good joke brandon|1|4
8:28 PM - 25 Nov 2015|Door opens Mrs Wilson Yes I husband died He made promise tell something Your meatloaf sucks|7|27
8:43 PM - 25 Nov 2015|wanna go ding dong ditching|509|1.1K
4:37 PM - 25 Nov 2015|If cranberry sauce isn't shaped like came get hell thanksgiving table|15|64
11:42 AM - 25 Nov 2015|@mattSgardner6 matt never chillen|2|7
8:02 PM - 24 Nov 2015|@mattSgardner6 ill b|1|1
6:10 PM - 24 Nov 2015|When see favorite cousin pull thanksgiving pic twitter com feF8elesCz|8.9K|18K
4:45 PM - 24 Nov 2015|netflix spill spaghetti couch|294|556
6:14 PM - 23 Nov 2015|Man I got many questions watching pic twitter com fULmGjNQ6O|9.5K|9.9K
4:01 PM - 24 Nov 2015|@aiqueeen that's pretty impressive|1|1
3:46 PM - 24 Nov 2015|Sister I don't know friends people like cuz ur kinda annoying|2|0
2:12 PM - 24 Nov 2015|ME So I hired INTERVIEWER Not chance ME wiping mustard footie pajamas How come|65|133
12:15 PM - 24 Nov 2015|7-year-old boy genius Arden Hayes stopped last night kick @StarWars cast ass https amp twimg com v 5b6b1792-93ee-4706-8979-21b6f02ffdbd|409|1K
5:49 PM - 22 Nov 2015|This may may favourite video internet pic twitter com I7qu96xb1a|6.4K|7.9K
7:30 AM - 24 Nov 2015|The cast director The Breakfast Club 1985 pic twitter com uBHshyAvbI|708|1.5K
8:00 AM - 24 Nov 2015|WHEN iM 45 WiLL RETiRE AND BE A COLLEGE VERSACE PROFESSOR AND TEACH A CLASS ON HOW TO MAKE YOUR MONEY WORK FOR YOU #VersacePhilosophy101|1.2K|2.2K
8:53 AM - 24 Nov 2015|horror movie GUY behind oh shit whats gonna happen ME head slowly turns complete 180 we're gonna die|38|86
7:12 AM - 20 Nov 2015|Never stop retweeting pic twitter com xPPdsk7Q8D|19K|9.4K
10:44 PM - 23 Nov 2015|weird roommate https vine co v izHJ6OMUdOt|702|2.9K
10:49 PM - 23 Nov 2015|According 'The Santa Clause' rules Santa ODs heroin dealer become next Santa|11|56
5:15 PM - 23 Nov 2015|Future life https vine co v iziZXMjleDx|81|84
6:48 PM - 23 Nov 2015|thing expect life change even year ago fucking shit hoodtrose im middle damn|1|2
1:17 PM - 23 Nov 2015|LMAO signed McDonalds University pic twitter com hpZQj4uSd1|3.9K|8.8K
4:29 PM - 23 Nov 2015|Michael Caine wife circa 1970s pic twitter com UeLcAQAL66|436|1.7K
7:22 PM - 22 Nov 2015|SKRILLEX DEAD LOOKS LIKE HE WANTS TO SUE THE SEATING PLANNER pic twitter com 1PvG0ogw7i|4.3K|4.5K
8:19 AM - 18 Nov 2015|Hi I'm Tristan toothless magician let answer probably wondering I cannot make teeth appear|139|527
9:34 PM - 22 Nov 2015|Gene flicked forehead I bruise|2|4
4:49 PM - 22 Nov 2015|VERY SERIOUS SCIENTIST picks copy Weird Science Oh I don't care one bit|13|60
8:14 AM - 21 Nov 2015|ill leave https vine co v elWUgJwha36|11K|16K
9:51 AM - 22 Nov 2015|I bet Donald Trump tweets solid gold Blackberry|123|505
2:26 AM - 22 Nov 2015|This time day culprit overthinking deep emotional thoughts life stress endeavor|1|3
8:45 AM - 20 Nov 2015|Radical Islam pic twitter com SSghGNzsul|17|25
12:05 PM - 21 Nov 2015|The KKK gone Supreme Court adopt highway Well technically white stripe middle|1.3K|4.2K
10:04 AM - 21 Nov 2015|I don't usually post stuff like can't silent think dogs good|120|252
10:25 AM - 21 Nov 2015|Keep positive mindset today Don focus instead ask|209|238
10:31 AM - 21 Nov 2015|It's good life|7|7
11:29 PM - 17 Nov 2015|@TheOtherHeart pretty accurate|6.4K|7.8K
9:42 PM - 19 Nov 2015|dad put fire fireplace looked said oh it's LIT|3|10
8:52 PM - 14 Nov 2015|Hillary that's November I'll asking goats Goats wait wat H VOTES meant say votes Goats ya makes sense|40|102
7:04 PM - 19 Nov 2015|LANCELOT fight honor King Arthur who's LANCEALITTLE someone help get horse|100|177
9:19 AM - 20 Nov 2015|Wife But zoo told never come back Me loading hotdogs shotgun Those giraffes can't live salad Eleanor|539|992
12:39 AM - 20 Nov 2015|Just got trouble taking pic squad cause I didn't realize Leo DiCaprio table next us lol|34|266
12:06 AM - 20 Nov 2015|You really took one chin huh Not proud I college needed money I meant fantasy football oh|6|25
12:07 AM - 20 Nov 2015|ASAP Rocky Split J round two Lol|7|84
12:07 AM - 20 Nov 2015|@mattSgardner6 cause love im lookin santas lil helper|1|0
11:44 PM - 18 Nov 2015|Nicest Satanists ever pic twitter com b3tmHtfgSF|11K|11K
6:27 PM - 19 Nov 2015|Randy Jackson voice it's dawg|1|4
6:04 PM - 19 Nov 2015|My boy @notbrandonf gonna wreck weekend finals #h20polo|5|6
4:39 PM - 19 Nov 2015|I'm sure I believe Santa I guess I'm eggnogstic|76|218
11:53 AM - 19 Nov 2015|ME wearing Tommy Hilfiger ready go GF u put something less hideous TOMMY HILFIGER climbs unnecessary|349|710
11:00 PM - 18 Nov 2015|ur join Twitter beef pic twitter com 530iFRcuoY|9|44
6:48 PM - 18 Nov 2015|identifies problem snack Well everything I could|311|523
6:06 PM - 18 Nov 2015|#help @uber driver harmonizing along #nickleback car moving fast jump #sos|222|553
6:06 PM - 18 Nov 2015|mission manipulation idea surrounds corruption government general public full 'sheep' dont think|1|1
11:22 AM - 18 Nov 2015|I kiss leaving car I stop poke head back Me I m supposed tell wife right Her NO Me oh ok gotcha|29|154
11:30 AM - 18 Nov 2015|magician notices I ve waited around everyone left show Magician oh hey Me whispering I know re real|119|360
9:38 PM - 17 Nov 2015|When open convo start typing http vine co v iBlaKB37A3b|4.6K|4.5K
9:46 PM - 17 Nov 2015|@brandonxchoi brandon original relatable|1|1
7:37 PM - 17 Nov 2015|YO WHY DO U ONLY MAKE THE LOW FAT ONES I WEIGH LIKE 150 I NEED FAT AND THESE TASTE LIKE WOOD @HoneyMaidSnacks pic twitter com MkD6QB0LIl|188|654
7:44 PM - 17 Nov 2015|I want tha top|1|1
8:19 AM - 17 Nov 2015|Another day another opportunity|1.3K|891
8:09 AM - 17 Nov 2015|@l_ovelee yes But prescription|1|1
8:09 AM - 17 Nov 2015|Who's excited new upcoming episode Hibernation I #WeBareBears pic twitter com feYOXnAXju|42|77
1:17 AM - 16 Nov 2015|Sees ex wife drinking alone bar Me Can I buy drink For old times sake Her Sure Me GET THIS BITCH A GLASS OF POISON|260|807
1:53 AM - 15 Nov 2015|Help spread please #prayforkorea pic twitter com nx4TWhCZbh|1.7K|689
6:00 PM - 16 Nov 2015|Laughing hard right https vine co v e5OBTiXAeqx|1.5K|2K
4:36 PM - 16 Nov 2015|It's #tooltime @MaxwellHolt pic twitter com EkME1i9LgQ|216|366
8:32 PM - 15 Nov 2015|talking mirror You awkward today Person Hey Me Good How|182|355
9:18 AM - 15 Nov 2015|ayyyeeeooo thats https twitter com bbywolf666 status 665650303484583936|3|14
2:36 PM - 14 Nov 2015|I feel great https vine co v iBhzrO3WD3I|52|143
3:38 PM - 14 Nov 2015|Hey listen new 1D album Um I listen music 70's 80's show unique superior I u peasants|224|838
