3:49 PM - 11 Dec 2015|The time come The new trailer #XMen #Apocalypse http fox co XMenTrailer|1.1K|2K
5:13 PM - 30 Nov 2015|isn't pathetic waste much time certain people end prove weren't even worth second|2.6K|5.1K
3:08 PM - 11 Dec 2015|Phoebe Buffay hairporn pic twitter com m4mrn0oYg8|125|247
9:16 PM - 9 Dec 2015|When liquor really start kickin pic twitter com KxszASabec|4K|4.1K
4:26 AM - 10 Dec 2015|Me bed currently pic twitter com GG7bmmT8q3|2.1K|2.4K
12:21 PM - 10 Dec 2015|Constantly chasing people couldn't care less|5|8
4:26 PM - 10 Dec 2015|History repeats that's goes|1|12
1:30 PM - 7 Dec 2015|Obamacake https vine co v eWzQ0jOi5Zm|874|1.3K
12:15 PM - 10 Dec 2015|Underwater|6.1K|11K
10:05 AM - 10 Dec 2015|Really grinds gears|33K|53K
7:14 PM - 9 Dec 2015|ahs hotel literally 96 sex|297|938
7:09 PM - 9 Dec 2015|I watched lady gaga ride dick cool https www instagram com p _GHyTni0Oy|11|48
6:35 PM - 7 Dec 2015|MY HEART pic twitter com cBjEargO7o|474|979
3:32 PM - 8 Dec 2015|Racists cant even provide reason ignorant pic twitter com 0AYBtFac1T|19K|16K
6:59 PM - 9 Dec 2015|pastel pink pic twitter com RxbN20bXfP|102|127
6:56 PM - 9 Dec 2015|SHAKA BRAHS pic twitter com i3riCf7w5z|37K|66K
6:29 PM - 9 Dec 2015|@rowblanchard @amandlastenberg love Wish stayed longer 3 us gotta get together ASAP|880|3.3K
6:26 PM - 9 Dec 2015|This whole year I hair every article The girl blue hair The girl pixie cut And it's gone Feels good|11K|24K
8:03 AM - 9 Dec 2015|even zayn Malik thIS IS SO FUNNY pic twitter com WSqs9IGp6X|9.8K|6.1K
4:26 PM - 9 Dec 2015|@amandlastenberg amazing woman Thank cheering today couldn't done without|884|3.7K
8:55 PM - 4 Dec 2015|couldn't agree pic twitter com JRPZr1fmql|1K|2.2K
9:40 AM - 9 Dec 2015|Racists cant even provide reason ignorant pic twitter com zSPJiqU4f2|2.4K|3.4K
8:45 AM - 9 Dec 2015|decent day|1.8K|2.3K
1:24 PM - 6 Dec 2015|Happy Hanukkah Jew #tbs pic twitter com SsmXgUOIXc|1K|4.2K
12:02 PM - 7 Dec 2015|This Episode pic twitter com yV3TIe8C1f|4.4K|5.6K
5:16 AM - 9 Dec 2015|@maddiebuckley_ thanks Maddie pic twitter com 7wmDAj1TLy|1|3
8:31 PM - 8 Dec 2015|I CANT BREATHE pic twitter com 0GxV2fdGeY|4.4K|8.2K
8:30 PM - 8 Dec 2015|Thank everyone watched #ScreamQueens season We best time making love hearing much guys love|1.9K|4.2K
4:10 PM - 8 Dec 2015|It's time year pic twitter com zPFDq8lTGw|2.8K|1.9K
8:09 PM - 8 Dec 2015|accuracy aesthetic thia made fucking wild|1|1
7:02 PM - 8 Dec 2015|4 v3ry speshul sum1 pic twitter com r7WvxoHsjr|2|2
6:57 PM - 8 Dec 2015|Fifty Shades Of Jelena pic twitter com yxNXEWREsy|2.3K|7.1K
6:04 PM - 8 Dec 2015|If you're girl fav eachothers tweets We're friends u dm anytime go get lunch|8.9K|8.4K
6:18 PM - 8 Dec 2015|set fire head set fire head tonight pic twitter com I88YwaKjst|22|44
1:53 PM - 1 Dec 2015|mood board holographic pic twitter com dtpFvwuc1W|2.3K|2.8K
6:41 AM - 2 Dec 2015|mood board pic twitter com wFVk9qnmd6|2.1K|2.5K
5:46 AM - 8 Dec 2015|Edward Scissorhands 1990 pic twitter com NhMfPTGANc|369|438
1:46 PM - 7 Dec 2015|2 years ago today dad came home surprised us w puppy greatest day life 3 pic twitter com 27EohPeXgV|1|14
12:11 PM - 3 Dec 2015|THAT CLAPBACK IM SCREAMING pic twitter com i3JzBJ6tN3|13K|15K
4:26 PM - 6 Dec 2015|let go passenger emo leslie ann edits brought @knopeperkins pic twitter com aUilxI2maZ|65|108
4:43 PM - 6 Dec 2015|can't help falling love Elvis Presley pic twitter com GtZV3uCJ4O|378|618
11:30 AM - 6 Dec 2015|This good group sound like trying Out sing pic twitter com Pdjr8XqOUw|5K|5.3K
8:34 AM - 6 Dec 2015|Tbh Happy Xmas War Over feels weirdly judgmental pic twitter com g3IB0ggCnm|65|106
10:36 AM - 6 Dec 2015|mashups amazing pic twitter com PZuOBRYYyw|1.5K|3K
3:07 PM - 29 Nov 2015|Ed Sheeran surprised wedding pic twitter com tdWqrN5gso|2.3K|4.4K
10:07 AM - 5 Dec 2015|I shouldn't crying hard https amp twimg com v 00da6b0a-93a5-45b9-bab3-a57a3048b261|5.7K|8K
7:59 AM - 3 Dec 2015|On December 18 #YouCanSeeThemBoth https amp twimg com v 61b95032-6377-4a4f-8812-150e2c629e8e|2.8K|8.2K
10:31 PM - 5 Dec 2015|Michael realizes bought women's suit|118|287
8:34 PM - 5 Dec 2015|RAISE YOUR HAND IF YOUR AWAKE BECAUSE A BAD B TCH NEVER SLEEPS pic twitter com 0CpwBNLGM0|3.5K|10K
4:11 PM - 19 Nov 2015|Lorde dances like club lost earring https vine co v iuABMbKnP9J|1.3K|2.8K
10:29 AM - 4 Dec 2015|I'm Best New Artist Thanks @NME u guys aren't mean u vote http www nme com awardsvote pic twitter com UIkZ1jQKDH|4.1K|8.1K
7:32 PM - 29 Nov 2015|Will king pickup lines http vine co v hlBnx0urIP7|70|102
11:17 AM - 2 Dec 2015|I reached money goal http twitter com WORLDSTARC0MEDY status 671896396694290432 photo 1pic twitter com QYt1GctysC|350|55
3:49 PM - 2 Dec 2015|If doesn't inspire get 146 final pass class nothing https amp twimg com v 2eee18af-abe9-4b99-bffa-411cc9eac644|214|206
2:03 PM - 2 Dec 2015|ahs starts tn pic twitter com slYo0DjNPL|284|538
1:08 PM - 2 Dec 2015|Hi everyone Thanks support years I really appreciate You're best pic twitter com WggTJMz0sv|2K|5.8K
7:10 PM - 30 Nov 2015|love Miley pic twitter com 4HEOTQHB2H|2.7K|5.9K
2:10 PM - 1 Dec 2015|MUST RT EVERY DECEMBER pic twitter com Br1C6XoPJB|2.4K|1.7K
7:05 PM - 1 Dec 2015|IT'S DECEMBER pic twitter com z3LfkKFBzk|3.1K|3.3K
6:47 PM - 1 Dec 2015|It's time year https vine co v OXIqLvF17P9|3.2K|2.7K
4:23 PM - 1 Dec 2015|Sexy back https vine co v iaVArHbp0r5|12K|14K
3:07 PM - 1 Dec 2015|signs melanie martinez lyrics virgo pic twitter com kLFGC0PABZ|537|612
11:49 AM - 1 Dec 2015|@FamousBirthdays don't know|4.5K|9.5K
9:48 AM - 1 Dec 2015|Sometimes I stress band things I remember fans favorite song 43 second long song called Pizza|59K|83K
7:21 PM - 30 Nov 2015|@maddiebuckley_ @tnwisniewski @alex_morales777 finally found poem Poetry Out Loud https twitter com jodyhighroller status 671522593074118656|1|3
8:49 AM - 30 Nov 2015|Amy Schumer Serena Williams posed topless calendar http bzfd 1OzYYTT pic twitter com 2wcgHggTQn|300|1K
4:08 PM - 24 Nov 2015|Christmas time And forget historical scene mean girls pic twitter com VdzpJWeWMr|45K|62K
4:57 PM - 30 Nov 2015|I'm gonna watch Legally Blonde Red White Blonde tonight hopes studying AP Gov test tmw|2|10
5:13 PM - 30 Nov 2015|Teacher homework plagiarized Me pic twitter com 4c2sGhi9Lo|2.2K|3.5K
8:43 AM - 30 Nov 2015|disabled models featured inspiring NY fashion week #DisaBodyPosi pic twitter com cEnNH0kNdq|20K|21K
3:26 PM - 30 Nov 2015|im gonna DL tinder use LAX hit|28K|55K
1:56 PM - 30 Nov 2015|#Trans kids go enough earth would school disrespect like https twitter com lexi4prez status 671446553165475843|69|140
12:18 PM - 30 Nov 2015|lawyer Your honor client would like plead guilty reason 'ITS JUST A PRANK BRO CHILL BRO IT WAS A PRANK CHILL OUT BRO'|2.6K|4.7K
7:53 AM - 28 Nov 2015|heart exploded pic twitter com S9dZ9gfYg1|11K|18K
11:10 PM - 29 Nov 2015|Hi earthlings|46K|82K
7:40 PM - 29 Nov 2015|muslims evil grammar evil u dumb redneck|211|1.1K
7:38 PM - 29 Nov 2015|I disgusted https amp twimg com v 1f62a0ef-2073-4175-b19b-aebddfd097da|2K|2.9K
10:03 PM - 28 Nov 2015|signs dogs virgo pic twitter com odFYDG3yh8|706|710
1:12 AM - 29 Nov 2015|signs colors virgo pic twitter com VpiORIJvg1|987|884
12:45 PM - 29 Nov 2015|signs big cities virgo New York NY pic twitter com rczLDIeLa3|1.4K|1.3K
6:33 PM - 29 Nov 2015|signs halsey lyrics virgo pic twitter com 4OnAVJs4Yw|888|857
7:30 PM - 27 Nov 2015|Things I'm bad singing Things I lot sing|725|764
8:00 AM - 28 Nov 2015|what's favorite Christmas song pic twitter com CEvmevgGWX|1.4K|1.5K
2:08 PM - 29 Nov 2015|@ #TheMadness tour heard screams emitting backstage minutes ago accidentally dying hair silver Yay|13K|34K
5:30 PM - 29 Nov 2015|@halsey feel u halsey|24K|42K
4:39 PM - 29 Nov 2015|GIMME GIMME GIMME pic twitter com VKtlQLpeGh|1.7K|3.7K
4:32 PM - 29 Nov 2015|What u mean Im lowkey cute How work Im 8 cute Im really ugly I contain artificial cuteners Am I Low Carb Diet cute|2.1K|2.8K
4:39 PM - 29 Nov 2015|Is version cute free trial run Am I gone wake ugly 1 day face gone ask payment information continue cuteness|488|834
4:31 PM - 29 Nov 2015|GOALS pic twitter com m1BQbpVqMW|1K|2.1K
1:31 AM - 26 Nov 2015|Johnny Depp Winona Ryder pic twitter com 87YwuLK4K1|287|388
1:52 AM - 26 Nov 2015|cuties pic twitter com N5dahBzvqq|225|340
10:09 AM - 26 Nov 2015|The Outsiders 1983 pic twitter com SMWyipLSVs|122|143
10:26 AM - 26 Nov 2015|James Franco Freaks Geeks pic twitter com JfxHA0HGBw|1.7K|2.7K
10:38 AM - 26 Nov 2015|Johnny Depp 1994 pic twitter com 3dK844JFyG|114|172
10:39 AM - 26 Nov 2015|Johnny Depp 1992 pic twitter com eQQdmssHWP|221|266
7:04 PM - 26 Nov 2015|Alicia Silverstone The Babysitter 1995 pic twitter com q8LxxDizTy|166|349
7:15 PM - 26 Nov 2015|lovely ladies order pic twitter com nJf6vc27cQ|97|256
8:19 PM - 26 Nov 2015|Johnny Depp Glen Lantz A Nightmare Elm Street 1984 pic twitter com 69xRUnODlV|139|258
8:20 PM - 26 Nov 2015|Johnny Depp Glen Lantz A Nightmare Elm Street 1984 pic twitter com i4W3W8U7Bj|206|371
2:24 PM - 29 Nov 2015|Cry-Baby 1990 pic twitter com MFGj5nCFow|251|424
2:24 PM - 29 Nov 2015|Johnny Depp smoking blunt holding super-soaker set Sleepy Hollow 1999 pic twitter com CVBCNak9ST|314|510
3:22 PM - 29 Nov 2015|Beyonce BEAT Magazine pic twitter com xhiQkgMqH5|90|136
3:05 PM - 29 Nov 2015|I running president must protect woman right choose must defend Planned Parenthood #JJdinner|4.1K|9.3K
1:21 PM - 29 Nov 2015|people shouldnt need second chances hard right thing first time|1|2
1:15 PM - 29 Nov 2015|Johnny Depp pic twitter com uY8xEQBHiz|330|478
1:17 PM - 29 Nov 2015|babyyyy pic twitter com 1GvBwthycL|354|477
