12:42 PM - 10 Dec 2015|The world wanted drug lord declared war Islamic State http nyp st 1jR6Rtc|1.2K|664
8:54 AM - 7 Dec 2015|KEO'S COMEBACKS Keough Novak https li st l 1UpZOOdziNlprAbpDWZbeq|27|121
12:48 AM - 29 Nov 2015|Don't bite hand feeds hands matter filthy animal|17|62
4:49 PM - 25 Nov 2015|I'm turnt like opposite direction|93|154
1:37 PM - 23 Nov 2015|Bernie Sanders rapper Killer Mike Busy Bee Atlanta pic twitter com jqOiLlMgrQ|21K|29K
6:02 AM - 20 Nov 2015|Guy Fieri counter-terrorism shows Fox month scare shit old people pic twitter com mCXLLXdIB8|90|168
6:53 PM - 14 Nov 2015|Omg fantastic article http www bustle com articles 95692-if-presidential-candidates-were-clueless-characters-who-would-be-captain-of-the-pismo-beach-disaster-relief|1|0
