5:15 PM - 5 Dec 2015|Love Muraco built Liberty football program The ultimate players' coach He's determined beat BGHS pic twitter com kO6bURAIIU|13|47
1:01 PM - 5 Dec 2015|Sanchez offensive coordinator going like Walmart shoppers Black Friday Sanchez happy I scared lol #702hsfb|1|1
3:14 PM - 4 Dec 2015|Thanks gratitude BYU players Cougar Nation You changed life|677|2.4K
5:35 PM - 4 Dec 2015|Congratulation goes Harold Bell committing Southern Utah University Go Thunderbirds Go Aggies pic twitter com 0K0Y8qjn8s|2|9
6:06 PM - 2 Dec 2015|STATE SATURDAY SAM BOYD 12 pic twitter com jBhloCNwhQ|70|92
3:45 PM - 3 Dec 2015|Congratulation Alex Sims committing Southern Utah University Go Thunderbirds Go Aggies pic twitter com pihMWAHu6W|12|42
9:01 PM - 22 Nov 2015|All said I look see people singing along Less popular songs It strengthens continue making #REALMUSIC|30|197
11:53 PM - 20 Nov 2015|Could possibly proud guys tonight I'll take boys team day We may won damnit fought #AV|13|44
11:56 PM - 20 Nov 2015|AV better pic twitter com 2yBn6vbIfy|28|45
11:18 PM - 20 Nov 2015|#11 game y'all can't get passed pic twitter com 3UaKDvQhTv|91|134
9:37 PM - 20 Nov 2015|@aggiefootball05 held Bishop Gorman lowest points season 28 #AggiePride|34|24
8:52 PM - 20 Nov 2015|Arbor View finally gets end zone They may win might ruin Gorman chance #1 pic twitter com HxK0EfkIar|32|33
9:34 PM - 20 Nov 2015|Who would thought Gorman v Arbor View would closer game Basic v Silverado Hope Gorman stays hungry state title #702hsfb|3|5
9:59 PM - 20 Nov 2015|Look I know it's closed gap Gorman talk beat us put 28 I'm proud teamAV|28|53
10:02 PM - 20 Nov 2015|S O Arbor Boys Holding G 28|41|56
11:26 PM - 20 Nov 2015|Gorman fights Arbor View sets sights Reed High http bit ly 1SOFtrB|2|2
10:37 PM - 20 Nov 2015|No 1 @BishopGormanFB advances closest test season https shar es 1cb6zd #NVprepsfb @TheTateMartell @BiaggioAli1234|16|32
10:26 PM - 20 Nov 2015|Updated Teen dead shooting next Mojave HS https shar es 1cbGux @reviewjournal thanks @WesJuhl @rickytwrites @ColtonLochhead|7|1
11:05 PM - 20 Nov 2015|Gaels grind Aggies https shar es 1cbCw9|1|2
7:32 PM - 14 Nov 2015|Proud worn Arbor View across chest pic twitter com 79bFC7rCTd|13|23
7:40 PM - 15 Nov 2015|Breaking verbal story 3-star OL @keenenking verballed @Coach_Leach #GoCougs 3 P-12 schools http www scout com college washington-state story 1612257-breaking-future-coug-ol-talks-cfc sub|9|31
9:53 PM - 15 Nov 2015|Arbor View @aggiefootball05 lineman @KeenenKing commits Washington State https shar es 15BIf2 #NevadaPreps|7|11
7:04 PM - 15 Nov 2015|#Wazzu landed commitment three-star guard Keenen King Las Vegas Arbor View http rvls co 1j2Q8Tk pic twitter com llWfeDpTjN|8|15
8:21 PM - 15 Nov 2015|Keenen King commits Washington St Go Cougars Go Aggies @raybrewer21|11|18
4:10 PM - 15 Nov 2015|Honored first team league cornerback pic twitter com nCciW616LJ|27|86
12:11 PM - 14 Nov 2015|Football Is More Than Just A Game pic twitter com 4KIrFLrf3u|32|63
12:11 PM - 14 Nov 2015|The girls soccer team Not 1 Not 2 Not 3 WE GOT 4 pic twitter com D6yPHKiXHh|14|32
12:14 PM - 14 Nov 2015|State Champions 2015 pic twitter com EfutHTlnCF|62|80
10:26 AM - 14 Nov 2015|Army football took field today carrying French flag #Solidarity pic twitter com JnsCUnyqoX|14|51
