8:41 PM - 23 Nov 2015|missing Alberta bitty @MadiganMckenna|1|1
5:37 AM - 20 Nov 2015|You know meet someone everything common That's @MadiganMcKenna|1|1
6:38 AM - 19 Nov 2015|ive never laughged piss joke sees impressed everyone takes one step fact ive never laughed life|2.3K|4.7K
3:53 PM - 17 Nov 2015|The acts intolerance seen week place Canada We must fight hate embracing values pluralism acceptance|7K|9.4K
9:48 AM - 18 Nov 2015|Trudeau denounces vicious senseless acts intolerance http huff 1luXjWo pic twitter com LVZ9Ei3pFR|23|25
5:50 PM - 15 Nov 2015|@blatchkiki Love isn response Paris attacks Toughness http natpo st 1MLw83F pic twitter com bh2a0BMT9k|45|46
9:30 AM - 18 Nov 2015|Justin Trudeau formally commits lifting visa requirement Mexicans http www cbc ca 1 3323013 pic twitter com A7eWXqgPOa|66|92
1:47 PM - 15 Nov 2015|A fast-paced first day #G20 Had constructive meetings @EPN @jokowi pic twitter com WWsengukKp|590|1.7K
