10:58 AM - 11 Dec 2015|CARL ICAHN WARNS I think meltdown beginning http read bi 1Udx0zE pic twitter com wvguSGDPCR|9|2
5:37 AM - 11 Dec 2015|There Is True Value Bargains In Silver Gold Silver Guru http dlvr CzXlJN #silver|1|0
4:51 AM - 10 Dec 2015|The federal income tax become engine big government growth http j mp 1PXiNIj|20|8
5:30 PM - 9 Dec 2015|China accelerates gold reserves accumulation http research perthmint com au 2015 12 09 china-accelerates-gold-reserves-accumulation pic twitter com zTJxqsfFz6|1|0
1:14 PM - 8 Dec 2015|Smith Wesson reported great quarter gun sales http read bi 1NgPwCq|5|0
2:59 PM - 8 Dec 2015|5 signs US economy isn't ready rate hike http read bi 1XZOUX2|2|5
3:43 PM - 8 Dec 2015|The smart money getting real estate http read bi 1R8nUFB|6|7
11:45 PM - 8 Dec 2015|ISIS tearing Europe apart http read bi 1NgHbia|4|1
12:19 AM - 9 Dec 2015|Sweden declared war cash http read bi 1NgHwkN|6|4
6:41 AM - 9 Dec 2015|The history US dollar bills 7 amazing GIFs http read bi 1XZPfci pic twitter com 1RA65pKKSn|1|3
6:54 AM - 9 Dec 2015|The Dow-Dupont merger reveals depressing truth American mega-businesses today http read bi 1OT9bet|3|2
10:50 AM - 8 Dec 2015|Between 2010 2013 least 30 000 victims #commodities fraud Learn @CFTC http smartcheck cftc gov documents CFTC_SmartCheck_Infographic_1 pdf|2|2
7:30 AM - 8 Dec 2015|Gold Buying Surges At U S Mint In November China Buys 21 Tonnes In November Alone http www goldcore com uk gold-blog gold-buying-surges-at-u-s-mint-in-november-china-buys-21-tonnes-in-november-alone pic twitter com Y9WUKdA40R|1|0
6:01 AM - 8 Dec 2015|How content spreads social networking sites http goo gl DyfTLx #data #socialmedia pic twitter com VUIbwPdsIU|11|13
7:00 PM - 6 Dec 2015|What age reveal personalities #socialmedia users http wef ch 1RtnhFT #Twitter pic twitter com ECpHQdPJK7|88|67
6:07 AM - 8 Dec 2015|Models BETTER people comes investing #trading #tech #technology #profit pic twitter com 0E2S3wHVou|1|1
4:48 AM - 8 Dec 2015|Futures getting slammed oil made new six-year low http read bi 1NfyeFP pic twitter com Vt5xOffDMq|4|1
5:06 AM - 8 Dec 2015|Crude oil crashes 37 barrel http read bi 1NfyeFP pic twitter com BJekCALZDW|11|2
6:25 PM - 7 Dec 2015|Chart US student loan balances exceed 1 3 trillion - pic twitter com ANe0f7Ts2X|31|18
1:23 PM - 7 Dec 2015|These 2 charts basically tell entire global demographic story http read bi 1jKFAbK pic twitter com 9sqmEYofiZ|5|4
1:58 PM - 7 Dec 2015|The company owns DVD-vending machines said sales terrible stock crashing http read bi 1jKIJIA|19|12
12:24 PM - 4 Dec 2015|#Economic BENEFITS #deflation Higher standard living purges excess #markets reallocates Capital @FederalReserve @ECB|1|0
7:33 PM - 6 Dec 2015|Goldman thinks oil prices could fall another 50 market spends another year sorting http read bi 1XUsIgZ|22|8
1:37 AM - 7 Dec 2015|BOND MARKET WARNING 'People going carried stretchers' http read bi 1IOZoBy pic twitter com luE3tI0XIH|11|5
5:21 AM - 7 Dec 2015|This chart illustrates investing stocks worst http read bi 1YTZfG9 pic twitter com nY7lpuwZf4|35|24
6:48 AM - 7 Dec 2015|Goldman Sachs' short-term outlook oil bleak http read bi 1XUsIgZ|1|2
8:24 AM - 7 Dec 2015|Gun stocks going nuts right http read bi 1NdU4JO|20|24
2:57 AM - 7 Dec 2015|Are financial services firms ready KYC #risk management revolution - community blog Neil Jeans http dlvr CxVYzl|1|0
5:30 PM - 6 Dec 2015|According Bloomberg Why Bankruptcy Might Be Mining Industry's Last Best Hope http bloom bg 1XIeAHq via business|5|2
4:55 PM - 6 Dec 2015|Always hot #topic What #hype #networkmarketing #DSA #MLM http bit ly 1Fe5aQC #mombiz #momleaders #entrepreneur WAHM|2|2
8:51 AM - 6 Dec 2015|A man discovery learning new momentum priorities X392-A137-000 Ministry Imagination Create pic twitter com H08eRPOlO8|1|0
3:09 AM - 6 Dec 2015|28 charts show America changed since Fed gave us 0 rates http read bi 1lgu5dW pic twitter com cY5gCqXJ6s|37|39
3:15 AM - 6 Dec 2015|Auto Loan Madness Intensifies Car Buyers Take On Record Debt Lunatic Financing Terms http davidstockmanscontracorner com auto-loan-madness-continues-as-us-car-buyers-take-on-record-debt-lunatic-financing-terms-zero-hedge utm_source ReviveOldPost utm_medium social utm_campaign ReviveOldPost|5|2
6:47 AM - 6 Dec 2015|#Gold Demand #China Heading For Record Reserves Increase 14 Tonnes In October http hubs ly H01tTnM0|2|2
9:47 AM - 4 Dec 2015|JP MORGAN We see 76 chance recession within 3 years http read bi 1lfzOki|99|63
9:29 PM - 29 Nov 2015|'The War Terror Creating More Terror' - weekly column http bit ly 1IiTQnZ pic twitter com bExHTC2pN4|415|356
6:19 PM - 3 Dec 2015|Want know last year revenue Now ask Cortana https cards twitter com cards 3rn6fn 18wam|9|65
10:26 PM - 3 Dec 2015|What They're NOT Telling You #SanBernadino @PrisonPlanet https youtu fIFHN7zoIQ8|15|14
11:15 AM - 14 Nov 2015|Standardization documents #Shariah ruling could push non-conventional #Finance space towards fast paced growth #IslamicBanking|1|0
4:33 AM - 1 Dec 2015|1 3 million Muslims #Canada opportunity #islamicfinance #islamicbanking #sukuk @WIBC_2015 pic twitter com DsbetnGNLT|4|5
11:20 AM - 27 Nov 2015|Islamic finance manage assets 6 5 trillion globally 2020 http sabahdai ly 9HfKDS|2|1
7:09 AM - 3 Dec 2015|Sharia standard gold fit well global Islamic economy http GulfNews com http bit ly 1TzXOd2|1|0
5:06 PM - 3 Dec 2015|Music end world composer John Luther Adams making art times crisis http slate 1XDsQGK pic twitter com 5vH5HlZbe9|15|35
4:03 PM - 3 Dec 2015|As The Credit Cycle 'Turns' Global Defaults Surge To 6-Year Highs http endtimeheadlines org 2015 12 as-the-credit-cycle-turns-global-defaults-surge-to-6-year-highs pic twitter com W9ln27L0Ei|1|0
7:40 AM - 3 Dec 2015|MT @KeithMcCullough lol #Yellen reaffirms confidence #economy meet #Fed's goals pic twitter com w0xVXEDqN0|9|8
11:49 AM - 2 Dec 2015|Over past year commodity prices declined 29 I call #Deflation http www bloomberg com quote BCOM IND|1|1
1:17 AM - 3 Dec 2015|Europe growth pickup fails counter #deflation pressures http bloom bg 1NJ2cHZ via @jrandow #PMI pic twitter com GM8SnrKlzZ|2|0
8:14 PM - 2 Dec 2015|SLV 60min - #Silver looks consolidating next move Lots upside Gaps sayin' come get pic twitter com Si1Y00KMaN|1|2
10:00 PM - 2 Dec 2015|How Simplify Complex http bit ly TTUiTunes #fx #money #finance #gold #trading #stocks #market #gold #profit pic twitter com x7qMY6qXhn|2|2
3:12 AM - 3 Dec 2015|#Inflation remains political financial establishment's favorite method manipulating currency benefit #SpecialInterests|1|0
8:43 AM - 2 Dec 2015|To see world Josh Adamski pic twitter com rreQynOv6C|37|42
5:03 PM - 1 Dec 2015|The Biggest Risks Big Data #BigData #Business #RT http bit ly 1LtmnbG pic twitter com 76vo2jP6Wv|76|63
11:23 AM - 2 Dec 2015|Companies defaulting debt like it's 2009 Blame cheap oil http money cnn com 2015 12 02 investing defaults-bankruptcies-2009-great-recession via @MattMEgan5 pic twitter com 4JxK7fIOOO|12|5
8:10 PM - 2 Dec 2015|Fall #gold prices gold loan companies reeling http www businesstoday magazine features gold-loan-companies-like-muthoot-and-manappuram-are-facing-heat-because-of-fall-in-gold-prices story 226501 html pic twitter com ht9BmOCDQ1|8|14
3:49 PM - 2 Dec 2015|A Complete History How Bankers Use 15th Century Magick To Enslave The World In #Debt http wp p3OH4P-Zd pic twitter com eQ4rQ658TP|8|5
12:40 PM - 25 Nov 2015|Thanks Democrats IRS agents FBI CIA agents We can't stop terrorists audit|1.2K|829
9:56 PM - 1 Dec 2015|California 1848 Gold found American River HANGTOWN CREEK http amzn 1SxuwdS #Bookboost #IARTG pic twitter com quhGQ2KDcI|87|11
6:33 AM - 2 Dec 2015|Record #Silver #Coin Demand Signals Financial Trouble Ahead https srsroccoreport com record-silver-coin-demand-signals-financial-trouble-ahead via @SRSroccoReport SLV pic twitter com uQiIMLU8bL|1|0
11:07 AM - 1 Dec 2015|FED'S EVANS I'm little nervous http read bi 1Rk1lNr|1|1
11:12 AM - 1 Dec 2015|Hyperinflation Watch Kazakhstan Unveils New 20 000 Tenge Banknote http davidstockmanscontracorner com hyperinflation-watch-kazakhstan-unveils-new-20000-tenge-banknote utm_source ReviveOldPost utm_medium social utm_campaign ReviveOldPost|2|0
10:27 AM - 30 Nov 2015|Welcome future pic twitter com ejl6D1En26|251|153
4:03 AM - 24 Nov 2015|The current #mining meltdown taken historical proportions Five years massive underperformance one chart pic twitter com XHqQnRAxJB|4|2
7:25 AM - 29 Nov 2015|What #gold really worth http cfa 1GsXrwD|8|8
7:12 PM - 28 Nov 2015|The science confidence Why idea good anything http buff ly 1TeajuJ pic twitter com slPymXhPI7|96|117
12:23 PM - 29 Nov 2015|Man arrested attempting sell 3 000 stolen ancient coins black market http www rightrelevance com search articles hero article 30996c7716428af9f3738a6a496a891614026396 query numismatics taccount numismatics_rr pic twitter com uiLT8xCEbI|1|0
4:42 AM - 29 Nov 2015|Economic Wisdom Great Economists Demolish Establishment Nonsense http dld bz cSfTH The Case #Logic #Reason|1|0
4:42 AM - 29 Nov 2015|How man woman #integrity live He lives #values beliefs without compromise|1|0
3:49 AM - 28 Nov 2015|Until c19th miners commonly thought metals grew earth living veins http www conciatore org 2015 11 veins-of-earth html #histSTM pic twitter com QCDsjj3CvW|17|22
6:10 PM - 27 Nov 2015|Wait endtimes luxurious 17 5M doomsday bunker http ow ly V9kQh pic twitter com u9gWr5j2bj|15|27
