10:27 AM - 11 Dec 2015|Results want work @chippergaines @TheMagnoliaMom @hgtv let's make happen pic twitter com OAORbjgqtK|62|365
8:15 PM - 10 Dec 2015|@amellywood You welcome jokes acting aside deserve Justice League Ninja Turtles sequel #Arrowverse|24|135
10:43 AM - 1 Dec 2015|The #NFL 'absolutely' targeting @RobGronkowski @jeffphowe says http cbsloc al 1O0CxEM|9|9
3:37 PM - 16 Nov 2015|Tough times don't last tough people #gopats|11K|18K
1:10 PM - 16 Nov 2015|Can't take photo today without dropping insane spoiler Might coolest day ever Oliver Queen|2.7K|9.3K
11:15 AM - 14 Nov 2015|When someone asks who's going win fight tonight #andSTILL pic twitter com ORPjs3YDiM|3.5K|7.7K
