4:10 PM - 4 Dec 2015|even star wars movie sucks it'll worth incredible @carrieffisher interviews http www hitfix com news carrie-fisher-just-scorched-good-morning-america-and-youre-not-worthy|393|859
9:12 AM - 5 Dec 2015|Would juniors want buy embroidered class sweatpants 25|5|0
10:00 AM - 29 Nov 2015|Teen Sick Of Mother Barging Into Room With Clean Folded Clothes http onion com 1TeS9sf pic twitter com yS9MPj3mGq|476|1.2K
6:54 AM - 26 Nov 2015|#ImThankfulFor every dog universe|17|22
5:51 PM - 17 Nov 2015|There's something Michael Bubl that's enchanting I dunno man|1|3
1:43 PM - 14 Nov 2015|I wonder going take hotdog prom year I can't wait hotdog prom year|175|453
