12:18 PM - 11 Dec 2015|Good morning Twitter pic twitter com 4YvsKwRYc1|132|405
1:22 PM - 10 Dec 2015|For great education incredible adventure come New Zealand Follow us find #StudyinNZ pic twitter com QWby4w7O3l|58|115
4:08 PM - 3 Dec 2015|@tylerperry 1 hr go I know excited u #TheWiz You got popcorn No Wiz Australia|298|1.2K
7:10 AM - 11 Dec 2015|Tragic O J Simpson News We're Heartbroken To Report That At 68 Years Old The Father Of 5 Has http bit ly 1TFozMx|14|4
8:57 PM - 6 Dec 2015|Rapper Pulls Out Fake Gun During Rap Battle Instantly Regrets It http bit ly 1lmzT5B pic twitter com 4lNNIWRvNe|31|9
2:32 AM - 11 Dec 2015|You've Been Pooping Wrong Your Entire Life http bit ly 1Q6pYOt pic twitter com H1hs8XxqrU|13|1
7:38 PM - 21 Nov 2015|Yes The Boob Gap Is A Thing Photo Gallery http bit ly 1Yn862U|92|27
8:35 AM - 11 Dec 2015|The Manliest Life Hacks http virraltrendz com link uef0tb2icc|18|1
8:59 AM - 11 Dec 2015|The words President Trump music ears https twitter com horseshort status 675358827366117376|4|7
2:36 AM - 11 Dec 2015|Goodness Gracious Did You See The Size Of Iggy Azalea's Compare That To Her Tiny Waist http bit ly 1TEKIup pic twitter com Qwtccxbygp|13|3
3:05 PM - 9 Dec 2015|Is Kim Kardashian About To Sue Kylie Jenner All Over These Photos Taken By Kylie http twenty4newws com link b5pngw32tq|92|49
1:25 AM - 11 Dec 2015|These People Have Major Regrets http pubvirral com link c9lxh7hkkj|20|4
8:53 AM - 7 Dec 2015|16 mind blowing sex records actually exist http bit ly 1RA7hSq pic twitter com n8OEbKonCU|23|10
8:00 AM - 11 Dec 2015|NICKI MINAJ NUDE PHOTOS LEAKED ALLEGEDLY BY EX Safaree Samuels see click http bit ly 1D9zWJo pic twitter com 2ziso2IQ1C|12|6
1:28 AM - 2 Dec 2015|Female Masturbation 5 Things You May Not Know http bit ly 1QaYWng pic twitter com iZaefMXyWV|166|132
8:00 AM - 11 Dec 2015|NICKI MINAJ NUDE PHOTOS LEAKED ALLEGEDLY BY EX Safaree Samuels see click http bit ly 1D9zWJo pic twitter com SbfYkcXTkj|31|6
3:06 AM - 11 Dec 2015|This Is The Craziest Game Show You've EVER Seen OMG http bit ly 21Udlda|18|11
1:11 AM - 11 Dec 2015|Oral sex isn fun also super healthy Here proof http bit ly 1IrAay6|16|2
8:29 AM - 29 Nov 2015|The 23-Year-Old Takes A Selfie In A Bikini Zoom In Closer And You Won Believe Your Eyes http bit ly 1MWMHoX|77|40
9:06 AM - 8 Dec 2015|Never forget one else|267|187
9:10 AM - 6 Dec 2015|What Your Girlfriend Thinks While You Go Down On Her http bit ly 1RxI9vD|78|43
6:46 AM - 11 Dec 2015|Donald Trump rich idiot looks like|130|120
4:44 AM - 10 Dec 2015|I've lived I've loved I've lost I've missed I've hurt I've trusted I've made mistakes I've learn|30|23
7:55 PM - 4 Dec 2015|@Harry_Styles next purchase pic twitter com 8NCzz5ynC9|20|6
7:32 AM - 11 Dec 2015|Don't tell us pilgrims look like pilgrims|5|1
11:36 AM - 10 Dec 2015|More glitter pic twitter com 8tWxkJvo3U|1.5K|5.5K
7:28 AM - 11 Dec 2015|@hgarbow @santiagos58 Ya think|2|2
12:50 PM - 8 Dec 2015|Extraordinary 'Smart Pill' Is Proven To Increase Focus And Concentration http megafocus co pLfJ7Q|36|9
12:36 AM - 10 Dec 2015|10 Of The Hottest Sexy Selfies Photos http bit ly 1lwzQnQ pic twitter com kYrBpJaI8t|17|32
7:11 AM - 11 Dec 2015|Here's Why Men Decide To Cheat Ladies pay attention signs http bit ly 1IZVBl1 pic twitter com OW7XC14BtW|13|3
11:52 PM - 10 Dec 2015|Thick Chicks In Sexy Dresses Photo Gallery http bit ly 1Ub3lXO pic twitter com MS8C78glHp|25|13
9:53 PM - 8 Dec 2015|Mental Health 2nd Amendment - No Excuse 4 #GunGrab #2A - American Thinker - http bit ly 1ErlP31 - pic twitter com kUr1U9fOex 16|23|7
6:36 AM - 8 Dec 2015|Other girls winter vs Me winter pic twitter com WoAtgLbO7m|2.5K|2K
6:44 AM - 11 Dec 2015|@ThePatriot143 @ministrorafael1 @WayneDupreeShow None #Hillary2016 #ImWithHer|1|0
12:21 PM - 10 Dec 2015|Who's better positioned beat Hillary #GeneralElections Results @WayneDupreeShow tonight 9pm EST|135|52
11:50 PM - 10 Dec 2015|RETWEET FOLLOW ALL WHO RT FOLLOWBACK GAIN WITH #MGWV FOLLOW @SweetNovember_T|142|20
8:01 AM - 10 Dec 2015|Innocent Words That Make Women HORNY http bit ly 1XZcMPJ pic twitter com t11udMOrJ2|45|16
4:38 AM - 11 Dec 2015|Perfect breasts without bra http bit ly 1IJbzoI pic twitter com AvMM0ikSsf|26|12
5:36 PM - 9 Dec 2015|After 19-Years Of Marriage He Discovers His Wife Was Transgender How He Reacts WOW http pubvirral com link 9emsyusjji|18|11
9:01 AM - 3 Dec 2015|They Told This Soldier's Dog To Turn Around Now Watch What Happens http bit ly 1QhqU0A pic twitter com 1YCWX6wUuj|57|48
7:13 AM - 10 Dec 2015|Dear Problems I BIG GOD|42|36
9:00 AM - 3 Dec 2015|Anonymous Declared War ISIS And Now ISIS Is Hitting Back http bit ly 1TA5Qma pic twitter com 7GypgjJ68a|97|57
10:18 PM - 28 Nov 2015|Guy Posts Snapchat Of Catching Cheating Girlfriend 10 Photos http bit ly 1XA49Wu http twitter com AmazingLovePost status 670844095800156161 photo 1pic twitter com R5G76jcKO5|43|12
8:01 AM - 10 Dec 2015|21 Rarely Seen Photos Kim Kardashian Before The Fame http bit ly 1XZf7Kq pic twitter com HzWvAr7Mq8|48|14
2:43 PM - 10 Dec 2015|Since Hamas endorsed Obama past would ISIS like America's next POTUS|10|4
1:48 PM - 10 Dec 2015|Citizens United poll Trump 38 Cruz 33 Rubio 10 http www breitbart com big-government 2015 12 10 exclusive-donald-trump-ted-cruz-dominate-citizens-united-poll #MakeDCListen #CruzCrew #Election2016 #PJNET #tcot #ccot #ycot|150|107
2:07 PM - 5 Dec 2015|Things learned sex sex Photo Gallery http bit ly 1jGhkYx pic twitter com TgDVdBpfU9|56|44
6:35 PM - 4 Dec 2015|Kaley Cuoco TOPLESS Photo Gallery http bit ly 1TINm37 pic twitter com RabpC8GdoG|46|21
11:39 AM - 10 Dec 2015|Don't judge book movie|138|175
7:14 AM - 9 Dec 2015|Trump About You https youtu 2_5b98GrlPE via @YouTube|9|7
8:07 PM - 5 Dec 2015|The 7 Grossest Things About Sharing A Bed With Someone See click http bit ly 1NbgRG4 pic twitter com i229tm7dFO|34|18
9:33 AM - 10 Dec 2015|Perfect breasts without bra Perfect breasts without bra see click http bit ly 1Qy3nJ0 pic twitter com TVASaiMHZ5|12|10
8:10 AM - 10 Dec 2015|Should You Spit Or Swallow After A Blowjob http bit ly 1Ne8aNz pic twitter com 4KlPecRt1m|21|10
6:08 PM - 3 Dec 2015|Shoppers Are FURIOUS Because Target Is Selling This Controversial Sweater http bit ly 1ldjv7B pic twitter com gsACtSlly8|92|59
1:33 AM - 3 Dec 2015|How Did Selena Gomez Fit Herself Into This Dress http bit ly 1YK4MyV pic twitter com h2VbGbOUHU|71|45
7:21 AM - 8 Dec 2015|Hot pancakes pic twitter com z2xP3S4ede|748|690
4:50 AM - 4 Dec 2015|Whoops IT'S A WINDY DAY http bit ly 1YN73JU|26|7
4:13 AM - 9 Dec 2015|This Is The Craziest Game Show You've EVER Seen OMG http bit ly 1mabUXF pic twitter com LuYtHSHgsN|51|57
4:12 PM - 23 Nov 2015|Brain-Enhancing 'Smart Pills' Used By Billionaires Are Leaving People Wanting More http megafocus co JyThDX pic twitter com 3z1yGXnJgA|14|7
5:36 PM - 9 Dec 2015|After 19-Years Of Marriage He Discovers His Wife Was Transgender How He Reacts WOW http pubvirral com link 9emsyusjji|13|7
6:24 AM - 10 Dec 2015|College Professor In Hot Water After Snapchatting Himself Banging A Student http celeberitypic mobi 4923731-15960022|21|8
4:10 PM - 9 Dec 2015|Wow - Holy SH T http bit ly 1Oj53lh pic twitter com IV8c2tmeS9|53|55
4:16 AM - 9 Dec 2015|Oral sex isn fun also super healthy Here proof http bit ly 1Qvq805 pic twitter com EVc46RCcx5|60|49
4:23 AM - 10 Dec 2015|Follow back whoever retweet|42|8
5:51 AM - 9 Dec 2015|Child Rapist Raped Stitched By Medics Re-Raped By 20 Prisoners http bit ly 1HJSwuq pic twitter com hLEe4EMJJW|6|2
9:34 AM - 1 Dec 2015|You'll Never Believe Carbon Footprint Obama's Paris Climate Change Speech http deneenborelli com p 9835 #tcot pic twitter com lxEuoT2MfI|116|72
3:31 AM - 1 Dec 2015|Halo Friend How|2|1
2:33 PM - 30 Nov 2015|Political Correctness slow death #FreeSpeech Are willing sacrifice rights #RebootLiberty pic twitter com 8Mdip32QOC|296|215
11:25 AM - 29 Nov 2015|Doctors Calling This Pill A Steroid For Your Brain Harness The Power http megafocus co pLfJ7Q pic twitter com SOU2Fkd4gN|23|21
1:00 AM - 30 Nov 2015|New 'Limitless Pill' Takes Internet Storm Harness The Power http megafocus co tnNVb6 pic twitter com YrnpzORfhV|10|21
2:53 AM - 30 Nov 2015|Thinking friend Olivia lovely family x pic twitter com L9FwwxyY2w|120K|190K
