1:03 PM - 8 Dec 2015|Cristiano Ronaldo scores third-fastest #UCL hat-trick ever He's behind Bafetimbi Gomis Mike Newell via @ESPNStatsInfo|115|28
2:19 PM - 30 Nov 2015|Been since I posted greatest sports photo ever Ali knocks Cleveland Williams Photo Neil Leifer pic twitter com LQaUmR7v75|182|286
3:14 PM - 28 Nov 2015|The worst champion ever And vile homophobic bigot boot Apart feel free celebrate|1.3K|733
1:51 PM - 20 Nov 2015|THE TRUCK IS HERE #holidaysarecoming https amp twimg com v af14dcaa-f4dd-41d5-9492-cc59adc71dbe|2.6K|2.7K
11:54 PM - 19 Nov 2015|Lambert You cant workplace mediocre acceptable I dont want you've got adrenalin football'|18|23
11:53 PM - 19 Nov 2015|Lambert I felt I first looked around acceptance mid-table team|15|14
8:18 AM - 17 Nov 2015|Bill Murray gift keeps giving #MurrayChristmas https amp twimg com v 2877b2c2-d1b8-4876-b122-0c57cd1fb54c|73|107
11:36 AM - 15 Nov 2015|Zebra loose Philadelphia http twitter com ddyer__ status 665974028767731712 video 1|1.4K|724
11:48 AM - 15 Nov 2015|HOURGLASS live Manchester Apollo x pic twitter com AnbPD2fSot|2K|2.9K
