2:30 AM - 11 Dec 2015|When help others respect Don't look Serve human beings compassionate intent|7.7K|9.3K
10:30 AM - 9 Dec 2015|Listen mug http etsy 1Ra99lO pic twitter com K56VJJkDhR|401|634
2:09 PM - 7 Dec 2015|The Four Elemelons https vine co v OKpJri1nbEX|3K|4K
11:25 AM - 6 Dec 2015|Start day right good strong cup Tchaikoffee #classical #music #humor pic twitter com RnYmTd9SWt|12|16
4:31 AM - 6 Dec 2015|Object blocking way Yells|282|683
7:43 AM - 6 Dec 2015|dont forget brush teeth good person today kiddos pic twitter com mhieqiEbkw|5.3K|19K
3:58 PM - 5 Dec 2015|All hymns start G sus chord #classical #music #humor https twitter com Cullison_Sam13 status 666034051627753472|4|7
3:33 PM - 5 Dec 2015|Overheard Apparently Flasher one reindeer police want neighbor's roof|184|481
3:49 PM - 5 Dec 2015|I spent way many class hours grade school wondering scratch paper scrap paper Too afraid ask|2|4
12:00 PM - 5 Dec 2015|What's comfortable reading position pic twitter com xGGmqM5Soq|341|641
1:07 PM - 4 Dec 2015|To yall bragging drinking driving This guy hit 2x legal limit pic twitter com AbBzDfS1Cq|41K|35K
8:29 AM - 2 Dec 2015|tears streaming face https vine co v eL31pjvW3pT|22K|36K
5:42 PM - 30 Nov 2015|I need #JessicaJones I need|44|151
9:25 AM - 27 Nov 2015|BLACK FRIDAY SPECIAL we'll trade concepts You'll give units shared idea call money lies I wrote|65|174
12:54 PM - 26 Nov 2015|Thankful Guy year pic twitter com oOwJbaYssB|3|14
1:30 PM - 26 Nov 2015|How long http etsy 1NglXTy pic twitter com c7t4rJyDIl|239|587
1:00 PM - 24 Nov 2015|Months ago Rupert Murdoch bought National Geographic fired writers This hit stands pic twitter com sr3Savvdli|1.5K|892
6:30 PM - 22 Nov 2015|@NicolleBarnett geologist cuddling faux conglomerate|1|2
8:29 AM - 22 Nov 2015|Have peaceful Sunday pic twitter com GXEM65cTnK|3.8K|9K
6:43 AM - 22 Nov 2015|One greatest heroes Robert F Kennedy born day 1925 pic twitter com K53LAWvy5d|1.6K|5.4K
11:03 AM - 21 Nov 2015|@JamieNoTweet lost found Cincinnati @AronoffCenter pic twitter com yH4rTDM65G|26|135
11:33 AM - 21 Nov 2015|Grand Nationals Finalist Feature #thatwestboundband #masonbands https www youtube com embed I_2J6h9ZfmU|9|10
9:21 PM - 14 Nov 2015|4th place #TheWestBoundBand #masonbands https instagram com p -F_HXXEz8G|22|50
6:12 PM - 14 Nov 2015|It's go time William Mason Marching Band ready give pride #TheWestBoundBand https instagram com p -FphknEz5p|3|9
2:46 PM - 14 Nov 2015|Mason going finals Stay tuned time #ThatWestBoundBand #masonbands #boa2015 https instagram com p -FR5v7Ez7_|5|15
10:35 AM - 14 Nov 2015|Three teams attackers involved assault Paris three arrests made Brussels - French prosecutor http bbc 1WXcuDi|783|574
10:25 AM - 14 Nov 2015|#ParisAttacks latest - 129 dead - 352 injured - 99 critical condition http bbc 1kwn0pn|4.1K|1.7K
10:37 AM - 14 Nov 2015|Shocked saddened terrorist attacks #Paris Standing #France @space_station Our thoughts w pic twitter com LLR7jK6gFe|12K|18K
8:09 AM - 14 Nov 2015|#ThatWestBoundBand fun facts 89 brass 44 percussion 116 woodwinds 71 color guard Marching 2016 @RoseParade pic twitter com S8C4d4XK4F|8|22
8:43 AM - 14 Nov 2015|This incident happened earlier year still relevant https twitter com lesleyabravanel status 665337466799398912|1|2
11:37 AM - 14 Nov 2015|Beautiful performance #ThatWestBoundBand #masonbands #boa2015 https twitter com jeffbweaver status 665597669730029568|1|3
7:46 PM - 13 Nov 2015|8 Paris attackers dead hunt continues possible accomplices - sources tell French media http bbc 1PGMOds pic twitter com U4pstmXN3Q|2.6K|1.7K
