5:47 PM - 11 Dec 2015|Person one here's idea Person two idea bullshit And that's basically philosophy|147|269
6:00 PM - 10 Dec 2015|Retweet 5pm Friday we'll give winner tickets Sunday night's show Details http orpheum-memphis com contest pic twitter com v0i3CE8Ef8|58|18
4:33 AM - 9 Dec 2015|Perhaps room kind romance beloved friends Mac Stewart spiritual friendship http spiritualfriendship org 2015 12 09 what-is-spiritual-friendship-a-basic-primer|3|6
2:19 PM - 7 Dec 2015|The way stop Donald Trump destroy Horcruxes The wig definitely one If need I'll finding six|8.9K|8.2K
3:59 AM - 8 Dec 2015|How horrible Voldemort nowhere near bad https twitter com BBCNewsbeat status 674170911344455680|220K|200K
8:31 AM - 8 Dec 2015|Socrates drinking hemlock dying literally better admitting idiots right single thing|259|377
10:05 AM - 5 Dec 2015|My coolest move today casually chatting I stopped believing Santa Breakfast Santa event teeming kids|1|10
7:31 PM - 4 Dec 2015|What seem safer man sitting chair Eli priest fell broke neck You may face problems setbacks|16|32
5:26 AM - 3 Dec 2015|Don focused want take granted slaughter plundering burning misery|15|21
8:51 AM - 2 Dec 2015|The best way spread Christmas cheer canceling exams rest year|16K|18K
9:42 PM - 30 Nov 2015|Thankful Ben Carson I've storing spiritual grain heavenly pyramids years phrase said dinner|1|5
6:52 PM - 30 Nov 2015|drop outta high school forget God pic twitter com Uns2Sm5Vzu|320|494
12:21 PM - 30 Nov 2015|Baby It's Cold Outside 2015 Version I really can't stay Good I need catch shows anyway|427|747
4:07 PM - 29 Nov 2015|I upset I thought @Noah1127 ignored tweet birthday It's still drafts|1|1
6:02 AM - 29 Nov 2015|In Advent wait something radically new God-Child new human second Adam new world new creation one|119|133
3:10 PM - 20 Nov 2015|eat burrito tortilla anything falls simply start building next burrito|2.2K|3.2K
6:02 AM - 28 Nov 2015|Officer Swasey disagree d abortion industry sacrificed trying save lives @PPact clinic That's pro-life|443|651
7:14 PM - 27 Nov 2015|The kids friends decorating Christmas tree Enjoying memories laughter Merry Christmas friends|1|1
11:21 AM - 27 Nov 2015|If want get warm must stand near fire If want joy peace eternal life must get close #CSLewis|2.7K|3.7K
5:30 AM - 27 Nov 2015|Happy 20th Birthday @Noah1127 So proud Noah Hope great day|1|1
11:45 AM - 25 Nov 2015|Whether rich reds vampy plums lip color great way disguise emptiness feel holiday season|1.5K|1.5K
6:47 PM - 26 Nov 2015|Just like pyramids thought Ben Carson stuffing turkey bread|82|215
10:45 AM - 25 Nov 2015|Africa 2015 Christians 517 million 63 Muslims 248 million 30 Africa 2050 Christians 1 1 billion Muslims 670 million|21|15
10:26 AM - 22 Nov 2015|Human culture extremely complex mixture brilliant truth marred half-truths overt resistance truth|342|561
8:46 AM - 22 Nov 2015|Got churro machine bday Between beignet mix I completely lost pleasure seductive power|281|549
10:13 AM - 21 Nov 2015|As college student re either struggling academically financially spiritually Or 3|4.1K|5.7K
12:53 PM - 19 Nov 2015|Before sin Satan assures us it's consequence sin persuades us it's unforgivable @FultonSheen|107|130
2:15 PM - 17 Nov 2015|know I never cry - girl tell story cried something stupid|8.5K|23K
4:41 PM - 17 Nov 2015|Pet peeve It's 2015 whenever rebuke ignorance implying past foolish finally human beings become wise|14|46
8:46 PM - 15 Nov 2015|The entire South puts Nativity play church Christmas Which Middle Eastern couple desperate shelter|7.8K|7.4K
9:55 AM - 16 Nov 2015|I tweet every day 169 000 Bosnian Muslim refugees came US 1990s radicalized warzone Not one terrorist|1.8K|1.5K
10:49 AM - 16 Nov 2015|Religion pure undefiled God Father care orphans widows distress James 1 27|146|213
10:46 AM - 16 Nov 2015|You shall also love stranger strangers land Egypt Deuteronomy 10 19|255|373
10:46 AM - 16 Nov 2015|Don't even think claiming policies influenced biblical values declare you're turning refugees away|440|657
8:05 AM - 16 Nov 2015|No one ever learned sinner told|474|928
8:00 PM - 15 Nov 2015|He gives beloved sleep Because hair fall head apart sin keep love|148|477
1:15 AM - 15 Nov 2015|I happy pray today Lutheran community Rome May God bless work dialogue Christian unity|5.9K|18K
