7:40 AM - 9 Dec 2015|I love Bill O'Brien Carl Nassib terrific player great story https twitter com MarkBermanFox26 status 674602875809488897|16|20
5:14 AM - 7 Dec 2015|We get Pittsburgh vape pic twitter com QxRZAwFkWz|83|172
1:25 PM - 6 Dec 2015|NFC East like buying milk Dollar Tree|9|6
11:03 AM - 6 Dec 2015|The Penn State women's soccer team 2015 College Cup champ|7|10
7:51 AM - 28 Nov 2015|Baby we're grinding I get excited Ooh I like I try I can't fight pic twitter com JwjUVu8HTa|14|16
3:52 PM - 26 Nov 2015|Kind ironic dance Cam Newton likely win Tony award Romo|65|223
9:33 AM - 26 Nov 2015|Let us gather watch game get emotionally worked wrecks relationships loved ones eat silence|4|8
7:19 PM - 24 Nov 2015|This perfection https twitter com tommylang1630 status 669327628516528128|41|38
3:59 PM - 19 Nov 2015|I saw @Ludacris Denver airport He wearing Jnco's|1|5
10:34 AM - 15 Nov 2015|I honestley think Ben Rothlisberger lazy feel pain Kind takes muscles frown smile type deal|140|380
