8:57 PM - 5 Dec 2015|still friends pic twitter com W0ZokvkDax|1.3K|1.7K
2:29 PM - 3 Dec 2015|I want thank Heavenly Father|6.1K|7.2K
4:44 PM - 3 Dec 2015|lot people might get shit funny pic twitter com 9pxFgtbojb|231|205
4:53 PM - 1 Dec 2015|yesterday vs today pic twitter com C6dhVekipp|2.8K|4.7K
8:47 AM - 28 Nov 2015|sure|1|3
2:22 PM - 25 Nov 2015|If ever say that's girl I guarantee heart melt little puddle happiness|1.1K|2.3K
9:15 PM - 24 Nov 2015|The Jonas Brothers used lit pic twitter com LtAncHXjpm|7.3K|13K
10:20 AM - 23 Nov 2015|HANNAH MONTANA'S ID EXPIRES TODAY pic twitter com dzuHinHA80|788|1K
8:41 PM - 21 Nov 2015|i'm happy camper nothin care|2.3K|5.1K
1:28 PM - 21 Nov 2015|NAT IS SO PRETTY WTF pic twitter com rC8VTlGfef|15|55
5:19 PM - 15 Nov 2015|Not taking anything away France doesn't anyone care places pic twitter com grQFzJb30I|14K|12K
7:50 PM - 15 Nov 2015|where's sky pic twitter com VDlDinAKBz|3|32
