8:20 AM - 6 Dec 2015|I NEED ONE pic twitter com hcYdwig9my|3.6K|3.8K
10:16 PM - 9 Dec 2015|Five Guys burgers fries pic twitter com kJNSwZgR27|3.1K|3.6K
4:44 PM - 10 Dec 2015|Chicken Tenders Fries pic twitter com PJ5N36hh2E|2.8K|3.4K
7:59 PM - 10 Dec 2015|BBQ Chicken pic twitter com nJcPDv8zHq|2.1K|2K
3:17 AM - 11 Dec 2015|Cinnamon Roll Cheesecake pic twitter com Dhwj1JTpKh|1.7K|2.7K
6:34 PM - 10 Dec 2015|Will I ever turn pizza pic twitter com 86RRsQkV1Q|1.5K|1.7K
7:06 PM - 10 Dec 2015|unfollow problems|1|2
10:35 AM - 4 Dec 2015|Don't pic twitter com F9dkzmMTus|396|472
1:05 PM - 8 Dec 2015|saves file closes program program ARE YOU SURE YOU WANT TO CLOSE WITHOUT SAVING nervously saves|519|687
