3:59 AM - 8 Dec 2015|How horrible Voldemort nowhere near bad https twitter com BBCNewsbeat status 674170911344455680|220K|200K
7:14 PM - 6 Dec 2015|You may know episode Sex City I played bowl cream cheese|1|3
8:35 AM - 3 Dec 2015|@Pb__andJ we're even eating food pic twitter com 2J741gQ6sO|1|2
4:55 PM - 1 Dec 2015|You thought puberty good wait see second puberty|14K|39K
9:43 PM - 19 Nov 2015|I think we're cute pic twitter com 3xkVia6kAu|1|3
9:19 PM - 15 Nov 2015|My friend breaking Spongebob core pic twitter com 6iOb1TOAbJ|3.7K|6.4K
