1:54 PM - 11 Dec 2015|I'm 39 said Is thing Over Bed Bath Beyond PA system|2|36
4:21 PM - 9 Dec 2015|In LA cable Come watch Nathan For You finale live Vista Theater FREE admission full Thurs Dec 10 10pm doors 9 30|123|853
7:15 AM - 9 Dec 2015|Alvin And The Chipmunks The Road Chip reads Hell World Urethra Demon Or maybe I need glasses|12|63
12:22 PM - 7 Dec 2015|If wasn't office building lobbies I'd never know Hanukah|4|21
10:30 AM - 6 Dec 2015|I know replies filled Jonny Mosely references holy shit snowing outside window San Francisco|17|108
10:16 AM - 5 Dec 2015|The original Final Fantasy VII today PS4|1.8K|2.4K
7:44 PM - 3 Dec 2015|I asked god miracle He gave vine Larry David WWE character https vine co v iaxnxjXWE9h|1.5K|2.3K
3:10 PM - 3 Dec 2015|The Game Awards hours away know means It's time bets https www youtube com watch v iT6y9tslTK8 feature youtu pic twitter com hk41CqTMxh|61|138
2:32 PM - 2 Dec 2015|doesn't way join movement help us #endgunviolence - http wecanendgunviolence org|2.7K|4.7K
3:55 PM - 1 Dec 2015|From CLT IT sky limit @Zappos Here Eric realized transferring almost 2 years ago #Growth pic twitter com 0JTqtOroJ7|3|11
9:37 AM - 1 Dec 2015|Growing talents within Read Joy say internal transferring @Zappos #Opportunities pic twitter com HoPo94Eh8r|2|8
5:02 PM - 30 Nov 2015|The Pfeffermans Transparent Season 2 Ep 1 available NOW @AmazonVideo http amzn 1IwWYY5 pic twitter com fXU24NWe9I|33|53
5:00 PM - 27 Nov 2015|White people can't terrorists But get sunburned easily Everything evens|574|1.6K
4:30 PM - 16 Nov 2015|High school prepares kids real life work day ends 3PM summer vacation 2 months long calculators illegal|172|346
