7:45 PM - 11 Dec 2015|Spoilers #BATMAN #47 This Just Happened wow can't believe redacted http bit ly 1J0lrp5 pic twitter com MZ1wHHSfya|104|326
2:10 PM - 11 Dec 2015|6 Popular Movie Characters Who Should Be Dead According To Science http goo gl L83Ev4|4|10
8:08 AM - 10 Dec 2015|Can someone take cute date please pic twitter com v9G8soWJEy|4.5K|6.5K
12:36 PM - 11 Dec 2015|In relationship love art Appreciate Enjoy learn|3|5
12:00 PM - 11 Dec 2015|Top 10 Most Controversial Twitter Posts 2013 http bit ly 1GhyEuB pic twitter com 39l1b3h8Wi|129|3
12:45 PM - 11 Dec 2015|Only 90s kids know http vine co v Mj7wYdzppeI|5|14
1:31 PM - 8 Dec 2015|Ted Kids cling past matter tightly hold already gone|1.8K|2.7K
7:54 AM - 11 Dec 2015|Three Jamaican boys posing photo 1974 pic twitter com 7SgWyMeAz2|113|144
10:45 AM - 11 Dec 2015|Trying get bed like pic twitter com VdncOz7m3v|3.4K|3.7K
10:47 AM - 11 Dec 2015|RT @hitRECord Illustrators Writers - check new #ComicCollective challenge http bit ly 1Z2nqSW pic twitter com aEmrCGVLsi|39|152
10:50 AM - 11 Dec 2015|The best 10 Fictional Firearms Video Game titles http goo gl bhRXTc pic twitter com paiykUOmwo|2|1
4:52 PM - 8 Dec 2015|Give try Help end bullying #IAmAWitness pic twitter com BKg9MOjiaU|1K|1.9K
1:20 PM - 10 Dec 2015|Elegance Is Bliss pic twitter com Oe4mE2dkIg|13|46
6:37 PM - 10 Dec 2015|Wasn't ready millionaire I ill-prepared I prepared ill though skill - Survival|9|8
8:22 PM - 10 Dec 2015|yearly CN holiday card patients @ChildrensLA pic twitter com YWLW0LOY6B|37|198
8:21 PM - 10 Dec 2015|#Animation Animated Shinya Ohira absolutely gorgeous pic twitter com rsYBz4EFtv|2|3
9:36 AM - 10 Dec 2015|Anyone else ever felt like pic twitter com fWF6B248zn|1|1
9:41 AM - 10 Dec 2015|Digging holes best thing EVER -One happy puppy pic twitter com tP5HZVpCX1|119|458
10:09 PM - 9 Dec 2015|Beautiful #animation https twitter com openculture status 674800844018184192|2|2
9:25 PM - 9 Dec 2015|Just waiting crush call back pic twitter com bo3NXQmAEg|308|783
8:13 PM - 9 Dec 2015|fuck cant best friend lives 30 seconds away always comes stay others houses|1|1
8:05 PM - 9 Dec 2015|talking guy parents like hey big fan work|281|760
7:26 PM - 9 Dec 2015|Can't wait show guys holiday video I shot year Jason Yasmeen - finished today it's beautiful|91|265
7:27 PM - 9 Dec 2015|Adorable little kitten pic twitter com T53OScoULk|77|99
7:27 PM - 9 Dec 2015|Bunny tongues cute pic twitter com 7B49RcdgCD|364|711
7:27 PM - 9 Dec 2015|Neck Kisses Cuddling pic twitter com OmrGGMmFXm|284|927
7:19 PM - 9 Dec 2015|much cuteness pic twitter com RUn3sVLHxx|389|771
11:39 AM - 20 Nov 2015|Meet Diesel Zazu look like high asses lmaoo 10 10 would chill pic twitter com 0KMxWbIEb3|1.3K|2.2K
5:44 PM - 9 Dec 2015|NSFW-ish Alphonse mucha inpired @egoraptor I drew many moons ago forgot upload twitter pic twitter com boygyzU7qG|277|1.6K
6:52 PM - 9 Dec 2015|Basically I'm handling life right pic twitter com mbqjWH3f5Y|1|1
6:53 PM - 9 Dec 2015|Motivation pic twitter com 4JXGzq0hlZ|1|1
6:57 PM - 9 Dec 2015|Someone finally said pic twitter com mb9sfnXMad|1|1
