9:31 PM - 28 Nov 2015|Everyone reading tweet pass finals raise GPA I'm blessing holy water speaking existence|9.6K|7.2K
4:37 PM - 15 Nov 2015|you'll bodyguard long lost pal that's fair trade hear gets weirder|3.5K|5.9K
6:23 PM - 28 Nov 2015|it's i'm BAD reading maps i'm mapathetic|8|30
9:27 AM - 28 Nov 2015|Gosh Droban exclaimed Josh Groban @rhettandlink #GMM|50|362
5:40 PM - 25 Nov 2015|3 4 left|1|0
2:50 AM - 25 Nov 2015|hash tag take system|17|157
9:06 AM - 19 Nov 2015|You found X 10k RTs unlocks glimpse truth @thexfiles #FindTheX pic twitter com nj9NQ4fTnd|10K|2.5K
6:17 AM - 19 Nov 2015|If turn backs refugees destroying country supposed https amp twimg com v 637de7c1-7cf1-4782-b9ec-093273a18b6b|2.9K|4.6K
11:09 AM - 15 Nov 2015|I'm artist thought drawing phone case pretty cute pic twitter com NHznSbhPxn|3|14
