8:11 AM - 7 Dec 2015|Be one WITH us http goo gl U25gGW launched best network world changers #WUVIP pic twitter com 5yH1aWixBv|4|17
8:15 AM - 7 Dec 2015|The Wellness Universe Flow Chart What means #WUVIP Join us http ow ly Viz9l pic twitter com p5FibuG9wt|4|11
8:20 AM - 7 Dec 2015|Be one us - Join growing #network #worldchangers http thewellnessuniverse com #WUVIP pic twitter com 95qGYmIGqq|2|9
8:30 AM - 7 Dec 2015|Join different kind tribe - A #network people unifying #worldchangers http thewellnessuniverse com #WUVIP pic twitter com Se8h3ompJu|2|7
10:15 AM - 6 Dec 2015|All us goodness make difference We Please join helping really good person http gofundme com Don_Martini|2|5
3:44 AM - 6 Dec 2015|Listen short interview Steffi Black self-help guru Catherine B Roy It rocks http bit ly 1SD4SVE pic twitter com lWe4EjmH4n|30|16
10:15 AM - 3 Dec 2015|All us goodness make difference Please join helping really good person http gofundme com Don_Martini #WUVIP|6|6
10:00 AM - 2 Dec 2015|Emotional Connection @HeatherCLang @TheWellnessUniv @boxyourwayfit #WUVIP #LHM Read http bit ly 1PMdv0j pic twitter com QLluvkieUF|6|7
5:39 PM - 24 Nov 2015|Your favorite movie company MOVING MASTERS NYC http fb 1PXSGiG wishes everyone HAPPY WONDERFUL THANKSGIVING|3|3
11:30 AM - 29 Nov 2015|rt @guidetosoul Always face light #hope #faithhopelove #angels #grace #healing #WUVIP #LHM pic twitter com PM1w28Ci7Y|2|5
12:51 AM - 20 Nov 2015|BIG THANKS visitors new #website https www catherinebroy com Be happy successful time #lhm pic twitter com 07JkPpSWBi|35|35
11:29 AM - 24 Nov 2015|Steel Masters NYC provides best iron steel fabrication repair service You deserve best yes Get http www steelmastersnyc com less|3|3
6:11 AM - 18 Nov 2015|Dear authors check #Fiverr It's awesome Here http bit ly 1WXJdgZ @PeterDavidsonAU @deangloster @blueinkdragon @mhightower87|1|2
