7:44 PM - 9 Dec 2015|Who president RT Temmie Fav Donald Trump pic twitter com nelemCKiBr|1.3K|77
12:36 PM - 11 Dec 2015|It's S'winter Florida pic twitter com cHBdv0tatr|819|837
11:57 AM - 9 Dec 2015|smol also mental emotional state come discover|1|0
11:47 AM - 9 Dec 2015|This partridge looks like know http www buzzfeed com elainawahl this-is-what-a-partridge-looks-like-just-so-you-know bftwuk utm_term 4ldqpgm#4ldqpgm pic twitter com tHV74zwZGH|395|779
3:03 AM - 9 Dec 2015|GSA meeting Thursday It awesome It awesome|1|0
1:16 AM - 9 Dec 2015|corn chips get shape famous triangle|557|1.4K
12:50 AM - 9 Dec 2015|live laugh love motor cycle|300|514
8:35 PM - 8 Dec 2015|Frisk Sans Thanks @hndsomejack https vine co v i7dgPTFq2FA|45|47
6:58 PM - 8 Dec 2015|School like happy holidays Our present exams projects stress Here go|1|0
6:46 PM - 8 Dec 2015|23 things one tells ADHD #MHW2015 http bzfd 1R8nWxm|122|283
5:50 PM - 8 Dec 2015|yay school making want cry I love education america teaches us hate learning care grades|1|0
2:49 AM - 8 Dec 2015|Shout-Out To The Real Hero Of Hanukkah http www buzzfeed com lyapalater shout-out-to-the-real-hero-of-hannukah bftw utm_term 4ldqpfp#4ldqpfp pic twitter com wOMEdTJ92W|44|144
4:31 PM - 7 Dec 2015|To celebrating Happy Hanukkah Hope it's started well great holiday family|200|876
5:41 AM - 7 Dec 2015|It's time year awkwardly explain Hannukah people|1|0
4:57 PM - 6 Dec 2015|try nail polish toesies accident apply bottom coral #506|1.5K|3.1K
5:15 PM - 6 Dec 2015|Happy Hanukkah|4.1K|8.9K
12:37 PM - 6 Dec 2015|LOOK cutie omg pic twitter com rWJvPnhdPq|1|2
11:45 AM - 6 Dec 2015|snapchat story meant someone never watched|1.3K|3.5K
5:56 PM - 5 Dec 2015|This Frankie He's wearing blush 11 10 really accents cheek bones pic twitter com iJABMhVidf|6.6K|9.5K
4:45 PM - 30 Nov 2015|RT dressed avocado like sam pepper pic twitter com Gu7S6iaDGu|4.5K|215
5:38 PM - 4 Dec 2015|I think Internet going kill pic twitter com o7uk7A1zGL|205|1.9K
10:46 AM - 4 Dec 2015|thing I'm good awkward|2.2K|2.5K
2:09 PM - 3 Dec 2015|making important life decisions based result buzzfeed quiz|2K|3.5K
11:56 AM - 2 Dec 2015|Kellogs protections squad pic twitter com eu6apk1vT5|1|2
8:00 PM - 1 Dec 2015|Disheartened Man Expected At Least One Text While Checking Phone After Flight http onion com 1N2AL62 pic twitter com IGPsn8C5mD|1.2K|2.6K
5:18 PM - 1 Dec 2015|taking looooooong nap|1.4K|1.6K
6:48 PM - 30 Nov 2015|even dog disappointed|1.7K|2.6K
6:38 PM - 30 Nov 2015|Nothing like good ole' heartwarming Disney pic twitter com WT43u4m6nH|553|1.6K
9:25 AM - 30 Nov 2015|u watching buzzfeed videos 6 hours straight|1.8K|3.6K
6:00 AM - 30 Nov 2015|comes jewels gems amulets moonstones golden coins riches would like please|838|1.2K
5:54 AM - 30 Nov 2015|I promise let fame get head pic twitter com 1CMHl22VvJ|2|8
1:06 PM - 29 Nov 2015|Wow undertale 2 looking really good pic twitter com iwNOykN4MZ|19|18
7:06 PM - 28 Nov 2015|Small bizness satday I best small SMALL BIRDNESS SATBIRDAY ALL NEW PRODUCT IN THE BIRD STORE FEEL THE BERD http probirdrights com|441|1.2K
4:46 PM - 28 Nov 2015|stress eating way semester|1.6K|2.4K
4:04 PM - 28 Nov 2015|pursuing lifelong dream meme|1.9K|2.6K
6:49 AM - 27 Nov 2015|Y'all hyped Christmas I'm laughing Chanukah like next week|11|10
11:54 AM - 27 Nov 2015|If open fire Planned Parenthood defend mouth better form words pro-life #PlannedParenthoodShooting|2.5K|2.4K
12:19 PM - 19 Nov 2015|Retweet you're gay disaster|1.6K|1.2K
9:57 PM - 25 Nov 2015|Person boy girl Papyrus I'm skeleton Person yea what's pants Papyrus spaghetti|8|15
10:16 PM - 25 Nov 2015|john ralphio voice pic twitter com A43MoJ0rXC|71|157
12:46 PM - 25 Nov 2015|fire nation attacking life|2K|2.5K
5:35 PM - 24 Nov 2015|im gay|1|0
6:40 PM - 23 Nov 2015|turn page around there's questions|1.6K|3K
5:13 PM - 23 Nov 2015|queermemedream shut hell mouth|1|0
5:10 PM - 23 Nov 2015|Fun tip Despite popular opinion clothing use adorn bodies actually dictated gender|1.1K|1.9K
12:16 PM - 23 Nov 2015|Michael Cera's mustache|1.1K|1.4K
1:55 PM - 21 Nov 2015|baby da - da - da dad daddy baby ew im kink fucking sinner|2.6K|2.9K
7:03 PM - 21 Nov 2015|Here's little magic hopefully bring guys clear skin Boop|586|1.6K
9:44 AM - 21 Nov 2015|netflix none creepy shit https twitter com Netflix_CA status 667862725104676865|345|1.2K
7:07 AM - 21 Nov 2015|ant-man ants mans peanuts movies times changed|632|1.2K
4:08 PM - 19 Nov 2015|try pic twitter com ZmwJ6jxQRK|1|3
10:36 AM - 19 Nov 2015|run banana mario kart|4.4K|5.3K
9:35 PM - 17 Nov 2015|imagine papyrus thinking BDSM stands best damn spaghetti meatballs|7|12
5:58 PM - 15 Nov 2015|Aesthetic bath pt 2 pic twitter com EuvAFNoE0J|1|0
5:22 PM - 15 Nov 2015|cat better life mine|1.9K|2.7K
6:45 AM - 15 Nov 2015|thanks poorly thought plural pop one piece popcorn still claim 'made popcorn' use info create drama|1.4K|2.2K
1:40 PM - 14 Nov 2015|wheeeew gay|1|0
9:47 AM - 14 Nov 2015|Hey guys gals non-binary pals I love I love much You valid important wonderful|777|2.1K
