3:18 PM - 10 Dec 2015|Dead pic twitter com ZwkLGtNcLF|237|737
2:44 PM - 10 Dec 2015|Leonard @_fournette ready awards show The red carpet show 6 pm CT ESPNU Awards show 7 pm ESPN pic twitter com mk4pBEmz5I|111|364
8:07 PM - 9 Dec 2015|justin bieber's even attractive pic twitter com wDr2KSwI4S|3.4K|7.5K
9:53 AM - 10 Dec 2015|Goddamn hell yes @azizansari @amyschumer Golden people get golden globes And big ups comedians behind The Martian|155|992
11:45 AM - 10 Dec 2015|True love pet comes room|1.9K|2.7K
7:08 AM - 10 Dec 2015|EVERYBODY LOOK ITS A PIG IN A BLANKET pic twitter com evxCQu5dhK|535|1K
10:11 AM - 10 Dec 2015|Very excited Silicon Valley got nominated Best Comedy @goldenglobes I think almost nominees great|84|1.1K
12:06 PM - 7 Dec 2015|Sad Kim Kanye didn't go baby name suggestion Smitty Werbenjagermanjensen-West|1.2K|2.8K
7:31 PM - 9 Dec 2015|gift guide women buy candle single red ribbon gift guide men BUY HIM A BOULDER OR A FOOTBALL THATS ALSO A GUN|722|2K
2:00 PM - 9 Dec 2015|@lsu I'm asking take away plus minus grading system I'm Just asking take away minus part Thanks|4|16
6:02 AM - 9 Dec 2015|looks first question exam looks camera like Jim The Office|17K|21K
4:45 PM - 9 Dec 2015|I'm Feliz Navidone semester|3.1K|2.8K
8:48 AM - 8 Dec 2015|still really bitter aren't grandfathered old grading scale @lsu|3|5
4:20 PM - 7 Dec 2015|From one saint another Welcome world Saint West #OITNB pic twitter com uCsK2JcxOF|407|891
6:10 PM - 7 Dec 2015|Mr Trump magician For next trick I alienate one billion people|506|1.1K
7:44 PM - 7 Dec 2015|please round grade A teacher 55 class pic twitter com 3IxUSApwPy|18K|29K
1:45 PM - 6 Dec 2015|know absolutely need study mentally can't|2.4K|2.6K
2:12 PM - 2 Dec 2015|MUST RT EVERY DECEMBER pic twitter com McEtiJl5OG|477|347
6:31 PM - 2 Dec 2015|I miss days kids young I could tell invisible Christmas tree|228|1.1K
5:11 AM - 5 Dec 2015|I didn't choose Harry Potter life Harry Potter life broke door told I wizard|2.3K|3.9K
10:44 AM - 5 Dec 2015|first wanna go left wanna turn right pic twitter com YmaOKhWfTM|3.9K|8.3K
11:29 AM - 20 Nov 2015|If one else going say I Avatar sucked|10|23
11:54 AM - 5 Dec 2015|cause i'm missin' body pic twitter com IRnu2i5Ssj|7.7K|13K
12:22 PM - 5 Dec 2015|Gluten free pizza like roller coaster goes straight|376|782
1:01 PM - 5 Dec 2015|Feeling like Looking like It's last open bar year 8-10 Come drown sorrows pic twitter com FztXqdMfm4|2|9
10:29 PM - 30 Nov 2015|mom dresses versus dress pic twitter com yJs0RAu0MM|12K|27K
5:11 PM - 1 Dec 2015|I believe today Christmas 1st|2.1K|3K
5:21 PM - 1 Dec 2015|TIRED media damn LIES pic twitter com XAM8HMs1S4|5.4K|18K
2:39 PM - 30 Nov 2015|Speaking someone would never succeeded hadn't first failed grand scale I enjoyed pic twitter com 4AMhiZLM7z|11K|18K
12:05 PM - 22 Nov 2015|We go little crazy it's four days till Thanksgiving right http bit ly 1QCk4nW #SNL https vine co v iz7qQO5DQqE|101|240
7:35 PM - 22 Nov 2015|direct deposit hits account #AMAs pic twitter com uYzZMo72G7|443|784
11:01 AM - 16 Nov 2015|Hi sorry - getting literally every uber|6.3K|11K
9:18 PM - 22 Nov 2015|I move rebrand mid-night since clearly still right|252|544
2:37 AM - 16 Nov 2015|27 reasons Paris capital world http bzfd 20TEA7g pic twitter com gHG3AVkket|144|525
3:45 AM - 16 Nov 2015|teacher describe one word done|5.1K|5.4K
