12:56 PM - 6 Dec 2015|The Panthers finished warming heading locker room They'll probably hear they're champs|17|51
4:33 PM - 26 Nov 2015|Disgusting watch Cam Newton celebrate successes If classy would've like Cowboys chose successes|1.8K|2.2K
6:04 PM - 26 Nov 2015|TEAM|219|1K
4:45 PM - 26 Nov 2015|The Panthers undefeated playing Thanksgiving Day|110|190
3:59 PM - 26 Nov 2015|PSA Cam twist hit dem folks Superman'd There dabbing involved|102|139
2:00 PM - 26 Nov 2015|How catch And fumble|50|71
3:22 PM - 23 Nov 2015|Cam Newton putting dab contest annual Thanksgiving Jam feeding 900 CLT kids pic twitter com VQDgpZD29I|734|527
1:22 PM - 22 Nov 2015|Ya boy back week 10-0|849|1.7K
9:59 AM - 22 Nov 2015|Cardiac Cats let's gooooo @Panthers #Undefeated|19|46
4:54 PM - 21 Nov 2015|@Redskins Good luck getting trademark|4.8K|6.7K
12:36 PM - 21 Nov 2015|WE WANT BAMA|87|147
4:35 AM - 17 Nov 2015|There's doubt mind J J Watt call Andy Dalton apologize Even less doubt camera crew present|64|107
12:49 PM - 15 Nov 2015|Cam Newton Troll Level Master Class|139|135
12:58 PM - 15 Nov 2015|Cam Newton Did Very Elaborate TD Celebration Titans Defenders Were Not Happy About It This embed http bit ly 1QFd3ln|44|30
1:52 PM - 15 Nov 2015|If don't like Cam Newton celebrates don't let score #CAMVP pic twitter com vKfYIrnef0|1.8K|1.6K
1:06 PM - 14 Nov 2015|who's favorite nick saban QB starting nfl|70|135
8:43 AM - 14 Nov 2015|Bo Jackson taking moment talk Nick Chubb #Respect #UGAvsAUB pic twitter com RNAwiU0Lw7|263|424
