7:40 PM - 10 Dec 2015|The greatest blooper TV history pic twitter com SKFHGo8JON|1.1K|2K
6:07 PM - 10 Dec 2015|Another way fun bubblewrap pic twitter com 8sK4pyw3J8|254|400
7:30 PM - 5 Dec 2015|Finding house Google Earth|840|2.4K
8:03 PM - 5 Dec 2015|LET THE DUCK SWIM http vine co v ej5HQjXlMzA|3.7K|7.3K
7:38 PM - 4 Dec 2015|girls drop best friends boyfriends wyd|1.2K|2.1K
6:37 PM - 4 Dec 2015|calls dude babe sentence|3.1K|6.3K
7:30 PM - 2 Dec 2015|Let's play fun little game called let's see many times I watch Elf Christmas|764|1.3K
4:40 PM - 2 Dec 2015|People give want pic twitter com ZV2z1zvrse|792|1.4K
5:30 AM - 2 Dec 2015|When got band performance 8 got kill people 9 pic twitter com Biux3brxbj|2.3K|4.6K
8:10 PM - 1 Dec 2015|someone physically attractive boring hell pic twitter com TI4NzZ2b1x|698|1.8K
10:00 PM - 30 Nov 2015|THERE IS ACTUALLY NOT A BETTER FEELING THEN TO HAVE A BESTFRIEND WHO ALSO THINKS OF U AS THEIR BESTFRIEND|509|1.3K
5:58 AM - 25 Nov 2015|Alas firstly allow taketh self portrait|289|493
8:08 PM - 23 Nov 2015|I want someone look way Joe Biden looks Obama pic twitter com aUN6U9en7L|12K|17K
5:32 PM - 22 Nov 2015|When someone brags something pic twitter com DqRPUDBAGv|1.8K|3.3K
7:31 AM - 20 Nov 2015|thats lot cream cheese bagel yea well thats lot asshole personality|582|1.4K
7:30 AM - 17 Nov 2015|Taking time leave mean Yelp review|486|1.3K
1:41 PM - 16 Nov 2015|Pokemon real pic twitter com Ux8bKxuyF5|1.6K|2.4K
7:47 PM - 15 Nov 2015|girl bitchy doesnt mean period maybe doesnt fucking like re annoying little shit|616|1.4K
10:52 AM - 14 Nov 2015|Being adults still watching children's Disney movies|504|1.2K
8:52 PM - 13 Nov 2015|SAY IT LOUDER FOR THE PEOPLE IN THE BACK pic twitter com 4fLbSaS0Lk|3K|3.2K
7:30 PM - 13 Nov 2015|Saying literally context|772|1.7K
