11:28 AM - 26 Nov 2015|glasses upside lol pic twitter com otWLgeftlm|152|236
6:05 PM - 8 Dec 2015|kenny genius pic twitter com u7hkK4g9H9|3.8K|10K
11:55 AM - 6 Dec 2015|NAILED IT pic twitter com LrPSxF08t4|5.3K|9.8K
12:03 PM - 6 Dec 2015|I prefer loneliness fake company|488|353
6:08 AM - 5 Dec 2015|girl fed lmao pic twitter com Pnbiyaqxky|929|1.2K
1:31 PM - 6 Dec 2015|Hey characters independent films try shave shower|642|2.8K
8:37 AM - 6 Dec 2015|The midnight singer became midnight Skype caller|1|3
