10:11 AM - 1 Dec 2015|When mates discussing answers exam realise badly fucked pic twitter com zTaflRSQhN|2.3K|2.1K
5:10 PM - 24 Nov 2015|talk soon https instagram com p -fSPcYj6cY pic twitter com 4rgRV5ZwYV|756|3.4K
9:06 AM - 9 Dec 2015|Literally can't wait Star Wars RT @pwincessjai Too cute handle @ArjunArtist pic twitter com sJpcS1XuB3|31|89
11:39 PM - 10 Dec 2015|um thanks pic twitter com pE7F5nM6ea|26|267
6:04 AM - 11 Dec 2015|Dreams come true New job Lol https youtu CU-_Y8NL4-s|36K|51K
6:15 PM - 10 Dec 2015|Got new job Thanks @JKCorden|30K|53K
8:07 AM - 11 Dec 2015|Europe Pre-sale #PurposeWorldTour available http fahlo justinbieber See u soon pic twitter com 482JHkyIPM|29K|43K
1:26 PM - 11 Dec 2015|How Nasa organize party They planet|199|238
5:22 AM - 11 Dec 2015|Current mood pic twitter com BSkRMGDyyf|3.2K|2.3K
12:22 PM - 11 Dec 2015|WHO DID THIS pic twitter com L0f1hriL5U|2.4K|3.2K
5:11 AM - 4 Dec 2015|Story life pic twitter com OK7VPhkFtE|4.4K|4.2K
6:22 AM - 3 Dec 2015|How semester going pic twitter com PpHYwG2BBH|3K|3.4K
5:01 PM - 4 Dec 2015|CAN'T WAIT TO WATCH THESE MOVIES NEXT YEAR http factsofschool com movies-of-2016 pic twitter com Ea0ZRfjFRF|505|581
9:34 PM - 7 Dec 2015|SO TRUE WTF pic twitter com 2PW5Y7dodc|1.3K|1.6K
2:16 PM - 11 Dec 2015|amazing pic twitter com RPS7SXdp9i|744|1.9K
9:00 AM - 11 Dec 2015|Spending large amount time someone literally causes pick habits Choose friends wisely|67|132
7:00 PM - 8 Dec 2015|Well said pic twitter com ggDwA9LhiD|2.7K|4.2K
6:28 AM - 10 Dec 2015|Let tell thing called Christmas pic twitter com gN0Oo2zjn5|1.5K|3.6K
11:57 AM - 22 Nov 2015|A Physicist Biologist relationship But Chemistry|2.5K|2.4K
6:05 PM - 8 Dec 2015|My friend David lost ID Now he's Dav|407|443
10:05 AM - 9 Dec 2015|Kanye West opening breakfast restaurant called Omelette Finish|134|229
3:10 PM - 30 Nov 2015|Best excuse ever pic twitter com fip6WKiWap|4K|5.1K
5:10 AM - 30 Nov 2015|Looks like someone explaining pic twitter com Ul1O3OzKAA|2.9K|3.7K
1:10 AM - 29 Nov 2015|This funny reason pic twitter com JDyEs2D674|3.3K|4.1K
1:10 PM - 28 Nov 2015|It's point semester pic twitter com K3ygOCITWv|3.3K|3.1K
10:39 AM - 10 Dec 2015|Louboutins redefining nude pump pic twitter com Yl5l4BABTN|780|3.6K
6:17 AM - 9 Dec 2015|The best feelings world pic twitter com zTLRhtEdoS|2.7K|3.4K
8:20 AM - 6 Dec 2015|I NEED ONE pic twitter com hcYdwig9my|4.1K|4.2K
7:14 PM - 9 Dec 2015|Found little gem today pic twitter com iV8HOClFQk|817|2.3K
10:37 AM - 10 Dec 2015|mood need 10 million dollars cash|288|227
