8:21 PM - 7 Dec 2015|Wayne Carey getting sorts injections sort need going South African jungle Just saying|8|13
3:55 PM - 11 Dec 2015|Newtown Couple Who Call Tofu Tofizzle Buys 9 50 Green Smoothie For Dog Highlights Everything Wrong With Sydney pic twitter com vXGFhPMItu|20|24
2:18 PM - 11 Dec 2015|Gerard Baden-Clay deserves full force law sentencing http couriermail com au link be5aabc36dca07139f37829f25c735af domain couriermail com au|5|6
11:15 PM - 10 Dec 2015|Insightful analysis Chris Graham's shameful misuse young writer New Matilda http www wheelercentre com notes it-s-not-easy-being-green|16|17
7:00 PM - 10 Dec 2015|This bigger problem country ISIS ever pic twitter com JYfU8oi25M|3.9K|3.2K
1:01 PM - 10 Dec 2015|Heart Officially Broken http www news com au lifestyle parenting kids the-heartbreaking-and-selfless-wish-list-for-santa-from-a-young-girl news-story 681efff25b678de92b4418c7df0edd24 pic twitter com UA3TaGtTPf|6|1
12:47 PM - 10 Dec 2015|Are New Year's resolutions place One submit first-ever writing contest http hellomrmag com short-long|1|6
3:08 AM - 10 Dec 2015|The truth whether pets really watch TV https www facebook com dcbpets posts 1530789450575670 0 pic twitter com S4Jxlwcp3D|17|80
3:51 PM - 9 Dec 2015|I'm pretty sure Uber describing bus route https newsroom uber com seattle 2015 12 more-people-in-fewer-cars pic twitter com Ow8CNrNoY9|698|610
1:57 AM - 10 Dec 2015|Bill Shorten's people tomorrow rn pic twitter com 20jdhbWArf|2|6
1:48 AM - 10 Dec 2015|This may interest @vanOnselenP http www gaystarnews com article top-australian-catholic-thinker-gay-marriage-is-inevitable-and-a-popular-vote-is-a-waste-of-time|1|2
1:33 AM - 10 Dec 2015|Gratitude Fake http m smh com au lifestyle life how-faking-gratitude-can-make-you-genuinely-grateful--and-happier-20151209-gljh2l html|1|2
9:56 PM - 9 Dec 2015|Get Rhys make sandwich epic proportions - latest @ChangeAus petition targeting family member http chn ge 21QHbiN|1|2
9:20 PM - 9 Dec 2015|Geez https twitter com KerriSackville status 674805792906870784|2|1
3:12 PM - 9 Dec 2015|Facebook's Instant Articles launched Australia morning http www smh com au business media-and-marketing fairfax-media-to-launch-instant-articles-on-facebook-20151209-glj25x html - live iOS @SMH page https www facebook com sydneymorningherald fref ts|5|2
2:51 PM - 9 Dec 2015|They're remaking 'The BFG' trailer's it's bit difficult know feel http bit ly 1lvnPPv|1|0
7:24 AM - 9 Dec 2015|Donald Trump The police London terrified lives pic twitter com 7wnfACgwOg|7.4K|5.6K
10:48 AM - 9 Dec 2015|The case Paris Hilton lucrative self-made parody American excess compelling https broadly vice com en_us article paris-hilton-profile-2015-19-fragrances-and-counting-heiress via @broadly|1|4
3:11 PM - 7 Dec 2015|Donald Trump basically YouTube comment section running president|34K|37K
4:32 AM - 9 Dec 2015|Tomorrow's @couriermail front page #badenclay pic twitter com 2ypw4GCMr4|87|64
4:12 AM - 8 Dec 2015|Editor I dare Picture Desk I can't people notice Editor Pay 20 Picture Desk pic twitter com VLrK2384Ba|16K|14K
4:46 PM - 8 Dec 2015|Spent past days tracking Satoshi Nakamoto Sydney part @Gizmodo's investigation http www gizmodo com au 2015 12 this-australian-says-he-and-his-dead-friend-invented-bitcoin|8|13
7:44 PM - 8 Dec 2015|Quite development 'Bitcoin founder' Craig Wright's home raided Australian police http gu com p 4fvv2 stw @mlle_hunt I|23|5
6:49 PM - 8 Dec 2015|The memories function Facebook lacks certain sentimentality sometimes pic twitter com 0d3xCe2bYf|23|42
6:16 PM - 8 Dec 2015|Beijing's smog situation gotten bad residents sketing landmarks photos http tandl 1ITaJk1 pic twitter com kGucec8ajd|33|15
12:41 AM - 8 Dec 2015|So I'm baking cake I don't raw eggs I use bit fresh chicken #recipeoftheday|2|0
5:05 AM - 7 Dec 2015|Are You Being Served Actor Nicholas Smith Dies http news sky com story 1601423 are-you-being-served-actor-nicholas-smith-dies|58|17
6:46 PM - 6 Dec 2015|Not often see newspaper go full-on front page trolling New York Daily News gives good go pic twitter com okXJW0jfGN|437|297
3:13 AM - 6 Dec 2015|In case missed Mark Scott's exit interview @afrmag must-read http neilwrit es 1HO9DLn pic twitter com PC8B8fcEmT|38|55
7:31 PM - 5 Dec 2015|Seriously Netflix please never fix pic twitter com B3Hx8XNhO1|2.6K|4.4K
11:20 PM - 5 Dec 2015|Cronulla rioters 10 years later speak pride regret death 'I'm ashamed' http www smh com au nsw cronulla-rioters-10-years-later-speak-of-pride-regret-death-im-not-ashamed-20151127-gl9mrh html|7|1
5:05 AM - 5 Dec 2015|The first editorial front page The New York Times since 1920 pic twitter com Lr8GGYPsLM|29|15
11:15 PM - 3 Dec 2015|Not News Ltd Christmas Party NOT cancelled held Hawaii pic twitter com wd4U5cbk0d|3|15
4:12 AM - 2 Dec 2015|It's official @SBS make eps #TheFamilySBS available online simplified Chinese subtitles RESPECT http www sbs com au programs the-family-law|7|68
7:01 PM - 28 Nov 2015|This definitely gave lot think I phrase word certain things Say Thank You Sorry pic twitter com HMP7c6Svvh|11K|12K
1:39 AM - 28 Nov 2015|My best mate @bkjabour wedding day incomparable @sleemol Could happier @ https instagram com p -n7CN9i4Xq|1|14
3:07 AM - 27 Nov 2015|Lost fucking shit Send help pic twitter com 57hcmRbWAg|9|15
7:16 PM - 26 Nov 2015|Yahoo published review Rihanna new album even though hadn heard Via @FasterLouder pic twitter com A0fZmqi9gl|279|208
1:00 PM - 26 Nov 2015|Dr Mumbo Richard Wilkins post-ARIA absence Today http mumbrella com au wilkins-post-aria-absence-from-today-332794 pic twitter com faMuIcHEG2|2|0
1:07 AM - 26 Nov 2015|I'd like pay respect came us #ARIAs Specifically Madison Avenue pic twitter com B4NlMro7YJ|3|14
12:24 AM - 26 Nov 2015|DICK HEAD http www theguardian com us-news 2015 nov 26 new-york-times-outrageous-donald-trump-mocking-reporter-disability CMP soc_567|1|2
11:45 PM - 25 Nov 2015|The first F-bomb drops #ARIAs Follow live updates via @cameron_adams @McCabeRadar http www heraldsun com au entertainment music aria-awards-2015-aussie-stars-gather-for-musics-big-night news-story a676234fcebbaf0d476cd55adbbeef6c|3|0
9:53 PM - 25 Nov 2015|Can't believe I'm missing drama Neighbours pic twitter com GEtFTj1VxB|5|15
7:18 PM - 25 Nov 2015|Cases cholera dropped stopped going toilet place ate oh http www realestate com au blog yes-toilet-kitchen|1|0
7:12 PM - 25 Nov 2015|Should make awkward Christmas lunch #auspol #ReclaimAustralia pic twitter com 6n76VtIqEy|18|20
8:02 PM - 24 Nov 2015|Anyone lost #cat inner-west Sydney Please re-tweet We pic twitter com RSqr1wQlaO|129|36
10:50 PM - 24 Nov 2015|My Facebook feed Adele music videos Adele articles Adele singing w kids toys Racist comment Adele prosthetics Adele Miss Piggy|2|16
10:32 PM - 24 Nov 2015|I don't know believe anymore stares hands https twitter com SBSNews status 669399517209436160|6|7
9:44 PM - 24 Nov 2015|John Edwards depart Endemol Shine Australia http www tvtonight com au 2015 11 john-edwards-to-depart-endemol-shine-australia html pic twitter com 3ckd281TCe|2|1
8:00 PM - 24 Nov 2015|And Australia celebrates @BindiIrwin won American #DWTS pic twitter com VuLqQqfIMu|1|3
8:00 PM - 24 Nov 2015|JUST IN Bindi Irwin WON America's Dancing With Stars #9News pic twitter com iOteiBmBZC|78|160
7:37 PM - 24 Nov 2015|Pyne Thank saying I'm visionary guy Heckle Revolutionary Pyne I thought said visionary #qt pic twitter com MBjEoozEM2|3|1
2:16 PM - 24 Nov 2015|Friday Night Lights turned musical I feelings http junkee com friday-night-lights-is-being-turned-into-a-musical-and-i-have-some-feelings-about-that 69807|1|1
11:48 AM - 23 Nov 2015|Look let's forget - Translation I remember dying day|3.3K|4.3K
4:01 AM - 24 Nov 2015|This https twitter com misskatimus status 669123671747747841|1|4
2:35 AM - 24 Nov 2015|We sent copies #hittinghome Australia's political leaders|218|364
1:50 AM - 24 Nov 2015|#HittingHome @FergusonNews - 10 minutes stats alone incredible No woman child live fear Ever No excuses|12|14
12:11 AM - 24 Nov 2015|From team behind #TheSlap comes Christos Tsiolkas' provocative new drama #Barracuda #ABCTV2016 pic twitter com d7yTWWUwIW|8|12
12:03 AM - 24 Nov 2015|I'm stoked hear I love https twitter com abciview status 669063213221220353|23|67
10:02 PM - 23 Nov 2015|@nicchristensen news redundancies THAT SBS piece Sums nicely http mumbrella com au a-plate-of-media-redundancy-schadenfreude-but-whose-fault-is-the-bitter-aftertaste-332181|2|1
1:39 AM - 23 Nov 2015|Corey Bernardi always looks like world view brings much inner peace happiness pic twitter com qa33jImhpX|5|2
11:30 AM - 23 Nov 2015|This #Fargo renewed third installment FX http bit ly 1NLMdmp pic twitter com TTMKdUDwJb|118|151
1:02 PM - 23 Nov 2015|Barnaby Joyce seems relatively unfazed morning pic twitter com T9hPLLEEHF|25|30
5:47 PM - 22 Nov 2015|Later shitlords pic twitter com ZgnyUz8SWo|729|1.2K
12:10 AM - 23 Nov 2015|@ElizaSum @antsharwood yes that's thought text article made clear target news corp guess thats case|1|1
1:22 AM - 23 Nov 2015|Poor form I hope writer finds funny feels sting redundancy https twitter com sbscomedy status 668662807051661312|4|8
1:20 AM - 23 Nov 2015|55 people job 55 people going home unsure future pay bills find work Still funny @SBSComedy|6|4
1:09 AM - 23 Nov 2015|Bring December 25 pic twitter com jAEyvhDDED|2|6
12:53 AM - 23 Nov 2015|The loss journalist matter company loss industry importantly audience|9|10
8:08 PM - 22 Nov 2015|The ABC done good work telling Australians' stories domestic violence http www abc net au news 2015-11-23 oen-drum-dispatches-from-australia's-domestic-violence-crisis 6950546 #HittingHome|38|45
4:19 PM - 22 Nov 2015|Phenomenal headline pic twitter com uz0UXos1ze|57|55
11:28 PM - 22 Nov 2015|The thing satire supposed funny Without humour mean spirited crap https twitter com tom_cowie status 668682178486665216|4|0
11:19 PM - 22 Nov 2015|Paris attacks photo diary talented @mearesy http bit ly 1lDSnOM pic twitter com HlQJaXKWvs|2|0
11:10 PM - 22 Nov 2015|Why journalist would celebrate staff cuts rival newspaper media organisation beyond Ask bell tolls|8|11
10:20 PM - 22 Nov 2015|Not funny laughing journos losing jobs - dream dashed many talented people Good luck one It's tough|14|30
10:47 PM - 22 Nov 2015|Not fair funny SBS's wannabe onion site reads like terrible student newspaper http www sbs com au comedy article 2015 11 23 fired-news-corp-journalists-now-free-pursue-jobs-actual-journalists pic twitter com VPTk1GZIq0|23|17
10:10 PM - 22 Nov 2015|Anyone laugh journalists losing jobs - profession matter - a-grade arsehole|8|24
5:26 PM - 22 Nov 2015|@Adele wants #HotlineBlingRemix @Drake If happened internet would literally break http au complex com music 2015 11 adele-wants-to-do-hotline-bling-remix-with-drake utm_campaign complexmag utm_source facebook utm_medium social sr_share facebook|3|2
3:56 AM - 22 Nov 2015|guys pic twitter com 74LMSPyJ27|61|84
11:23 PM - 21 Nov 2015|My favourite #ReclaimAustralia pics thus far Stay Classy #Straya pic twitter com rXxrEBsS9f|177|149
4:58 PM - 21 Nov 2015|Nothing says Proud Aussie Patriot screaming racial abuse face covered Imbeciles #ReclaimAustralia #UPF|45|67
4:49 PM - 21 Nov 2015|French journalist says Sydney TV reporter 'hungry sensationalism' Paris http www smh com au world french-journalist-says-sydney-tv-reporter-hungry-for-sensationalism-in-paris-20151121-gl4lxw html via @smh|8|5
1:41 PM - 20 Nov 2015|Modern Family actor Reid Ewing reveals cosmetic surgery agony http ow ly UTXKw pic twitter com hcS2Jdp3Hq|4|4
3:05 AM - 20 Nov 2015|@sleemol Love cast real parents dad could spend time together|1|1
11:17 PM - 19 Nov 2015|#ReclaimAustralia activist backing Melton anti-Islam rally jailed Tasers bomb manuals http trib al 6L0jfMa pic twitter com AIdQs1UJiO|4|5
7:31 PM - 19 Nov 2015|Currently News Corp bunch anti-vaxxers protesting front Birds Tokyo playing acoustic set inside Friday|11|20
5:13 PM - 19 Nov 2015|Turnbull looking picture Turnbull holding newspaper Turnbull Have reached peak Turnbull pic twitter com mEw6Hxe17T|26|15
4:01 PM - 18 Nov 2015|Having couple I tell unexpected sentence https twitter com globalpost status 667130260769538049|2|3
5:34 AM - 18 Nov 2015|A little glimpse hope people indoctrinated hatred find way http www newyorker com magazine 2015 11 23 conversion-via-twitter-westboro-baptist-church-megan-phelps-roper via @newyorker|1|0
5:14 AM - 18 Nov 2015|Netflix Australia reaches 2 5m users ACMA ZDNet https lnkd e8fEnA5|2|2
3:28 AM - 18 Nov 2015|The sight reporter expressing emotion sign times Anne Perkins http trib al wjbkJ79|44|35
12:30 AM - 18 Nov 2015|#FOMO Tune tonight 9 30pm #B430 @DannyjClayton @OPPOMobileAU pic twitter com StHRBbfpSN|2|5
8:08 PM - 17 Nov 2015|HELP @MosmanDaily - #LOSTDOG Maltese terrier named Louis Last seen Inkerman St No collar Call 0412076390 pic twitter com KefgHWx6LA|6|0
9:53 PM - 16 Nov 2015|This Sydney-based scone delivery service HOW GENIUS Ping @sarahdaviscc http www baumgartnerbakes com|4|6
6:19 PM - 16 Nov 2015|@mrbenjaminlaw brings us hilarious glimpse Chinese-Aus family #TheFamilyLawSBS #SBS2016 https youtu e15MgFFrZD0|29|34
5:40 PM - 16 Nov 2015|Our 24-hour Food Network Australia live 1pm Channel 33 http bit ly 1HR0Rw0 pic twitter com 5X6oAaOIAj|8|8
6:00 PM - 16 Nov 2015|Australia new free food channel @FoodNetworkAU live #SBS2016|3|6
3:58 AM - 16 Nov 2015|With much sadness world it's important look reaching help pic twitter com 0wsaY5ycLH|21|46
12:10 AM - 16 Nov 2015|Waleed talks stop ISIL #TheProjectTV Written Waleed @twhittyer http snpy tv 1MM12sJ|4.1K|3.8K
11:46 PM - 15 Nov 2015|Voting #tvweeklogies open Cast vote http www tvweeklogieawards com au vote pic twitter com gkahkhQ3Z6|6|8
11:10 PM - 15 Nov 2015|Pauline Hanson threatens sue questions adviser James Ashby http www buzzfeed com markdistefano hanson-wont-explain utm_term ik8Klqlva via @MarkDiStef #auslaw #defamation|4|2
3:13 PM - 15 Nov 2015|SO EXCITED EP new breakfast show @nova100 What line-up @ChrissieSwan @MrSamPang @JBrown pic twitter com CxJGanqjQo|3|23
5:04 PM - 15 Nov 2015|Sad @stephharmon leaving us means there's rare fun job opening Editor @junkeedotcom http junkeemedia com news were-hiring-editor-of-junkee-com|23|10
1:50 PM - 15 Nov 2015|God damn you've got kind - Kurt Vonnegut's advice newborns advice hold close right http www smh com au comment view-from-the-street view-from-the-street-god-damn-it-we-need-to-be-kind-20151115-gkzh9i html|2|0
8:02 PM - 14 Nov 2015|Power passion positive change @JesintaCampbell opens @Buddy_Franklin battle beat bullies http ow ly UED6j|5|3
