7:15 PM - 8 Dec 2015|I almost cried watching Victoria's Secret fashion show they're pretty I|1|0
4:43 AM - 30 Nov 2015|Quite excited Christmas #update|891|1.8K
8:22 PM - 27 Nov 2015|Normal time normal friends Ahh Human interaction pic twitter com qWsU0geWl7|2|6
5:12 PM - 26 Nov 2015|If group chats don't look like rn you're wrong pic twitter com lsaJ6CFTbn|1|6
8:24 PM - 23 Nov 2015|When u fail really hard pic twitter com nqDxGh7YVa|2|7
6:31 AM - 21 Nov 2015|Abigail Hanna 21 Topsfield arrested Saturday morning abduction 2-year-old girl Hamilton http bos gl AxjKMQa|5|2
