2:32 PM - 11 Dec 2015|The bags eyes packed I'm going anywhere|1.5K|1.3K
8:29 AM - 10 Dec 2015|I believe got move minimum wage living wage 15 bucks hour And I apologize nobody|1.7K|4.4K
8:43 PM - 9 Dec 2015|Bleep Bloop pic twitter com uByB0qgUfD|3|19
12:13 PM - 9 Dec 2015|This best thing read today I promise pic twitter com cSRghxQV87|24K|19K
3:20 PM - 9 Dec 2015|Quran say u need 4 0 GPA dad|2.2K|2.2K
2:55 PM - 9 Dec 2015|one great moments planet earth https twitter com hsilkchampagne status 674696305558573056|1.4K|3.7K
4:51 PM - 7 Dec 2015|Why y'all using mug shot like he's shooter https twitter com fox7austin status 673987949076156416|7.2K|5.2K
6:58 PM - 8 Dec 2015|We got stand together attacked scared today https amp twimg com v 3ff85249-7536-47b7-8476-c86eff7720dd|2.6K|4K
10:57 AM - 8 Dec 2015|Take ur girl swimming first date pic twitter com fnjeBu1HaP|480|850
12:54 PM - 7 Dec 2015|Current mood pic twitter com UC1SmU7IZ2|7|7
10:28 PM - 6 Dec 2015|Make sure u pass that's key knowing success bless https twitter com invinceible90 status 673750034312138752|4.1K|2.7K
6:51 PM - 6 Dec 2015|ugh hate body need work eats|84|67
10:13 AM - 6 Dec 2015|Happy Pioneer Day This day changed everything us #8123|411|779
9:00 AM - 4 Dec 2015|touch soul|3.6K|3.8K
9:00 AM - 5 Dec 2015|touch soul|3.7K|3.8K
9:00 AM - 6 Dec 2015|touch soul|3.2K|3.5K
6:04 PM - 30 Nov 2015|Y'all need get I get there's re runs OK seriously shit dead gone https twitter com KaySeeVee status 671506722167590913|99|282
4:33 PM - 5 Dec 2015|@_alexandradavis shelby twp awful pic twitter com 9x1sfS9mmX I|1|1
1:37 PM - 5 Dec 2015|He cried lot baby By age two wasn speaking eating Our local doctor didn pic twitter com Z7jPzqL5BV|481|775
11:01 PM - 4 Dec 2015|bill nye social justice guy pic twitter com SZUStOeJ18|4.3K|5.6K
6:20 PM - 16 Nov 2015|insane #PrayForSyria pic twitter com Vs1ddvFKeU|23K|13K
9:27 AM - 22 Nov 2015|This dog fuckin MOOK walkin round built like gotdam jar olives pic twitter com YEsoDx72LU|966|1.9K
12:38 PM - 3 Dec 2015|Gandhi Was Racist Who Forced Young Girls Sleep Bed Him http bit ly 1SAoMjZ pic twitter com G1kXwmkfBU|3.9K|3.2K
10:52 AM - 3 Dec 2015|#Inspiration day Vine @quenblackwell https vine co v iuZlxWXmeX6|285|444
9:46 AM - 28 Nov 2015|I wasted phone battery watch 25 times pic twitter com S7ErXMUe5v|14K|20K
4:25 PM - 2 Dec 2015|ur fave androgyne pic twitter com miruPV8dYi|130|523
8:34 PM - 29 Nov 2015|date im roasting u|5.6K|4K
7:53 PM - 1 Dec 2015|gender THIS economy|69|117
12:54 PM - 1 Dec 2015|dudes wore much makeup girls don't tf y'all borrow palettes it'll get leave face alone|2|3
5:27 AM - 1 Dec 2015|December 1st|1.4K|1.6K
1:46 PM - 30 Nov 2015|What's heavier|2|0
8:45 AM - 1 Dec 2015|Hello Interview Magazine wheelchair accessory you're trivializing people disabled pic twitter com Yops1Zi0ln|1.1K|950
7:06 PM - 29 Nov 2015|u fail test still keep 98 pic twitter com ZK017fdVVH|1|10
5:14 PM - 29 Nov 2015|self portrait @DannyDeVito pic twitter com ysYByqHDha|10|49
8:28 PM - 28 Nov 2015|Descriptions man attacked PP killed 3 people wounded 9 Gentle pleasant well spoken ate healthy http www nytimes com 2015 11 29 us robert-dear-suspect-in-colorado-killings-preferred-to-be-left-alone html hp action click pgtype Homepage clickSource story-heading module a-lede-package-region region top-news WT nav top-news|183|99
4:00 PM - 28 Nov 2015|1 3 My brother hung foyer living room I sixteen It wasn much surprise pic twitter com a9Gye2DnLZ|300|964
12:27 PM - 28 Nov 2015|im skateboard https vine co v eQWbxpB6z9U|71|109
3:31 PM - 25 Nov 2015|Surprising grandma sister Mexico pic twitter com CD6CitJI17|8.7K|17K
8:27 PM - 25 Nov 2015|What kind Black Friday deals y'all got @FAFSA|7.5K|4.3K
7:35 AM - 26 Nov 2015|native americans thanksgiving important pic twitter com NPqN2dEvFQ|3.2K|2.9K
1:30 PM - 24 Nov 2015|zayns always looking right left pic twitter com hchMMLXLi7|18K|14K
3:40 PM - 24 Nov 2015|I like|19K|24K
7:27 PM - 24 Nov 2015|love bein woke beautiful|295|588
12:13 PM - 24 Nov 2015|People Marching - different ages race gender economic background chanting #BlackLivesMatter #4thPrecinctShutDown pic twitter com SXwogV01y6|182|198
6:46 PM - 23 Nov 2015|Hillary gotta link French Montana wants chance pic twitter com Uri6SNmVSB|1.5K|2.1K
9:39 PM - 23 Nov 2015|leaves lot shit future self deal|5|14
3:10 PM - 22 Nov 2015|colourpop make lips look hella chapped 3 pic twitter com 9bydtMftfL|5|19
8:22 PM - 18 Nov 2015|guys prefer - that's nice don't care|3.2K|3.6K
10:52 AM - 21 Nov 2015|Iconic pic twitter com l81RM2uAPD|1.7K|1.9K
11:05 AM - 20 Nov 2015|Mr Trump If picture ID maybe I could use #MuslimID pic twitter com YBPp3g8KL4|1K|1.7K
12:22 PM - 20 Nov 2015|Hey @realDonaldTrump #MuslimID via Princeton U Yep I'm affiliate volunteer prestigious university pic twitter com wtxzhKL2gx|570|1K
3:10 AM - 21 Nov 2015|Hey @realDonaldTrump #MuslimID Proudly working @UN help address dire needs world pic twitter com qQbPxgTNAA|222|329
7:07 AM - 21 Nov 2015|hey @realDonaldTrump take care vets underinsured indigent - proud carry #MuslimID pic twitter com VEcXZxli3r|419|571
12:25 PM - 21 Nov 2015|Just looking adele track listing Not listening tho Songs look sad|240|383
12:28 PM - 21 Nov 2015|Song straight titled I miss Nah I'm cool|204|337
10:27 AM - 21 Nov 2015|I smell like coconut oil pic twitter com 90A3e0R7IH|28|95
9:11 AM - 21 Nov 2015|ur cute fuck pic twitter com VaHIz3SnQt|2|5
7:06 PM - 20 Nov 2015|i'm sorry sometimes feels like million tiny thoughts|406|615
11:44 AM - 20 Nov 2015|A powerful poem feels like transgender http ted com iwD3I3b #TDOR|143|207
9:47 PM - 19 Nov 2015|CNN reporter suspended tweet implying sympathy refugees Punished human http politi co 1MYhIck pic twitter com LWJB359BTD|810|357
7:24 PM - 19 Nov 2015|It's cupping season pic twitter com ugmW0Dgj7T|774|1.5K
11:37 AM - 19 Nov 2015|You look cute https twitter com steadynights status 667419783038672896|1|0
5:38 AM - 19 Nov 2015|#InternationalMensDay isn't anti-feminist hashtag let's talk poc men disabled men trans men male rape victims|888|689
5:35 PM - 17 Nov 2015|isn't twenty one pilots song https vine co v iuKK5FrU3BF|5.6K|6K
2:32 PM - 17 Nov 2015|I'm blessed I'm moved I like thank God jesus pic twitter com DypnmpgRIm|875|1K
3:29 PM - 17 Nov 2015|still lion less mane pic twitter com UPT2or5F3q|1|6
10:28 AM - 17 Nov 2015|slurps tea loudly https twitter com nytgraphics status 666683240154050560|15|21
9:25 AM - 17 Nov 2015|#VIDEO Watch preview Zayn's new song Befour provided @thefader http youtu 6cq78cXGk_I|1.8K|1.5K
5:27 PM - 15 Nov 2015|A AP Rocky - Goldie pic twitter com REmkoC3SNC|1.8K|1.8K
4:20 PM - 15 Nov 2015|These ppl chosen occupy 4th precinct officer shot #JamarClark arrested #Justice4Jamar pic twitter com nqEK9xc9nU|842|815
