5:04 AM - 26 Nov 2015|Pope Francis Goes Thug Life pic twitter com fuyIPIJkoT|6.6K|7.3K
5:05 PM - 10 Dec 2015|Mary could really normal human tried I feel like you're really making effort CANT W8 2GET AWAY FROM ANA|1|13
12:12 PM - 10 Dec 2015|This favorite picture Mary McIntyre pic twitter com 02hEs4x5Bq|4|31
3:04 PM - 9 Dec 2015|tune December 16th 11 35 10 35c pic twitter com nZDLKEr1rl|8.9K|20K
11:49 AM - 5 Dec 2015|Hey #Kimye can't wait hear name|1.2K|1.5K
9:45 PM - 19 Nov 2015|Me I ask price something turns expensive af I gotta act like I'm thinking pic twitter com dIoC87e2Vc|3.9K|5.4K
10:55 AM - 22 Nov 2015|When realize tomorrow's Monday pic twitter com BHQFCFgLsX|1.4K|2.9K
8:36 AM - 20 Nov 2015|Houston lightning storm seen space https vine co v MFzIvZBq6M7|1.1K|1.6K
3:30 PM - 18 Nov 2015|Mary Cunningham hilarious I love everything spastic little thottie|1|9
4:36 AM - 14 Nov 2015|Please don't forget #Lebanon It also witness #ISIS horror yesterday #Solidarity Media attention required pic twitter com syQzB3RRWN|10K|6K
8:18 AM - 14 Nov 2015|When Paris turned lights rest world turned pic twitter com rdDQ0G1zH7|22K|22K
