11:38 AM - 9 Dec 2015|@sydneywashere cause made mac n cheese|1|1
9:00 PM - 8 Dec 2015|It something parent ever wants happen http www clickhole com r 3560tsd pic twitter com NPwi3KLbdT|82|158
12:47 PM - 8 Dec 2015|The squad going Europe I repeat squad going 2 London Paris Pierrefonds Rome Weymouth Saint Petersburg #SquadGoing2Europe2k16|1|1
6:41 AM - 4 Dec 2015|finishes petting dog My dog|2.3K|4K
4:52 PM - 4 Dec 2015|The top 5 biggest secrets Britain 1 Doctor 2 Larry 3 Prince Harry's love life 4 Wales 5 The Cumberbatch baby name|968|1.2K
3:00 PM - 29 Nov 2015|The View except all-octopus panel|14|89
4:46 PM - 29 Nov 2015|like what's-that -i-can't-hear-u-because-i've-insulated-my-room-with-amazing-books-that-i-got-for-40 -off sale http bit ly 1242y5K|3|8
8:44 AM - 26 Nov 2015|HI KIDS WOULD YOU LIKE A BISCUIT OR PERHAPS SOME MURDER pic twitter com XhSYtbswpy|1.2K|2K
12:25 PM - 23 Nov 2015|dance like nobody's watching except books always watching waiting|31|40
6:02 AM - 23 Nov 2015|The center square religion Book Banning BINGO http ow ly UWGo5 pic twitter com dGLxEYvpgC|10|14
12:27 PM - 21 Nov 2015|The Doctor's neck 73 colder since stopped wearing scarf|191|441
3:18 PM - 18 Nov 2015|#IWouldSleepMoreBut books|23|28
8:25 AM - 17 Nov 2015|A bunch people bought book called GIRL ON A TRAIN got confused reading whole thing http bit ly 1QJZh0I|1|6
8:35 AM - 16 Nov 2015|We Need To Talk About The New B N Commercial Starring Tony Bennett And Lady Gaga http bit ly 1MRlYdx|1|3
7:05 AM - 14 Nov 2015|ICYMI A 6th-grader dropped 57 points high school varsity team's season opener http es pn 1SOA4S7 pic twitter com nBoFS6YNI3|3K|3.4K
