5:49 AM - 12 Dec 2015|There meme Japan squish baby face called rice ball babies http bzfd 1NiqC5v pic twitter com mjETcVTqYo|275|547
6:03 AM - 12 Dec 2015|insert card shown pic twitter com N4zTViNAKe|736|794
6:32 PM - 10 Dec 2015|Looking first question exam like https vine co v e2d0aA00Taz|793|786
7:18 PM - 9 Dec 2015|THIS IS THE WORST pic twitter com x96XGIyriN|1.6K|4.4K
7:56 PM - 9 Dec 2015|people wanna act like environmental concerns shouldn't important topic politics WHAT WOULD WE DO W O EARTH|5|7
10:30 AM - 8 Dec 2015|Turning final like pic twitter com sCSJFFlKtr|412|349
11:07 AM - 8 Dec 2015|How finals going pic twitter com nG5j5ttt50|2.4K|4.2K
9:14 PM - 5 Dec 2015|it's really unattractive ambition anything life|43|55
11:12 AM - 5 Dec 2015|The final cumulative https twitter com liltarthebasedq status 673194164603912192|1.7K|848
6:13 PM - 3 Dec 2015|always make sure sound accreate pic twitter com yxHRsh9QQ5|1.7K|1.7K
7:59 PM - 3 Dec 2015|Keep pathway success clean always water plants pic twitter com Q6CvC13dip|955|1.2K
5:35 PM - 2 Dec 2015|little girl amazing pic twitter com kZIUoPISJJ|1.7K|3.2K
7:29 PM - 29 Nov 2015|Thinkin bout homework I still pic twitter com A6xeYjR4cL|5.3K|6.2K
6:14 PM - 29 Nov 2015|Special cast member talking dead means someone gonna die #TheWalkingDead|20|42
9:27 PM - 28 Nov 2015|My humor never understood|4|2
10:34 PM - 28 Nov 2015|Kayla poot|2|2
10:05 PM - 28 Nov 2015|I case didn't know pic twitter com pmFTO9MI8F|1|5
3:40 PM - 29 Nov 2015|VS LACE LASTS ABOUT 2 SECS|5|3
4:24 PM - 29 Nov 2015|ur dedicated detective investigates vicious felonies ur crush walks pic twitter com OBjvIO0UAb|17K|19K
3:39 PM - 26 Nov 2015|How people thanksgiving vs day pic twitter com 87hYcE5r6s|18K|24K
10:55 AM - 29 Nov 2015|I manage take picture pic twitter com 2rXhWoxl1r|871|6.2K
3:47 PM - 29 Nov 2015|mirror mirror wall I prettiest pic twitter com gFEv1WKgch|1.6K|6.9K
4:12 PM - 27 Nov 2015|ready night town pic twitter com taOZXDUpcf|4.8K|12K
7:26 AM - 25 Nov 2015|I honestly feel bad potato grows doesn't get become mashed potatoes|4|3
5:19 PM - 24 Nov 2015|Lor Bunion ft Lil Yeastie|1|3
7:31 PM - 24 Nov 2015|I watch https vine co v elKBJO6m05u|2.5K|4.8K
6:43 AM - 21 Nov 2015|You never make feel like shit|2|2
1:08 AM - 20 Nov 2015|Logic solved Rubik's cube without looking freestyling pic twitter com OUKRLEuEgV|15K|16K
2:42 PM - 19 Nov 2015|I rly can't wait @celia2795 @Tara_Blair @taylorsistek|2|4
9:30 AM - 18 Nov 2015|This future looks like pic twitter com wNqyuDSfIz|953|1.6K
5:26 PM - 14 Nov 2015|@taylorsistek wuuut u best playin I ain't white Naaaah|1|1
