7:52 PM - 8 Dec 2015|Photo creds @Killacrawford pic twitter com KElc7Q8oTs|4|7
1:06 PM - 28 Nov 2015|IM IN TEARS http twitter com GianniFanucchi1 status 670486075538718723 video 1|2K|2.8K
7:01 AM - 5 Dec 2015|#TravisTravisTravis #AlwaysBelieve Cymbal players give @GRHS_Band #MorePower pic twitter com EVorPjiNyw|2|3
9:16 PM - 1 Dec 2015|If doesn't inspire get 146 final pass class nothing https amp twimg com v 2eee18af-abe9-4b99-bffa-411cc9eac644|1.9K|2.1K
10:19 AM - 24 Nov 2015|Onto bigger booties|251|409
11:11 AM - 1 Dec 2015|For anyone interested conjugal visits tonight 6-8 If didn't already know I prefer blondes|4|1
6:38 AM - 24 Nov 2015|Why don't girls like|421|665
11:44 AM - 14 Nov 2015|Harvard band bunch savages pic twitter com WQ8V6IIQNR|1.5K|5K
11:09 AM - 21 Nov 2015|d marcy he's say 1st word d dad say dad d SAY IT dick cheney made money iraq war|727|1.6K
9:31 AM - 21 Nov 2015|Saw SETX Sports forum full Nederland fans #MrToupsIsWise @Toups_J pic twitter com ZS0OwrN7iG|28|6
8:02 AM - 21 Nov 2015|I'll never forget hard slayed pic twitter com AHPLuiROo3|524|1.2K
7:21 AM - 21 Nov 2015|@FilthyFrank @Idubbbz @jk_rowling sorry boys you're gonna find Hogwarts|1|0
12:58 AM - 21 Nov 2015|@FilthyFrank look you've done pic twitter com 06wvXfBTrG|972|2.2K
7:16 PM - 18 Nov 2015|IM DYING OMG pic twitter com kggpXptGIW|4.4K|8.7K
