1:08 PM - 1 Dec 2015|In four consecutive Ravens' games winning points scored time clock|55|36
8:43 PM - 30 Nov 2015|Brent Urban pic twitter com FnIHDYV0Yw|902|1.2K
3:02 PM - 30 Nov 2015|Forget on-the-court action Monmouth bench delivers Oscar-worthy performances http es pn 1YEntnD|2.5K|2.3K
8:56 PM - 27 Nov 2015|Bench goals pic twitter com DbWBdcUoa0|5.9K|8.2K
5:24 PM - 26 Nov 2015|MONMOUTH WINS HAWKS HAVE BEATEN A RANKED OPPONENT FOR THE FIRST TIME IN SCHOOL HISTORY 70-68 OVER #17 NOTRE DAME|792|716
12:25 PM - 26 Nov 2015|Finally Thanksgiving without drunken uncle Just nieces nephews bottle Jack Daniels|4.9K|13K
7:56 PM - 24 Nov 2015|Sauce year Benn Benn https amp twimg com v b1e5b2c1-f17b-408d-b0a5-ed3e595946fe|2K|2.5K
6:24 PM - 17 Nov 2015|Kessel finesses one Malkin Malkin galloping FIRES SCOOORES WHAT A GOAL MY GOODNESS MURPHY https vine co v iuKrPKJDiTa|165|246
