9:02 PM - 11 Dec 2015|Durant doesn't get nearly enough attention defense https twitter com anthonyVslater status 675535477798137856|39|69
9:13 PM - 11 Dec 2015|Tayshaun Prince 34 minutes 0-5 FG Shabazz Muhammad 16 minutes 3-6 FG Yeesh|2|2
5:00 PM - 11 Dec 2015|A Stormtrooper walked past Zach LaVine Star Wars Night Denver He double take asked What|11|16
4:15 PM - 11 Dec 2015|Look dab @CameronNewton @OBJ_3 dabs In Ninja Turtles mask Because awesome http snpy tv 1IKne6E|781|1.2K
8:34 AM - 11 Dec 2015|We knew already @SheaSerrano god|8|34
6:57 AM - 11 Dec 2015|baby wouldnt let put shoes wanted put 'em wrong feet i'm like haha karma's bitch huh hoe|77|356
5:49 AM - 11 Dec 2015|My still popping seeing @NBAonTNT game last night sure what's better - dunk bench pic twitter com cbfC6D4HKT|141|231
9:55 PM - 10 Dec 2015|Rajon Rondo goes baseline slams https vine co v iZe3uPvmOJ9|121|138
8:25 PM - 10 Dec 2015|Let's take 5 step drop 3 pump fakes situation|3|6
7:56 PM - 10 Dec 2015|If Aaron Rodgers facemask grabbed Bridgewater would put 10 Green Bay points board|119|214
5:50 PM - 10 Dec 2015|Adrian wrecked entire defense|1|2
9:29 AM - 10 Dec 2015|@Bomani_Jones smartest guy sports He's also ESPN's interesting personality http trib al C30Gwlw pic twitter com K7ry4dTXoZ|397|671
9:13 AM - 10 Dec 2015|Still can't get KAT's shot chart Ridiculous pic twitter com tpdA6PJywl|35|30
8:24 PM - 9 Dec 2015|That's bad RT @TheCauldron Karl-Anthony Towns imitates Shaq #BBQChicken Shaq calls 7 foot Drake pic twitter com 2HZCejsHmD|16|35
7:52 PM - 9 Dec 2015|High-5s around Karl-Anthony Towns tallies 26 Pts 14 Reb Wolves beat Lakers OT 123-122 pic twitter com w1p47eTVyP|626|1.9K
8:08 PM - 9 Dec 2015|Tyus scores 27 pts 11-22 shooting 3-9 3s w 8a 6r 1 steal block 2 TOs 36 mins D-League debut Was 5 6-pt loss|36|76
7:52 PM - 9 Dec 2015|26 points 14 boards 3 blocks Towns His 18 second Ricky 22 best game|9|6
7:51 PM - 9 Dec 2015|Hey @KarlTowns take bow pic twitter com UlEvdbbJzr|71|187
7:35 PM - 9 Dec 2015|CP3 6th game 10 Ast season pic twitter com h42c6UxMNd|200|327
7:22 PM - 9 Dec 2015|KG turned crowd yells everyone stand Love intensity|8|9
8:54 AM - 9 Dec 2015|Stephen Curry pace 426 3s season breaking record last season 286 It's Babe Ruth hit 90 HR 60|434|317
8:49 PM - 8 Dec 2015|RONDOOOOO @realchriswebber voice @SacramentoKings @NBATV #NBAvine https vine co v i7EDZMz29he|3.3K|3.6K
9:08 PM - 8 Dec 2015|KG much offensively defensively every possession staggering Look Wolves 2000-01 2001-02 2002-03 2003-04 teams|11|2
2:36 PM - 8 Dec 2015|Several teams intrigued Shabazz Muhammad rival executives say Minnesota -- deep wings -- unwilling move deal|227|260
9:42 AM - 8 Dec 2015|Spurs childish https vine co v MIga19hWhab|2.8K|3.8K
3:59 AM - 8 Dec 2015|How horrible Voldemort nowhere near bad https twitter com BBCNewsbeat status 674170911344455680|220K|200K
5:26 AM - 8 Dec 2015|From dept crazy Steph Curry stats He's 9-of-13 beyond 29 feet season|77|122
9:04 PM - 7 Dec 2015|KG put Blake poster kind dunk used back posters cool LaVine That wasn't baby jam|9|33
8:35 PM - 7 Dec 2015|DeSean Jackson's entire career 10 minutes|202|262
7:42 PM - 7 Dec 2015|Kevin Garnett's turn back clock poster Blake Griffin angles reactions pic twitter com 7phE8a5FMk|137|104
7:36 PM - 7 Dec 2015|The #MNWild's shutout streak ended period set franchise record -- 178 minutes 52 seconds without allowing goal|4|6
7:28 PM - 7 Dec 2015|Mood pic twitter com 04CjvmvESS|763|1.3K
7:02 PM - 7 Dec 2015|Rubio dumps The Big Ticket The Big Slam #NBAVine #LACatMIN https vine co v i7DV9PHbW1v|2.3K|2.4K
6:45 PM - 7 Dec 2015|PAUL PIERCE'S REACTION LMAOOO https twitter com BekeGSW status 674054622034526208|57|54
6:44 PM - 7 Dec 2015|Between Boban I'm sure happening right https twitter com FredKatz status 674054664996970497|125|332
6:41 PM - 7 Dec 2015|Refs stupid giving KG tech dunk|6|11
6:38 PM - 7 Dec 2015|All https twitter com tkkent89 status 674055444738924544|15|62
6:33 PM - 7 Dec 2015|ANYTHING IS POSSIBLE pic twitter com jgpxeeCCUq|806|631
6:32 PM - 7 Dec 2015|KAT REACTION https vine co v i7DtuA02dXb|276|356
6:32 PM - 7 Dec 2015|WHAT YEAR IS IT https vine co v i7DTTwumHY5|2.1K|1.7K
6:31 PM - 7 Dec 2015|KG posterized Blake Griffin No wasn't old video That happened|60|71
6:31 PM - 7 Dec 2015|KEVIN GARNETT IN 2003 JUST APPEARED|4|2
6:30 PM - 7 Dec 2015|KAT 3-3 3 tonight|4|4
6:11 PM - 7 Dec 2015|Everybody wants Steph https vine co v i7DHW6M5rwA|39|59
6:03 PM - 7 Dec 2015|Maybe try triple team https vine co v i7D6aKxM7Zp|6|18
6:01 PM - 7 Dec 2015|That grown-man move Wiggins My goodness|2|4
5:59 PM - 7 Dec 2015|Get young'n https vine co v i7Dv67Uwhjt|30|41
5:59 PM - 7 Dec 2015|Just Rubio playing good defensively it's possible play half Disrupting everything|1|9
5:58 PM - 7 Dec 2015|Karl-Anthony Towns made 2 threes far first half Look world|1|3
2:43 PM - 7 Dec 2015|Source NCAA currently discussing rewriting bench decorum rules curtail celebrations Monmouth bench Remember it's kids|2.2K|2.1K
5:40 PM - 7 Dec 2015|Nice job @fsnorth RT @TheCauldron Great slow motion look Zach LaVine's buzzer beating 3 Clippers pic twitter com rnuFjWvH2Q|7|10
5:22 PM - 7 Dec 2015|KD Thunder attended Cam Payne's HS jersey retirement everyone freaking http www sbnation com lookit 2015 12 7 9869218 kevin-durant-and-the-thunder-attend-cam-paynes-high-school-jersey pic twitter com c0hl69qNqk|155|161
4:54 PM - 7 Dec 2015|This says lot KD Westbrook -- guys Thunder https twitter com erikhorneok status 674027843416891393|88|109
5:20 PM - 7 Dec 2015|I honestly wouldn't care Trump's fire-breathing racism weren't resonating many people man That's what's disturbing|81|96
5:13 PM - 7 Dec 2015|Pierce KG already chirpin|4|11
1:34 PM - 7 Dec 2015|Nike statement lifetime LeBron deal http trib al KxjikAX pic twitter com 4V8hKUIj1v|88|81
1:04 PM - 7 Dec 2015|BREAKING Nike signed LeBron James lifetime deal Largest single athlete guarantee company's 44-year history|8K|4.6K
12:55 PM - 7 Dec 2015|@Timberwolves KG needs 8 def boards pass Karl Malone 11 406 become NBA's all-time leader category pic twitter com cssU7WpwwJ|29|24
4:53 PM - 6 Dec 2015|Nobody goes bad game great game quicker Steph Curry|55|81
4:54 PM - 6 Dec 2015|Yo @randymoss - need stretch run hop plane Massachusetts We need deep threat Give us 2 months|1.3K|2.4K
4:47 PM - 6 Dec 2015|Ron Rivera 16-16-1 games decided TD less That stat 2-14 Sept 15 2013|263|251
4:29 PM - 6 Dec 2015|Ted Ginn's hands pic twitter com JgCjifiBNh|15|19
1:25 PM - 6 Dec 2015|Odell Beckham Jr place kicker pic twitter com ySeuKY0ttf|31|33
1:17 PM - 6 Dec 2015|The #Gophers going bowling Minnesota take Central Michigan @QuickLaneBowl Detroit pic twitter com hGTWfJUVJr|255|353
1:11 PM - 6 Dec 2015|one thing never expected jameis 11 picks 12 games us would bet|46|67
12:01 PM - 6 Dec 2015|#SoleWatch #Giants @OBJ_3 proclaims King NY custom cleats http trib al cwYCJEG pic twitter com ncRhcQg1iA|305|412
12:03 PM - 6 Dec 2015|Vikings suck today refs never ref nfl Wow|79|128
11:44 AM - 6 Dec 2015|The refs far costing #Vikings game terrible|60|86
11:06 AM - 6 Dec 2015|Are playing packers These penalties ridiculous|1|3
11:06 AM - 6 Dec 2015|Nfl referees joke|1|0
10:34 AM - 6 Dec 2015|Odell Beckham Jr casual one handed grab pic twitter com GWmB7tIHEb|139|120
10:25 AM - 6 Dec 2015|Barr groin injury game hamstring new Smith https twitter com VikingsPR status 673568910151553026|4|3
10:19 AM - 6 Dec 2015|Ouch #ARIvsSTL https vine co v i7izpLBLIUE|41|37
9:24 AM - 6 Dec 2015|Just 20-year old rookie big men https vine co v i7ejJO6x5Z0|40|72
9:12 AM - 6 Dec 2015|Towns apologizes making jumper swinging ball Wiggins https vine co v i7eHEg59vKm|347|426
9:03 AM - 6 Dec 2015|Antone Exum start second straight game safety Andrew Sendejo today|5|21
8:38 AM - 6 Dec 2015|The future present https vine co v i7eOmUehqAv|20|54
8:30 AM - 6 Dec 2015|Kevin Garnett scores 26 000th point http nba com 1PMui5f pic twitter com HjeUsehGIE|99|155
7:04 PM - 5 Dec 2015|Rubio-Lavine-Wiggins-Towns-Dieng interesting I'm intrigued|2|1
6:40 PM - 5 Dec 2015|Back-to-back behind back dimes RR9 Kings top 77-75 late 3rd pic twitter com Nvt4NmdneT|50|72
4:19 PM - 5 Dec 2015|Curry made 3 reviewed probably try figure crucial things like How|111|128
4:17 PM - 5 Dec 2015|Curry clearly shaken due strange fourth quarter portion basketball game|70|211
10:16 PM - 4 Dec 2015|J R Smith laughed told Blatt thinks LeBron needs help I mean I 15 first I don't know else want|496|271
5:35 PM - 4 Dec 2015|@RealDealBeal23 reverse #WizSuns https vine co v iW3HEYx1vtp|330|635
5:33 PM - 4 Dec 2015|Shank found Aaron Hernandez's cell http wp p14QSB-9VER|204|137
5:09 PM - 4 Dec 2015|WAIT WHAT https twitter com ken_rosenthal status 672944503452508161|5|4
4:48 PM - 4 Dec 2015|Melo's kicks tonight pic twitter com 8pVAmkRk2p|206|542
7:04 AM - 4 Dec 2015|look buster https vine co v iWPuQ6vFMnj|303|293
9:43 PM - 3 Dec 2015|WARP PIPE RT @UncleHemp Time log https vine co v iWPv31UFZXb|451|353
9:38 PM - 3 Dec 2015|Facemask rule written wasn't violated Lions http wp p14QSB-9VBk|1.1K|731
9:13 PM - 3 Dec 2015|After seeing postgame interview I'm rejecting possibility Kawhi robot Spurs designed|64|128
9:07 PM - 3 Dec 2015|Megatron died #GBvsDET https vine co v iWPblnwdWlp|488|445
9:06 PM - 3 Dec 2015|When it's turn water slide https vine co v iWPWHYxKguv|217|219
9:04 PM - 3 Dec 2015|Kawhi Leonard good even gets Tim Duncan make O face pic twitter com ENpvKgCbE5|113|133
9:01 PM - 3 Dec 2015|If Cleveland Factory Sadness Detroit Assembly Line Sadness|29|37
8:44 PM - 3 Dec 2015|Just looked face mask call grab twist Just incorrect call|2.4K|1.5K
6:15 PM - 3 Dec 2015|Dumba one-timer 1-0|6|40
6:07 PM - 3 Dec 2015|OUCH KEVIN #NBAVine https vine co v iWF9ZHwlH9O|2.9K|2.8K
6:02 PM - 3 Dec 2015|Oh KD https vine co v iWF0iVpxUU0|705|450
5:06 PM - 3 Dec 2015|impressed speed guy running ice fix camera behind goal Ottawa cc @emptynetters pic twitter com OATLKkuAlp|322|481
5:38 PM - 3 Dec 2015|Thunderous Throwdown #NBAVine https vine co v iWFIFWPhLMP|861|1.2K
5:07 PM - 3 Dec 2015|Hassan Goatside https vine co v iWFvmHUe3zi|18|22
5:06 PM - 3 Dec 2015|This nifty little set Thunder running lately https vine co v iWFnwPUY021|55|87
4:51 PM - 3 Dec 2015|@PlanetPat5 cleared takeoff https vine co v iWFeZTzH73W|407|850
10:17 AM - 3 Dec 2015|And yet Steph 35 2 PER Cold-blooded|80|94
10:15 AM - 3 Dec 2015|Russell Westbrook 31 9 PER Kevin Durant 31 6 Wilt holds NBA record full season 31 8 PER This INSANE teammates|465|344
9:23 AM - 3 Dec 2015|Durant Westbrook pace career seasons it's like never hear|62|80
1:08 PM - 2 Dec 2015|yoooo man literally every movie better it's imagined part 2 w subtitle time it's personal wow pic twitter com tkPDVSaAys|139|265
2:43 PM - 2 Dec 2015|Fans-I appreciate votes All-Star game 3 3 would kill don't want die yet Thank understanding Too old|20K|23K
8:20 AM - 2 Dec 2015|Orlando Johnson ridiculous dunk @nbadleague last night Wow https vine co v iWedvB262p2|1.2K|1K
8:12 AM - 1 Dec 2015|Your hands slow said Your cadence rhythm said This one's state Minnesota pic twitter com HkgGRK0aL1|13K|17K
5:05 AM - 2 Dec 2015|When Big 10 won't award award via @PMortell37 http www sbnation com college-football 2015 12 1 9833290 peter-mortell-holder-of-the-year-minnesota pic twitter com 74bYluneyB|54|105
6:35 PM - 1 Dec 2015|Proud honor former @Twins Justin Morneau wife Krista continued work Twin Cities #WolvesCare pic twitter com hOrrwhaMEU|35|176
7:52 PM - 1 Dec 2015|UNC-Maryland game incredible Size shooting two GREAT point guards|93|199
7:47 PM - 1 Dec 2015|A world class ankle breaking Melo Trimble https vine co v iWO2jM7qPF1|1.4K|956
7:39 PM - 1 Dec 2015|That'll #mnwild takes #blackhawks 2-1 Chicago @rsuter20 game-winning goal #MINvsCHI pic twitter com RUQWJs4oR8|959|1.2K
7:22 PM - 1 Dec 2015|cmon http vine co v iWOhuAVZbq5|538|370
7:37 PM - 1 Dec 2015|Brodin save game Panarin shot hit|8|88
7:21 PM - 1 Dec 2015|Ryan Suter scores 7 56 left put #MNWild 2-1 Potted Mikael Granlund rebound|3|10
7:08 PM - 1 Dec 2015|Press box announcer gave penalty Gary Suter|9|90
7:03 PM - 1 Dec 2015|Shabazz Muhammad throws Magic https vine co v iWO6YhYu7l9|21|28
6:54 PM - 1 Dec 2015|@Adam_Jacobi Here true fact Kobe took 3s tonight Steph Curry EVER taken regular season game Ray Allen 2x|8|9
6:38 PM - 1 Dec 2015|3 great looks Kerwin Roach throwing monster slam https vine co v iWOO2pUOLwL|274|197
6:28 PM - 1 Dec 2015|KG 12 minutes tonight passing Jason Kidd 50 110 third place NBA all-time list|3|5
5:54 PM - 1 Dec 2015|Kerwin Roach https vine co v iWM9pUuBBQ9|235|192
6:04 PM - 1 Dec 2015|best 7 series could minnesota lynx sweep sixers|1.6K|2.8K
6:01 PM - 1 Dec 2015|Rubio's back Towns runs break finishes oop #ORLatMIN #NBALeaguePass #NBAGIF pic twitter com gUW07Vmt3w|105|262
12:54 PM - 1 Dec 2015|Twins reach 4-year deal power hitting Korean 1st baseman Byung-Ho Park Read -- http bit ly 21sSFbW #MNTwins|11|19
7:59 AM - 1 Dec 2015|Agree https twitter com 985thesportshub status 671691007457538054|17K|20K
9:59 AM - 1 Dec 2015|Ranking 30 greatest moments @Timberwolves history via @DunkingWolvesFS http dunkingwithwolves com 2015 11 30 30-greatest-moments-in-timberwolves-history pic twitter com GugZDQbiCn|1|1
7:03 AM - 1 Dec 2015|Karl-Anthony Towns PER 21 07 puts elite class rookie players 20 PER history pic twitter com V53gFRDOVl|84|105
8:38 PM - 30 Nov 2015|The #Browns finish ever|95|134
8:04 PM - 30 Nov 2015|ICYMI This monster slam Charles Buggs seals win @GopherMBB http snpy tv 1OB5dae|29|65
8:09 PM - 30 Nov 2015|Austin Davis better pro Johnny Manziel|34|99
8:23 PM - 30 Nov 2015|Steph pic twitter com LBIWaK5fF3|91|115
8:14 PM - 30 Nov 2015|Minnesota beats Clemson get B1G board Big Ten ACC Challenge pic twitter com OXqyf9jZjr|115|232
8:14 PM - 30 Nov 2015|Jordan Murphy scored 24 points lead @GopherMBB 89-83 win Clemson Big Ten ACC Challenge http snpy tv 1Iy13ey|54|72
2:45 PM - 30 Nov 2015|kobestan least rational stans idea damn|115|124
12:07 PM - 30 Nov 2015|PFT confirms minor knee strain Gronk He's expected week two likely|50|57
11:49 AM - 30 Nov 2015|Happy Kobe Sad Kobe http 53eig ht 1YE3Xrv pic twitter com 7w5gdGGheh|189|188
12:05 PM - 30 Nov 2015|Update Rob Gronkowski told it's minor knee strain timeframe week two likely per source Best case NE|917|1.1K
11:50 AM - 30 Nov 2015|THIS JUST IN MRI shows Rob Gronkowski bruised knee tears He's considered week week via @diannaESPN pic twitter com qX2K0wVdRo|5.7K|7.7K
11:56 AM - 30 Nov 2015|The 30 Greatest Moments Timberwolves History -- ranked Check let us know got wrong http dunkingwithwolves com 2015 11 30 30-greatest-moments-in-timberwolves-history #Twolves|1|0
10:09 AM - 30 Nov 2015|Robert Flores dropped truth bomb First Take rest sports media http dlvr CtQTqg|179|191
9:22 AM - 30 Nov 2015|Enjoyed @brittrobson's interview Ricky Rubio bit KG struck https www minnpost com sports 2015 11 i-am-dying-win-qa-timberwolves-ricky-rubio pic twitter com lGUKrgFsD3|21|32
8:13 AM - 30 Nov 2015|Sounds like #Patriots TE Rob Gronkowski knee unlikely miss one game I'm told In fact may even miss|5.5K|4.6K
6:54 AM - 30 Nov 2015|The internet three tweets pic twitter com 19hdJCySVA|11K|14K
9:42 PM - 29 Nov 2015|can't wait see tim duncan's retirement letter it's prolly gonna retired scribbled post-it locker game|806|1.2K
8:33 PM - 29 Nov 2015|SOURCES Since hasn't able successfully suspend Roger Goodell decided take Tom Brady's receivers instead|3K|3.3K
9:15 PM - 29 Nov 2015|More testing likely updates ahead one source texted Gronk's leg injury Doesn't appear serious|5.8K|4.5K
9:10 PM - 29 Nov 2015|Sources tell pending MRI Rob Gronkowski's injury bad looked #Patriots|2.3K|1.5K
8:49 PM - 29 Nov 2015|Tom Brady driving field force OT throwing guys aren't even pre-loaded Madden 16 Amazing|2.8K|2.9K
8:32 PM - 29 Nov 2015|ban injuries ban knees|104|215
8:28 PM - 29 Nov 2015|oh god gronk anyone gronk|101|174
8:22 PM - 29 Nov 2015|Great vision pass Kris Dunn pic twitter com flAOn1SSJG|8|15
7:52 PM - 29 Nov 2015|Every single Kobe highlight reel must include clip pic twitter com TapIYucEOm|1.1K|1.2K
8:20 PM - 29 Nov 2015|Oh God This game horseshit|1.6K|2.8K
7:53 PM - 29 Nov 2015|Tom Brady retire best QB ever play game|503|938
4:48 PM - 29 Nov 2015|You missed Kobe https vine co v ia2jUaAt2Id|2.2K|2.4K
5:39 PM - 29 Nov 2015|@NBCSports pulling promotional stops epic rivalry #SNF pic twitter com lQKzV91LuT|135|158
5:36 PM - 29 Nov 2015|Let Gronk Let Gronk Let Gronk|10|32
5:36 PM - 29 Nov 2015|Snow Day Gronk Day TOUCHDOWN #NEvsDEN #GronkSPIKE pic twitter com dyxzJFLc7c|1.8K|2.1K
1:26 PM - 29 Nov 2015|Have Day @AdrianPeterson #MINvsATL pic twitter com 1j1LAWvxfi|747|1.5K
12:58 PM - 29 Nov 2015|Just another stunning one-handed touchdown Odell Beckham|8|21
12:58 PM - 29 Nov 2015|Wiggins stays CP3 myriad moves survives Blake post forcing miss Kid gonna something|10|18
12:58 PM - 29 Nov 2015|Holy Odell|495|865
12:42 PM - 29 Nov 2015|@AdrianPeterson puts exclamation point 35-yard touchdown run 2nd score day pic twitter com tjVg6lNT1g|823|971
12:42 PM - 29 Nov 2015|AP IS LOOSE|56|122
9:00 AM - 29 Nov 2015|Odell Beckham Jr pregame warmups wearing Charlie Brown Snoopy cleats #NYGvsWAS pic twitter com gREGJGVGo5|56|103
9:40 PM - 28 Nov 2015|Rondo seems impressed Iggy's 3 #Kings vs #Warriors https vine co v iajLQZIYVmJ|119|120
8:10 PM - 28 Nov 2015|@StephenCurry30's scintillating shooting continues 1Q vs SAC - 17 pts 4 6 FGA #SplashChart pic twitter com CFmdC0DM15|127|255
10:40 PM - 27 Nov 2015|Oh hi https vine co v iavXxHZJQQA|18|58
9:58 PM - 27 Nov 2015|At 6-2 Minnesota currently 2nd best road record NBA Golden State - 8-0 #Twolves|66|81
10:01 PM - 27 Nov 2015|Memphis best fast break ever https vine co v hEOM1OmaUBB|4K|4.6K
9:48 PM - 27 Nov 2015|Westbrook also averaging 28-10-7 PER that's higher full-season PER ever The turnovers fair tax I'd say|359|819
7:23 PM - 27 Nov 2015|Steph toying Ronnie Price via @NBATV https vine co v ia1V0qhep73|1.6K|2.2K
4:47 PM - 27 Nov 2015|Kevin Garnett good dude http cbsprt co 1MJrGkB|89|112
7:56 AM - 27 Nov 2015|For 4 million per ESPN expected offer Bayless next summer @Grantland33 could hired 40 staffers #happythanksgiving|719|603
8:49 PM - 26 Nov 2015|packers lost jay cutler home thanksgiving gotta give back least two lombardi trophies that's rule|232|402
8:28 PM - 25 Nov 2015|LaVine's lob Prince man Low-key I didn't know Tayshaun I thought Andrew When caught I like oh|120|261
8:26 PM - 25 Nov 2015|Damn Blakeeeee https vine co v izLtbQUnlrp|9|2
7:34 PM - 25 Nov 2015|Rajon Rondo neat 10pts 5-10FG 9 reb 13 asts falling 1 reb short 5th triple double season pic twitter com 8kiEuYTwXn|212|481
7:28 PM - 25 Nov 2015|Andrew Wiggins goes beast mode Paul Millsap one https vine co v izLhODdVbXb|68|57
7:22 PM - 25 Nov 2015|Have get ball Wiggins Have|7|21
7:21 PM - 25 Nov 2015|Wow Wiggins What take|2|1
6:24 PM - 25 Nov 2015|Rondo 12 assists 21 minutes He could get 25 assists tonight|14|10
5:56 PM - 25 Nov 2015|That pass KAT tho pic twitter com mTmG08Rplj|17|62
5:49 PM - 25 Nov 2015|Teague demonstrating good Rubio defends torching LaVine|2|8
5:34 PM - 25 Nov 2015|Does Sam Mitchell Zach LaVine actually run plays Cause sure doesn't look like|2|3
10:30 AM - 25 Nov 2015|You can't go store buy 6-pack beast Karl-Anthony Towns Kevin Garnett's personal project http es pn 1lK3XYV|261|558
9:47 AM - 25 Nov 2015|Can't believe I missed Marco Rubio says Tupac's lyrics insightful Biggie's https www washingtonpost com news the-fix wp 2015 04 14 the-marco-rubio-guide-to-hip-hop|2|4
6:42 PM - 24 Nov 2015|Nick Young borrowed game shoes tonight Gilbert Arenas Said rummaged Gil's closet yesterday pic twitter com XjoqLdpmro|597|508
9:10 AM - 18 Nov 2015|How many times row YOU watch @OregonStateMBB GPII dunk http pac12 1YgzhMR https vine co v iueaiW7nJUH|64|105
3:35 PM - 24 Nov 2015|walked work baby shouted daddy you're lame guess plans evening've changed cuz gotta fistfight baby|216|678
7:36 PM - 23 Nov 2015|I missed https vine co v izXg3TP9VTT|60|43
7:24 PM - 23 Nov 2015|WIGGINS OH MY|138|305
7:22 PM - 23 Nov 2015|KG Towns' ear crunch time pic twitter com yYZW3ygJTq|3|7
7:19 PM - 23 Nov 2015|Wiggins taking|20|54
7:10 PM - 23 Nov 2015|Patriots 73-0 Gillette Stadium leading halftime since 2002|598|503
6:35 PM - 23 Nov 2015|Six straight points Kevin Garnett 2015|2|4
4:50 PM - 23 Nov 2015|Kevin Durant return tonight Utah|75|120
6:28 PM - 23 Nov 2015|Looks like ankle injury isn't going stop Rubio getting back start second half|1|0
6:20 PM - 23 Nov 2015|NOOOOOOOOOOOOOO RT @TheCauldron Ricky Rubio rolled ankle stepping Nerlens Noel's foot https vine co v izgY7Z5OIel|3|5
5:56 PM - 23 Nov 2015|Games 15 assists season Rajon Rondo 4 Rest NBA 2 Brandon Knight Russell Westbrook|220|196
5:53 PM - 23 Nov 2015|I won't impressed quarterback shouts deez nuts line scrimmage|570|761
5:50 PM - 23 Nov 2015|LaVine needs use runner often It nice|1|0
5:41 PM - 23 Nov 2015|Tom Brady audibles Rex Ryan https vine co v izgjiWjbb7X|140|141
3:04 PM - 23 Nov 2015|Nike made another sneaker Oregon football fans http trib al 0SCZmQK pic twitter com NCUiG8gJ7F|33|101
3:24 PM - 23 Nov 2015|Allen Iverson https vine co v ed3bZzvlYL1|2K|2.2K
2:00 PM - 23 Nov 2015|Military Appreciation pic twitter com nbKwkItz43|2K|4.2K
7:10 PM - 22 Nov 2015|feel like could've coached warriors 15-0 record tbh ME ok steph u go amazing u dudes u ok ready break|107|271
5:51 PM - 22 Nov 2015|After 74-63 win one BBN @Tyusjones06 rock Kentucky #BBN #kentuckywildcats pic twitter com a8pyvV9jqG|1.6K|2.4K
3:55 PM - 22 Nov 2015|Great idea head butt kicker|10|32
3:39 PM - 22 Nov 2015|Great drive teddy|1|1
3:37 PM - 22 Nov 2015|Really nice throw Teddy Big-time|3|14
2:58 PM - 22 Nov 2015|Congrats LT number 21 retired @Chargers pic twitter com 13MyHSoykB|2.8K|4.2K
2:53 PM - 22 Nov 2015|Teddy Back field #Vikings|1|4
2:53 PM - 22 Nov 2015|These refs know goodell watching|1|1
2:51 PM - 22 Nov 2015|Funny happens give Aaron Rodgers 23 tries 10-yard line|90|115
2:27 PM - 22 Nov 2015|49ers blowing Vikings Week 1 might weirdest result season|80|212
2:25 PM - 22 Nov 2015|Someone wake Norv afternoon nap|2|6
2:08 PM - 22 Nov 2015|Teddy sick juke Peppers dives first third long #Vikings|2|7
1:52 PM - 22 Nov 2015|Teddy|11|60
1:51 PM - 22 Nov 2015|Teddy avoids pressure DROPS A DIME Rudy TD|16|35
1:38 PM - 22 Nov 2015|Ravens best four players - Joe Flacco Justin Forsett Steve Smith Terrell Suggs - year|3.3K|1.7K
11:50 AM - 22 Nov 2015|Kevin Martin moving wolves starting lineup Also 'Bazz get minutes|13|17
12:48 PM - 22 Nov 2015|Tailgating Minnesota Vikings fans burned jersey Green Bay Packers QB Aaron Rodgers drone #GBvsMIN pic twitter com sNXbyvzDlm|430|272
12:29 PM - 22 Nov 2015|panthers go undefeated patriots go undefeated meet super bowl that's great race war finally starts|233|361
10:30 AM - 22 Nov 2015|Of course Oregon Ducks Nike KD 8 PE http trib al pKRkfvw pic twitter com JQQXlR5AB6|36|91
10:28 AM - 22 Nov 2015|Just stifle urge wave fire truck I five|937|4K
10:25 AM - 22 Nov 2015|Good luck @Vikings #DefendTheNorth today pic twitter com 0CCkdfiyfD|430|866
10:24 AM - 22 Nov 2015|We Minnesota Strong #OneMN #DefendTheNorth pic twitter com wh2sD76yht|322|550
9:14 PM - 21 Nov 2015|Juding face made Adele little nervous #SNL https vine co v izWvTuddb60|123|181
7:00 AM - 22 Nov 2015|Patriots 8 7 chance going 16-0 heading today per FPI Toughest matchup left Week 16 Jets 61 2 chance winning|16|24
3:51 PM - 21 Nov 2015|Amazingly Michigan State led Michigan Ohio State zero seconds clock won games|7.9K|5.4K
2:35 PM - 21 Nov 2015|Kings lead Magic 27-22 first quarter Rondo 9 pts 3 3 3s three assists|52|135
2:14 PM - 21 Nov 2015|Oh bounce pass Rondo https vine co v izuMzrALLYU|26|31
10:42 AM - 21 Nov 2015|don't trust person doesn't yank microwave door open right hits triple zeroes ad starts beeping|77|215
9:41 PM - 20 Nov 2015|And react like soccer crowd ball hits post misses https twitter com solefob status 667940685065007104|15|32
9:05 PM - 20 Nov 2015|Kirk reached twice still missed RT @TheCauldron Steph Curry Shakes Kirk Hinrich Hits Floater In Traffic https vine co v iuErIYrHgPP|3|6
8:30 PM - 20 Nov 2015|More Nike LeBron exclusives Oregon Ducks http trib al AqXsHVv pic twitter com LDLPzaUvpV|31|104
8:11 PM - 20 Nov 2015|Is @22Wiggins' home @adidasHoops Crazylight Boost model's best colorway season #KicksOnCourt pic twitter com mCarzoVGf0|31|158
8:05 PM - 20 Nov 2015|Steph Curry throws hook pass alley-oop Andre Iguodala losing ball taking back https vine co v iuEBxUA760p|18|27
7:59 PM - 20 Nov 2015|Nifty Bulls alley-oop play two handed slam Jimmy Butler https vine co v iu0LbAUtdOF|117|142
10:58 PM - 19 Nov 2015|In 48 total minutes season Curry-Klay-Iggy-Barnes-Dray lineup HAS AN OFFENSIVE RATING OF 153 7 A NET RATING OF 61 8 AHHHHHH|228|278
10:36 PM - 19 Nov 2015|nobody fun playing basketball andre iguodala fucking love much|42|300
10:23 PM - 19 Nov 2015|The surprising thing Warriors' comeback wasn't surprising|98|131
10:18 PM - 19 Nov 2015|Iggy dance https vine co v iuI7VutwVlU|40|37
10:09 PM - 19 Nov 2015|Weird stakes mid-Nov streak rivalry made playoff game it's awesome I LOVE THE NBA|973|2.4K
10:05 PM - 19 Nov 2015|YOU GET A 3 AND YOU GET A 3 AND YOU GET A 3 AND YOU GET A 3|85|82
10:04 PM - 19 Nov 2015|chris paul dropping FOHs steph curry's forehead|28|74
9:27 PM - 19 Nov 2015|Bryce Harper's pronunciation memes going wreak havoc twitter h @byjanehammond https vine co v iujFXdbUbHU|478|478
8:51 PM - 19 Nov 2015|Kids Learn This Post Move Tomorrow https vine co v iujrFijVtDV|291|324
8:52 PM - 19 Nov 2015|I asked Steph Curry point there's spot floor feels can't shoot Got sheepish smile really|92|183
8:47 PM - 19 Nov 2015|Blake Griffin's #NBAKicks #GSWatLAC pic twitter com gMfmVSits5|258|782
8:27 PM - 19 Nov 2015|#KicksOnCourt #Clippers' Paul Pierce wearing Hyperdunk 2015 Low PE pic twitter com B6Oc5i9jwd|78|244
8:16 PM - 19 Nov 2015|Blake Griffin improved every year|10|5
