9:06 AM - 12 Dec 2015|Something tells ndsu qbs parents wanted hockey player knows @BarstoolChief @BarstoolBigCat pic twitter com DRnTTkZC6v|1|9
8:28 AM - 12 Dec 2015|Congrats graduates Best luck Stop celebration needs #MavNation #MavGrad|1|3
8:24 AM - 12 Dec 2015|Congratulations great career @mcuddy23 pic twitter com CP5Ccy13CD|599|1.2K
7:22 AM - 12 Dec 2015|future pic twitter com g0EpYBUDsU|4.7K|8.1K
3:26 PM - 2 Dec 2015|There's calendar week without mass shooting President Obama's 2nd term|2.4K|3.6K
1:20 PM - 11 Dec 2015|Don't bring knife gun fight Meek Mill may brought water urine sample http hnhh co abchq pic twitter com PXGx4csFy1|85|86
12:39 PM - 11 Dec 2015|Ty Dolla ign spits brand new verse Blase remix f Jeezy Diddy Juicy J http hnhh co sehyse pic twitter com 1IlejGK5Me|52|74
11:51 AM - 10 Dec 2015|Replay Antonio Brown's TD celebration pic twitter com HDG5Y31D90|443|438
8:32 AM - 11 Dec 2015|The greatest Christmas card time Merica pic twitter com cOgt4afoYT|4.4K|6.4K
8:21 PM - 7 Dec 2015|Hold beer toss cold one pic twitter com Pgant930qc|6.5K|7.6K
10:01 AM - 11 Dec 2015|When try take puck away Jack Eichel https vine co v iZvn0TZlnuh|686|1.1K
10:33 AM - 11 Dec 2015|dont u hate hypocrites|1|5
9:24 PM - 10 Dec 2015|Party thot starter pack pic twitter com 2HhzFwmmGW|2K|4.6K
7:08 PM - 10 Dec 2015|Let's make America great pic twitter com y8hz1Pvz9V|100K|19K
8:36 PM - 10 Dec 2015|It done pic twitter com KH4gbw1k8l|769|1.2K
8:51 PM - 10 Dec 2015|Writer suffers compound leg fracture Iowa State court storm http tw nbcsports com FCD pic twitter com wK2frpc2A0|24|10
8:42 PM - 10 Dec 2015|Who would better left Tackle Minnesota Vikings|1|1
8:25 PM - 10 Dec 2015|Seriously No timeouts You're well within range Run ball let clock go 5 spike kick So fucking dumb|137|234
8:03 PM - 10 Dec 2015|One called facemask One wasn't Incompetent officiating season #MINvsAZ pic twitter com 10Jj7g8is7|54|58
8:26 PM - 10 Dec 2015|This disgusting pic twitter com 4DFXNZAkc0|6.4K|5.5K
8:25 PM - 10 Dec 2015|Garbage toilet cunt fuck diarrhea joke O LINE HASNT PROTECTED TEDDY Fuck Turn overs Fuck THIS SHIT I'm chugging house paint|526|1.2K
8:25 PM - 10 Dec 2015|Impact play sack Dwight Freeney 4th season earning 200 000 incentive bonus|492|859
7:59 PM - 10 Dec 2015|Bridgewater hits Wallace touchdown bus erupts cheers Except Arizona native Coach @dheats13 course|3|9
7:55 PM - 10 Dec 2015|m trying tackle peterson jersey number 50|161|205
7:56 PM - 10 Dec 2015|If Aaron Rodgers facemask grabbed Bridgewater would put 10 Green Bay points board|119|215
7:10 PM - 10 Dec 2015|GOOD GOAL 24 game point streak got like pic twitter com c1BzEef45r|1.1K|1.5K
6:48 PM - 10 Dec 2015|@TJOshie77 gets 2 price 1 #WSHvsFLA https amp twimg com v b4a8c7ff-9f5d-4817-bdc9-065b5f2baa70|174|418
6:43 PM - 10 Dec 2015|Giroux nice hands pic twitter com iA8aGXhLTL|311|452
6:25 PM - 10 Dec 2015|Not even puck head could ruin win Nice job girls #DSB #TEAM|7|9
6:02 PM - 10 Dec 2015|I think radical idea richest country history world health care right privilege|2.7K|5.9K
5:44 PM - 10 Dec 2015|Fuck ISIS pic twitter com Ec04nbXG7k|5K|6.9K
3:57 PM - 10 Dec 2015|FREE SLICES OF PIZZA TONIGHT UNTIL 8 30 Stop try amazing pizzas|3|4
8:48 PM - 8 Dec 2015|Auston Matthews destroys water bottle first goal earlier What shot #2016nhldraft pic twitter com KUDaMtrq1V|202|272
1:32 PM - 10 Dec 2015|One day till big debut #MaverickHolidaySpecial pic twitter com GqW75C9XLz|2|11
11:51 AM - 10 Dec 2015|#TBT After scoring Bills days Christmas I threw gifts stands pic twitter com iotz0nlb60|506|754
11:51 AM - 10 Dec 2015|DEVELOPING Reports active shooter @ArkansasState campus school gives update http cbsn ws 1U8YfeC pic twitter com 9OmXlGhA1M|263|68
11:35 AM - 10 Dec 2015|Balance A key ingredient Conor McGregor's success http es pn 1U8ULZG|477|954
2:18 PM - 25 Nov 2015|8 year old boy wrote letter asking Santa stop bullying overweight sister school pic twitter com Xvmi7PyTcs|3.5K|4.5K
11:21 AM - 10 Dec 2015|Yeah I'm convinced Alex Semin doesn't give fuck Alex Semin This guy care #ALLSTAR|124|474
10:59 AM - 10 Dec 2015|No disrespect Plies singing hello I've heard song|2K|3.5K
10:57 AM - 10 Dec 2015|J J Watt says broke hand practice yesterday play Patriots Sunday pic twitter com 3n3P7Nb9MO|3.2K|4.6K
10:20 AM - 10 Dec 2015|In case didn't know pic twitter com vhYp7oWYe8|86|126
9:07 AM - 10 Dec 2015|This cool I need skate pic twitter com 49IE5VcDWo|1.9K|3K
9:54 AM - 10 Dec 2015|It's December 10th it's 42 degrees snow ground #WhatTheActualFuck|1|0
9:30 AM - 10 Dec 2015|I would pay see happen pic twitter com wKSDDboovJ|2.2K|4.8K
7:37 AM - 10 Dec 2015|Waiting Twins make season move pic twitter com qQ5zH8lLPu|1|6
11:04 PM - 9 Dec 2015|All I score 90th minute goal FIFA pic twitter com rd2BwyLhpb|1.5K|3.2K
4:32 AM - 9 Dec 2015|I doubt guy intellect contributions world would know existence https twitter com amourlads status 674303725805150208|1.1K|829
9:30 PM - 9 Dec 2015|GPA won matter heaven GPA won matter heaven GPA won matter heaven|2K|2.7K
4:14 PM - 9 Dec 2015|My nigga Jay said He ate Halloween Whooper turned MediO pic twitter com UBFQmboCRG|1|4
2:00 PM - 9 Dec 2015|When someone acts like can't take shot gave pic twitter com VojtB8UYmK|552|1.2K
2:01 PM - 9 Dec 2015|#mnwild wants wish Keith Ballard family best announced retirement #NHL pic twitter com E6V07Clckk|165|509
1:32 PM - 9 Dec 2015|Twas year @Drake http hnhh co abcee pic twitter com DOiiMaBOAZ|188|278
10:34 AM - 9 Dec 2015|A year final concussion #mnwild defenseman Keith Ballard retires @Russostrib writes http strib mn 1NiKuFu pic twitter com th0xhoy1cD|36|21
12:11 PM - 9 Dec 2015|Austin HS full court shot proves Big 9 breeds great athletes Craig Dahl Lauren Andrego Oman Oman http www foxsports com buzzer story austin-northfield-minnesota-oman-oman-full-court-shot-video-120915|3|16
12:00 PM - 9 Dec 2015|Vikings won 3 straight 5 last 6 vs AZ They meet #TNF http nfl com 1U4z10Y #WhatComesNext pic twitter com EKpWDD5gXV|147|533
11:29 AM - 9 Dec 2015|When reinforce gangster https vine co v eVnmpDuXKwz|2.3K|2.8K
11:07 AM - 9 Dec 2015|Ryan Johansen dirty dangles https vine co v iZBZZp7Otlh|506|712
10:33 AM - 9 Dec 2015|#BabyWatch Welcome Parker Dubnyk #StateOfHockey family Mom dad big brother well #mnwild|231|815
10:14 AM - 9 Dec 2015|@maureenmckamey reports search crews congregated one area west Madison Lake looking Michael Cook 38 http www keyc com story 30706801 search-crews-continue-looking-for-missing-madison-lake-man|2|0
10:03 AM - 9 Dec 2015|Patrol cars ATVs swamp w side Madison Lake No info yet related Michael Cook search pic twitter com P3JKGiq48g|3|0
6:15 AM - 9 Dec 2015|It's skill something It's desire commitment best #UNRL|27|38
7:06 AM - 9 Dec 2015|Me walking last final pic twitter com SdTIkKwbdL|3.8K|4.9K
12:02 AM - 9 Dec 2015|wish apple option turn read receipts certain people others|1.5K|3.8K
10:02 PM - 8 Dec 2015|A Minnesota high-schooler hit buzzer-beater THIS spot floor Seriously WATCH http es pn 1YXMRoA|2.7K|3.5K
6:36 PM - 8 Dec 2015|Yeah know who's kid #BabyManziel https twitter com _katherinewebb status 674315312481869824|1.6K|2.8K
6:55 PM - 8 Dec 2015|What goal Kyle Okposo pic twitter com gWtffxo2oy|697|965
4:01 PM - 8 Dec 2015|IN THE NIGHT VIDEO http vevo ly LcS6j5|13K|13K
11:16 AM - 8 Dec 2015|girls twitter like omgg true pic twitter com DfRDmsjWfv|2.7K|5.8K
12:25 PM - 8 Dec 2015|I respect man much Going miss ice @Duper0009 pic twitter com DecpFTiU6N|5|18
11:48 AM - 26 Nov 2015|Open window https vine co v izVEtTM9UO9|16K|17K
9:10 PM - 7 Dec 2015|Guess pic twitter com 7toSyoK1O9|46K|45K
3:39 PM - 6 Dec 2015|How http vine co v ia0Je7ALvJe|9.2K|9.8K
9:19 PM - 7 Dec 2015|#cabinfever3 get ready #taylorgangent|1.3K|1.5K
11:30 PM - 5 Dec 2015|Racism finally pic twitter com qo1ox0O8CU|480|556
8:50 PM - 7 Dec 2015|NFC East Standings pic twitter com ATihHrElLb|297|206
8:35 PM - 7 Dec 2015|Tie game Parise 6 09 left Parise-type goal Crash net|6|92
12:08 PM - 6 Dec 2015|Fuck college I'm trying work DJ Khaled pic twitter com J7HhtnRuyt|22K|16K
7:22 PM - 7 Dec 2015|I'll tell ya The Cowboys right like bunch lower case letters They're capitalizing man That's wild|976|1.5K
6:37 PM - 7 Dec 2015|The Past Present Future NBA maniac one shot https vine co v i7DtuA02dXb|89|260
6:28 PM - 7 Dec 2015|Alexander Ovechkin could spend 1000 day 300 years wouldn't run money current 124 million contract|313|580
6:10 PM - 7 Dec 2015|u make @thisisdbotch9 splits https twitter com awillert7 status 674047851576475648|1|4
7:08 PM - 4 Dec 2015|Story life @JManziel2 pic twitter com t9UdjWaS22|2.6K|4.1K
9:47 AM - 7 Dec 2015|Brandon Prust 5000 fine spearing Brad Marchand https vine co v i75XYLXt2aj|642|888
11:32 PM - 6 Dec 2015|A sunburn result skin cells committing mass suicide protect damaged DNA cause cancer|1.5K|2.5K
7:28 PM - 6 Dec 2015|Wishing I Hogwarts final exams always cancelled|6.6K|8.3K
2:05 PM - 25 Nov 2015|This worth deleting Twitter https vine co v iuHvjTE6lJp|1.7K|1.4K
5:54 PM - 6 Dec 2015|Obama delivers speech Oval Office terrorism ISIS http cbsn ws 1NDMIi3 pic twitter com EXCG3mzsAs|141|157
5:06 PM - 6 Dec 2015|Minnesota high school hockey championship vs Florida Panthers game The attendance unreal pic twitter com lCxK9zOdgk|510|744
4:42 PM - 6 Dec 2015|Cam Newton tells Superdome This house pic twitter com gZNMdajXYi|494|352
4:45 PM - 6 Dec 2015|PATRICK KANE 22 GAMES NEW @NHLBlackhawks RECORD|2.9K|3.3K
6:25 AM - 6 Dec 2015|realize tomorrow monday https vine co v OXbYzWm9jlq|4.6K|6.3K
4:11 PM - 5 Dec 2015|MAVERICK GOAL ALERT Jutzi blast point OZ face-off win w Mavericks PP 23 seconds 1-0 pic twitter com TjBC9cid9z|5|5
4:05 PM - 5 Dec 2015|Fuckin Botch kid legend man|1|4
3:55 PM - 5 Dec 2015|Troy Jutting lit smoke set Herb Brooks National Hockey Center fire alarm pic twitter com r0qdOkXxiC|9|11
3:52 PM - 5 Dec 2015|Interesting lineup Mavericks tonight Foguth C Nelson Schwalbe J Nelson play D https twitter com MavHockey status 673272918688718848|1|1
1:12 PM - 5 Dec 2015|9 years ago today P M Bouchard scored 'spin-o-rama' goal 6th round shootout @mnwild 3-2W vs Chicago pic twitter com hMwobzDklK|14|31
9:35 PM - 4 Dec 2015|@Buccigross OT winner #1 ranked Badgers lady Gophers pic twitter com YkE65epcsp|12|51
12:30 PM - 4 Dec 2015|NHL LEADERS EVEN STRENGTH FACE-OFF WINS Toews CHI 266 Giroux PHI 252 O Reilly BUF 247 Koivu MIN 238 Little Bergeron 228|109|227
6:00 PM - 17 Nov 2015|Girls Soccer vs Guys Soccer https vine co v hbUMPZalwJM|2.8K|3.3K
11:11 AM - 4 Dec 2015|Shoutout homie @G_Eazy new album #WhenItsDarkOut #EazySeason|1|4
8:44 PM - 3 Dec 2015|I'm going bender play #NFLisrigged|1|6
8:43 PM - 3 Dec 2015|I still think Aaron Rodgers bitch|2|8
8:42 PM - 3 Dec 2015|Lol i'm sorry thumb hitting face mask isn't pass interference Heck play|3.5K|4.4K
8:40 PM - 3 Dec 2015|That bs ending football game I've ever seen|3|3
8:38 PM - 3 Dec 2015|Turning assignment nighter pic twitter com MCSYrQ440i|1.4K|2K
8:34 PM - 3 Dec 2015|graduating seems impossible everyday|1|5
4:09 PM - 3 Dec 2015|Astronauts describing space Barry Wilmore seen shit http twitter com carolkeezy status 671606792363741185 photo 1pic twitter com p1wHpOQKce|1.9K|2.7K
7:03 PM - 3 Dec 2015|ARodg's O scores 0 1st half fault INT fault high Line beat Brady's worse ARodg keeps getting pass|581|827
6:45 PM - 3 Dec 2015|Great patience Mark Stone #bunt https vine co v iWUKMUd6zHi|69|236
6:17 PM - 3 Dec 2015|The Packers haven't trailed 17 points 1st quarter since 2004 pic twitter com HrXPLlKgan|1.2K|2.4K
4:13 PM - 3 Dec 2015|When someone asks I've started studying finals https vine co v eDe3Lg5LhlF|2.7K|2.6K
8:48 AM - 3 Dec 2015|@StonerAndersonn sounds like class needs learn handle large amounts booze|1|17
3:52 AM - 3 Dec 2015|Congratulations GREAT job done POLICE law enforcement California shootings Give credit credit due|3.2K|8.3K
11:15 AM - 3 Dec 2015|@MajidJordan announced debut album release date http hnhh co abcax pic twitter com jKwWI7CQMW|40|58
8:21 AM - 3 Dec 2015|The infamous Browns QB jersey updated via @BrokawInc pic twitter com TpPYFiMuWo|1.7K|2.3K
9:58 AM - 3 Dec 2015|Yeah Chara Pacioretty gonna kiss lips pic twitter com kpEJaF1BMu|360|871
9:45 AM - 3 Dec 2015|Of 87 Minnesota natives committed D-I men's hockey program 63 made commitments playing #mshsl team|15|18
10:20 PM - 2 Dec 2015|@SportsCenter @notthefakeSVP Thank Scott Very proud hold kicker's balls every Saturday truly honored accept award|1.3K|2.5K
8:43 AM - 3 Dec 2015|Where @MallofAmerica today MT @webertom1 Great photo Metropolitan Stadium opened Middle nowhere pic twitter com mcLM6Ou29y|80|86
9:02 AM - 3 Dec 2015|can't study course material final one night shift MAXIMUM OVERDRIVE http twitter com WORLDSTARC0MEDY status 672297483641352192 photo 1pic twitter com dzJnY5J7wy|4.7K|7.3K
7:52 AM - 3 Dec 2015|Per @AdamSchefter #Rams looked hard Browns QB Johnny Manziel http www turfshowtimes com 2015 12 3 9842468 st-louis-rams-johnny-manziel-nick-foles-jeff-fisher utm_campaign turfshowtimes utm_content chorus utm_medium social utm_source twitter pic twitter com QoO8M8U4xT|37|28
6:53 AM - 3 Dec 2015|@AdrianPeterson named NFC Offensive Player Month November MORE http mnvkn gs X94tWm pic twitter com GisBmWXc4w|286|530
6:48 AM - 3 Dec 2015|Dan Bilzerian Chris Brown pic twitter com O4kyiXRgRs|2.4K|3.9K
6:39 AM - 3 Dec 2015|Minnesota punter gives Holder Year award @notthefakeSVP salutes #SCSVP http es pn 1XBTxvu|985|1.8K
6:17 AM - 3 Dec 2015|Bride goes #mnwild game eats burger wins hockey hearts http strib mn 1HE2Cg9|13|33
5:01 AM - 3 Dec 2015|Bruggeman making senior season count St Scholastica http www uscho com 2015 12 03 bruggeman-making-senior-season-count-with-st-scholastica|15|8
9:08 PM - 2 Dec 2015|These brothers real MVP's pic twitter com zJbjEpHK9P|116|328
7:56 PM - 2 Dec 2015|Yeah look Capuano face n tell guy doesn't love eating meat lovers calzones burping public pic twitter com tZy0B5Afkp|577|1.4K
4:30 PM - 2 Dec 2015|If tinder video profiles https vine co v iWzDuDiH6A1|1.1K|1.8K
4:09 PM - 2 Dec 2015|I think said better I think you're talking right #IcebergSuccess pic twitter com 9w8mSQQQvY|6|3
3:30 PM - 2 Dec 2015|Sparks Hellebuyck It's good night 22-year-old American goalie making start #2 #TORvsWPG one hour pic twitter com OodNipSIpP|191|561
3:09 PM - 2 Dec 2015|Love Beauty https twitter com 68jagr status 672184424814010368|1|5
12:52 PM - 2 Dec 2015|Its hard concept understand people want hurt kill kind We're human Wheres humanity|2.8K|5.9K
11:53 AM - 2 Dec 2015|Active shooter reported San Bernardino California http cnn 1QUvy6v pic twitter com 1kvVX4GwMZ|2.6K|818
12:04 PM - 2 Dec 2015|CBS Bomb squad process attempting neutralize apparent explosive device San Bernardino law enforcement source says|3|1
11:18 AM - 2 Dec 2015|Yeo Reilly plan get whether plays get around group practice us work|2|2
9:57 AM - 2 Dec 2015|BLOG #mnwild recalls Mike Reilly first time reassigns Christian Folin http strib mn 1XyYR2K|22|37
1:34 AM - 2 Dec 2015|That's one way save suicide victim pic twitter com svO0b4mNKt|1.2K|1.8K
9:35 PM - 1 Dec 2015|There hockey game United Center floor hours ago pic twitter com 3bzFjoIAlo|28|114
8:43 PM - 1 Dec 2015|I hate popular tweets get recycled big accounts|3|3
7:57 PM - 1 Dec 2015|yeah cheeseburger Phil absolute snipe sauce bingo A lil bit luck mixed lil bit sharks hockey goal happen|323|834
7:47 PM - 1 Dec 2015|Parise asked reporters interviewing Suter hold mics right hands #mnwild|179|613
10:33 AM - 28 Nov 2015|Definition SAVAGE Age Objective Steal WPG' Helmet wear proudly Status Complete #NHL pic twitter com s2jkVMJS3O|269|376
6:25 PM - 1 Dec 2015|I can't believe today Christmas 1st|2.4K|3.8K
6:40 PM - 1 Dec 2015|When one homies hood makes pic twitter com u9FtSHYn1C|114|216
2:22 PM - 1 Dec 2015|David Price joining Red Sox They long history failing playoffs perfect fit|1.3K|1.8K
3:14 PM - 1 Dec 2015|With 217 Mil 7 yr deal David Price making 31 000 000 year 2 583 333 month 84 931 day 3 538 hour 59 minute 98 second|2.9K|2.9K
2:59 PM - 1 Dec 2015|Can curse Red Sox @LILBTHEBASEDGOD|3.7K|4.9K
11:19 AM - 1 Dec 2015|I didn't De-commit University Of Minnesota|42|178
10:49 AM - 1 Dec 2015|Navy put anchor awesome helmets game Army via @NavyAthletics pic twitter com 0IEwQvW2t5|3.4K|5.4K
9:35 AM - 1 Dec 2015|FINALLY A pizza slice joint coming DT Mankato I know I'll bar closeFollow spread word @PolitosMankato|3|11
8:10 AM - 1 Dec 2015|The rosters mostly #northstars #mnwild Vs #blackhawks alumni game Feb 20 pic twitter com L7hNeDC9F5|70|79
8:52 PM - 30 Nov 2015|LOL Ray Lewis bashing johnny field stuff Buddy take look mirror You're joke|2|8
8:40 PM - 30 Nov 2015|Just turn phone @Browns|6.7K|6.8K
8:17 PM - 30 Nov 2015|Matt Schaub 3 carries 10 yards Isaiah Crowell 7 carries 7 yards Do|66|143
8:12 PM - 30 Nov 2015|Yeah 8th grade I don't give shit Manziel shooting heroin Tuesday morning put kid game|322|730
8:09 PM - 30 Nov 2015|And Browns wonder won 5 games 40 years|1|0
4:02 PM - 30 Nov 2015|Holiday Gift Idea Elbow Pad Toss Hoodie http ow ly V2GSf pic twitter com NNu3pCQ83Z|2|6
8:08 PM - 28 Nov 2015|Kane distracted season allegations summer pic twitter com NNrYiQKzr4|844|1.8K
12:17 PM - 30 Nov 2015|#WCHA Rookie Week Jason Pawloski 2-0-0 1 00 GAA 947 sv 1st career ShO @MavHockey sweep pic twitter com RDFqx6DWmR|4|8
12:10 PM - 30 Nov 2015|#WCHA Offensive Player Week Teddy Blueger Epic 5-pt performance 1g-4a 1st per Sat WCHA since '87 pic twitter com 8u0BAQLAzy|1|6
2:12 PM - 29 Nov 2015|WORST DROPPED INTERCEPTION EVER https vine co v iaQJgOOLhd0|481|539
2:52 PM - 29 Nov 2015|The #Vikings won 4 straight road games first time since 1998 WATCH http mnvkn gs QluP3W pic twitter com E4p99nM2kk|126|353
2:23 PM - 29 Nov 2015|Marriage goals pic twitter com yxqZRYFDMe|2K|3.3K
8:46 PM - 28 Nov 2015|Weird thing 4th 26 Donovan threw Freddie caught Darren Sharper defended And re jail right|4K|2.8K
7:16 PM - 27 Nov 2015|First hockey game calls #MHWfanphoto choice Thanks picture @thisisdbotch9 https twitter com thisisdbotch9 status 670404763725393920|1|3
1:55 PM - 24 Nov 2015|Fck ISIS Merica pic twitter com PBNzLZHJad|2.4K|5K
3:52 PM - 27 Nov 2015|don't girl pic twitter com vlqWjTbC13|2.1K|5.3K
12:29 PM - 27 Nov 2015|h m today https vine co v hOBOtODQdJ7|1.4K|1.6K
9:18 AM - 27 Nov 2015|Black Friday years 2005 5am 2010 3am 2012 12am 2013 Thursday 8pm 2014 Thursday 2020 4th July|2.4K|4.9K
8:30 AM - 27 Nov 2015|Good job America pic twitter com M2Gtm2WgEi|5.3K|6.7K
8:53 AM - 27 Nov 2015|And five minutes happened Joseph Labate scored first professional goal #UNRL pic twitter com 7JzKg2RuRX|567|729
9:52 PM - 26 Nov 2015|They running football plays pic twitter com pTHmrAWyJX|12K|13K
8:05 AM - 27 Nov 2015|When food nasty you're trying hurt anybody's feelings pic twitter com LsV5WBAxp8|2.4K|3.7K
9:02 PM - 26 Nov 2015|Hot Topic tomorrow https vine co v MTmMhUmzavp|3.8K|4.6K
8:52 PM - 26 Nov 2015|Just guess Brett Favre hate happening night|708|1.7K
8:52 PM - 26 Nov 2015|No one gets saltier Packers fans can't beat bears lions home lol|2|8
8:04 PM - 26 Nov 2015|Brett Favre says working lot preparing triathlon Looks great Maybe Jerry Jones give call|1.3K|2.5K
7:15 PM - 26 Nov 2015|No Green Bay Packer wear No 4 ever pic twitter com 1kvCiRzXjn|12K|19K
1:45 PM - 26 Nov 2015|I see dabbin man Cam Newton remains best pic twitter com cRByzqHD9k|7.5K|8.4K
1:07 PM - 26 Nov 2015|Walking kitchen like https vine co v O0vdrrBppUO|1.1K|864
1:02 PM - 26 Nov 2015|When mom says thanksgiving dinner ready pic twitter com ixiHcrpgu0|1.3K|1.6K
8:15 AM - 26 Nov 2015|Happy Slapsgiving How I Met Your Mother fans pic twitter com BaJ5r8ouRm|22|46
8:13 AM - 26 Nov 2015|many things thankful '|1|10
5:48 AM - 26 Nov 2015|This new fav wisdom teeth video pic twitter com qBNiT1i9KF|11K|14K
5:04 PM - 25 Nov 2015|When @Drake announces starting lineups Toronto Raptors #DrakeNight https amp twimg com v c7820aa3-b794-4c2b-b05b-0d8f8fe6fd1f|3.2K|4.6K
5:12 PM - 25 Nov 2015|Drake sitting next mom courtside #DrakeNight Toronto via @Raptors http vine co v iz3AZDmYYKE|19K|25K
4:26 PM - 25 Nov 2015|Doc play-by-play dogs running backyard pic twitter com 8a2NzAvfbi|190|337
3:53 PM - 25 Nov 2015|Final evening Face Blankets Down mustaches tomorrow We confirmed TV Guys' beards Writers' scruff pic twitter com luLPfoiFwU|6|30
7:59 AM - 22 Nov 2015|We better get tough RADICAL ISLAMIC TERRORISTS get tough life safety wonderful country jeopardy|5.3K|10K
11:23 AM - 17 Nov 2015|Which one goes @Movember stache Tap recipe tag #JamesonMo pics http jmeson us ASL3FF pic twitter com udGy0Yycsy|190|541
2:22 PM - 25 Nov 2015|Can't wait see everyone tonight One favorite nights year|2|3
10:11 AM - 25 Nov 2015|Miss Evan pic twitter com UyknkD3oMp|2|2
9:45 AM - 25 Nov 2015|TROPHY TRACKER At quarter point season @mnwild' Mikko Koivu leads Selke race http nhl com 6014BR4Gw pic twitter com nSl6jD1Rki|88|256
2:08 PM - 24 Nov 2015|Hey @Browns What's wrong little partying every pic twitter com nImhS6qm2x|498|784
8:38 AM - 25 Nov 2015|Every year wednesday parents tell disappointed they'll I'm hungover thanksgiving Party jacks tonight|1|28
8:31 AM - 25 Nov 2015|Devan Dubnyk makes 12th straight start tonight His second child due Dec 4 way he's call speak #mnwild|12|44
8:19 PM - 24 Nov 2015|A little something tonight's game @kcoffee_23 @NorthstarHoops Great game @Mankato_East pic twitter com DrPvomKRTr|24|46
8:17 AM - 25 Nov 2015|Much respect anybody take care kids don't look handout|348|580
11:12 AM - 24 Nov 2015|I need game https vine co v izjYQmupeiQ|953|1.7K
4:46 PM - 23 Nov 2015|Putting final touches Cabin Fever 3 This shits bout fire|17K|20K
10:34 PM - 24 Nov 2015|@thisisdbotch9 that's pretty personal Idk Mrs Clause want information disclosed|2|2
6:45 AM - 25 Nov 2015|Our thoughts prayers Stedman family #Pray4Stedman https twitter com STLouisRams status 669521013281980416|103|201
6:22 AM - 25 Nov 2015|NFL's Stedman Bailey -- Video Of Bloody Crime Scene After Drive By Shooting http dlvr Cr5k0t|47|45
9:47 PM - 24 Nov 2015|#Rams WR Stedman Bailey shot twice head sitting car 2 young relatives cousin He stable Miami ICU|6.3K|2.5K
9:29 PM - 24 Nov 2015|Rumors circulating Stedman Bailey shot multiple times including head going surgery speak Prayers|27|22
8:23 PM - 24 Nov 2015|For Wild's Ryan Carter family home ties bind @Russostrib writes http strib mn 1Hlznys pic twitter com 77mBJRj5nt|15|24
9:46 PM - 24 Nov 2015|We live world man girlfriend doesn't miss game But guy parties Ok pic twitter com 4X2HwVnEAl|1|1
9:17 PM - 24 Nov 2015|Area 51 released new video UFOs This insane https vine co v izP7rgb7urL|4|9
8:24 PM - 24 Nov 2015|One day social media kids going find R Kelly peed little girl going let|354|368
3:04 PM - 24 Nov 2015|aren real man unless u make 80k year 6 5 pic twitter com grTUNh8Qnq|3.8K|8.6K
7:11 PM - 24 Nov 2015|Idk it's Minnesota thing sometimes hands cold scroll I phone I throw couch walk away|1|1
6:39 PM - 24 Nov 2015|When hear momma talking bad adult table pic twitter com SaS9gwrEi4|1.6K|2.4K
6:20 PM - 24 Nov 2015|The big ten gopher hockey joke trying set age limit players Sorry schools know use resources available|1|2
5:39 PM - 24 Nov 2015|Aunt isn't 3rd plate Me isn't 4th divorce #ThanksgivingClapBack pic twitter com 0BCdKIWRUP|6.7K|6.4K
8:08 PM - 23 Nov 2015|I want someone look way Joe Biden looks Obama pic twitter com aUN6U9en7L|12K|17K
8:21 PM - 23 Nov 2015|What actor Bond The Man Broom pic twitter com G6OQ6u5XoH|8.4K|13K
3:15 PM - 24 Nov 2015|Moved 3rd string went bye week Yet Greg Hardy play like nothing wrong #NFLisajoke|1|7
2:24 PM - 24 Nov 2015|Can someone explain Manziel wrong He's allowed drink alcohol|30|27
2:12 PM - 24 Nov 2015|The dude drinks He bye week played pretty well Given else NFL puts seems tame https twitter com WriterNonActive status 669276234354855936|133|193
8:03 AM - 24 Nov 2015|come back store run cousins #ThanksgivingWithBlackFamilies pic twitter com pKwoLpxVbd|10K|9.5K
10:09 AM - 24 Nov 2015|Blackhawks released Stadium Series sweaters What's everyone think pic twitter com 0DoFwMFPGd|22|31
10:08 AM - 24 Nov 2015|#mnwild #StadiumSeries uniform http ow ly V1WQs pic twitter com xVXoyNvJ4G|688|1.1K
6:17 AM - 24 Nov 2015|Today 2000 @mnwild Manny Fernandez recorded 1st shutout victory franchise history vs Chicago 2-0 Xcel pic twitter com obQDiraDUb|9|28
6:29 PM - 23 Nov 2015|When you're literally unconscious team needs bucket pic twitter com x8i1UILXkJ|3.9K|4.6K
5:17 PM - 22 Nov 2015|Duluth beautiful pic twitter com ezuHkp9T93|46|139
8:58 PM - 22 Nov 2015|Congrats @theweeknd @justinbieber wins tonight #AMAs #CanadianTalent|1.5K|2.2K
8:21 PM - 22 Nov 2015|Houston lightning storm seen space http vine co v MFzIvZBq6M7|1.2K|2.1K
8:33 PM - 22 Nov 2015|Nicki Minaj won best Rap Hip-Hop artist Drake pic twitter com SPsriKChfi|4.6K|6.5K
7:47 PM - 22 Nov 2015|Its actually sad stores open 6pm thanksgiving Thanksgiving giving thanks family find best deals|4|17
6:02 PM - 22 Nov 2015|White people always snitchin @ though pic twitter com triihRvgyv|3.1K|4.6K
5:57 PM - 22 Nov 2015|Meghan Trainor Charlie Puth #AMAs pic twitter com 3pg7HIYlhu|949|1.5K
5:56 PM - 22 Nov 2015|Meghan Charlie high school couple make halls class #AMAs pic twitter com ZkUdzDP7Ka|2.6K|4.4K
4:53 PM - 22 Nov 2015|This ref running 4 3 http vine co v izaAXeutZpW|5.4K|7.2K
3:53 PM - 22 Nov 2015|Is James Jones' hoodie trending yet|1|5
4:07 PM - 22 Nov 2015|@thisisdbotch9 isn't ex GF https twitter com woridstarhiph0p status 668581104736071680|1|3
9:17 AM - 22 Nov 2015|To every night Skilled fast good shot https twitter com MNWildfan46_ status 668478001089130496|3|33
8:32 AM - 22 Nov 2015|Someone call Canada ask want two states Wisconsin Iowa sale You get low price free|1|15
7:04 PM - 21 Nov 2015|When everyone loses sight puck except pic twitter com QIHdgkAmwR|554|846
8:12 AM - 22 Nov 2015|3 shots 20 go gonna belligerent one cousin fuckers Wisconsin #packersvikes|3|11
