4:18 PM - 6 Dec 2015|Tilda Swinton's handwriting Wingdings|85|227
6:42 PM - 29 Nov 2015|The Buzzfeed interview Also contains photos scary hair http www buzzfeed com kayetoal neil-gaiman-on-storytelling-in-the-age-of-the-internet-and-o# gx6gKvQa9|131|324
11:32 AM - 28 Nov 2015|The surviving recording Virginia Woolf voice beautiful love letter language http buff ly 1YA6GlU pic twitter com L4WogwwAkl|198|286
10:30 AM - 28 Nov 2015|We spoke @CarolMovie director Todd Haynes memorable characters http www empireonline com movies features characters-todd-haynes-told-todd-haynes pic twitter com x5s4qd7XQK|30|69
1:28 PM - 27 Nov 2015|studying Star Wars prequel mid term|35|165
6:00 AM - 20 Nov 2015|Robert Duvall wearing cue cards Marlon Brando's lines making The Godfather 1972 pic twitter com 008Bc9O8wM|423|523
11:32 AM - 19 Nov 2015|MUST WATCH Brutally Honest Peter Jackson Why THE HOBBIT Films Didn't Work http goo gl pDxZa7 pic twitter com F8vscbWCKN|100|208
