8:05 PM - 10 Dec 2015|lunacy n We keep throwing rocks water thinking make tide|278|340
5:13 PM - 10 Dec 2015|This good I good Good pic twitter com DggsycxmT5|626|1.3K
2:27 PM - 7 Dec 2015|get floor floor Nice Try Buddy|17|30
3:11 PM - 7 Dec 2015|really want WOW Christmas i've got Student Loan payment w name|6|7
3:15 PM - 6 Dec 2015|Did eat tator tots Ralph https vine co v eH7UKqbdthQ|1.4K|1.7K
3:20 PM - 3 Dec 2015|u ever zoom toilet emoji pic twitter com N4jMUx7Rbr|1.5K|1.8K
5:28 PM - 2 Dec 2015|terrified everything|1|6
10:33 AM - 18 Nov 2015|Are comfortable making small talk first date|2|1
10:50 AM - 2 Dec 2015|I pleasantly musing looking window passersby someone stopped directly front vomited ground|2|16
11:14 AM - 2 Dec 2015|jack frost nipping nose like hey buddy back you're hungry bite sandwich|1K|1.3K
7:17 PM - 1 Dec 2015|sorry I can't come party I'm Facebook stalking former high school classmates see who's getting divorced|154|559
4:55 PM - 1 Dec 2015|You thought puberty good wait see second puberty|14K|39K
7:54 PM - 1 Dec 2015|@colesprouse that's called midlife crisis|4.1K|21K
9:30 AM - 30 Nov 2015|Now quality content https vine co v eZTKdwtuirz|875|1.3K
6:54 PM - 29 Nov 2015|I even sure Foxing emo band sad SOMETHING|21|32
3:52 PM - 26 Nov 2015|When family makes poop jokes Thanksgiving dinner|1|4
12:20 PM - 26 Nov 2015|what's new uncle - everything's I'm still alive|4|26
2:05 PM - 22 Nov 2015|could find worm today put spaggettis dirt|2.3K|4K
7:01 PM - 20 Nov 2015|It's snowing Inside heart|150|326
10:09 AM - 16 Nov 2015|ur feeling sensitive don't want ur feelings get hurt pic twitter com qeo3q9HYUZ|2.4K|4K
3:50 PM - 15 Nov 2015|water twice day pic twitter com hwplcMGzHi|1.1K|2.3K
12:17 PM - 15 Nov 2015|gender hooking w u nana grizol songs backseat car|2|7
8:30 PM - 14 Nov 2015|Costume makes cat forget cat pic twitter com kHzADdnq76|4.8K|8.1K
5:06 PM - 14 Nov 2015|ll cry two hours ll drink many beers fine|1.3K|1.9K
3:07 PM - 14 Nov 2015|ur trying best nothing going right pic twitter com xLzkFAhOlY|4.1K|4.9K
