9:30 AM - 10 Dec 2015|This deserves endless retweets pic twitter com GVEcuqoAZE|3.1K|2K
6:25 PM - 10 Dec 2015|Glorious storytelling best podcast digitown Sheesh They're I cannot https www instagram com p _InoMDya5L|1|0
8:43 AM - 9 Dec 2015|We need Shane McMahon back TV stat|176|208
2:35 PM - 2 Dec 2015|@XavierJago Make sure check newest music video release song Crash You're awesome https www youtube com watch v YurQd0YkODM|1|1
8:29 PM - 26 Nov 2015|Fav DM You guys family I never stop loving|22|264
11:49 PM - 17 Nov 2015|Get curved hoes get curved cuz get hoes|812|637
